,id,username,created_at,lang,cleaned_tweets,favorite_count,retweet_count,text,tokens,lemmas
882,1354309638427090944,ShamikaRavi,2021-01-27 06:05:54,en,shivaroor indiatoday congratulations shiv im sure youll raise bar good luck,161,3,@ShivAroor @IndiaToday Congratulations Shiv. I’m sure you’ll raise the bar. Good luck!,"[shivaroor, indiatoday, congratulations, shiv, im, sure, youll, raise, bar, good, luck]","['shivaroor', 'indiatoday', 'congratulation', 'shiv', 'be', 'sure', 'will', 'raise', 'bar', 'good', 'luck']"
883,1354265845812273157,ShamikaRavi,2021-01-27 03:11:53,en,symplectic thank,0,0,@symplectic2025 Thank you.,"[symplectic, thank]","['symplectic', 'thank']"
884,1354265794973032451,ShamikaRavi,2021-01-27 03:11:41,en,symplectic: shamikaravi prof ravi et good article saubhik chakrabarti citing research extensively root caus,0,4,"RT @symplectic2025: @ShamikaRavi Prof. Ravi, ET has a good article by Saubhik Chakrabarti citing your research extensively, to do root caus…","[symplectic:, shamikaravi, prof, ravi, et, good, article, saubhik, chakrabarti, citing, research, extensively, root, caus]","['symplectic', 'shamikaravi', 'prof', 'ravi', 'et', 'good', 'article', 'saubhik', 'chakrabarti', 'cite', 'research', 'extensively', 'root', 'caus']"
885,1354247078419943424,ShamikaRavi,2021-01-27 01:57:18,en,wionews: guidelines curbs continue stay several parts world prof amos panet shamikaravi explain quint,0,13,"RT @WIONews: As guidelines and curbs continue to stay in several parts of the world, Prof Amos Panet and @ShamikaRavi explain how the quint…","[wionews:, guidelines, curbs, continue, stay, several, parts, world, prof, amos, panet, shamikaravi, explain, quint]","['wionews', 'guideline', 'curb', 'continue', 'stay', 'part', 'world', 'prof', 'amos', 'panet', 'shamikaravi', 'explain', 'quint']"
886,1354246922299559938,ShamikaRavi,2021-01-27 01:56:41,en,wionews: #covid vaccines may supercharge global economic growth world achieve complete economic,0,7,"RT @WIONews: The #COVID19 vaccines may supercharge the global economic growth in 2021, but when will the world achieve a complete economic…","[wionews:, #covid, vaccines, may, supercharge, global, economic, growth, world, achieve, complete, economic]","['wionews', 'covid', 'vaccine', 'supercharge', 'global', 'economic', 'growth', 'world', 'achieve', 'complete', 'economic']"
887,1354067983245537282,ShamikaRavi,2021-01-26 14:05:39,en,shamikaravi: overall: ) improving economy ) shrinking infection ) rising daily vaccinations stars aligning,0,109,"RT @ShamikaRavi: So overall: 
1) Improving economy
2) Shrinking infection
3) Rising daily vaccinations 
... the stars are aligning, it’s be…","[shamikaravi:, overall:, ), improving, economy, ), shrinking, infection, ), rising, daily, vaccinations, stars, aligning]","['shamikaravi', 'overall', 'improve', 'economy', 'shrink', 'infection', 'rise', 'daily', 'vaccination', 'star', 'align']"
888,1354067973670019072,ShamikaRavi,2021-01-26 14:05:36,en,shamikaravi: ) rising daily vaccinations (l yesterday),0,32,"RT @ShamikaRavi: And 2) Rising daily vaccinations. 
(&gt;4L yesterday) https://t.co/OWefCrOPx3","[shamikaravi:, ), rising, daily, vaccinations, (l, yesterday)]","['shamikaravi', 'rise', 'daily', 'vaccination', 'l', 'yesterday']"
889,1354067959279357952,ShamikaRavi,2021-01-26 14:05:33,en,shamikaravi: combine economic growth projections following: ) steadily improving #covidindia numbers- daily cases,0,29,"RT @ShamikaRavi: Combine the above economic growth projections with following: 
1) steadily improving #COVID19India numbers- daily cases &amp;…","[shamikaravi:, combine, economic, growth, projections, following:, ), steadily, improving, #covidindia, numbers-, daily, cases]","['shamikaravi', 'combine', 'economic', 'growth', 'projection', 'follow', 'steadily', 'improve', 'covidindia', 'numbers-', 'daily', 'case']"
890,1354067814416433152,ShamikaRavi,2021-01-26 14:04:58,en,overall: ) improving economy ) shrinking infection ) rising daily vaccinations stars aligning,718,109,"So overall: 
1) Improving economy
2) Shrinking infection
3) Rising daily vaccinations 
... the stars are aligning,… https://t.co/jN1Z8gYz89","[overall:, ), improving, economy, ), shrinking, infection, ), rising, daily, vaccinations, stars, aligning]","['overall', 'improve', 'economy', 'shrink', 'infection', 'rise', 'daily', 'vaccination', 'star', 'align']"
891,1354067808615718913,ShamikaRavi,2021-01-26 14:04:57,en,) rising daily vaccinations (l yesterday),269,32,"And 2) Rising daily vaccinations. 
(&gt;4L yesterday) https://t.co/OWefCrOPx3","[), rising, daily, vaccinations, (l, yesterday)]","['rise', 'daily', 'vaccination', 'l', 'yesterday']"
892,1354067759173275648,ShamikaRavi,2021-01-26 14:04:45,en,combine economic growth projections following: ) steadily improving #covidindia numbers- daily c,190,29,"Combine the above economic growth projections with following: 
1) steadily improving #COVID19India numbers- daily c… https://t.co/xFO6T5LbT0","[combine, economic, growth, projections, following:, ), steadily, improving, #covidindia, numbers-, daily, c]","['combine', 'economic', 'growth', 'projection', 'follow', 'steadily', 'improve', 'covidindia', 'numbers-', 'daily', 'c']"
893,1354062765065871361,ShamikaRavi,2021-01-26 13:44:55,en,india: big decline (-) fastest recovery () () imfnews,2048,565,India: From a big decline in 2020 (-8%) to the fastest recovery in 2021 (11.5%) &amp; 2022 (6.8%) @IMFNews https://t.co/YSquTyptHR,"[india:, big, decline, (-), fastest, recovery, (), (), imfnews]","['india', 'big', 'decline', 'fast', 'recovery', 'imfnews']"
894,1354060668404604928,ShamikaRavi,2021-01-26 13:36:35,en,widespread sentiment exactly violent protests achieved undermining caus,498,67,This is a widespread sentiment now. What exactly have the violent protests achieved other than undermining the caus… https://t.co/kygVpPEeMW,"[widespread, sentiment, exactly, violent, protests, achieved, undermining, caus]","['widespread', 'sentiment', 'exactly', 'violent', 'protest', 'achieve', 'undermine', 'caus']"
895,1354056555503603715,ShamikaRavi,2021-01-26 13:20:14,en,publicly available data twitter methodology details bottom slides fun,39,3,It is publicly available data from @Twitter and the methodology details are at the bottom of the slides. Have fun! 👍 https://t.co/Gq5Z2hBRTd,"[publicly, available, data, twitter, methodology, details, bottom, slides, fun]","['publicly', 'available', 'data', 'twitter', 'methodology', 'detail', 'slide', 'fun']"
896,1354053603372064768,ShamikaRavi,2021-01-26 13:08:30,en,spent evening sc jamir institution st mp nagaland worked pm nehru,157,12,"Spent an evening with SC Jamir, an institution in himself. The 1st MP from Nagaland, he worked with PM Nehru, then… https://t.co/fd9Xdw7O8y","[spent, evening, sc, jamir, institution, st, mp, nagaland, worked, pm, nehru]","['spend', 'evening', 'sc', 'jamir', 'institution', 'st', 'mp', 'nagaland', 'work', 'pm', 'nehru']"
897,1353993749966143500,ShamikaRavi,2021-01-26 09:10:40,en,thank sharing,32,4,Thank you for sharing🙏 https://t.co/TYTzGAzYgo,"[thank, sharing]","['thank', 'share']"
898,1353990952122126339,ShamikaRavi,2021-01-26 08:59:33,en,heres joe biden: overwhelmingly positive despite opposition pitted trump,65,6,And here’s Joe Biden: overwhelmingly positive despite being in opposition and pitted against Trump. Now if only… https://t.co/DlbpKdXzLK,"[heres, joe, biden:, overwhelmingly, positive, despite, opposition, pitted, trump]","['heres', 'joe', 'biden', 'overwhelmingly', 'positive', 'despite', 'opposition', 'pit', 'trump']"
899,1353990903791161344,ShamikaRavi,2021-01-26 08:59:22,en,sentiment analysis modi vs rahul gandhi merely reflect expected tone government vs opposition,114,19,Does the sentiment analysis of Modi Vs Rahul Gandhi merely reflect the expected tone of “Government Vs Opposition”?… https://t.co/ijYHbZomUF,"[sentiment, analysis, modi, vs, rahul, gandhi, merely, reflect, expected, tone, government, vs, opposition]","['sentiment', 'analysis', 'modi', 'vs', 'rahul', 'gandhi', 'merely', 'reflect', 'expect', 'tone', 'government', 'vs', 'opposition']"
900,1353961398510919680,ShamikaRavi,2021-01-26 07:02:07,en,anuraagsaxena datarvls thank anurag,7,0,@anuraag_saxena @DataRvls Thank you Anurag.,"[anuraagsaxena, datarvls, thank, anurag]","['anuraagsaxena', 'datarvls', 'thank', 'anurag']"
901,1353959546167861248,ShamikaRavi,2021-01-26 06:54:45,en,vivekagnihotri thank vivek,34,1,@vivekagnihotri Thank you Vivek. 🙏,"[vivekagnihotri, thank, vivek]","['vivekagnihotri', 'thank', 'vivek']"
902,1353883670445133824,ShamikaRavi,2021-01-26 01:53:15,en,celebrating governing document letter spirit happy republic day,464,52,"Celebrating our governing document, in letter &amp; spirit. Happy republic day! 🇮🇳 https://t.co/1LjaePFTAR","[celebrating, governing, document, letter, spirit, happy, republic, day]","['celebrate', 'governing', 'document', 'letter', 'spirit', 'happy', 'republic', 'day']"
903,1353873296538755072,ShamikaRavi,2021-01-26 01:12:02,en,svembu congratulations sridhar recognition well deserved,301,9,@svembu Congratulations Sridhar. This recognition is very well deserved!,"[svembu, congratulations, sridhar, recognition, well, deserved]","['svembu', 'congratulation', 'sridhar', 'recognition', 'deserve']"
904,1353751243798114305,ShamikaRavi,2021-01-25 17:07:02,en,also john locke would cringe implied definition liberalism,413,50,Also John Locke would cringe at the implied definition of liberalism here👇 https://t.co/LLMhh8ytBf,"[also, john, locke, would, cringe, implied, definition, liberalism]","['john', 'locke', 'cringe', 'imply', 'definition', 'liberalism']"
905,1353706280674758658,ShamikaRavi,2021-01-25 14:08:22,en,xi jinping joking,793,105,Xi Jinping Joking...? 🤔 https://t.co/n80w15LlgT,"[xi, jinping, joking]","['xi', 'jinping', 'joke']"
906,1353703363691462659,ShamikaRavi,2021-01-25 13:56:47,en,lighter note episode reminded news coimbatore :),361,51,"On a lighter note, this episode reminded me of below news from Coimbatore in 2013 :) 
 https://t.co/jOsaeIBf4T","[lighter, note, episode, reminded, news, coimbatore, :)]","['light', 'note', 'episode', 'remind', 'news', 'coimbatore']"
907,1353700750241611778,ShamikaRavi,2021-01-25 13:46:24,en,folks raked silly portrait controversy perhaps arent aware genius paresh maity,2541,428,The folks who raked up the silly portrait controversy perhaps aren’t aware of the genius of Paresh Maity. This was… https://t.co/o4epNcN0SZ,"[folks, raked, silly, portrait, controversy, perhaps, arent, aware, genius, paresh, maity]","['folk', 'rake', 'silly', 'portrait', 'controversy', 'not', 'aware', 'genius', 'paresh', 'maity']"
908,1353623465681580033,ShamikaRavi,2021-01-25 08:39:17,en,comparing word frequencies: modi: india covid efforts r gandhi: congress govt love,1260,252,"Comparing word frequencies:
Modi: India, Covid, Efforts... 
R Gandhi: Congress, Govt, Love... https://t.co/RG8tPKLLtV","[comparing, word, frequencies:, modi:, india, covid, efforts, r, gandhi:, congress, govt, love]","['compare', 'word', 'frequencies', 'modi', 'india', 'covid', 'efforts', 'r', 'gandhi', 'congress', 'govt', 'love']"
909,1353623413609304065,ShamikaRavi,2021-01-25 08:39:05,en,sentiment analysis: tweets posted narendramodi rahulgandhi,7740,1757,Sentiment analysis: tweets posted by @narendramodi &amp; @RahulGandhi https://t.co/5n69PkD3tF,"[sentiment, analysis:, tweets, posted, narendramodi, rahulgandhi]","['sentiment', 'analysis', 'tweet', 'post', 'narendramodi', 'rahulgandhi']"
910,1353554365005459457,ShamikaRavi,2021-01-25 04:04:43,en,#covidindia big fluctuations daily vaccinations meanwhile daily new cases k,276,26,"#COVID19India 
Big fluctuations in daily vaccinations. Meanwhile daily new cases are ~14K. https://t.co/CFHHkZDnzB","[#covidindia, big, fluctuations, daily, vaccinations, meanwhile, daily, new, cases, k]","['covidindia', 'big', 'fluctuation', 'daily', 'vaccination', 'daily', 'new', 'case', 'k']"
911,1353325236893085696,ShamikaRavi,2021-01-24 12:54:14,en,#newresearch deaton #covid effects: a) theres trade-off b/w lives economy countries fewer de,39,5,"#NewResearch Deaton on #COVID19 effects: 
a) There’s been no trade-off b/w lives &amp; economy. Countries with fewer de… https://t.co/gmKuAxVUio","[#newresearch, deaton, #covid, effects:, a), theres, trade-off, b/w, lives, economy, countries, fewer, de]","['newresearch', 'deaton', 'covid', 'effect', 's', 'trade', 'b', 'w', 'life', 'economy', 'country', 'few', 'de']"
912,1353303308245471233,ShamikaRavi,2021-01-24 11:27:06,en,niece insists today beti ko padhai se bachao day tomorrow monday test,2359,62,My niece insists that today should be “Beti ko padhai se bachao” day. Tomorrow is Monday test! 🤓👧🏻… https://t.co/YmarxqV4Gc,"[niece, insists, today, beti, ko, padhai, se, bachao, day, tomorrow, monday, test]","['niece', 'insist', 'today', 'beti', 'ko', 'padhai', 'se', 'bachao', 'day', 'tomorrow', 'monday', 'test']"
913,1353296422947360770,ShamikaRavi,2021-01-24 10:59:44,en,heres excellent book quality data political economy government statistics - details,98,7,Here’s an excellent book on quality of data and the political economy of government statistics - with details from… https://t.co/5ik0udL3oj,"[heres, excellent, book, quality, data, political, economy, government, statistics, -, details]","['heres', 'excellent', 'book', 'quality', 'datum', 'political', 'economy', 'government', 'statistic', 'detail']"
914,1353226337872318464,ShamikaRavi,2021-01-24 06:21:15,en,sanjeevsanyal mother boys thought worse things actually amazed quickly could climb,20,0,"@sanjeevsanyal As a mother of 2 boys, I thought of worse things! But actually was amazed how quickly I could climb… https://t.co/9Bbp4PhNuX","[sanjeevsanyal, mother, boys, thought, worse, things, actually, amazed, quickly, could, climb]","['sanjeevsanyal', 'mother', 'boy', 'think', 'bad', 'thing', 'actually', 'amazed', 'quickly', 'climb']"
915,1353225659854688256,ShamikaRavi,2021-01-24 06:18:33,en,aparanjape actually initial hesitation amazed quickly could climb :),1,0,"@aparanjape Actually no. After initial hesitation, I was amazed how quickly I could climb up &amp; down. :)","[aparanjape, actually, initial, hesitation, amazed, quickly, could, climb, :)]","['aparanjape', 'actually', 'initial', 'hesitation', 'amazed', 'quickly', 'climb']"
916,1353225311958179841,ShamikaRavi,2021-01-24 06:17:10,und,,16,2,https://t.co/bKr73Iiicz,[],[]
917,1353224602990768129,ShamikaRavi,2021-01-24 06:14:21,en,oct johnshopkinssph theeiu published world health preparedness report global health security,40,15,In Oct 2019 ⁦@JohnsHopkinsSPH⁩ &amp; ⁦⁦@TheEIU⁩ published the World Health Preparedness Report &amp; Global Health Security… https://t.co/FY13TofIXO,"[oct, johnshopkinssph, theeiu, published, world, health, preparedness, report, global, health, security]","['oct', 'johnshopkinssph', 'theeiu', 'publish', 'world', 'health', 'preparedness', 'report', 'global', 'health', 'security']"
918,1353012770719973376,ShamikaRavi,2021-01-23 16:12:36,en,see design sustainable living,1014,62,"What do you see?
Design for sustainable living. https://t.co/xsZGItBJkp","[see, design, sustainable, living]","['design', 'sustainable', 'living']"
919,1352995311988269057,ShamikaRavi,2021-01-23 15:03:14,en,pune - youngest old city india educational hub years successfully transforming int,262,26,Pune - the youngest old city of India. It’s been an educational hub for years and now successfully transforming int… https://t.co/5L2qVBGTKM,"[pune, -, youngest, old, city, india, educational, hub, years, successfully, transforming, int]","['pune', 'young', 'old', 'city', 'india', 'educational', 'hub', 'year', 'successfully', 'transform', 'int']"
920,1352978774023786496,ShamikaRavi,2021-01-23 13:57:31,en,#dailyupdate #covidindia daily vaccinations: encouraging trend,574,66,"#DailyUpdate #COVID19India 
Daily vaccinations: encouraging trend. https://t.co/OTjQfUJCiS","[#dailyupdate, #covidindia, daily, vaccinations:, encouraging, trend]","['dailyupdate', 'covidindia', 'daily', 'vaccination', 'encourage', 'trend']"
921,1352974899199918083,ShamikaRavi,2021-01-23 13:42:07,und,kingsthings:,0,119296,RT @kingsthings: https://t.co/x0Hl0X6vqU,[kingsthings:],['kingsthing']
922,1352905883630641152,ShamikaRavi,2021-01-23 09:07:53,en,corruption cultural phenomenon ie countries culturally corrupt several papers posited,43,6,Is corruption a cultural phenomenon? i.e. Are some countries culturally corrupt? Several papers have posited that t… https://t.co/CKPuUIttGF,"[corruption, cultural, phenomenon, ie, countries, culturally, corrupt, several, papers, posited]","['corruption', 'cultural', 'phenomenon', 'ie', 'country', 'culturally', 'corrupt', 'paper', 'posit']"
923,1352646271899557890,ShamikaRavi,2021-01-22 15:56:16,en,drsunilpani rijomjohn aiimsrpr abhiruchigalhot congratulations publication sunil suggestions make,3,1,@DrSunilpani @RijoMJohn @aiims_rpr @AbhiruchiGalhot Congratulations on the publication Sunil! Your suggestions make… https://t.co/IlMhwnUB0x,"[drsunilpani, rijomjohn, aiimsrpr, abhiruchigalhot, congratulations, publication, sunil, suggestions, make]","['drsunilpani', 'rijomjohn', 'aiimsrpr', 'abhiruchigalhot', 'congratulations', 'publication', 'sunil', 'suggestion']"
924,1352643672844582915,ShamikaRavi,2021-01-22 15:45:57,en,overall #covidindia : total cases = recovered = () active = () deaths =,107,17,"Overall #COVID19India :
Total cases = 10,625,501
Recovered = 10,282,722 (96.77%)
Active = 189,708 (1.79%)
Deaths =… https://t.co/0YB0sOmNtw","[overall, #covidindia, :, total, cases, =, recovered, =, (), active, =, (), deaths, =]","['overall', 'covidindia', 'total', 'case', '=', 'recover', '=', 'active', '=', 'death', '=']"
925,1352643661662588930,ShamikaRavi,2021-01-22 15:45:54,en,daily cases continue falling k,138,21,"Daily cases continue falling. 
Now &lt;14K https://t.co/m4DJKwVyVi","[daily, cases, continue, falling, k]","['daily', 'case', 'continue', 'fall', 'k']"
926,1352643650505723904,ShamikaRavi,2021-01-22 15:45:51,en,#dailyupdate #covidindia india vaccinated l people yesterday daily new cases fall k (day mov,320,50,"#DailyUpdate #COVID19India 
India vaccinated &gt;2.5L people yesterday. While daily new cases fall below 14K (7Day mov… https://t.co/OAfnD9eFbM","[#dailyupdate, #covidindia, india, vaccinated, l, people, yesterday, daily, new, cases, fall, k, (day, mov]","['dailyupdate', 'covidindia', 'india', 'vaccinate', 'l', 'people', 'yesterday', 'daily', 'new', 'case', 'fall', 'k', 'day', 'mov']"
927,1352519154750820352,ShamikaRavi,2021-01-22 07:31:09,tl,adhiyajna south side nahi yeh east side hai #northeast,11,0,@Adhiyajna_ South side nahi. Yeh East side hai. #NorthEast,"[adhiyajna, south, side, nahi, yeh, east, side, hai, #northeast]","['adhiyajna', 'south', 'nahi', 'yeh', 'east', 'hai', 'northeast']"
928,1352518497817911297,ShamikaRavi,2021-01-22 07:28:33,en,results phase trial (july) finally out: #covaxin led tolerable safety outcomes enhanced immune resp,266,81,Results of phase 1 trial (July) are finally out: #Covaxin led to tolerable safety outcomes and enhanced immune resp… https://t.co/mKmtiwDz8V,"[results, phase, trial, (july), finally, out:, #covaxin, led, tolerable, safety, outcomes, enhanced, immune, resp]","['result', 'phase', 'trial', 'july', 'finally', 'covaxin', 'lead', 'tolerable', 'safety', 'outcome', 'enhance', 'immune', 'resp']"
929,1352511275280945153,ShamikaRavi,2021-01-22 06:59:51,en,nearly choked kamalam,437,21,Nearly choked on my Kamalam! https://t.co/cVvKhko1l5 https://t.co/3ccx20P5Bv,"[nearly, choked, kamalam]","['nearly', 'choke', 'kamalam']"
930,1352485345959448579,ShamikaRavi,2021-01-22 05:16:49,en,pharmacy world - work #vaccinediplomacy,166,23,Pharmacy to the world - at work. #VaccineDiplomacy https://t.co/5jIYp4UlTQ,"[pharmacy, world, -, work, #vaccinediplomacy]","['pharmacy', 'world', 'work', 'vaccinediplomacy']"
931,1352483829554974722,ShamikaRavi,2021-01-22 05:10:47,en,go girl #bhawanakanth,427,34,You go girl! #BhawanaKanth 👏 https://t.co/UAgLZ64bSH,"[go, girl, #bhawanakanth]","['girl', 'bhawanakanth']"
932,1352480596476399616,ShamikaRavi,2021-01-22 04:57:56,en,vp: today spoke phone director-general dr tedros adhanom ghebreyesus discussed united states work,0,10083,"RT @VP: Today, I spoke by phone with @WHO Director-General Dr. Tedros Adhanom Ghebreyesus. We discussed how the United States will work as…","[vp:, today, spoke, phone, director-general, dr, tedros, adhanom, ghebreyesus, discussed, united, states, work]","['vp', 'today', 'speak', 'phone', 'director', 'general', 'dr', 'tedros', 'adhanom', 'ghebreyesus', 'discuss', 'united', 'states', 'work']"
933,1352307224144609282,ShamikaRavi,2021-01-21 17:29:01,en,context:,398,59,"Some context: 
https://t.co/tV5w8Vagsi",[context:],['context']
934,1352306422973820928,ShamikaRavi,2021-01-21 17:25:50,en,dj vu repeatedly surprised surveys rajdeep exact thing happened months back,4149,865,"Déjà vu! How can you be repeatedly surprised by your own surveys, Rajdeep? Exact same thing happened 6 months back… https://t.co/9R15Hcazgo","[dj, vu, repeatedly, surprised, surveys, rajdeep, exact, thing, happened, months, back]","['dj', 'vu', 'repeatedly', 'surprise', 'survey', 'rajdeep', 'exact', 'thing', 'happen', 'month']"
935,1352296006377828353,ShamikaRavi,2021-01-21 16:44:27,en,kpsharmaoli: thank prime minister shri narendramodi ji well government people india generous grant one,0,3575,RT @kpsharmaoli: I thank Prime Minister Shri @narendramodi ji as well as the Government and people of India for the generous grant of one m…,"[kpsharmaoli:, thank, prime, minister, shri, narendramodi, ji, well, government, people, india, generous, grant, one]","['kpsharmaoli', 'thank', 'prime', 'minister', 'shri', 'narendramodi', 'ji', 'government', 'people', 'india', 'generous', 'grant']"
936,1352292554109120512,ShamikaRavi,2021-01-21 16:30:43,en,daily cases daily vaccinations vaccine hesitancy seems realindia needs major strategy counter,115,13,"Daily cases &amp; Daily vaccinations. 
Vaccine hesitancy seems real...India needs a major strategy to counter this. https://t.co/IKs6iKe7W3","[daily, cases, daily, vaccinations, vaccine, hesitancy, seems, realindia, needs, major, strategy, counter]","['daily', 'case', 'daily', 'vaccination', 'vaccine', 'hesitancy', 'realindia', 'need', 'major', 'strategy', 'counter']"
937,1352292548094484480,ShamikaRavi,2021-01-21 16:30:42,en,#dailyupdate #covidindia active cases india fallen l diverging trends: south korea japan,224,36,"#DailyUpdate #COVID19India
Active cases in India have fallen below 2L.
Diverging trends: South Korea &amp; Japan https://t.co/azmbyHFXhC","[#dailyupdate, #covidindia, active, cases, india, fallen, l, diverging, trends:, south, korea, japan]","['dailyupdate', 'covidindia', 'active', 'case', 'india', 'fall', 'l', 'diverge', 'trend', 'south', 'korea', 'japan']"
938,1352266511914713088,ShamikaRavi,2021-01-21 14:47:14,en,bmalmet: old enough remember taught nyu stefani germanotta performed original music evolved,0,77,RT @B52Malmet: I am old enough to remember when I taught at NYU and Stefani Germanotta performed her original music before she evolved into…,"[bmalmet:, old, enough, remember, taught, nyu, stefani, germanotta, performed, original, music, evolved]","['bmalmet', 'old', 'remember', 'teach', 'nyu', 'stefani', 'germanotta', 'perform', 'original', 'music', 'evolve']"
939,1352262094830227458,ShamikaRavi,2021-01-21 14:29:41,en,cgdev: promises concerning vaccines africa really vague timetable promises gyudemoore,0,20,"RT @CGDev: ""The promises concerning vaccines in Africa have been really vague. There has been no timetable, only promises.""

@gyude_moore o…","[cgdev:, promises, concerning, vaccines, africa, really, vague, timetable, promises, gyudemoore]","['cgdev', 'promise', 'concern', 'vaccine', 'africa', 'vague', 'timetable', 'promise', 'gyudemoore']"
940,1352252064575836163,ShamikaRavi,2021-01-21 13:49:50,en,remarkable journey congratulations ashishchauhan deft stewardship - good luck next,127,16,Remarkable journey! Congratulations @ashishchauhan for deft stewardship - and good luck for the next 50 👍 https://t.co/MLTbuaWbpn,"[remarkable, journey, congratulations, ashishchauhan, deft, stewardship, -, good, luck, next]","['remarkable', 'journey', 'congratulation', 'ashishchauhan', 'deft', 'stewardship', 'good', 'luck']"
941,1352212031156310018,ShamikaRavi,2021-01-21 11:10:45,en,relieved hear,87,3,Relieved to hear this. https://t.co/XNQZhWWG5T,"[relieved, hear]","['relieve', 'hear']"
942,1352205908479119362,ShamikaRavi,2021-01-21 10:46:26,en,important update,75,5,Important update. https://t.co/4Tp1DnPUVK,"[important, update]","['important', 'update']"
943,1351938698800074753,ShamikaRavi,2021-01-20 17:04:38,en,daily cases daily vaccinations: #covidindia,288,19,Daily cases &amp; Daily vaccinations: #COVID19India https://t.co/kZxqUxh8G7,"[daily, cases, daily, vaccinations:, #covidindia]","['daily', 'case', 'daily', 'vaccination', 'covidindia']"
944,1351890644734623744,ShamikaRavi,2021-01-20 13:53:41,en,mohamednasheed: today air india plane land male doses astrazeneca vaccine - gift india,0,7167,"RT @MohamedNasheed: Today, an Air India plane will land in Male’ with 100,000 doses of AstraZeneca vaccine - a gift from India. For 🇲🇻 it’s…","[mohamednasheed:, today, air, india, plane, land, male, doses, astrazeneca, vaccine, -, gift, india]","['mohamednasheed', 'today', 'air', 'india', 'plane', 'land', 'male', 'dose', 'astrazeneca', 'vaccine', 'gift', 'india']"
