,id,username,created_at,lang,cleaned_tweets,favorite_count,retweet_count,text,tokens,lemmas
284,1313223987204366344,ChrisHammer180,2020-10-05 21:06:11,en,dartsbehindthe highrollerradio diamtube charlie lukejones johndarts djk doubletroubleds,2,0,@DartsBehindThe @HighRollerRadio @DIAMtube @Charlie10644202 @lukejones5 @johndarts2020 @djk29_ @DoubleTroubleDS… https://t.co/MkLPTdjvWB,"[dartsbehindthe, highrollerradio, diamtube, charlie, lukejones, johndarts, djk, doubletroubleds]","['dartsbehindthe', 'highrollerradio', 'diamtube', 'charlie', 'lukejones', 'johndarts', 'djk', 'doubletroubleds']"
285,1313223269064028161,ChrisHammer180,2020-10-05 21:03:20,en,thedartsreferee good advice although get accounts taking eye-catching thumbnail tactic far,0,0,@TheDartsReferee Good advice. Although you do get some accounts taking the eye-catching thumbnail tactic too far to… https://t.co/rUQYnVRc5A,"[thedartsreferee, good, advice, although, get, accounts, taking, eye-catching, thumbnail, tactic, far]","['thedartsreferee', 'good', 'advice', 'account', 'take', 'eye', 'catch', 'thumbnail', 'tactic', 'far']"
286,1313221222856118273,ChrisHammer180,2020-10-05 20:55:12,en,philmcdyidarmy dougan favourite major fortunate anderson's nine-darter whole,0,0,@PhilMcDYidArmy @dougan90 My favourite major too. I was fortunate to be there for Anderson's nine-darter. The whole… https://t.co/4v99UTBQJU,"[philmcdyidarmy, dougan, favourite, major, fortunate, anderson's, nine-darter, whole]","['philmcdyidarmy', 'dougan', 'favourite', 'major', 'fortunate', 'anderson', 'darter']"
287,1313220298326630400,ChrisHammer180,2020-10-05 20:51:32,en,duncanmitchel bullyboy sporting scriptwriter like mind works said,0,0,@DuncanMitchel80 @BullyBoy180 You should be a sporting scriptwriter! I like how your mind works. That said if I had… https://t.co/TbxBrXFfAp,"[duncanmitchel, bullyboy, sporting, scriptwriter, like, mind, works, said]","['duncanmitchel', 'bullyboy', 'sporting', 'scriptwriter', 'like', 'mind', 'work', 'say']"
288,1313219721240686594,ChrisHammer180,2020-10-05 20:49:14,en,philmcdyidarmy dougan oh go next year everything back kind proper normal,0,0,@PhilMcDYidArmy @dougan90 Oh no! Will you go next year if everything is back to a kind of proper normal?,"[philmcdyidarmy, dougan, oh, go, next, year, everything, back, kind, proper, normal]","['philmcdyidarmy', 'dougan', 'oh', 'year', 'kind', 'proper', 'normal']"
289,1313219434614489088,ChrisHammer180,2020-10-05 20:48:06,en,duncanmitchel bullyboy that's good shout think people assume recent finishing mean may,1,0,@DuncanMitchel80 @BullyBoy180 That's a good shout. I think people will assume his recent finishing will mean he may… https://t.co/XHDFp45XSo,"[duncanmitchel, bullyboy, that's, good, shout, think, people, assume, recent, finishing, mean, may]","['duncanmitchel', 'bullyboy', 'good', 'shout', 'think', 'people', 'assume', 'recent', 'finishing', 'mean']"
290,1313218279775887361,ChrisHammer180,2020-10-05 20:43:30,en,philmcdyidarmy dougan would great final years countless majors seeking,1,0,"@PhilMcDYidArmy @dougan90 That would be a great final. 99 years between them, countless majors but both seeking the… https://t.co/Uj9FVDhArE","[philmcdyidarmy, dougan, would, great, final, years, countless, majors, seeking]","['philmcdyidarmy', 'dougan', 'great', 'final', 'year', 'countless', 'major', 'seek']"
291,1313204357404471300,ChrisHammer180,2020-10-05 19:48:11,en,duncanmitchel hi - seen preview bit later planned fittingly struggled make start,1,0,@DuncanMitchel80 Hi - just seen this. Preview a bit later than planned. I fittingly struggled to make a start just… https://t.co/Fgut2sp1Tk,"[duncanmitchel, hi, -, seen, preview, bit, later, planned, fittingly, struggled, make, start]","['duncanmitchel', 'hi', 'see', 'preview', 'bit', 'later', 'plan', 'fittingly', 'struggle', 'start']"
292,1313204048661803009,ChrisHammer180,2020-10-05 19:46:58,en,shaun yes sorry logged post i've seen message save,0,0,"@Shaun89268746 Yes, sorry i just logged in to post it so I've just seen this message! Here it is to save you having… https://t.co/jXOCdjZCPw","[shaun, yes, sorry, logged, post, i've, seen, message, save]","['shaun', 'yes', 'sorry', 'log', 'post', 'see', 'message', 'save']"
293,1313201582230646784,ChrisHammer180,2020-10-05 19:37:09,en,here's preview world grand prix enough time read first double-in,10,3,"Here's my preview for the World Grand Prix, with just enough time for you to read it before the first double-in on… https://t.co/b8fDH62r2A","[here's, preview, world, grand, prix, enough, time, read, first, double-in]","['preview', 'world', 'grand', 'prix', 'time', 'read', 'double']"
294,1312872544396095490,ChrisHammer180,2020-10-04 21:49:41,en,sportinglifefc: needs sam allardyce defensive coach #mufc #lfc #mcfc,0,3,"RT @SportingLifeFC: Who needs Sam Allardyce most as defensive coach?

#MUFC #LFC #MCFC","[sportinglifefc:, needs, sam, allardyce, defensive, coach, #mufc, #lfc, #mcfc]","['sportinglifefc', 'need', 'sam', 'allardyce', 'defensive', 'coach', 'mufc', 'lfc', 'mcfc']"
295,1312810323842342912,ChrisHammer180,2020-10-04 17:42:26,en,needs roy keane got patrice evra #mufc #mantot,39,8,Who needs Roy Keane when you've got Patrice Evra. #mufc #ManTot https://t.co/IbNJB9Dpt4,"[needs, roy, keane, got, patrice, evra, #mufc, #mantot]","['need', 'roy', 'keane', 'get', 'patrice', 'evra', 'mufc', 'mantot']"
296,1312699258018070529,ChrisHammer180,2020-10-04 10:21:06,en,outrageous skill finish portsmouth's marcus messi harness #pompey,6,0,"Outrageous skill and finish from Portsmouth's Marcus Messi Harness #Pompey 

https://t.co/d4r7CLLc5q","[outrageous, skill, finish, portsmouth's, marcus, messi, harness, #pompey]","['outrageous', 'skill', 'finish', 'portsmouth', 'marcus', 'messi', 'harness', 'pompey']"
297,1312668555402514432,ChrisHammer180,2020-10-04 08:19:06,en,find sam allardyce trending #mcfc,16,1,"When you find out why Sam Allardyce is trending #mcfc
https://t.co/t23nbYGCPI","[find, sam, allardyce, trending, #mcfc]","['find', 'sam', 'allardyce', 'trend', 'mcfc']"
298,1312464349143855111,ChrisHammer180,2020-10-03 18:47:39,en,cbtnorthwest lives road lives roa-oad variations endless,0,0,"@cbtnorthwest ""He lives down the road, he lives down the roa-oad..."". Variations are endless!","[cbtnorthwest, lives, road, lives, roa-oad, variations, endless]","['cbtnorthwest', 'live', 'road', 'live', 'roa', 'oad', 'variation', 'endless']"
299,1312375198658818048,ChrisHammer180,2020-10-03 12:53:24,en,rmabolton kevindavies burndenaces yes trusted previous regimes done burnley surely,0,0,"@rmabolton @Kevin__Davies @BurndenAces Yes, I wouldn't have trusted previous regimes to have done a Burnley. Surely… https://t.co/ga1HKp5MjW","[rmabolton, kevindavies, burndenaces, yes, trusted, previous, regimes, done, burnley, surely]","['rmabolton', 'kevindavies', 'burndenaces', 'yes', 'trust', 'previous', 'regime', 'burnley', 'surely']"
300,1312362415250706432,ChrisHammer180,2020-10-03 12:02:36,en,rmabolton kevindavies burndenaces completely agree financially would helped us flip sid,0,0,"@rmabolton @Kevin__Davies @BurndenAces I completely agree, but financially it would have helped us. On the flip sid… https://t.co/M8yJt5hms1","[rmabolton, kevindavies, burndenaces, completely, agree, financially, would, helped, us, flip, sid]","['rmabolton', 'kevindavies', 'burndenaces', 'completely', 'agree', 'financially', 'help', 'flip', 'sid']"
301,1312355451611295744,ChrisHammer180,2020-10-03 11:34:56,en,kevindavies burndenaces still wonder we'd cocked last game season reach play offs,2,0,@Kevin__Davies @BurndenAces Still wonder where we'd be if we hadn't cocked up that last game of the season to reach the play offs.,"[kevindavies, burndenaces, still, wonder, we'd, cocked, last, game, season, reach, play, offs]","['kevindavies', 'burndenaces', 'wonder', 'cock', 'game', 'season', 'reach', 'play', 'off']"
302,1312354853121863681,ChrisHammer180,2020-10-03 11:32:34,en,tomc -,0,0,@TomC_22 0-0 all over it!,"[tomc, -]",['tomc']
303,1312354550142169088,ChrisHammer180,2020-10-03 11:31:21,en,time bolton drawn group bayern munich harrogate playing likes hinckl,3,0,"This time in 2007, Bolton were drawn in a group with Bayern Munich while Harrogate were playing the likes of Hinckl… https://t.co/4BvQEg8URz","[time, bolton, drawn, group, bayern, munich, harrogate, playing, likes, hinckl]","['time', 'bolton', 'drawn', 'group', 'bayern', 'munich', 'harrogate', 'playing', 'likes', 'hinckl']"
304,1312124999172415489,ChrisHammer180,2020-10-02 20:19:12,en,quarter century since (what's story) morning glory wow noel right #morningglory,1,0,"A quarter of a century since (What's The Story) Morning Glory. Wow. Noel was right wasn't he... 
#MorningGlory25… https://t.co/q2fH71m1XG","[quarter, century, since, (what's, story), morning, glory, wow, noel, right, #morningglory]","['quarter', 'century', 'story', 'morning', 'glory', 'wow', 'noel', 'right', 'morningglory']"
305,1311747200721080322,ChrisHammer180,2020-10-01 19:17:58,en,tbuckleythinks tomc crazy think say old rubbish fact gets thousands likes,1,0,"@tbuckleythinks @TomC_22 Crazy to think you can say any old rubbish as a fact, gets 10s of thousands of likes and i… https://t.co/YX7IQNfiUd","[tbuckleythinks, tomc, crazy, think, say, old, rubbish, fact, gets, thousands, likes]","['tbuckleythinks', 'tomc', 'crazy', 'think', 'old', 'rubbish', 'fact', 'get', 'thousand', 'like']"
306,1311743297493381122,ChrisHammer180,2020-10-01 19:02:27,en,tomc much medicals complete contracts signed,0,0,"@TomC_22 So much for ""medicals complete, contracts signed"" https://t.co/ExXe9t4YGC","[tomc, much, medicals, complete, contracts, signed]","['tomc', 'medical', 'complete', 'contract', 'sign']"
307,1311686147735728131,ChrisHammer180,2020-10-01 15:15:22,en,draw ever topped one #ucldraw,17,2,"No draw has ever topped this one 
#UCLdraw https://t.co/RvdsAbkE7s","[draw, ever, topped, one, #ucldraw]","['draw', 'top', 'ucldraw']"
308,1311614504485126145,ChrisHammer180,2020-10-01 10:30:41,en,dartsbehindthe yes i've hit three bullseye never one visit,3,0,@DartsBehindThe Yes I've hit three bullseye... But never in one visit!,"[dartsbehindthe, yes, i've, hit, three, bullseye, never, one, visit]","['dartsbehindthe', 'yes', 'hit', 'bullseye', 'visit']"
309,1311576214730137600,ChrisHammer180,2020-10-01 07:58:32,en,weirdest way score last minute winner,7,1,"Weirdest way to score a last minute winner

https://t.co/vHhmunNA9g","[weirdest, way, score, last, minute, winner]","['weird', 'way', 'score', 'minute', 'winner']"
310,1311073552729284609,ChrisHammer180,2020-09-29 22:41:08,en,tickerscricket fair point well made jose probably given chance find hand sanitiser,0,0,"@tickerscricket Fair point, well made. Jose probably wouldn't have given him chance to find some hand sanitiser","[tickerscricket, fair, point, well, made, jose, probably, given, chance, find, hand, sanitiser]","['tickerscricket', 'fair', 'point', 'jose', 'probably', 'give', 'chance', 'find', 'hand', 'sanitiser']"
311,1311032409337540610,ChrisHammer180,2020-09-29 19:57:38,en,tomsportsjourno lovely polite answer that's damning bolton's state angry criticism,2,0,@tomsportsjourno Such a lovely polite answer that's more damning about Bolton's state than any angry criticism!,"[tomsportsjourno, lovely, polite, answer, that's, damning, bolton's, state, angry, criticism]","['tomsportsjourno', 'lovely', 'polite', 'answer', 'damn', 'bolton', 'state', 'angry', 'criticism']"
312,1311031213386326017,ChrisHammer180,2020-09-29 19:52:53,en,bolton's new signing arthur gnahoua giving greatest ever answer want sign club,184,38,"Bolton's new signing Arthur Gnahoua giving the greatest ever answer to ""why did you want to sign for this club.""… https://t.co/544RQ8Eeui","[bolton's, new, signing, arthur, gnahoua, giving, greatest, ever, answer, want, sign, club]","['bolton', 'new', 'sign', 'arthur', 'gnahoua', 'give', 'greatest', 'answer', 'want', 'sign', 'club']"
313,1310905165583704065,ChrisHammer180,2020-09-29 11:32:01,en,davesmith sure dancing ice/vardy/rooney fans get never mind,0,0,@DaveSmith8882 Not sure any Dancing On Ice/Vardy/Rooney fans will get it but never mind!,"[davesmith, sure, dancing, ice/vardy/rooney, fans, get, never, mind]","['davesmith', 'sure', 'dance', 'ice', 'vardy', 'rooney', 'fan', 'mind']"
314,1310904529920176135,ChrisHammer180,2020-09-29 11:29:30,en,seeing rebekah vardy trending here's throwback actual greatest moment time,0,0,"Seeing as Rebekah Vardy is trending, here's a throwback to the actual greatest ""It's..."" moment of all time https://t.co/IwJBLfLCSo","[seeing, rebekah, vardy, trending, here's, throwback, actual, greatest, moment, time]","['see', 'rebekah', 'vardy', 'trend', 'throwback', 'actual', 'great', 'moment', 'time']"
315,1310712200168984579,ChrisHammer180,2020-09-28 22:45:15,en,sportinglifefc: jurgen klopp getting stuck roy keane get popcorn #livars #lfc,0,8,"RT @SportingLifeFC: 🥊 Jurgen Klopp getting stuck into Roy Keane

🍿 Get the popcorn!

#LIVARS | #LFC 
https://t.co/RYtiBGLuwa","[sportinglifefc:, jurgen, klopp, getting, stuck, roy, keane, get, popcorn, #livars, #lfc]","['sportinglifefc', 'jurgen', 'klopp', 'get', 'stick', 'roy', 'keane', 'popcorn', 'livars', 'lfc']"
316,1310331470330957831,ChrisHammer180,2020-09-27 21:32:21,en,devon petersen refused let agonising defeats get way incredible ascent believed would,6,0,Devon Petersen refused to let those agonising defeats get in the way of an incredible ascent that he believed would… https://t.co/t9inCJT83x,"[devon, petersen, refused, let, agonising, defeats, get, way, incredible, ascent, believed, would]","['devon', 'petersen', 'refuse', 'let', 'agonising', 'defeat', 'way', 'incredible', 'ascent', 'believe']"
317,1310320356914274313,ChrisHammer180,2020-09-27 20:48:12,en,july: misses match dart reach st final sept: misses match darts win st title tonight: reaches first stage,22,1,"July: Misses match dart to reach 1st final
Sept: Misses 4 match darts to win 1st title
Tonight: Reaches first stage… https://t.co/bc68mF1TnL","[july:, misses, match, dart, reach, st, final, sept:, misses, match, darts, win, st, title, tonight:, reaches, first, stage]","['july', 'miss', 'match', 'dart', 'reach', 'st', 'final', 'sept', 'miss', 'match', 'dart', 'win', 'st', 'title', 'tonight', 'reach', 'stage']"
318,1310303705917521921,ChrisHammer180,2020-09-27 19:42:02,en,sportinglife: nicholas pooran defying laws everything ipl,0,12,"RT @SportingLife: 🤯 Nicholas Pooran defying the laws of everything in the IPL.

https://t.co/ivSZx1np9T","[sportinglife:, nicholas, pooran, defying, laws, everything, ipl]","['sportinglife', 'nicholas', 'pooran', 'defy', 'law', 'ipl']"
319,1310303647163650049,ChrisHammer180,2020-09-27 19:41:48,en,sportinglife: dom jockey training (part ii) car-crash experience riding school intrepid newcol returned,0,13,"RT @SportingLife: 📽️🏇 Dom Does... Jockey Training (Part II)

😮 After a car-crash experience at riding school, our intrepid @newcol returned…","[sportinglife:, dom, jockey, training, (part, ii), car-crash, experience, riding, school, intrepid, newcol, returned]","['sportinglife', 'dom', 'jockey', 'training', 'ii', 'car', 'crash', 'experience', 'ride', 'school', 'intrepid', 'newcol', 'return']"
320,1310211328116744193,ChrisHammer180,2020-09-27 13:34:57,en,brianstr even wins - titles per season that's partly raising,0,0,"@BrianStr66 Even if he ""only"" wins 5-10 titles per season from now on, that's more than partly down to him raising… https://t.co/dnBdIoernz","[brianstr, even, wins, -, titles, per, season, that's, partly, raising]","['brianstr', 'win', 'title', 'season', 'partly', 'raise']"
321,1310181981628461056,ChrisHammer180,2020-09-27 11:38:21,en,player world number one six years taken darts new heights allowed go boil,24,1,A player who has been world number one for six years &amp; taken darts to new heights is allowed to go off the boil for… https://t.co/6N7yIMDYM9,"[player, world, number, one, six, years, taken, darts, new, heights, allowed, go, boil]","['player', 'world', 'number', 'year', 'take', 'dart', 'new', 'height', 'allow', 'boil']"
322,1310142207312134144,ChrisHammer180,2020-09-27 09:00:18,en,sportinglifefc: agrees roy hodgson current handball rule killing game blame referees -,0,10,"RT @SportingLifeFC: 👍 Who agrees with Roy Hodgson that the current handball rule is ""killing the game""?

""I don't blame the referees - they…","[sportinglifefc:, agrees, roy, hodgson, current, handball, rule, killing, game, blame, referees, -]","['sportinglifefc', 'agree', 'roy', 'hodgson', 'current', 'handball', 'rule', 'kill', 'game', 'blame', 'referee']"
323,1309244865948065792,ChrisHammer180,2020-09-24 21:34:35,en,monkers well even intend inspiring words may well,0,0,"@Monkers79 Well, even if he didn't intend it to be inspiring, his words may well have been after all!","[monkers, well, even, intend, inspiring, words, may, well]","['monker', 'intend', 'inspiring', 'word']"
324,1309240931116294145,ChrisHammer180,2020-09-24 21:18:57,en,imagine able ronnie o'sullivan age let alone first year professional,88,13,"Imagine being able to do this to Ronnie O'Sullivan at any age, let alone at 18 in your first year as a professional… https://t.co/pEd1wqxgn6","[imagine, able, ronnie, o'sullivan, age, let, alone, first, year, professional]","['imagine', 'able', 'ronnie', ""o'sullivan"", 'age', 'let', 'year', 'professional']"
325,1309239028202569728,ChrisHammer180,2020-09-24 21:11:23,en,younger players coming theyre good really ronnie o'sullivan may need lose arm,8,1,"""The younger players coming through, they’re not that good, really""

Ronnie O'Sullivan may need to lose an arm and… https://t.co/KDSASklPPu","[younger, players, coming, theyre, good, really, ronnie, o'sullivan, may, need, lose, arm]","['young', 'player', 'come', 'good', 'ronnie', ""o'sullivan"", 'need', 'lose', 'arm']"
326,1309222909815205888,ChrisHammer180,2020-09-24 20:07:20,en,sportinglife: nobody tells gazza story quite like ally mccoist here's one best mark ally's th birthday #rangersfc h,0,24,"RT @SportingLife: 🤣 Nobody tells a Gazza story quite like Ally McCoist. Here's one of his best to mark Ally's 58th birthday

#RangersFC 

h…","[sportinglife:, nobody, tells, gazza, story, quite, like, ally, mccoist, here's, one, best, mark, ally's, th, birthday, #rangersfc, h]","['sportinglife', 'tell', 'gazza', 'story', 'like', 'ally', 'mccoist', 'good', 'mark', 'ally', 'th', 'birthday', 'rangersfc', 'h']"
327,1309039212327469056,ChrisHammer180,2020-09-24 07:57:23,en,warrenallsworth gwsnookertips barryhearn yes right always enter certainly wouldn',0,0,"@warrenallsworth @GWSnookerTips @BarryHearn Yes you are right, they don't always all enter but it certainly wouldn'… https://t.co/loNZCWCBTB","[warrenallsworth, gwsnookertips, barryhearn, yes, right, always, enter, certainly, wouldn']","['warrenallsworth', 'gwsnookertips', 'barryhearn', 'yes', 'right', 'enter', 'certainly', 'wouldn']"
328,1309035969996296195,ChrisHammer180,2020-09-24 07:44:30,en,gwsnookertips barryhearn barney hypothetically invitational tour card opted enter every single,0,0,"@GWSnookerTips @BarryHearn If Barney, hypothetically, had an invitational tour card and opted to enter every single… https://t.co/6LxBiLqJE1","[gwsnookertips, barryhearn, barney, hypothetically, invitational, tour, card, opted, enter, every, single]","['gwsnookertips', 'barryhearn', 'barney', 'hypothetically', 'invitational', 'tour', 'card', 'opt', 'enter', 'single']"
329,1308875270003318784,ChrisHammer180,2020-09-23 21:05:56,en,seems impossible score moment time,0,0,It seems impossible to not score at this moment in time https://t.co/WXuZU1SAug,"[seems, impossible, score, moment, time]","['impossible', 'score', 'moment', 'time']"
330,1308872846022717442,ChrisHammer180,2020-09-23 20:56:18,en,still can't work joelinton scored,77,16,"Still can't work out how Joelinton hasn't scored this

https://t.co/Rb7rRpoe2C","[still, can't, work, joelinton, scored]","['work', 'joelinton', 'score']"
331,1308804526980427777,ChrisHammer180,2020-09-23 16:24:50,en,barney coming retirement enter q school reckon he'll win tour card,0,0,So Barney is coming out of retirement to enter Q School. Reckon he'll win a tour card?,"[barney, coming, retirement, enter, q, school, reckon, he'll, win, tour, card]","['barney', 'come', 'retirement', 'enter', 'q', 'school', 'reckon', 'win', 'tour', 'card']"
332,1308678759927681025,ChrisHammer180,2020-09-23 08:05:05,en,can't believe years ago today nation bag nerves midnight watching sir steve,3,1,Can't believe this was 20 years ago today. When the nation was a bag of nerves after midnight watching Sir Steve Re… https://t.co/bPVw1EgzCZ,"[can't, believe, years, ago, today, nation, bag, nerves, midnight, watching, sir, steve]","['believe', 'year', 'ago', 'today', 'nation', 'bag', 'nerve', 'midnight', 'watch', 'sir', 'steve']"
333,1308532634008653824,ChrisHammer180,2020-09-22 22:24:25,en,tomc he's definitely done purpose social media fame,0,0,@TomC_22 He's definitely done that on purpose  for social media fame,"[tomc, he's, definitely, done, purpose, social, media, fame]","['tomc', 'definitely', 'purpose', 'social', 'medium', 'fame']"
334,1308512183287009282,ChrisHammer180,2020-09-22 21:03:10,en,marcusroworth rupertviney another soundbite added list things expect hear,0,0,"@Marcus_Roworth @RupertViney Another soundbite added to the list of ""things you didn't expect to hear in 2020""!","[marcusroworth, rupertviney, another, soundbite, added, list, things, expect, hear]","['marcusroworth', 'rupertviney', 'soundbite', 'add', 'list', 'thing', 'expect', 'hear']"
335,1308465719907155969,ChrisHammer180,2020-09-22 17:58:32,en,even mask sub deserves medal somehow laughing coach,159,32,"Even with a mask, the sub deserves a medal for somehow not laughing at her coach https://t.co/y0IRis7B4w","[even, mask, sub, deserves, medal, somehow, laughing, coach]","['mask', 'sub', 'deserve', 'medal', 'laugh', 'coach']"
336,1308325964477345795,ChrisHammer180,2020-09-22 08:43:12,en,sportinglifefc: zlatan ibrahimovic's brace ac milan last night means he's scored -top flight seasons seven different,0,7,RT @SportingLifeFC: 👏 Zlatan Ibrahimovic's brace for AC Milan last night means he's now scored in 23-top flight seasons in seven different…,"[sportinglifefc:, zlatan, ibrahimovic's, brace, ac, milan, last, night, means, he's, scored, -top, flight, seasons, seven, different]","['sportinglifefc', 'zlatan', 'ibrahimovic', 'brace', 'ac', 'milan', 'night', 'mean', 'score', '-top', 'flight', 'season', 'seven', 'different']"
337,1307823268011876354,ChrisHammer180,2020-09-20 23:25:39,en,daveallen gezzyprice wonderful event watch brilliantly organised staged pdc great coverage,2,1,"@DaveAllen1981 @Gezzyprice Wonderful event to watch, brilliantly organised and staged by the PDC and great coverage… https://t.co/OPjhv7tz1p","[daveallen, gezzyprice, wonderful, event, watch, brilliantly, organised, staged, pdc, great, coverage]","['daveallen', 'gezzyprice', 'wonderful', 'event', 'watch', 'brilliantly', 'organise', 'stage', 'pdc', 'great', 'coverage']"
338,1307813678536941569,ChrisHammer180,2020-09-20 22:47:33,en,jacquioatley superb coverage always weekend really enjoyed start finish,1,0,"@JacquiOatley Superb coverage as always this weekend, really enjoyed it from start to finish!","[jacquioatley, superb, coverage, always, weekend, really, enjoyed, start, finish]","['jacquioatley', 'superb', 'coverage', 'weekend', 'enjoy', 'start', 'finish']"
339,1307813000829644805,ChrisHammer180,2020-09-20 22:44:52,en,pleased put winning tip anyone read preview know backing / third favourite,4,0,Pleased to have put up a winning tip for anyone who read the preview. I know backing a 6/1 third favourite isn't a… https://t.co/RBstKln7zq,"[pleased, put, winning, tip, anyone, read, preview, know, backing, /, third, favourite]","['pleased', 'win', 'tip', 'read', 'preview', 'know', 'back', 'favourite']"
340,1307799393970671617,ChrisHammer180,2020-09-20 21:50:47,en,incredible gerwyn price looked unbeatable v wright earlier averaging eighth time las,6,0,Incredible from Gerwyn Price. Looked unbeatable v Wright earlier when averaging 100+ for the eighth time in his las… https://t.co/SoRJtym0Za,"[incredible, gerwyn, price, looked, unbeatable, v, wright, earlier, averaging, eighth, time, las]","['incredible', 'gerwyn', 'price', 'look', 'unbeatable', 'v', 'wright', 'earlier', 'averaging', 'eighth', 'time', 'las']"
341,1307796956186578946,ChrisHammer180,2020-09-20 21:41:06,en,way congratulate opponent even though defeat must hurt gerwyn price rob cross,33,2,"What a way to congratulate your opponent even though defeat must have hurt. 

👏 Gerwyn Price and Rob Cross https://t.co/As8zL9DD2Z","[way, congratulate, opponent, even, though, defeat, must, hurt, gerwyn, price, rob, cross]","['way', 'congratulate', 'opponent', 'defeat', 'hurt', 'gerwyn', 'price', 'rob', 'cross']"
342,1307779000035684352,ChrisHammer180,2020-09-20 20:29:45,en,hamisharnold looks like people siding thinking,1,0,@hamisharnold It looks like most people are siding with your thinking!,"[hamisharnold, looks, like, people, siding, thinking]","['hamisharnold', 'look', 'like', 'people', 'side', 'think']"
343,1307778892690845700,ChrisHammer180,2020-09-20 20:29:20,en,driscollmania like outside box thinking - bringing atmosphere emotions equation,0,0,@Driscollmania I like your outside the box thinking - bringing the atmosphere and emotions into the equation!,"[driscollmania, like, outside, box, thinking, -, bringing, atmosphere, emotions, equation]","['driscollmania', 'like', 'outside', 'box', 'thinking', 'bring', 'atmosphere', 'emotion', 'equation']"
