,id,username,created_at,lang,cleaned_tweets,favorite_count,retweet_count,text,tokens,lemmas
0,1393685764043595776,garyvee,2021-05-15 21:52:34,en,ajv innonate msg finally,28,0,@ajv @innonate @msg Finally,"[ajv, innonate, msg, finally]","['ajv', 'innonate', 'msg', 'finally']"
1,1393685711526760456,garyvee,2021-05-15 21:52:21,en,minutes away final drop open market,341,37,4 minutes away from the final drop .. after that it’s all open market ... https://t.co/tukU45Zmog,"[minutes, away, final, drop, open, market]","['minute', 'away', 'final', 'drop', 'open', 'market']"
2,1393654834918789127,garyvee,2021-05-15 19:49:40,en,teamgaryvee: respectfully give damn people's opinions raising bar podcast -- listen applepodca,0,20,"RT @TeamGaryVee: ""How To Respectfully Not Give A Damn About Other People's Opinions | Raising The Bar Podcast"" -- Listen now on @ApplePodca…","[teamgaryvee:, respectfully, give, damn, people's, opinions, raising, bar, podcast, --, listen, applepodca]","['teamgaryvee', 'respectfully', 'damn', 'people', 'opinion', 'raise', 'bar', 'podcast', 'listen', 'applepodca']"
3,1393631601507061760,garyvee,2021-05-15 18:17:20,en,get one free mj im giveaways next week discord,355,28,Get one free MJ ... I’m doing giveaways next week on discord ♥️❤️ https://t.co/KoUtevvuYu,"[get, one, free, mj, im, giveaways, next, week, discord]","['free', 'mj', 'be', 'giveaway', 'week', 'discord']"
4,1393631532674437125,garyvee,2021-05-15 18:17:04,en,kaushalkakadia: garyvee hmmm keyword initial,0,5,"RT @KaushalKakadia: @garyvee Hmmm keyword is ""initial"" 🤔","[kaushalkakadia:, garyvee, hmmm, keyword, initial]","['kaushalkakadia', 'garyvee', 'hmmm', 'keyword', 'initial']"
5,1393628442374123521,garyvee,2021-05-15 18:04:47,en,,102,10,More https://t.co/oSI3UAGH6L,[],[]
6,1393625669972660231,garyvee,2021-05-15 17:53:46,en,got confused lol floor hits lol last initial drop man long week,257,18,Got confused lol 155 is when the floor hits .. lol .. 555 is last initial drop .. man this has been a long week ♥️ https://t.co/Q2vSNSFYqk,"[got, confused, lol, floor, hits, lol, last, initial, drop, man, long, week]","['get', 'confused', 'lol', 'floor', 'hit', 'lol', 'initial', 'drop', 'man', 'long', 'week']"
7,1393605157309591553,garyvee,2021-05-15 16:32:16,en,brianvlasich veefriends lava,24,2,@BrianVlasich @veefriends Lava is just so ...,"[brianvlasich, veefriends, lava]","['brianvlasich', 'veefriends', 'lava']"
8,1393319057055756296,garyvee,2021-05-14 21:35:24,en,teamgaryvee: people flex public wallets digital world kyle jackie show kyleandjackieo -- listen,0,25,"RT @TeamGaryVee: ""How People Will Flex Their Public Wallets In The Digital World | Kyle and Jackie O Show"" @kyleandjackieo -- Listen now on…","[teamgaryvee:, people, flex, public, wallets, digital, world, kyle, jackie, show, kyleandjackieo, --, listen]","['teamgaryvee', 'people', 'flex', 'public', 'wallet', 'digital', 'world', 'kyle', 'jackie', 'kyleandjackieo', 'listen']"
9,1393291047367753728,garyvee,2021-05-14 19:44:06,en,ufgator veefriends u win one discord - giving away tokens next week,37,0,@UF7Gator @veefriends U can win one in my discord - giving away 50 tokens next week,"[ufgator, veefriends, u, win, one, discord, -, giving, away, tokens, next, week]","['ufgator', 'veefriends', 'win', 'discord', 'give', 'away', 'token', 'week']"
10,1393289293083422720,garyvee,2021-05-14 19:37:08,en,rickydebler like marathons,4,0,@RickyDebler I like marathons,"[rickydebler, like, marathons]","['rickydebler', 'like', 'marathon']"
11,1393289133410357249,garyvee,2021-05-14 19:36:30,en,caring something silly id healthy balance life hobbies passions wonderful additions,1073,123,"Caring about something “silly” I’d such a healthy balance to life 

Hobbies and passions are wonderful additions to… https://t.co/iXsokVpKGk","[caring, something, silly, id, healthy, balance, life, hobbies, passions, wonderful, additions]","['care', 'silly', 'would', 'healthy', 'balance', 'life', 'hobby', 'passion', 'wonderful', 'addition']"
12,1393272265396076544,garyvee,2021-05-14 18:29:28,en,journey launch veefriends ill never forget get build years,2214,119,It was such a journey to launch ⁦@veefriends⁩ .. I’ll never forget it .. and now I get to build it for 45 years ❤️… https://t.co/X1kgxRBjEV,"[journey, launch, veefriends, ill, never, forget, get, build, years]","['journey', 'launch', 'veefriends', 'ill', 'forget', 'build', 'year']"
13,1393251396380676101,garyvee,2021-05-14 17:06:32,en,anyone know companys great making halloween costumes,700,40,Anyone know company’s they are great at making Halloween costumes ??,"[anyone, know, companys, great, making, halloween, costumes]","['know', 'company', 'great', 'make', 'halloween', 'costume']"
14,1393238591384477698,garyvee,2021-05-14 16:15:39,en,steveelsewhere: get someone holds way garyvee holds polycom,0,18,RT @SteveElsewhere: Get you someone who holds you the way @garyvee holds a polycom https://t.co/TSs6rfMv21,"[steveelsewhere:, get, someone, holds, way, garyvee, holds, polycom]","['steveelsewhere', 'hold', 'way', 'garyvee', 'hold', 'polycom']"
15,1393226608522190851,garyvee,2021-05-14 15:28:03,und,roadsodapod veefriends veeconference mikefrizzelle lol,5,1,@RoadSodaPod @veefriends @veeconference @mikefrizzelle 💔 ... lol,"[roadsodapod, veefriends, veeconference, mikefrizzelle, lol]","['roadsodapod', 'veefriends', 'veeconference', 'mikefrizzelle', 'lol']"
16,1393225934199791620,garyvee,2021-05-14 15:25:22,en,common sense cool,671,59,🐄 common sense is cool ♥️ https://t.co/MzWS43zFEl,"[common, sense, cool]","['common', 'sense', 'cool']"
17,1393201542594011140,garyvee,2021-05-14 13:48:26,en,teamgaryvee: people flex public wallets digital world kyle jackie show kyleandjackieo -- listen,0,19,"RT @TeamGaryVee: ""How People Will Flex Their Public Wallets In The Digital World | Kyle and Jackie O Show"" @kyleandjackieo -- Listen now on…","[teamgaryvee:, people, flex, public, wallets, digital, world, kyle, jackie, show, kyleandjackieo, --, listen]","['teamgaryvee', 'people', 'flex', 'public', 'wallet', 'digital', 'world', 'kyle', 'jackie', 'kyleandjackieo', 'listen']"
18,1393063691550085121,garyvee,2021-05-14 04:40:40,und,alexmarksd veefriends ty,5,0,@alexmarks3D @veefriends TY,"[alexmarksd, veefriends, ty]","['alexmarksd', 'veefriends', 'ty']"
19,1393057709046517767,garyvee,2021-05-14 04:16:54,en,brianjeronimo: proud owner epic dapper dachshund veefriends garyvee #veefriends,0,10,RT @brianjeronimo: Proud owner of an Epic Dapper Dachshund @veefriends @garyvee #veefriends https://t.co/uZe13hL2gu,"[brianjeronimo:, proud, owner, epic, dapper, dachshund, veefriends, garyvee, #veefriends]","['brianjeronimo', 'proud', 'owner', 'epic', 'dapper', 'dachshund', 'veefriends', 'garyvee', 'veefriends']"
20,1393012655976222728,garyvee,2021-05-14 01:17:52,en,beaveefriend: far tell #observantoyster token number incorporated garyvees signatur,0,19,"RT @beaveefriend: As far as I can tell, #ObservantOyster is the only token that has BOTH, the number 5 incorporated and @garyvee’s signatur…","[beaveefriend:, far, tell, #observantoyster, token, number, incorporated, garyvees, signatur]","['beaveefriend', 'far', 'tell', 'observantoyster', 'token', 'number', 'incorporate', 'garyvee', 'signatur']"
21,1393012598677835784,garyvee,2021-05-14 01:17:39,en,nhojkedals: look cute fellow found playing backyard #veefriends veefriends garyvee,0,11,RT @nhojkedals: Look at this cute fellow I found playing in my backyard. #veefriends @veefriends @garyvee https://t.co/oVxrciWiUD,"[nhojkedals:, look, cute, fellow, found, playing, backyard, #veefriends, veefriends, garyvee]","['nhojkedal', 'look', 'cute', 'fellow', 'find', 'play', 'backyard', 'veefriends', 'veefriends', 'garyvee']"
22,1393012208179814408,garyvee,2021-05-14 01:16:06,en,thelabchick: bigmeesh garyvee veefriends lakers nbatopshot nba,0,9,RT @thelabchick: @BigMeesh33 @garyvee @veefriends @Lakers @nbatopshot @NBA I am now! https://t.co/anGKWQbxLC,"[thelabchick:, bigmeesh, garyvee, veefriends, lakers, nbatopshot, nba]","['thelabchick', 'bigmeesh', 'garyvee', 'veefriends', 'lakers', 'nbatopshot', 'nba']"
23,1393012073144127488,garyvee,2021-05-14 01:15:33,en,decryptmedia: garyvee: decrypt interview,0,12,RT @decryptmedia: .@garyvee: The Decrypt Interview https://t.co/PLq6VBd1o3,"[decryptmedia:, garyvee:, decrypt, interview]","['decryptmedia', 'garyvee', 'decrypt', 'interview']"
24,1392962798599221255,garyvee,2021-05-13 21:59:45,en,teamgaryvee: business need nft strategy cnn interview cnn -- listen spotifypodcasts,0,27,"RT @TeamGaryVee: ""Why Your Business Will Need an NFT Strategy | CNN Interview"" @CNN -- Listen now on @spotifypodcasts https://t.co/Lc6Uvr5j…","[teamgaryvee:, business, need, nft, strategy, cnn, interview, cnn, --, listen, spotifypodcasts]","['teamgaryvee', 'business', 'need', 'nft', 'strategy', 'cnn', 'interview', 'cnn', 'listen', 'spotifypodcast']"
25,1392954637901254663,garyvee,2021-05-13 21:27:20,en,rd drop veefriends pm et see u soon,485,44,3rd drop of @veefriends @ 555pm ET .. see u soon ♥️,"[rd, drop, veefriends, pm, et, see, u, soon]","['rd', 'drop', 'veefriends', 'pm', 'et', 'soon']"
26,1392945125748355072,garyvee,2021-05-13 20:49:32,und,,326,24,https://t.co/RyAg4oYqab,[],[]
27,1392941106308993038,garyvee,2021-05-13 20:33:33,und,skullscrowns bigmeesh veefriends lakers nbatopshot nba,6,0,@SKULLSCROWNS @BigMeesh33 @veefriends @Lakers @nbatopshot @NBA ♥️,"[skullscrowns, bigmeesh, veefriends, lakers, nbatopshot, nba]","['skullscrowns', 'bigmeesh', 'veefriends', 'lakers', 'nbatopshot', 'nba']"
28,1392940934330036225,garyvee,2021-05-13 20:32:52,en,good,157,12,Too good https://t.co/GgdsjE1Gj5,[good],['good']
29,1392940808794411015,garyvee,2021-05-13 20:32:23,en,lobe depth interviews space veefriends,115,18,"https://t.co/N2vnjmaozw

Lobe doing in depth interviews about the space and @veefriends","[lobe, depth, interviews, space, veefriends]","['lobe', 'depth', 'interview', 'space', 'veefriend']"
30,1392875514252218368,garyvee,2021-05-13 16:12:55,en,ramiroitu dude love,18,0,@ramiroitu Dude !!!! I love that,"[ramiroitu, dude, love]","['ramiroitu', 'dude', 'love']"
31,1392874627798609920,garyvee,2021-05-13 16:09:24,en,always doodle meetings interviews :) doodle lot veefriends,176,19,I always doodle in meetings and interviews .... :) now I doodle a lot more ✅✅✅✅ @veefriends https://t.co/iQmOa5K6eA,"[always, doodle, meetings, interviews, :), doodle, lot, veefriends]","['doodle', 'meeting', 'interview', 'doodle', 'lot', 'veefriend']"
32,1392874427382128644,garyvee,2021-05-13 16:08:36,en,doodle love good white board doodle hey benrubi u paper,140,18,A 2013 doodle ... I love a good white board doodle ... hey @Benrubi u have that paper ? https://t.co/GoPHTk1RN5,"[doodle, love, good, white, board, doodle, hey, benrubi, u, paper]","['doodle', 'love', 'good', 'white', 'board', 'doodle', 'hey', 'benrubi', 'u', 'paper']"
33,1392841238689239045,garyvee,2021-05-13 13:56:43,en,murphyjason respect ps hit floor eth get,3,0,@MurphyJason I so so so respect that ... ps 40% of them hit the floor at .5Eth if they get there which is $1900 and… https://t.co/A8lPPHBNQw,"[murphyjason, respect, ps, hit, floor, eth, get]","['murphyjason', 'respect', 'ps', 'hit', 'floor', 'eth']"
34,1392839642253254660,garyvee,2021-05-13 13:50:23,en,skullscrowns yenifercarbaja respect much,24,0,@SKULLSCROWNS @YENIFERCARBAJA2 I respect that so much ♥️,"[skullscrowns, yenifercarbaja, respect, much]","['skullscrowns', 'yenifercarbaja', 'respect']"
35,1392839421423235079,garyvee,2021-05-13 13:49:30,en,true,313,18,True 🇬🇧 https://t.co/T1iC9NSRFx,[true],['true']
36,1392838589281710083,garyvee,2021-05-13 13:46:12,en,murphyjason hope earn respect happens tweet hopeful earn spades,2,1,@MurphyJason I hope to earn your respect on what happens from this tweet on .. I am hopeful to earn it in spades ..… https://t.co/vPKTnLEwnG,"[murphyjason, hope, earn, respect, happens, tweet, hopeful, earn, spades]","['murphyjason', 'hope', 'earn', 'respect', 'happen', 'tweet', 'hopeful', 'earn', 'spade']"
37,1392837892569960451,garyvee,2021-05-13 13:43:25,en,mcfetch teamgaryvee veefriends love,3,0,@Mcfetch12 @TeamGaryVee @veefriends Love this,"[mcfetch, teamgaryvee, veefriends, love]","['mcfetch', 'teamgaryvee', 'veefriends', 'love']"
38,1392837749120643074,garyvee,2021-05-13 13:42:51,und,jgalassodesign reberrys thedavidhu ;),3,0,@jgalassodesign @reberrys @the_david_hu ;),"[jgalassodesign, reberrys, thedavidhu, ;)]","['jgalassodesign', 'reberrys', 'thedavidhu']"
39,1392826202457575425,garyvee,2021-05-13 12:56:58,en,jgalassodesign reberrys thedavidhu im sad hadnt built trust enough janet respect take heart,3,0,@jgalassodesign @reberrys @the_david_hu Im sad I hadn’t built trust enough with you Janet .. but I respect your $0.02 and take them to heart,"[jgalassodesign, reberrys, thedavidhu, im, sad, hadnt, built, trust, enough, janet, respect, take, heart]","['jgalassodesign', 'reberrys', 'thedavidhu', 'be', 'sad', 'not', 'build', 'trust', 'janet', 'respect', 'heart']"
40,1392825988438953984,garyvee,2021-05-13 12:56:07,ht,paps: garyvee lets goooo aye aye,0,9,RT @412Paps: @garyvee let’s goooo aye aye! https://t.co/Vh3ktj2uJy,"[paps:, garyvee, lets, goooo, aye, aye]","['pap', 'garyvee', 'let', 'goooo', 'aye', 'aye']"
41,1392825976741040130,garyvee,2021-05-13 12:56:04,en,vaisakhsabu: heres version patient panda veefriends made garyvee learned super patient content,0,17,RT @vaisakhsabu90: Heres my version of Patient panda of @veefriends made by @garyvee. I have learned to be super patient with content from…,"[vaisakhsabu:, heres, version, patient, panda, veefriends, made, garyvee, learned, super, patient, content]","['vaisakhsabu', 'heres', 'version', 'patient', 'panda', 'veefriends', 'garyvee', 'learn', 'super', 'patient', 'content']"
42,1392825773795516416,garyvee,2021-05-13 12:55:16,en,andrewvolk veeconference humbled,5,0,@andrewvolk @veeconference Humbled,"[andrewvolk, veeconference, humbled]","['andrewvolk', 'veeconference', 'humble']"
43,1392825677188108294,garyvee,2021-05-13 12:54:53,en,alexbender hope timeout,4,0,@alexbender1980 I hope over timeout you will ❤️,"[alexbender, hope, timeout]","['alexbender', 'hope', 'timeout']"
44,1392825353392033809,garyvee,2021-05-13 12:53:36,en,nikolatopo nbatopshot zedrun first im nfts second hope passion hard work,3,0,@nikolatopo @nbatopshot @zed_run First ... I’m so with you on NFT’s !!! Second I hope my passion and hard work over… https://t.co/QcnLSgugqP,"[nikolatopo, nbatopshot, zedrun, first, im, nfts, second, hope, passion, hard, work]","['nikolatopo', 'nbatopshot', 'zedrun', 'be', 'nfts', 'second', 'hope', 'passion', 'hard', 'work']"
45,1392677495988699136,garyvee,2021-05-13 03:06:04,en,jgalassodesign arjun dailytxg i'm making work free ive worked hard janet lo,10,1,@jgalassodesign @Arjun01379882 @DailyTXG i'm not making them work for free? ive worked very hard janet and for a lo… https://t.co/B3mapiNowe,"[jgalassodesign, arjun, dailytxg, i'm, making, work, free, ive, worked, hard, janet, lo]","['jgalassodesign', 'arjun', 'dailytxg', 'make', 'work', 'free', 'have', 'work', 'hard', 'janet', 'lo']"
46,1392677139527487488,garyvee,2021-05-13 03:04:39,en,arjun jgalassodesign dailytxg understand inexpensive concept new doodle,6,0,"@Arjun01379882 @jgalassodesign @DailyTXG i understand it, its not an inexpensive concept and its new and the doodle… https://t.co/al7BChqtJx","[arjun, jgalassodesign, dailytxg, understand, inexpensive, concept, new, doodle]","['arjun', 'jgalassodesign', 'dailytxg', 'understand', 'inexpensive', 'concept', 'new', 'doodle']"
47,1392676305095872515,garyvee,2021-05-13 03:01:20,en,jgalassodesign arjun dailytxg im sad didnt build enough trust years,2,0,@jgalassodesign @Arjun01379882 @DailyTXG and im sad i didnt build enough trust with you through these years for you… https://t.co/2Wx3EgWP0U,"[jgalassodesign, arjun, dailytxg, im, sad, didnt, build, enough, trust, years]","['jgalassodesign', 'arjun', 'dailytxg', 'be', 'sad', 'not', 'build', 'trust', 'year']"
48,1392676125978120198,garyvee,2021-05-13 03:00:37,en,jgalassodesign arjun dailytxg didnt saw give made project janet adore u,2,0,"@jgalassodesign @Arjun01379882 @DailyTXG i didnt saw give me ... i made a project janet .. I adore u , we have been… https://t.co/1UyZYToHAZ","[jgalassodesign, arjun, dailytxg, didnt, saw, give, made, project, janet, adore, u]","['jgalassodesign', 'arjun', 'dailytxg', 'not', 'see', 'project', 'janet', 'adore', 'u']"
49,1392672388941221890,garyvee,2021-05-13 02:45:46,und,,1012,72,https://t.co/AQj4ZhzxWj,[],[]
50,1392672163187068928,garyvee,2021-05-13 02:44:52,und,,761,50,https://t.co/eAcwG5Bzui,[],[]
51,1392671752396869643,garyvee,2021-05-13 02:43:15,en,cmarcisso veefriends im happy :) u whatever works :) also #savingthisfor,34,3,"@CMarcisso @veefriends im so happy :) u do you, whatever works for you :) ...also #savingthisfor2029","[cmarcisso, veefriends, im, happy, :), u, whatever, works, :), also, #savingthisfor]","['cmarcisso', 'veefriends', 'be', 'happy', 'u', 'work', 'savingthisfor']"
52,1392668918918139908,garyvee,2021-05-13 02:31:59,en,ruckerjael: got opportunity interview jimmybutler ahead partnership announcement rhone talked futur,0,32,RT @RuckerJael: I got the opportunity to interview @JimmyButler ahead of his partnership announcement with Rhone. We talked about his futur…,"[ruckerjael:, got, opportunity, interview, jimmybutler, ahead, partnership, announcement, rhone, talked, futur]","['ruckerjael', 'get', 'opportunity', 'interview', 'jimmybutler', 'ahead', 'partnership', 'announcement', 'rhone', 'talk', 'futur']"
53,1392640497529856000,garyvee,2021-05-13 00:39:03,en,therawfounder: wolves garyvee ajv veefriends got rare floor lets fucking gooooooo,0,11,"RT @therawfounder: Where my wolves at? @garyvee @ajv @veefriends I got that very rare off the floor, let’s fucking gooooooo https://t.co/zV…","[therawfounder:, wolves, garyvee, ajv, veefriends, got, rare, floor, lets, fucking, gooooooo]","['therawfounder', 'wolf', 'garyvee', 'ajv', 'veefriends', 'get', 'rare', 'floor', 'let', 'fucking', 'gooooooo']"
54,1392635970105786377,garyvee,2021-05-13 00:21:03,en,bigtaint eighty coreyswiergosz veefriends mike hope prove actions building,5,0,@BigTaint69420 @8_8eighty @coreyswiergosz @veefriends mike i hope to prove to you with my actions of building this… https://t.co/Kp9s736xJ3,"[bigtaint, eighty, coreyswiergosz, veefriends, mike, hope, prove, actions, building]","['bigtaint', 'eighty', 'coreyswiergosz', 'veefriends', 'mike', 'hope', 'prove', 'action', 'build']"
55,1392608055142060034,garyvee,2021-05-12 22:30:08,en,many things revealed go :),298,28,many things will be revealed as we go on :) https://t.co/gLWf6Lm7F7,"[many, things, revealed, go, :)]","['thing', 'reveal']"
56,1392600583446671362,garyvee,2021-05-12 22:00:27,en,wow people clever dutch auctions know coming,141,15,wow .. people are so clever with Dutch Auctions https://t.co/mzETOF8BOx when they know what is coming.. this has be… https://t.co/8SdP8TaXQr,"[wow, people, clever, dutch, auctions, know, coming]","['wow', 'people', 'clever', 'dutch', 'auction', 'know', 'come']"
57,1392598464735977475,garyvee,2021-05-12 21:52:01,en,wallet working well veefriends needing alternative,279,20,the https://t.co/QakfMoz95M wallet working well with @veefriends for those needing a alternative,"[wallet, working, well, veefriends, needing, alternative]","['wallet', 'work', 'veefriends', 'need', 'alternative']"
58,1392597361445191681,garyvee,2021-05-12 21:47:38,en,going fun,155,16,THIS IS GOING TO BE FUN! https://t.co/r0QoD8APVg,"[going, fun]","['go', 'fun']"
59,1392588580112015365,garyvee,2021-05-12 21:12:45,en,teamgaryvee: modern finance kevin rose: veefriends kevinrose veefriends -- listen spotifypodcasts,0,11,"RT @TeamGaryVee: ""Modern Finance With Kevin Rose: VeeFriends"" @kevinrose @veefriends -- Listen now on @spotifypodcasts https://t.co/Lc6Uvrm…","[teamgaryvee:, modern, finance, kevin, rose:, veefriends, kevinrose, veefriends, --, listen, spotifypodcasts]","['teamgaryvee', 'modern', 'finance', 'kevin', 'rise', 'veefriends', 'kevinrose', 'veefriends', 'listen', 'spotifypodcast']"
60,1392584960846962688,garyvee,2021-05-12 20:58:22,en,louisgeneux: found missed turnt tick floor garyvee im,0,9,"RT @louisgeneux: just found out I missed out on turnt tick floor @garyvee 

Im 💀","[louisgeneux:, found, missed, turnt, tick, floor, garyvee, im]","['louisgeneux', 'find', 'miss', 'turnt', 'tick', 'floor', 'garyvee', 'be']"
61,1392575707419750400,garyvee,2021-05-12 20:21:36,en,flossboys: homie going veecon garyvee veefriends ajv,0,9,RT @FlossBoys: Me and the homie are going to VeeCon @garyvee @veefriends @ajv https://t.co/vvdpZunfyh,"[flossboys:, homie, going, veecon, garyvee, veefriends, ajv]","['flossboys', 'homie', 'go', 'veecon', 'garyvee', 'veefriends', 'ajv']"
62,1392575690210484224,garyvee,2021-05-12 20:21:32,en,thesashagroup: may - mickeycloud garyvee featured keynote speakers powderkegco unvalley,0,10,"RT @TheSashaGroup: On May 19-20, our very own @mickeycloud + @garyvee   will be featured as keynote speakers at the @PowderkegCo Unvalley 2…","[thesashagroup:, may, -, mickeycloud, garyvee, featured, keynote, speakers, powderkegco, unvalley]","['thesashagroup', 'mickeycloud', 'garyvee', 'feature', 'keynote', 'speaker', 'powderkegco', 'unvalley']"
63,1392575628487053318,garyvee,2021-05-12 20:21:17,en,emojimatt teamgaryvee veefriends lets go,2,0,@Emojimatt_ @TeamGaryVee @veefriends LETS GO!,"[emojimatt, teamgaryvee, veefriends, lets, go]","['emojimatt', 'teamgaryvee', 'veefriends', 'let']"
64,1392575591757582337,garyvee,2021-05-12 20:21:08,en,emojimatt dude,4,0,@Emojimatt_ DUDE!,"[emojimatt, dude]","['emojimatt', 'dude']"
65,1392575571092287490,garyvee,2021-05-12 20:21:03,en,cryptoreedz always take care family first,8,0,@CryptoReedz always take care of family first!,"[cryptoreedz, always, take, care, family, first]","['cryptoreedz', 'care', 'family']"
66,1392575284256387082,garyvee,2021-05-12 20:19:55,en,gregisenberg philtoronto veefriends krainak actually much he's boss people know lo,13,0,"@gregisenberg @philtoronto @veefriends @krainak he actually had too much .. he's my boss, people just don't know LO… https://t.co/6ESOt9Cx1G","[gregisenberg, philtoronto, veefriends, krainak, actually, much, he's, boss, people, know, lo]","['gregisenberg', 'philtoronto', 'veefriends', 'krainak', 'actually', 'boss', 'people', 'know', 'lo']"
67,1392575142476369925,garyvee,2021-05-12 20:19:21,und,,215,29,https://t.co/ITF5kNDMTb,[],[]
68,1392571766300610563,garyvee,2021-05-12 20:05:56,en,coreyswiergosz veefriends humbled period,9,0,@coreyswiergosz @veefriends humbled period,"[coreyswiergosz, veefriends, humbled, period]","['coreyswiergosz', 'veefriends', 'humble', 'period']"
69,1392547669311172610,garyvee,2021-05-12 18:30:11,en,insane watch humbled veefriends,637,31,This is insane to watch .. so humbled ❤️❤️❤️❤️❤️. @veefriends,"[insane, watch, humbled, veefriends]","['insane', 'watch', 'humble', 'veefriend']"
70,1392547610129584130,garyvee,2021-05-12 18:29:57,en,iearlgreytv veefriends im humbled,7,0,@iEarlGreyTV @veefriends I’m so humbled,"[iearlgreytv, veefriends, im, humbled]","['iearlgreytv', 'veefriends', 'be', 'humble']"
71,1392547549387571200,garyvee,2021-05-12 18:29:42,en,lot home work people like jmmyeth incredible support,161,13,I did a lot of home work and had people like @j1mmyeth be incredible support https://t.co/Cvp0iXV3xZ,"[lot, home, work, people, like, jmmyeth, incredible, support]","['lot', 'home', 'work', 'people', 'like', 'jmmyeth', 'incredible', 'support']"
72,1392547426255376385,garyvee,2021-05-12 18:29:13,en,superunsexy: many people sleeping sweet swan veefriends garyvee disposable id bought every one,0,10,"RT @SuperUnsexy: Too many people sleeping on the Sweet Swan @veefriends @garyvee

If I had more disposable I’d have bought every one of the…","[superunsexy:, many, people, sleeping, sweet, swan, veefriends, garyvee, disposable, id, bought, every, one]","['superunsexy', 'people', 'sleep', 'sweet', 'swan', 'veefriends', 'garyvee', 'disposable', 'would', 'buy']"
73,1392541865052868609,garyvee,2021-05-12 18:07:07,en,digitalpratik: #grateful practical lesson learnt garyvee #macro patience #micro speed,0,14,RT @digitalpratik: I am so very #grateful for the most practical lesson I have learnt from @garyvee which is #Macro patience &amp; #Micro speed…,"[digitalpratik:, #grateful, practical, lesson, learnt, garyvee, #macro, patience, #micro, speed]","['digitalpratik', 'grateful', 'practical', 'lesson', 'learn', 'garyvee', 'macro', 'patience', 'micro', 'speed']"
74,1392541820278693891,garyvee,2021-05-12 18:06:56,en,wow im humbled veefriends,239,21,"Wow💥 ...Im so humbled @veefriends 

https://t.co/mzETOF8BOx","[wow, im, humbled, veefriends]","['wow', 'be', 'humble', 'veefriends']"
75,1392540088614236174,garyvee,2021-05-12 18:00:03,en,goat gas wars wow,828,52,goat gas wars .. wow,"[goat, gas, wars, wow]","['goat', 'gas', 'war', 'wow']"
76,1392540056691281926,garyvee,2021-05-12 17:59:56,en,teedubya veefriends nailed,2,0,@teedubya @veefriends nailed it,"[teedubya, veefriends, nailed]","['teedubya', 'veefriends', 'nail']"
77,1392539911077699588,garyvee,2021-05-12 17:59:21,en,coreyswiergosz: lets go garyvee juicy jaguar time,0,9,RT @coreyswiergosz: Let’s go @garyvee !! Juicy Jaguar time https://t.co/JoZBgTG9au,"[coreyswiergosz:, lets, go, garyvee, juicy, jaguar, time]","['coreyswiergosz', 'let', 'garyvee', 'juicy', 'jaguar', 'time']"
