,id,username,created_at,lang,cleaned_tweets,favorite_count,retweet_count,text,tokens,lemmas
261,1381950143209988099,ShamikaRavi,2021-04-13 12:39:24,en,raisinadialogue: shamikaravi significant experimentation emerging startup space targeting social impact improving ac,0,5,"RT @raisinadialogue: .@ShamikaRavi there is significant experimentation emerging in the startup space targeting social impact, improving ac…","[raisinadialogue:, shamikaravi, significant, experimentation, emerging, startup, space, targeting, social, impact, improving, ac]","['raisinadialogue', 'shamikaravi', 'significant', 'experimentation', 'emerge', 'startup', 'space', 'target', 'social', 'impact', 'improve', 'ac']"
262,1381946704899891202,ShamikaRavi,2021-04-13 12:25:44,en,raisinadialogue: live tweeting discussion pandemic poser: health ir sureshpprabhu azizsyamsuddin carlb,0,13,"RT @raisinadialogue: We are LIVE tweeting the discussion Pandemic Poser: Health and the 4IR with @sureshpprabhu,  @aziz_syamsuddin,  @carlb…","[raisinadialogue:, live, tweeting, discussion, pandemic, poser:, health, ir, sureshpprabhu, azizsyamsuddin, carlb]","['raisinadialogue', 'live', 'tweet', 'discussion', 'pandemic', 'poser', 'health', 'ir', 'sureshpprabhu', 'azizsyamsuddin', 'carlb']"
263,1381946665095942144,ShamikaRavi,2021-04-13 12:25:34,en,samirsaran: #raisina pandemic poser: health ir shamikaravi gioasempre sureshpprabhu carlbildt,0,10,"RT @samirsaran: #Raisina2021 Pandemic Poser: Health and the 4IR

@ShamikaRavi @gioasempre @sureshpprabhu @carlbildt 

https://t.co/oXZ4EJOA…","[samirsaran:, #raisina, pandemic, poser:, health, ir, shamikaravi, gioasempre, sureshpprabhu, carlbildt]","['samirsaran', 'raisina', 'pandemic', 'poser', 'health', 'ir', 'shamikaravi', 'gioasempre', 'sureshpprabhu', 'carlbildt']"
264,1381946241970446340,ShamikaRavi,2021-04-13 12:23:54,en,raisinadialogue: shamikaravi: covid- health well economic crisis debate lives livelihoods grossly mi,0,6,RT @raisinadialogue: .@ShamikaRavi: Covid-19 is a health as well as economic crisis. The debate between lives and livelihoods is grossly mi…,"[raisinadialogue:, shamikaravi:, covid-, health, well, economic, crisis, debate, lives, livelihoods, grossly, mi]","['raisinadialogue', 'shamikaravi', 'covid-', 'health', 'economic', 'crisis', 'debate', 'live', 'livelihood', 'grossly', 'mi']"
265,1381944567239352325,ShamikaRavi,2021-04-13 12:17:14,en,enough test positivity rate rising beyond big variations across states: mh (),90,15,"Is it enough? No. 
Our test positivity rate is once again rising beyond 5%
Big variations across states: MH (15.5%)… https://t.co/CIoR22Rm2t","[enough, test, positivity, rate, rising, beyond, big, variations, across, states:, mh, ()]","['test', 'positivity', 'rate', 'rise', 'big', 'variation', 'state', 'mh']"
266,1381944562461986817,ShamikaRavi,2021-04-13 12:17:13,en,national level daily tests higher everand rising sharply,91,12,"At the national level, daily tests are higher than ever...and rising sharply. https://t.co/z8RUL2d6rO","[national, level, daily, tests, higher, everand, rising, sharply]","['national', 'level', 'daily', 'test', 'higher', 'everand', 'rise', 'sharply']"
267,1381944557508587522,ShamikaRavi,2021-04-13 12:17:12,en,#covidindia several queries testing every state india ramping daily testing,154,26,#COVID19India There have been several queries about testing. Every state in India is ramping up daily testing once… https://t.co/5IcpLV6XUO,"[#covidindia, several, queries, testing, every, state, india, ramping, daily, testing]","['covidindia', 'query', 'test', 'state', 'india', 'ramp', 'daily', 'testing']"
268,1381910749744820225,ShamikaRavi,2021-04-13 10:02:52,en,finally covid vaccines granted emergency approval restricted use usfda ema uk mhra pmda,1268,171,"Finally! COVID19 vaccines that have been granted emergency approval for restricted use by USFDA, EMA, UK MHRA, PMDA… https://t.co/OqozyRSNAD","[finally, covid, vaccines, granted, emergency, approval, restricted, use, usfda, ema, uk, mhra, pmda]","['finally', 'covid', 'vaccine', 'grant', 'emergency', 'approval', 'restrict', 'use', 'usfda', 'ema', 'uk', 'mhra', 'pmda']"
269,1381864947097903110,ShamikaRavi,2021-04-13 07:00:51,und,thedwivedula pmoindia nitiaayog,1,0,@TheDwivedula @PMOIndia @NITIAayog 🙏,"[thedwivedula, pmoindia, nitiaayog]","['thedwivedula', 'pmoindia', 'nitiaayog']"
270,1381848596144738306,ShamikaRavi,2021-04-13 05:55:53,en,today auspicious day remember mantra - resolve restraint #navratri #gudipadwa #ugadi #ramazan,148,16,"Today is an auspicious day. Remember the mantra - resolve &amp; restraint. 🙏
#Navratri #GudiPadwa #Ugadi #Ramazan… https://t.co/JnNV3geJLE","[today, auspicious, day, remember, mantra, -, resolve, restraint, #navratri, #gudipadwa, #ugadi, #ramazan]","['today', 'auspicious', 'day', 'remember', 'mantra', 'resolve', 'restraint', 'navratri', 'gudipadwa', 'ugadi', 'ramazan']"
271,1381840856244580353,ShamikaRavi,2021-04-13 05:25:08,en,rising deaths across states:,99,30,Rising deaths across states: https://t.co/fV2qBBGbr7,"[rising, deaths, across, states:]","['rise', 'death', 'state']"
272,1381840849470857219,ShamikaRavi,2021-04-13 05:25:06,et,new cases per million - spreading fastest in: ) delhi ) maharashtra ) chhattisgarh ) chandigarh ) goa ) ladak,83,29,"New cases per million - spreading fastest in:
1) Delhi
2) Maharashtra
3) Chhattisgarh
4) Chandigarh
5) Goa
6) Ladak… https://t.co/z8ldLB6rZp","[new, cases, per, million, -, spreading, fastest, in:, ), delhi, ), maharashtra, ), chhattisgarh, ), chandigarh, ), goa, ), ladak]","['new', 'case', 'million', 'spread', 'fast', 'delhi', 'maharashtra', 'chhattisgarh', 'chandigarh', 'goa', 'ladak']"
273,1381838070991843329,ShamikaRavi,2021-04-13 05:14:04,en,daily new cases: relentless surge,81,24,Daily new cases: relentless surge https://t.co/1xj2UYdPHI,"[daily, new, cases:, relentless, surge]","['daily', 'new', 'case', 'relentless', 'surge']"
274,1381838061420486658,ShamikaRavi,2021-04-13 05:14:01,en,growth rate active cases - across lockdown post lockdown second wave,65,13,"Growth rate of active cases - across lockdown, post lockdown &amp; second wave https://t.co/aSHTTQZ8gN","[growth, rate, active, cases, -, across, lockdown, post, lockdown, second, wave]","['growth', 'rate', 'active', 'case', 'lockdown', 'post', 'lockdown', 'second', 'wave']"
275,1381835781497520135,ShamikaRavi,2021-04-13 05:04:58,en,#covidindia surging infection lowering mobility people - lockdown lockdown biggest decline,409,93,#COVID19India The surging infection is lowering mobility of people - lockdown or no lockdown. The biggest decline i… https://t.co/IBDCzsBooq,"[#covidindia, surging, infection, lowering, mobility, people, -, lockdown, lockdown, biggest, decline]","['covidindia', 'surge', 'infection', 'lower', 'mobility', 'people', 'lockdown', 'lockdown', 'big', 'decline']"
276,1381833262306238466,ShamikaRavi,2021-04-13 04:54:57,en,kid super thrilled took back yearsthe box looks exactly tech upgradation al,306,8,"The kid is super thrilled. Took me back 35 years...the box looks exactly the same. As in, no tech upgradation at al… https://t.co/c9LN0PRDye","[kid, super, thrilled, took, back, yearsthe, box, looks, exactly, tech, upgradation, al]","['kid', 'super', 'thrilled', 'take', 'yearsthe', 'box', 'look', 'exactly', 'tech', 'upgradation', 'al']"
277,1381832352557490178,ShamikaRavi,2021-04-13 04:51:20,en,absolutely public consumption happy gudi padava,103,7,Absolutely. It is for public consumption. Happy Gudi Padava! https://t.co/VRwORlsOM5,"[absolutely, public, consumption, happy, gudi, padava]","['absolutely', 'public', 'consumption', 'happy', 'gudi', 'padava']"
278,1381831665593376769,ShamikaRavi,2021-04-13 04:48:36,en,new geometry box - source latest excitement household #magic,422,15,A new geometry box - source of latest excitement in the household. #magic,"[new, geometry, box, -, source, latest, excitement, household, #magic]","['new', 'geometry', 'box', 'source', 'late', 'excitement', 'household', 'magic']"
279,1381822677409615875,ShamikaRavi,2021-04-13 04:12:53,en,jeevantrampal vishypingali iimahmedabad fascinating research agenda jeevant look forward papers,6,0,@jeevantrampal @VishyPingali @IIMAhmedabad And you have a fascinating research agenda Jeevant! I look forward to the papers.,"[jeevantrampal, vishypingali, iimahmedabad, fascinating, research, agenda, jeevant, look, forward, papers]","['jeevantrampal', 'vishypingali', 'iimahmedabad', 'fascinating', 'research', 'agenda', 'jeevant', 'look', 'forward', 'paper']"
280,1381821831309488132,ShamikaRavi,2021-04-13 04:09:32,en,jeevantrampal: nice conversation shamikaravi vishypingali love well articulate thoughts complex issues,0,2,RT @jeevantrampal: Nice conversation with @ShamikaRavi and @VishyPingali. Love how well they articulate their thoughts on complex issues. T…,"[jeevantrampal:, nice, conversation, shamikaravi, vishypingali, love, well, articulate, thoughts, complex, issues]","['jeevantrampal', 'nice', 'conversation', 'shamikaravi', 'vishypingali', 'love', 'articulate', 'thought', 'complex', 'issue']"
281,1381814057771016197,ShamikaRavi,2021-04-13 03:38:38,en,satyshivs: good article prof shamikaravi #farmerpolitics punjab,0,6,"RT @SatyshivS: A very good article by Prof @ShamikaRavi on #FarmerPolitics in Punjab. 

https://t.co/JAugm5tiVk","[satyshivs:, good, article, prof, shamikaravi, #farmerpolitics, punjab]","['satyshivs', 'good', 'article', 'prof', 'shamikaravi', 'farmerpolitics', 'punjab']"
282,1381791820208742401,ShamikaRavi,2021-04-13 02:10:17,en,blogbroadstreet: state capacity: useful concept meaningless pablum,0,58,RT @BlogBroadstreet: State capacity: a useful concept or meaningless pablum? https://t.co/ikzpfWciLg,"[blogbroadstreet:, state, capacity:, useful, concept, meaningless, pablum]","['blogbroadstreet', 'state', 'capacity', 'useful', 'concept', 'meaningless', 'pablum']"
283,1381782818586468355,ShamikaRavi,2021-04-13 01:34:30,hi,orfhindi: gioasempre su,0,4,"RT @orfhindi: वैश्विक स्वास्थ्य में डिजिटल परिवर्तन को उत्प्रेरित करने के लिए सरकारें एकल और साझेदारी में क्या कर सकती हैं?
@gioasempre @su…","[orfhindi:, gioasempre, su]","['orfhindi', 'gioasempre', 'su']"
284,1381615219928047617,ShamikaRavi,2021-04-12 14:28:32,en,orfonline: #raisina day conversation : sureshpprabhu azizsyamsuddin carlbildt sim,0,9,"RT @orfonline: #Raisina2021 | Day 1 Conversation

𝗣𝗮𝗻𝗱𝗲𝗺𝗶𝗰 𝗣𝗼𝘀𝗲𝗿: 𝗛𝗲𝗮𝗹𝘁𝗵 𝗮𝗻𝗱 𝘁𝗵𝗲 𝟰𝗜𝗥 with @sureshpprabhu, @aziz_syamsuddin, @carlbildt, Sim…","[orfonline:, #raisina, day, conversation, :, sureshpprabhu, azizsyamsuddin, carlbildt, sim]","['orfonline', 'raisina', 'day', 'conversation', 'sureshpprabhu', 'azizsyamsuddin', 'carlbildt', 'sim']"
285,1381556817700868098,ShamikaRavi,2021-04-12 10:36:28,en,#sputnikv approved emergency use india v good news given excess demand existin,1689,340,#SputnikV has been approved for emergency use in India. This is v good news given our excess demand and the existin… https://t.co/lFrss54vuS,"[#sputnikv, approved, emergency, use, india, v, good, news, given, excess, demand, existin]","['sputnikv', 'approve', 'emergency', 'use', 'india', 'v', 'good', 'news', 'give', 'excess', 'demand', 'existin']"
286,1381518001917194242,ShamikaRavi,2021-04-12 08:02:13,und,yourssiddhant yes,1,0,@yoursSiddhant Yes,"[yourssiddhant, yes]","['yourssiddhant', 'yes']"
287,1381482796456108035,ShamikaRavi,2021-04-12 05:42:20,en,thoroughly enjoyed discussion 'behavioural science policymaking' - professors vishypingali,74,11,Thoroughly enjoyed the discussion on 'Behavioural Science in Policymaking'  - with professors @VishyPingali and… https://t.co/qgMZ19qIsP,"[thoroughly, enjoyed, discussion, 'behavioural, science, policymaking', -, professors, vishypingali]","['thoroughly', 'enjoy', 'discussion', 'behavioural', 'science', 'policymaking', 'professor', 'vishypingali']"
288,1381470104597057536,ShamikaRavi,2021-04-12 04:51:54,en,shamikaravi: yesman necessary beginning - buy us time - bolster infra (ppe testing masks oxygen beds etc,0,55,"RT @ShamikaRavi: @yesman7289 It was necessary in the beginning - to buy us time - to bolster infra (PPE, testing, masks, oxygen, beds, etc.…","[shamikaravi:, yesman, necessary, beginning, -, buy, us, time, -, bolster, infra, (ppe, testing, masks, oxygen, beds, etc]","['shamikaravi', 'yesman', 'necessary', 'beginning', 'buy', 'time', 'bolster', 'infra', 'ppe', 'testing', 'mask', 'oxygen', 'bed', 'etc']"
289,1381469592300572672,ShamikaRavi,2021-04-12 04:49:51,en,yesman necessary beginning - buy us time - bolster infra (ppe testing masks oxygen bed,434,55,"@yesman7289 It was necessary in the beginning - to buy us time - to bolster infra (PPE, testing, masks, oxygen, bed… https://t.co/8uHHJA0VXe","[yesman, necessary, beginning, -, buy, us, time, -, bolster, infra, (ppe, testing, masks, oxygen, bed]","['yesman', 'necessary', 'beginning', 'buy', 'time', 'bolster', 'infra', 'ppe', 'testing', 'mask', 'oxygen', 'bed']"
290,1381468689833230337,ShamikaRavi,2021-04-12 04:46:16,en,high growth infection everywhere india - including eastern states,374,100,But there is high growth in infection *everywhere* in India - including eastern states. https://t.co/RmtLWSLZop,"[high, growth, infection, everywhere, india, -, including, eastern, states]","['high', 'growth', 'infection', 'india', 'include', 'eastern', 'state']"
291,1381468681532698625,ShamikaRavi,2021-04-12 04:46:14,en,biggest growth: mh dl ct ch ga kl ka,418,128,"The biggest growth: MH, DL, CT, CH, GA, KL, KA https://t.co/PshAvHdlml","[biggest, growth:, mh, dl, ct, ch, ga, kl, ka]","['big', 'growth', 'mh', 'dl', 'ct', 'ch', 'ga', 'kl', 'ka']"
292,1381467191296487424,ShamikaRavi,2021-04-12 04:40:19,en,#covidindia insane health system sustain enormous growth infections - across state,3526,1177,"#COVID19India This is insane! 
No health system can sustain such enormous growth in infections - across any state,… https://t.co/dVGd3PrSOQ","[#covidindia, insane, health, system, sustain, enormous, growth, infections, -, across, state]","['covidindia', 'insane', 'health', 'system', 'sustain', 'enormous', 'growth', 'infection', 'state']"
293,1381298689428230147,ShamikaRavi,2021-04-11 17:30:45,en,country country seeing plot unfold unsustainable chinese debt unviable infrastructure proje,466,135,"Country after country we are seeing the same plot unfold. Unsustainable Chinese debt, unviable infrastructure proje… https://t.co/F3KQSAwrkR","[country, country, seeing, plot, unfold, unsustainable, chinese, debt, unviable, infrastructure, proje]","['country', 'country', 'see', 'plot', 'unfold', 'unsustainable', 'chinese', 'debt', 'unviable', 'infrastructure', 'proje']"
294,1381292928186785792,ShamikaRavi,2021-04-11 17:07:51,en,profitechconsu drharshvardhan open empirical question right need regular genome mapping across state,19,2,@profitechconsu1 @drharshvardhan Open empirical question right now. Need more &amp; regular genome mapping across state… https://t.co/b4wxMe96Vt,"[profitechconsu, drharshvardhan, open, empirical, question, right, need, regular, genome, mapping, across, state]","['profitechconsu', 'drharshvardhan', 'open', 'empirical', 'question', 'right', 'need', 'regular', 'genome', 'mapping', 'state']"
295,1381289454166368256,ShamikaRavi,2021-04-11 16:54:03,en,raisinadialogue: governments singly partnership catalyse digital transformation global health #tellraisina,0,11,"RT @raisinadialogue: What can governments do singly and in partnership to catalyse a digital transformation in global health?

#TellRaisina…","[raisinadialogue:, governments, singly, partnership, catalyse, digital, transformation, global, health, #tellraisina]","['raisinadialogue', 'government', 'singly', 'partnership', 'catalyse', 'digital', 'transformation', 'global', 'health', 'tellraisina']"
296,1381286923616985089,ShamikaRavi,2021-04-11 16:44:00,en,fascinating study think governance/administrative reforms - several attempts reforms ends mak,220,45,Fascinating study! Now think of governance/administrative reforms - and why several attempts at reforms ends up mak… https://t.co/RilccTPPDq,"[fascinating, study, think, governance/administrative, reforms, -, several, attempts, reforms, ends, mak]","['fascinating', 'study', 'think', 'governance', 'administrative', 'reform', 'attempt', 'reform', 'end', 'mak']"
297,1381253071783620609,ShamikaRavi,2021-04-11 14:29:29,en,rip bob mundell giant macroeconomics,283,23,"RIP Bob Mundell, a giant of macroeconomics.","[rip, bob, mundell, giant, macroeconomics]","['rip', 'bob', 'mundell', 'giant', 'macroeconomics']"
298,1381222682423742467,ShamikaRavi,2021-04-11 12:28:44,en,daily vaccinations: sharp rise april last days seen daily,226,24,Daily vaccinations: sharp rise in April. 7 out of last 10 days have seen &gt;3.5M daily. https://t.co/qCiDN9Gm09,"[daily, vaccinations:, sharp, rise, april, last, days, seen, daily]","['daily', 'vaccination', 'sharp', 'rise', 'april', 'day', 'see', 'daily']"
299,1381222671166283778,ShamikaRavi,2021-04-11 12:28:41,ca,total vaccinations,359,35,Total vaccinations &gt; 101M https://t.co/E7weDxS0it,"[total, vaccinations]","['total', 'vaccination']"
300,1381159428871782400,ShamikaRavi,2021-04-11 08:17:23,en,daily testing daily cases: across states uts highest test positivity rate: mh ga chandigarh nl kl ct wb,51,13,"Daily testing &amp; Daily cases: across states and UTs
Highest test positivity rate: MH, GA, Chandigarh, NL, KL, CT, WB… https://t.co/MBeZFiK53V","[daily, testing, daily, cases:, across, states, uts, highest, test, positivity, rate:, mh, ga, chandigarh, nl, kl, ct, wb]","['daily', 'test', 'daily', 'case', 'state', 'uts', 'high', 'test', 'positivity', 'rate', 'mh', 'ga', 'chandigarh', 'nl', 'kl', 'ct', 'wb']"
301,1381159423406563329,ShamikaRavi,2021-04-11 08:17:21,en,testing enough test positivity rate (who benchmark) poised increase testing,57,15,"Are we testing enough? 
The test positivity rate ~5% (@WHO benchmark) is poised to increase once again. So testing… https://t.co/q5SiwMDtIi","[testing, enough, test, positivity, rate, (who, benchmark), poised, increase, testing]","['test', 'test', 'positivity', 'rate', 'benchmark', 'poise', 'increase', 'testing']"
302,1381159417433837568,ShamikaRavi,2021-04-11 08:17:20,en,daily testing: rising sharply,50,10,Daily testing: rising sharply https://t.co/4r7sIr3fes,"[daily, testing:, rising, sharply]","['daily', 'testing', 'rise', 'sharply']"
303,1381154909777584140,ShamikaRavi,2021-04-11 07:59:25,en,daily cases: respite,67,14,Daily cases: no respite... https://t.co/6SgdZroCRT,"[daily, cases:, respite]","['daily', 'case', 'respite']"
304,1381153607085486081,ShamikaRavi,2021-04-11 07:54:15,en,overall situation:,69,18,Overall situation: https://t.co/RiwJdG2sAH,"[overall, situation:]","['overall', 'situation']"
305,1381153599447728130,ShamikaRavi,2021-04-11 07:54:13,en,daily vaccinations: rising steadily,71,12,Daily vaccinations: rising steadily. https://t.co/Mnq3I63e1P,"[daily, vaccinations:, rising, steadily]","['daily', 'vaccination', 'rise', 'steadily']"
306,1381153594607501318,ShamikaRavi,2021-04-11 07:54:12,en,growth rate active cases: lockdowns post lockdowns second wave (currently: ),64,13,"Growth rate of active cases: lockdowns, post lockdowns &amp; second wave. (Currently: 6.9%) https://t.co/OXoILKYMXd","[growth, rate, active, cases:, lockdowns, post, lockdowns, second, wave, (currently:, )]","['growth', 'rate', 'active', 'case', 'lockdown', 'post', 'lockdown', 'second', 'wave', 'currently']"
307,1381153589901418499,ShamikaRavi,2021-04-11 07:54:11,en,#covidindia daily cases daily deaths: rising,308,98,#COVID19India Daily cases &amp; Daily deaths: both rising https://t.co/tO60C0rWId,"[#covidindia, daily, cases, daily, deaths:, rising]","['covidindia', 'daily', 'case', 'daily', 'death', 'rise']"
308,1381090278266740738,ShamikaRavi,2021-04-11 03:42:36,en,raisinadialogue: shamika ravi (shamikaravi) non-resident senior fellow brookings institution speaking #raisina reg,0,3,"RT @raisinadialogue: Shamika Ravi (@ShamikaRavi), Non-resident Senior Fellow, Brookings Institution will be speaking at #Raisina2021. 

Reg…","[raisinadialogue:, shamika, ravi, (shamikaravi), non-resident, senior, fellow, brookings, institution, speaking, #raisina, reg]","['raisinadialogue', 'shamika', 'ravi', 'shamikaravi', 'non', 'resident', 'senior', 'fellow', 'brookings', 'institution', 'speak', 'raisina', 'reg']"
309,1380939988171325441,ShamikaRavi,2021-04-10 17:45:24,en,thebetterindia: heard famous lines khoob ladi mardani woh toh jhansiwali rani thi recall legendary woman pe,0,54,"RT @thebetterindia: Heard the famous lines ‘Khoob Ladi Mardani, Woh Toh Jhansiwali Rani Thi’? We recall the legendary woman who not only pe…","[thebetterindia:, heard, famous, lines, khoob, ladi, mardani, woh, toh, jhansiwali, rani, thi, recall, legendary, woman, pe]","['thebetterindia', 'hear', 'famous', 'line', 'khoob', 'ladi', 'mardani', 'woh', 'toh', 'jhansiwali', 'rani', 'thi', 'recall', 'legendary', 'woman', 'pe']"
310,1380903039507197956,ShamikaRavi,2021-04-10 15:18:35,en,jaycee artists signed mobile number,5,0,@jaycee1301 The artists have signed with their mobile number👍 https://t.co/2fLnowN7vx,"[jaycee, artists, signed, mobile, number]","['jaycee', 'artists', 'sign', 'mobile', 'number']"
311,1380866605580656643,ShamikaRavi,2021-04-10 12:53:48,en,traditional gond artwork - bhittichitra - intricate lively young artists travel across india spreading awar,953,96,Traditional Gond artwork - Bhittichitra - is intricate and lively. Young artists travel across India spreading awar… https://t.co/M7IbI3mEKy,"[traditional, gond, artwork, -, bhittichitra, -, intricate, lively, young, artists, travel, across, india, spreading, awar]","['traditional', 'gond', 'artwork', 'bhittichitra', 'intricate', 'lively', 'young', 'artist', 'travel', 'india', 'spread', 'awar']"
312,1380530773548093440,ShamikaRavi,2021-04-09 14:39:20,en,iimahmedabad: shamikaravi jeevantrampal discuss vishypingali behavioral science making public policy nse-ce,0,8,RT @IIMAhmedabad: @shamikaravi and @jeevantrampal discuss with @vishypingali on Behavioral Science in making of Public Policy at the NSE-Ce…,"[iimahmedabad:, shamikaravi, jeevantrampal, discuss, vishypingali, behavioral, science, making, public, policy, nse-ce]","['iimahmedabad', 'shamikaravi', 'jeevantrampal', 'discuss', 'vishypingali', 'behavioral', 'science', 'make', 'public', 'policy', 'nse', 'ce']"
313,1380507742041862147,ShamikaRavi,2021-04-09 13:07:48,en,nebuer anupmalani arpitrage lancelotpinto rsabareesh profmohanan disaggregated data: daily testing,3,0,@nebuer42 @anup_malani @arpitrage @lancelot_pinto @r_sabareesh @profmohanan Disaggregated data: daily testing and d… https://t.co/9N9vPyDNR6,"[nebuer, anupmalani, arpitrage, lancelotpinto, rsabareesh, profmohanan, disaggregated, data:, daily, testing]","['nebuer', 'anupmalani', 'arpitrage', 'lancelotpinto', 'rsabareesh', 'profmohanan', 'disaggregated', 'data', 'daily', 'testing']"
314,1380507511929769987,ShamikaRavi,2021-04-09 13:06:54,en,nebuer anupmalani arpitrage lancelotpinto rsabareesh profmohanan unlikely doesnt seem aggregate,29,2,@nebuer42 @anup_malani @arpitrage @lancelot_pinto @r_sabareesh @profmohanan Unlikely. Doesn’t seem from aggregate d… https://t.co/6RkBHAWLDY,"[nebuer, anupmalani, arpitrage, lancelotpinto, rsabareesh, profmohanan, unlikely, doesnt, seem, aggregate]","['nebuer', 'anupmalani', 'arpitrage', 'lancelotpinto', 'rsabareesh', 'profmohanan', 'unlikely', 'not', 'aggregate']"
315,1380429600895893505,ShamikaRavi,2021-04-09 07:57:18,en,vgokhale malikashok congratulations look forward reading,2,0,@VGokhale59 @MalikAshok Congratulations. Look forward to reading it.,"[vgokhale, malikashok, congratulations, look, forward, reading]","['vgokhale', 'malikashok', 'congratulation', 'look', 'forward', 'read']"
316,1380397358014341120,ShamikaRavi,2021-04-09 05:49:11,en,nikhili covidindiaorg thank nikhil many months shared daily stats response mine read everyday,70,4,"@nikhil_i @covid19indiaorg Thank you Nikhil. For many months now, you have shared this daily stats in response to mine. I read it everyday🙏","[nikhili, covidindiaorg, thank, nikhil, many, months, shared, daily, stats, response, mine, read, everyday]","['nikhili', 'covidindiaorg', 'thank', 'nikhil', 'month', 'share', 'daily', 'stats', 'response', 'read', 'everyday']"
317,1380394535264559107,ShamikaRavi,2021-04-09 05:37:58,en,daily testing: rising sharply,102,11,Daily testing: rising sharply. https://t.co/5pa7oTkJqk,"[daily, testing:, rising, sharply]","['daily', 'testing', 'rise', 'sharply']"
318,1380394529249878017,ShamikaRavi,2021-04-09 05:37:56,en,daily vaccinations: growing,99,11,Daily vaccinations: growing https://t.co/6FETtbUN98,"[daily, vaccinations:, growing]","['daily', 'vaccination', 'grow']"
319,1380394522383814656,ShamikaRavi,2021-04-09 05:37:55,en,deaths rising rising across states high rising: goa maharashtra punjab chhattisgarh kerala,47,14,"How are deaths rising rising across states?
High &amp; rising: Goa, Maharashtra, Punjab, Chhattisgarh and Kerala https://t.co/bSU49mnv6C","[deaths, rising, rising, across, states, high, rising:, goa, maharashtra, punjab, chhattisgarh, kerala]","['death', 'rise', 'rise', 'state', 'high', 'rise', 'goa', 'maharashtra', 'punjab', 'chhattisgarh', 'kerala']"
320,1380394514674683913,ShamikaRavi,2021-04-09 05:37:53,en,daily deaths rising,44,8,Daily deaths ~600 and rising. https://t.co/d2o5sWScDX,"[daily, deaths, rising]","['daily', 'death', 'rise']"
