,id,username,created_at,lang,cleaned_tweets,favorite_count,retweet_count,text,tokens,lemmas
572,1341529084959076352,alexdtang,2020-12-22 23:40:32,en,bgurley: wonderful xmas present founders employees investors vc-backed startups sec approved ability,0,209,"RT @bgurley: A wonderful 2020 Xmas present to the founders, employees, &amp; investors at VC-backed startups. SEC just APPROVED the ability to…","[bgurley:, wonderful, xmas, present, founders, employees, investors, vc-backed, startups, sec, approved, ability]","['bgurley', 'wonderful', 'xmas', 'present', 'founder', 'employee', 'investor', 'vc', 'back', 'startup', 'sec', 'approve', 'ability']"
573,1341528915387531267,alexdtang,2020-12-22 23:39:52,en,miamiangelsvc: we're hiring full-time venture associate role looking someone - years experience passionate abo,0,22,RT @MiamiAngelsVC: We're hiring for a full-time Venture Associate role! Looking for someone with 1-3 years of experience and passionate abo…,"[miamiangelsvc:, we're, hiring, full-time, venture, associate, role, looking, someone, -, years, experience, passionate, abo]","['miamiangelsvc', 'hire', 'time', 'venture', 'associate', 'role', 'look', 'year', 'experience', 'passionate', 'abo']"
574,1341411800030572547,alexdtang,2020-12-22 15:54:30,en,joepompliano: ufc moved forward live events pandemic danawhite called reckless irresponsible,0,20,"RT @JoePompliano: When the UFC moved forward with live events during the pandemic, @danawhite was called ""reckless"" &amp; ""irresponsible.""

His…","[joepompliano:, ufc, moved, forward, live, events, pandemic, danawhite, called, reckless, irresponsible]","['joepompliano', 'ufc', 'move', 'forward', 'live', 'event', 'pandemic', 'danawhite', 'call', 'reckless', 'irresponsible']"
575,1341364943141167104,alexdtang,2020-12-22 12:48:18,en,francissuarez: twitter,0,9,RT @FrancisSuarez: Twitter 💥,"[francissuarez:, twitter]","['francissuarez', 'twitter']"
576,1341143687766618115,alexdtang,2020-12-21 22:09:07,en,dividendgrowth: eat 'em drink 'em smoke 'em portfolio,0,3,"RT @DividendGrowth: Eat 'em, Drink 'em, Smoke 'em  Portfolio

https://t.co/W3TxmMDDpJ","[dividendgrowth:, eat, 'em, drink, 'em, smoke, 'em, portfolio]","['dividendgrowth', 'eat', 'drink', 'smoke', 'portfolio']"
577,1341096125928001536,alexdtang,2020-12-21 19:00:07,en,lifeofkchops: lots people moving #miami jmperrone put together hidden gems visit youre,0,5,RT @lifeofkchops: Lots of people are moving to #miami @JMPerrone2 and I put together some of the hidden gems you have to visit while you’re…,"[lifeofkchops:, lots, people, moving, #miami, jmperrone, put, together, hidden, gems, visit, youre]","['lifeofkchops', 'lot', 'people', 'move', 'miami', 'jmperrone', 'hide', 'gem', 'visit']"
578,1341032532981235712,alexdtang,2020-12-21 14:47:25,en,joepompliano: everyone knows trevor lawrence save millions dollars playing jaguars instead jets part,0,24,"RT @JoePompliano: Everyone knows Trevor Lawrence will save millions of dollars by playing for the Jaguars instead of the Jets.

The part no…","[joepompliano:, everyone, knows, trevor, lawrence, save, millions, dollars, playing, jaguars, instead, jets, part]","['joepompliano', 'know', 'trevor', 'lawrence', 'save', 'million', 'dollar', 'play', 'jaguar', 'instead', 'jet']"
579,1340775700312289281,alexdtang,2020-12-20 21:46:52,en,secretcapital: notes stephen mandel interview mandel founder managing partner lone pine capital tiger cub h/t,0,26,"RT @SecretCapital_: Notes on the Stephen Mandel interview. Mandel is the founder &amp; managing partner of Lone Pine Capital, a Tiger cub.

h/t…","[secretcapital:, notes, stephen, mandel, interview, mandel, founder, managing, partner, lone, pine, capital, tiger, cub, h/t]","['secretcapital', 'notes', 'stephen', 'mandel', 'interview', 'mandel', 'founder', 'manage', 'partner', 'lone', 'pine', 'capital', 'tiger', 'cub', 'h', 't']"
580,1340624602440101889,alexdtang,2020-12-20 11:46:27,en,slmandel: nick saban : want football nick saban : wins sec championship game -,0,84,"RT @slmandel: Nick Saban in 2012: ""Is this what we want football to be?""

Nick Saban in 2020: Wins the SEC championship game 52-46.","[slmandel:, nick, saban, :, want, football, nick, saban, :, wins, sec, championship, game, -]","['slmandel', 'nick', 'saban', 'want', 'football', 'nick', 'saban', 'win', 'sec', 'championship', 'game']"
581,1340480784982011905,alexdtang,2020-12-20 02:14:58,en,haduong: gold: use design thinking raise fund great content kauffmanfellows #openlp,0,3,RT @HaDuong_: This is gold: How to use design thinking to raise your fund. Great content from @KauffmanFellows #OpenLP.  https://t.co/clVKy…,"[haduong:, gold:, use, design, thinking, raise, fund, great, content, kauffmanfellows, #openlp]","['haduong', 'gold', 'use', 'design', 'thinking', 'raise', 'fund', 'great', 'content', 'kauffmanfellow', 'openlp']"
582,1340479071466209280,alexdtang,2020-12-20 02:08:10,en,pitdesi: eoy audit trying learn data takeaways limited data st yr vc () fint,0,100,"RT @pitdesi: Doing an EOY audit and trying to learn from the data. Some takeaways from LIMITED DATA in my 1st yr as a VC (2016)

at 500Fint…","[pitdesi:, eoy, audit, trying, learn, data, takeaways, limited, data, st, yr, vc, (), fint]","['pitdesi', 'eoy', 'audit', 'try', 'learn', 'data', 'takeaway', 'limited', 'data', 'st', 'yr', 'vc', 'fint']"
583,1340474046295777282,alexdtang,2020-12-20 01:48:12,en,postmarket: artful explanation tesla math well worth read know know like accounting like making mo,0,8,"RT @Post_Market: Artful explanation of Tesla math, well worth the read. 

I know, I know. “Do you like accounting, or do you like making mo…","[postmarket:, artful, explanation, tesla, math, well, worth, read, know, know, like, accounting, like, making, mo]","['postmarket', 'artful', 'explanation', 'tesla', 'math', 'worth', 'read', 'know', 'know', 'like', 'account', 'like', 'make', 'mo']"
584,1340106647629389825,alexdtang,2020-12-19 01:28:17,en,jason: case missed rabois chopped folks say episode year,0,3,"RT @Jason: In case you missed it, me and ⁦@rabois⁩ chopped it up again — some folks say episode of the year  https://t.co/1GL9UcapFt","[jason:, case, missed, rabois, chopped, folks, say, episode, year]","['jason', 'case', 'miss', 'rabois', 'chop', 'folk', 'episode', 'year']"
585,1340080725677096961,alexdtang,2020-12-18 23:45:17,en,twitter family: parents: galebowman wellbuiltstyle spouse: dividendgrowth children: superssports stnels,1,0,"My Twitter Family:
Parents: @GaleBowman @WellBuiltStyle
Spouse: @DividendGrowth
Children: @Super70sSports @stnels… https://t.co/RH1y1xGEhi","[twitter, family:, parents:, galebowman, wellbuiltstyle, spouse:, dividendgrowth, children:, superssports, stnels]","['twitter', 'family', 'parent', 'galebowman', 'wellbuiltstyle', 'spouse', 'dividendgrowth', 'child', 'superssports', 'stnels']"
586,1340004644999839748,alexdtang,2020-12-18 18:42:58,en,thecaptable: exclusive interview early youtube employee investor brenthurley live sit discuss: ea,0,3,"RT @thecaptable: Our Exclusive interview with early @YouTube employee and investor @BrentHurley is live! 

We sit down to discuss:

What ea…","[thecaptable:, exclusive, interview, early, youtube, employee, investor, brenthurley, live, sit, discuss:, ea]","['thecaptable', 'exclusive', 'interview', 'early', 'youtube', 'employee', 'investor', 'brenthurley', 'live', 'sit', 'discuss', 'ea']"
587,1339920931599380482,alexdtang,2020-12-18 13:10:19,en,ogreynolds owen trying help know asking someone people looking learn v,2,0,@ogreynolds Owen who are you trying to help as I know you are asking for someone.  People looking to learn  about v… https://t.co/R61tKkI5yg,"[ogreynolds, owen, trying, help, know, asking, someone, people, looking, learn, v]","['ogreynolds', 'owen', 'try', 'help', 'know', 'ask', 'people', 'look', 'learn', 'v']"
588,1339724404067086336,alexdtang,2020-12-18 00:09:23,en,anymanfitness: easiest fat-loss macro set ever: bodyweight x (eat many calories) divide answer (splitting cals,0,32,"RT @anymanfitness: Easiest Fat-Loss Macro Set Up Ever:

1. Bodyweight x 10 (eat this many calories)

2. Divide answer by 3 (splitting cals…","[anymanfitness:, easiest, fat-loss, macro, set, ever:, bodyweight, x, (eat, many, calories), divide, answer, (splitting, cals]","['anymanfitness', 'easy', 'fat', 'loss', 'macro', 'set', 'bodyweight', 'x', 'eat', 'calorie', 'divide', 'answer', 'splitting', 'cal']"
589,1339524592856141824,alexdtang,2020-12-17 10:55:24,en,bgurley: retrospect strategy also amazon low gross margin retailer adding advertising later skeptic,0,15,"RT @bgurley: In retrospect, this strategy is also what Amazon did. Low gross margin retailer, then adding advertising later. With a skeptic…","[bgurley:, retrospect, strategy, also, amazon, low, gross, margin, retailer, adding, advertising, later, skeptic]","['bgurley', 'retrospect', 'strategy', 'amazon', 'low', 'gross', 'margin', 'retailer', 'add', 'advertising', 'later', 'skeptic']"
590,1339221648961122305,alexdtang,2020-12-16 14:51:37,en,days wish could drive like stig,0,0,There are days I wish I could drive like The Stig... https://t.co/aBPCD1Fg9l,"[days, wish, could, drive, like, stig]","['day', 'wish', 'drive', 'like', 'stig']"
591,1339204003041849352,alexdtang,2020-12-16 13:41:30,en,dividendgrowth: charlie munger caltech: full video,0,10,"RT @DividendGrowth: Charlie Munger at Caltech: The Full Video

https://t.co/FQauGsAJSd","[dividendgrowth:, charlie, munger, caltech:, full, video]","['dividendgrowth', 'charlie', 'munger', 'caltech', 'video']"
592,1338840452003471362,alexdtang,2020-12-15 13:36:52,en,timing everything,0,0,Timing is everything... https://t.co/C84NLP5oAB,"[timing, everything]",['time']
593,1338840197748953091,alexdtang,2020-12-15 13:35:52,en,gqmagazine: adidas x prada sneaker set another hit shaping powerhouse partnership,0,3,RT @GQMagazine: This Adidas x Prada sneaker is set to be another hit in what is shaping up as a powerhouse partnership https://t.co/tV4g0Vl…,"[gqmagazine:, adidas, x, prada, sneaker, set, another, hit, shaping, powerhouse, partnership]","['gqmagazine', 'adidas', 'x', 'prada', 'sneaker', 'set', 'hit', 'shape', 'powerhouse', 'partnership']"
594,1338835687005696000,alexdtang,2020-12-15 13:17:56,en,goodmarketinghq: favourite landing page formula: / explain value provide (title) / explain create (subtitle,0,303,"RT @GoodMarketingHQ: My favourite landing page formula:

1/ Explain the value you provide (title)
2/ Explain how you'll create it (subtitle…","[goodmarketinghq:, favourite, landing, page, formula:, /, explain, value, provide, (title), /, explain, create, (subtitle]","['goodmarketinghq', 'favourite', 'landing', 'page', 'formula', 'explain', 'value', 'provide', 'title', 'explain', 'create', 'subtitle']"
595,1338800435654762499,alexdtang,2020-12-15 10:57:52,en,itsmeritesh: pjux here's formula - write everywhere start replacing wes provided could justify,0,1,"RT @itsmeritesh: @pjux Here's my formula -
I write we everywhere and I start replacing the ""we""s with ""I""s provided I could justify it with…","[itsmeritesh:, pjux, here's, formula, -, write, everywhere, start, replacing, wes, provided, could, justify]","['itsmeritesh', 'pjux', 'formula', 'write', 'start', 'replace', 'wes', 'provide', 'justify']"
596,1338546376238567433,alexdtang,2020-12-14 18:08:19,en,francissuarez: mayors job attract high paying jobs city tech revolutionizing every industry everyone city,0,93,RT @FrancisSuarez: It’s a Mayor’s job to attract high paying jobs to a city.  Tech is revolutionizing every industry.  Everyone city should…,"[francissuarez:, mayors, job, attract, high, paying, jobs, city, tech, revolutionizing, every, industry, everyone, city]","['francissuarez', 'mayors', 'job', 'attract', 'high', 'pay', 'job', 'city', 'tech', 'revolutionize', 'industry', 'city']"
597,1338137343388217345,alexdtang,2020-12-13 15:02:58,en,brentbeshore: haha accurate,0,125,RT @BrentBeshore: Haha. This accurate? https://t.co/8D9a4yUmSy,"[brentbeshore:, haha, accurate]","['brentbeshore', 'haha', 'accurate']"
598,1338099493871476737,alexdtang,2020-12-13 12:32:34,en,lesser version similar goals: acquisition accretive followed acquisit,1,0,A lesser version but similar goals:  “How will this acquisition be accretive?” Followed by “When will this acquisit… https://t.co/ROBuSzxT43,"[lesser, version, similar, goals:, acquisition, accretive, followed, acquisit]","['less', 'version', 'similar', 'goal', 'acquisition', 'accretive', 'follow', 'acquisit']"
599,1337798963018297348,alexdtang,2020-12-12 16:38:22,en,elainecapital: chase coleman reviewing principles managing portfolio following difficult year (tiger global returned,0,140,RT @ElaineCapital: Chase Coleman reviewing the principles of managing a portfolio following a difficult year in 2009 (Tiger Global returned…,"[elainecapital:, chase, coleman, reviewing, principles, managing, portfolio, following, difficult, year, (tiger, global, returned]","['elainecapital', 'chase', 'coleman', 'review', 'principle', 'manage', 'portfolio', 'follow', 'difficult', 'year', 'tiger', 'global', 'return']"
600,1337400292728594433,alexdtang,2020-12-11 14:14:12,en,tidefallcapital: investors active compare,0,9,"RT @TidefallCapital: Investors that were active in 1999, how does this compare?","[tidefallcapital:, investors, active, compare]","['tidefallcapital', 'investor', 'active', 'compare']"
601,1337394566706696193,alexdtang,2020-12-11 13:51:26,en,jjeremycai: really excited finally launch first fitness collection today best prices weights find ent,0,9,RT @jjeremycai: Really excited to finally launch our first fitness collection today with the best prices on weights you can find on the ent…,"[jjeremycai:, really, excited, finally, launch, first, fitness, collection, today, best, prices, weights, find, ent]","['jjeremycai', 'excited', 'finally', 'launch', 'fitness', 'collection', 'today', 'good', 'price', 'weight', 'find', 'ent']"
602,1336989248906530816,alexdtang,2020-12-10 11:00:51,en,mattcharris fun games miss first earnings callpublic markets unforgiving,1,0,@mattcharris It’s all fun and games until you miss your first earnings call....public markets are unforgiving.,"[mattcharris, fun, games, miss, first, earnings, callpublic, markets, unforgiving]","['mattcharris', 'fun', 'games', 'miss', 'earnings', 'callpublic', 'market', 'unforgiving']"
603,1336872834975535104,alexdtang,2020-12-10 03:18:16,en,axeliaklein: one quality vcs constantly looking people (both founders investors) ability hustle,0,25,RT @axeliaklein: One quality that VCs are constantly looking for in people (both founders and in other investors) is the ability to hustle.…,"[axeliaklein:, one, quality, vcs, constantly, looking, people, (both, founders, investors), ability, hustle]","['axeliaklein', 'quality', 'vcs', 'constantly', 'look', 'people', 'founder', 'investor', 'ability', 'hustle']"
604,1336872504762261504,alexdtang,2020-12-10 03:16:57,en,txu: / founded doordash mission growing empowering local economies business change often one thi,0,67,"RT @t_xu: 1/ We founded @DoorDash with the mission of growing and empowering local economies. While our business will change often, one thi…","[txu:, /, founded, doordash, mission, growing, empowering, local, economies, business, change, often, one, thi]","['txu', 'found', 'doordash', 'mission', 'grow', 'empower', 'local', 'economy', 'business', 'change', 'thi']"
605,1336746605857345540,alexdtang,2020-12-09 18:56:41,en,pitdesi: friend invested k doordash seed val today investment worth rough numbers company worth,0,226,"RT @pitdesi: Friend invested $5k in DoorDash seed @ $7M val
Today that investment is worth &gt;$6M...

rough numbers the company is worth 10,0…","[pitdesi:, friend, invested, k, doordash, seed, val, today, investment, worth, rough, numbers, company, worth]","['pitdesi', 'friend', 'invest', 'k', 'doordash', 'seed', 'val', 'today', 'investment', 'worth', 'rough', 'number', 'company', 'worth']"
606,1336321044022378503,alexdtang,2020-12-08 14:45:39,en,francissuarez: another indication accelerating migration financial tech community south florida area,0,40,RT @FrancisSuarez: This is another indication of the accelerating migration of the financial and tech community to the South Florida area.…,"[francissuarez:, another, indication, accelerating, migration, financial, tech, community, south, florida, area]","['francissuarez', 'indication', 'accelerate', 'migration', 'financial', 'tech', 'community', 'south', 'florida', 'area']"
607,1336321003937402880,alexdtang,2020-12-08 14:45:29,en,suhail: psa: early employee early exercise shares company low valuation file b,0,76,"RT @Suhail: PSA: If you are a *very* early employee, early exercise your shares when the company has a very low valuation, file your 83b, a…","[suhail:, psa:, early, employee, early, exercise, shares, company, low, valuation, file, b]","['suhail', 'psa', 'early', 'employee', 'early', 'exercise', 'share', 'company', 'low', 'valuation', 'file', 'b']"
608,1336320969812537348,alexdtang,2020-12-08 14:45:21,en,wallstplayboys: microstrategy buy notes cash december understand understand dont youre,0,12,"RT @WallStPlayboys: “MicroStrategy can buy out the notes in cash in December 2023.”

If you understand you understand. If you don’t you’re…","[wallstplayboys:, microstrategy, buy, notes, cash, december, understand, understand, dont, youre]","['wallstplayboys', 'microstrategy', 'buy', 'note', 'cash', 'december', 'understand', 'understand', 'not']"
609,1336288412345765890,alexdtang,2020-12-08 12:35:59,en,dividendgrowth: fascinating look additions deletions sp months action: h/t hussmanjp http,0,4,"RT @DividendGrowth: It's fascinating to look at how additions and deletions of S&amp;P 500 did 12 months after the action:

h/t @hussmanjp http…","[dividendgrowth:, fascinating, look, additions, deletions, sp, months, action:, h/t, hussmanjp, http]","['dividendgrowth', 'fascinating', 'look', 'addition', 'deletion', 'sp', 'month', 'action', 'h', 't', 'hussmanjp', 'http']"
610,1336287972577189890,alexdtang,2020-12-08 12:34:14,en,great author use first principles influence another person/people,0,0,Great author and use of first principles to influence another person/people. https://t.co/nokjBUr2yY,"[great, author, use, first, principles, influence, another, person/people]","['great', 'author', 'use', 'principle', 'influence', 'person', 'people']"
611,1336283871499984897,alexdtang,2020-12-08 12:17:56,en,davidsacks: / common dilemma saas founders whether focus individual users teams primary customer im,0,147,RT @DavidSacks: 1/ A common dilemma for SaaS founders is whether to focus on individual users or teams as the primary customer. This has im…,"[davidsacks:, /, common, dilemma, saas, founders, whether, focus, individual, users, teams, primary, customer, im]","['davidsacks', 'common', 'dilemma', 'saas', 'founder', 'focus', 'individual', 'user', 'team', 'primary', 'customer', 'be']"
612,1336247679819583490,alexdtang,2020-12-08 09:54:07,en,sensephotonics: drove #senseone #lidar row apple trees company working #agriculture automation ultra-wi,0,2,RT @SensePhotonics: We drove the #SenseOne #LiDAR down a row of apple trees with a company working in #agriculture automation. The ultra-wi…,"[sensephotonics:, drove, #senseone, #lidar, row, apple, trees, company, working, #agriculture, automation, ultra-wi]","['sensephotonic', 'drive', 'senseone', 'lidar', 'row', 'apple', 'tree', 'company', 'work', 'agriculture', 'automation', 'ultra', 'wi']"
613,1336096301281382401,alexdtang,2020-12-07 23:52:36,en,coryweinberg: new: reporting math = detailed look airbnb's financing history estimated returns major investor new,0,12,"RT @coryweinberg: NEW: 

Reporting + Math = A detailed look at Airbnb's financing history &amp; estimated returns for each major investor.

New…","[coryweinberg:, new:, reporting, math, =, detailed, look, airbnb's, financing, history, estimated, returns, major, investor, new]","['coryweinberg', 'new', 'report', 'math', '=', 'detail', 'look', 'airbnb', 'financing', 'history', 'estimate', 'return', 'major', 'investor', 'new']"
614,1336096042232795136,alexdtang,2020-12-07 23:51:34,en,optimist always forward looking,0,0,Be an optimist and always forward looking. https://t.co/3xyd1zI6vl,"[optimist, always, forward, looking]","['optimist', 'forward', 'look']"
615,1336001910537596928,alexdtang,2020-12-07 17:37:31,en,pandodaily: robots coming they've gotempathy,0,4,"RT @PandoDaily: The robots are coming. And they've got...empathy. 
https://t.co/gec1V7MvrB","[pandodaily:, robots, coming, they've, gotempathy]","['pandodaily', 'robot', 'come', 'gotempathy']"
616,1335806422894989312,alexdtang,2020-12-07 04:40:43,en,katieroof: remember sequoias black swanmemo well firm really good year anyway got ahold returns https,0,17,RT @Katie_Roof: Remember Sequoia’s “Black Swan”memo? Well the firm is having a really good year anyway. We got ahold of their returns https…,"[katieroof:, remember, sequoias, black, swanmemo, well, firm, really, good, year, anyway, got, ahold, returns, https]","['katieroof', 'remember', 'sequoia', 'black', 'swanmemo', 'firm', 'good', 'year', 'get', 'ahold', 'return', 'https']"
617,1335187842306351105,alexdtang,2020-12-05 11:42:42,en,ollieforsyth: breaking vc months ago knew nobody vc run community vc's - learnt,0,211,"RT @ollieforsyth: Breaking into VC...

18 months ago, I knew nobody in VC. I now run a community of 450 VC's - this is what we have learnt…","[ollieforsyth:, breaking, vc, months, ago, knew, nobody, vc, run, community, vc's, -, learnt]","['ollieforsyth', 'break', 'vc', 'month', 'ago', 'know', 'vc', 'run', 'community', 'vc', 'learnt']"
618,1334324371159207937,alexdtang,2020-12-03 02:31:35,en,sweatystartup: holy grail real estate investing cash-out-refinance completed one nov mm tax free,0,153,"RT @sweatystartup: The holy grail of real estate investing is the cash-out-refinance.

I completed one in Nov of 2019 and $2MM of tax free…","[sweatystartup:, holy, grail, real, estate, investing, cash-out-refinance, completed, one, nov, mm, tax, free]","['sweatystartup', 'holy', 'grail', 'real', 'estate', 'invest', 'cash', 'refinance', 'complete', 'nov', 'mm', 'tax', 'free']"
619,1334323531660849152,alexdtang,2020-12-03 02:28:15,en,wellbuiltstyle everything cyclical order shall restoredcant wait see comes back long,1,0,"@WellBuiltStyle Everything is cyclical and order shall be restored...can’t wait to see if it comes back and if so, for how long.","[wellbuiltstyle, everything, cyclical, order, shall, restoredcant, wait, see, comes, back, long]","['wellbuiltstyle', 'cyclical', 'order', 'shall', 'restoredcant', 'wait', 'come', 'long']"
620,1334276126412328961,alexdtang,2020-12-02 23:19:52,en,thank time today,0,0,Thank you for your time today. https://t.co/kv2csP9CvG,"[thank, time, today]","['thank', 'time', 'today']"
621,1334193378091823104,alexdtang,2020-12-02 17:51:04,en,techreview: last clean-teach gold rush bloodbath investors insist they've learned lessons time differ,0,4,RT @techreview: The last clean-teach gold rush was a bloodbath. Investors insist they've learned their lessons and this time will be differ…,"[techreview:, last, clean-teach, gold, rush, bloodbath, investors, insist, they've, learned, lessons, time, differ]","['techreview', 'clean', 'teach', 'gold', 'rush', 'bloodbath', 'investor', 'insist', 'learn', 'lesson', 'time', 'differ']"
622,1334192596659343366,alexdtang,2020-12-02 17:47:57,en,rmoas --lucky phuc yea two places recommend looking,2,0,@rmoas 1-800-Lucky and Phuc Yea are two places I recommend looking.,"[rmoas, --lucky, phuc, yea, two, places, recommend, looking]","['rmoas', '--lucky', 'phuc', 'yea', 'place', 'recommend', 'look']"
623,1334098942229946371,alexdtang,2020-12-02 11:35:48,en,ourlark: excited announce growing collaboration highmark provide / ai-powered health coaching members,0,9,"RT @ourlark: We are excited to announce our growing collaboration with @Highmark to provide 24/7, AI-powered health coaching to members to…","[ourlark:, excited, announce, growing, collaboration, highmark, provide, /, ai-powered, health, coaching, members]","['ourlark', 'excited', 'announce', 'grow', 'collaboration', 'highmark', 'provide', 'ai', 'powered', 'health', 'coaching', 'member']"
624,1334087588119015424,alexdtang,2020-12-02 10:50:41,en,calvinfo: lessons early stage founders:,0,62,"RT @calvinfo: Lessons for early stage founders: 
https://t.co/gZe8JBd9oc https://t.co/pLxXyp4dmQ","[calvinfo:, lessons, early, stage, founders:]","['calvinfo', 'lesson', 'early', 'stage', 'founder']"
625,1333209633880674305,alexdtang,2020-11-30 00:42:01,en,dividendgrowth: summary philip fisher's investment philosophy,0,25,RT @DividendGrowth: A Summary of Philip Fisher's Investment Philosophy https://t.co/5belK01Dkg,"[dividendgrowth:, summary, philip, fisher's, investment, philosophy]","['dividendgrowth', 'summary', 'philip', 'fisher', 'investment', 'philosophy']"
626,1332759828935172102,alexdtang,2020-11-28 18:54:39,en,superssports: plans weekend going duck hunting dog yes,0,125,"RT @Super70sSports: “Any plans this weekend?”

“Going duck hunting.”

“You have a dog?”

“Yes.” https://t.co/ms97sOBMzS","[superssports:, plans, weekend, going, duck, hunting, dog, yes]","['superssport', 'plan', 'weekend', 'go', 'duck', 'hunting', 'dog', 'yes']"
