,id,username,created_at,lang,cleaned_tweets,favorite_count,retweet_count,text,tokens,lemmas
577,1368941712240877573,ShamikaRavi,2021-03-08 15:08:32,en,moneycontrolcom: #mcpodcast economist prof shamikaravi talks motherhood made see gender difference drasti,0,2,RT @moneycontrolcom: #MCPodcast🎙️| Economist &amp; Prof. @ShamikaRavi talks about how motherhood made her see the gender difference in a drasti…,"[moneycontrolcom:, #mcpodcast, economist, prof, shamikaravi, talks, motherhood, made, see, gender, difference, drasti]","['moneycontrolcom', 'mcpodcast', 'economist', 'prof', 'shamikaravi', 'talk', 'motherhood', 'gender', 'difference', 'drasti']"
578,1368936099431686144,ShamikaRavi,2021-03-08 14:46:14,en,imfnews estimated (in ) economic impact achieving gender equality india would us bil,101,11,The @IMFNews estimated (in 2013) that the economic impact of achieving gender equality in India would be US$700 bil… https://t.co/Iuggd6QBVY,"[imfnews, estimated, (in, ), economic, impact, achieving, gender, equality, india, would, us, bil]","['imfnews', 'estimate', 'economic', 'impact', 'achieve', 'gender', 'equality', 'india', 'bil']"
579,1368933490012475392,ShamikaRavi,2021-03-08 14:35:52,und,smitasharma aiyaryamini archanakpr sabinadewan drfauziakhanncp kotaneelima indiaaheadnews mukhiaji,6,3,@Smita_Sharma @AiyarYamini @archanakpr @sabinadewan @DrFauziaKhanNCP @KotaNeelima @IndiaAheadNews @mukhia_ji… https://t.co/JMzIkLZsYD,"[smitasharma, aiyaryamini, archanakpr, sabinadewan, drfauziakhanncp, kotaneelima, indiaaheadnews, mukhiaji]","['smitasharma', 'aiyaryamini', 'archanakpr', 'sabinadewan', 'drfauziakhanncp', 'kotaneelima', 'indiaaheadnews', 'mukhiaji']"
580,1368933110205747202,ShamikaRavi,2021-03-08 14:34:21,en,consequences dire: ) women drop labour force (costly) ) women fewer/no kids (v costly),175,27,"The consequences will be dire:
1) women drop out of labour force (costly!)
2) women have fewer/no kids (v costly!)… https://t.co/yXmKO9NGCr","[consequences, dire:, ), women, drop, labour, force, (costly), ), women, fewer/no, kids, (v, costly)]","['consequence', 'dire', 'woman', 'drop', 'labour', 'force', 'costly', 'woman', 'few', 'kid', 'v', 'costly']"
581,1368933108498669573,ShamikaRavi,2021-03-08 14:34:21,en,rapid urbanization nuclearization families - missing institutional childcare support (govt private),190,30,With rapid urbanization &amp; nuclearization of families - and missing institutional childcare support (govt &amp; private)… https://t.co/d8c1IG8b6S,"[rapid, urbanization, nuclearization, families, -, missing, institutional, childcare, support, (govt, private)]","['rapid', 'urbanization', 'nuclearization', 'family', 'miss', 'institutional', 'childcare', 'support', 'govt', 'private']"
582,1368933104103006208,ShamikaRavi,2021-03-08 14:34:20,en,female labour force participation falling india several hypotheses dont believe women,393,75,Why is female labour force participation falling in India? There are several hypotheses but I don’t believe women a… https://t.co/Jt8Y1gTu0r,"[female, labour, force, participation, falling, india, several, hypotheses, dont, believe, women]","['female', 'labour', 'force', 'participation', 'fall', 'india', 'hypothesis', 'not', 'believe', 'woman']"
583,1368893586742210563,ShamikaRavi,2021-03-08 11:57:18,en,persistent gender inequality across labour markets highered stem politics women leadership wel,43,5,"For more on persistent gender inequality across labour markets, HigherEd, STEM, politics, women &amp; leadership as wel… https://t.co/J7WGJ6egUN","[persistent, gender, inequality, across, labour, markets, highered, stem, politics, women, leadership, wel]","['persistent', 'gender', 'inequality', 'labour', 'market', 'highered', 'stem', 'politic', 'woman', 'leadership', 'wel']"
584,1368893584158593029,ShamikaRavi,2021-03-08 11:57:17,en,) missing women indian democracy - indian women faring voters leaders india's democracy li,52,8,"4) ""Missing"" women in Indian democracy - how are Indian women faring as voters and leaders in India's democracy? Li… https://t.co/8Cm9m3TomU","[), missing, women, indian, democracy, -, indian, women, faring, voters, leaders, india's, democracy, li]","['miss', 'woman', 'indian', 'democracy', 'indian', 'woman', 'fare', 'voter', 'leader', 'india', 'democracy', 'li']"
585,1368893581478359042,ShamikaRavi,2021-03-08 11:57:17,en,) mental health wellbeing: housewife remains largest category suicide victims india (more x th,44,9,"3) Mental health &amp; wellbeing: ""housewife"" remains the largest category of suicide victims in India (more than 2X th… https://t.co/K7FMKcienf","[), mental, health, wellbeing:, housewife, remains, largest, category, suicide, victims, india, (more, x, th]","['mental', 'health', 'wellbeing', 'housewife', 'remain', 'large', 'category', 'suicide', 'victim', 'india', 'x', 'th']"
586,1368893576495566849,ShamikaRavi,2021-03-08 11:57:16,en,) healthcare: significant problem missing female patients- using data public hospital est,39,10,"2) Healthcare: we have a significant problem of ""missing female patients""-  using data from public hospital, we est… https://t.co/gqMltgnC32","[), healthcare:, significant, problem, missing, female, patients-, using, data, public, hospital, est]","['healthcare', 'significant', 'problem', 'miss', 'female', 'patients-', 'datum', 'public', 'hospital', 'est']"
587,1368893573781889025,ShamikaRavi,2021-03-08 11:57:15,en,#womensday reminder despite widespread development india persistent gender inequality aroun,240,46,"On #WomensDay, a reminder that despite widespread development in India, there is persistent gender inequality aroun… https://t.co/RE7mRolXqx","[#womensday, reminder, despite, widespread, development, india, persistent, gender, inequality, aroun]","['womensday', 'reminder', 'despite', 'widespread', 'development', 'india', 'persistent', 'gender', 'inequality', 'aroun']"
588,1368282076470906881,ShamikaRavi,2021-03-06 19:27:23,en,timesnow: seem significant problem mutant variant (of covid): shamikaravi former member pms economic advi,0,19,"RT @TimesNow: We don't seem to have a significant problem of the mutant variant (of Covid): @ShamikaRavi, Former Member, PM’s Economic Advi…","[timesnow:, seem, significant, problem, mutant, variant, (of, covid):, shamikaravi, former, member, pms, economic, advi]","['timesnow', 'significant', 'problem', 'mutant', 'variant', 'covid', 'shamikaravi', 'member', 'pms', 'economic', 'advi']"
589,1368281010605944833,ShamikaRavi,2021-03-06 19:23:09,en,timesnow: large talk billion people kind compliance saw state-after-state give cred,0,26,"RT @TimesNow: By and large, when we talk about 1.38 billion people, the kind of compliance we saw state-after-state ... we should give cred…","[timesnow:, large, talk, billion, people, kind, compliance, saw, state-after-state, give, cred]","['timesnow', 'large', 'talk', 'billion', 'people', 'kind', 'compliance', 'see', 'state', 'state', 'cred']"
590,1368114294047399936,ShamikaRavi,2021-03-06 08:20:40,en,jeremyfarrar: richly deserved - congratulations,0,168,RT @JeremyFarrar: Richly deserved - congratulations  https://t.co/YUInoltYrt,"[jeremyfarrar:, richly, deserved, -, congratulations]","['jeremyfarrar', 'richly', 'deserve', 'congratulation']"
591,1367828917390766083,ShamikaRavi,2021-03-05 13:26:41,en,brajeshjha thats one looks average across parties (also id expected higher attendance smaller parties),13,0,@Brajeshjha That’s why one looks at average across parties. (Also I’d have expected higher attendance for smaller parties.),"[brajeshjha, thats, one, looks, average, across, parties, (also, id, expected, higher, attendance, smaller, parties)]","['brajeshjha', 's', 'look', 'average', 'party', 'would', 'expect', 'high', 'attendance', 'small', 'party']"
592,1367828219076898816,ShamikaRavi,2021-03-05 13:23:55,en,muditkapoor: present indian political atmosphere feels similar according hoover roosevelt merely,0,6,RT @muditkapoor: At present the Indian political atmosphere feels some what similar to this. According to Hoover “Roosevelt was not merely…,"[muditkapoor:, present, indian, political, atmosphere, feels, similar, according, hoover, roosevelt, merely]","['muditkapoor', 'present', 'indian', 'political', 'atmosphere', 'feel', 'similar', 'according', 'hoover', 'roosevelt', 'merely']"
593,1367818355298607104,ShamikaRavi,2021-03-05 12:44:43,en,discovered stunning statistics analyzing parliament data: average attendance mps across major parties,1163,294,Discovered this stunning statistics while analyzing parliament data: Average attendance of MPs across major parties… https://t.co/l7GCy91xc5,"[discovered, stunning, statistics, analyzing, parliament, data:, average, attendance, mps, across, major, parties]","['discover', 'stunning', 'statistic', 'analyze', 'parliament', 'datum', 'average', 'attendance', 'mps', 'major', 'party']"
594,1367722430240681994,ShamikaRavi,2021-03-05 06:23:33,en,look whos back #bulbul,822,29,And look who’s back! #Bulbul https://t.co/pKVh2spkZi,"[look, whos, back, #bulbul]","['look', 's', 'bulbul']"
595,1367717109795459078,ShamikaRavi,2021-03-05 06:02:24,en,iamnkarthik correlation definitely causation study needs worry about: )reverse causation ie,14,0,"@iamnkarthik Correlation is definitely not causation. So, study needs to worry about: 
1)Reverse causation i.e. is… https://t.co/b7IDfhX2Kp","[iamnkarthik, correlation, definitely, causation, study, needs, worry, about:, )reverse, causation, ie]","['iamnkarthik', 'correlation', 'definitely', 'causation', 'study', 'need', 'worry', 'reverse', 'causation', 'ie']"
596,1367695952195153922,ShamikaRavi,2021-03-05 04:38:20,en,janjagrannews two days apart,0,0,@Jan_jagran_news Two days apart.,"[janjagrannews, two, days, apart]","['janjagrannews', 'day', 'apart']"
597,1367695529874923520,ShamikaRavi,2021-03-05 04:36:39,en,baburajvarma anuraagsaxena age biggest predictor covid deaths appears obesity might cl,20,0,"@baburajvarma @anuraag_saxena Age is the biggest predictor of covid deaths, but it appears that obesity might be cl… https://t.co/yrO9KuVY4Q","[baburajvarma, anuraagsaxena, age, biggest, predictor, covid, deaths, appears, obesity, might, cl]","['baburajvarma', 'anuraagsaxena', 'age', 'big', 'predictor', 'covid', 'death', 'appear', 'obesity', 'cl']"
598,1367689468019240968,ShamikaRavi,2021-03-05 04:12:34,en,latest: nine deaths covid occurred countries high #obesity levels mortality rates,1055,326,Latest: Nine out of 10 deaths from COVID19 have occurred in countries with high #obesity levels. Mortality rates we… https://t.co/AF5TWZctg2,"[latest:, nine, deaths, covid, occurred, countries, high, #obesity, levels, mortality, rates]","['late', 'death', 'covid', 'occur', 'country', 'high', 'obesity', 'level', 'mortality', 'rate']"
599,1367524545167454208,ShamikaRavi,2021-03-04 17:17:13,en,outstanding compilation,62,13,Outstanding compilation 🎶 https://t.co/T6f8d4pSXv,"[outstanding, compilation]","['outstanding', 'compilation']"
600,1367521404883664900,ShamikaRavi,2021-03-04 17:04:44,en,participatory rural appraisal - one field visits process incorporate local knowledg,298,8,This is participatory rural appraisal - from one of my field visits.  It is a process to incorporate local knowledg… https://t.co/bSyGGsD6qU,"[participatory, rural, appraisal, -, one, field, visits, process, incorporate, local, knowledg]","['participatory', 'rural', 'appraisal', 'field', 'visit', 'process', 'incorporate', 'local', 'knowledg']"
601,1367497561683206152,ShamikaRavi,2021-03-04 15:30:00,en,guess happening #development #fieldwork,328,22,Can you guess what is happening here? #development  #fieldwork https://t.co/Yuy1otpRfi,"[guess, happening, #development, #fieldwork]","['guess', 'happen', 'development', 'fieldwork']"
602,1367481384479068165,ShamikaRavi,2021-03-04 14:25:43,en,shamikaravi: case fatality rate: india = ( falling) global = ( rising),0,17,"RT @ShamikaRavi: Case fatality rate:
India = 1.41% (&amp; falling)
Global = 2.22% (&amp; rising) https://t.co/qvgOr9rOKh","[shamikaravi:, case, fatality, rate:, india, =, (, falling), global, =, (, rising)]","['shamikaravi', 'case', 'fatality', 'rate', 'india', '=', 'fall', 'global', '=', 'rise']"
603,1367449827521359874,ShamikaRavi,2021-03-04 12:20:19,en,deaths per million across countries: continues rise across several countries eastern europe reporting highest r,39,3,Deaths per million across countries: continues to rise across several countries. Eastern Europe reporting highest r… https://t.co/0ZuXoMnvvS,"[deaths, per, million, across, countries:, continues, rise, across, several, countries, eastern, europe, reporting, highest, r]","['death', 'million', 'country', 'continue', 'rise', 'country', 'eastern', 'europe', 'report', 'high', 'r']"
604,1367449822152728577,ShamikaRavi,2021-03-04 12:20:18,en,case fatality rate: india = ( falling) global = ( rising),163,17,"Case fatality rate:
India = 1.41% (&amp; falling)
Global = 2.22% (&amp; rising) https://t.co/qvgOr9rOKh","[case, fatality, rate:, india, =, (, falling), global, =, (, rising)]","['case', 'fatality', 'rate', 'india', '=', 'fall', 'global', '=', 'rise']"
605,1367449816809181188,ShamikaRavi,2021-03-04 12:20:16,en,deaths per million stabilised states except: kerala mizoram chhattisgarh chandigarh uttarakhand mp,41,4,"Deaths per million has stabilised in most states except:
Kerala, Mizoram, Chhattisgarh, Chandigarh, Uttarakhand, MP… https://t.co/cfPNcUd4Nw","[deaths, per, million, stabilised, states, except:, kerala, mizoram, chhattisgarh, chandigarh, uttarakhand, mp]","['death', 'million', 'stabilise', 'state', 'kerala', 'mizoram', 'chhattisgarh', 'chandigarh', 'uttarakhand', 'mp']"
606,1367449810916102148,ShamikaRavi,2021-03-04 12:20:15,en,states/uts continue witness growth cases per million: kerala chandigarh maharashtra chhattisgarh pun,40,6,"States/UTs that continue to witness growth in cases per million: Kerala, Chandigarh, Maharashtra, Chhattisgarh, Pun… https://t.co/WD3t2UpoDl","[states/uts, continue, witness, growth, cases, per, million:, kerala, chandigarh, maharashtra, chhattisgarh, pun]","['states', 'uts', 'continue', 'witness', 'growth', 'case', 'million', 'kerala', 'chandigarh', 'maharashtra', 'chhattisgarh', 'pun']"
607,1367449805434195976,ShamikaRavi,2021-03-04 12:20:14,en,new active cases slowing daily deaths slowing,50,8,"New active cases slowing down.
Daily deaths slowing down, once again. https://t.co/bRIb4nS6fJ","[new, active, cases, slowing, daily, deaths, slowing]","['new', 'active', 'case', 'slow', 'daily', 'death', 'slow']"
608,1367449799767715851,ShamikaRavi,2021-03-04 12:20:12,en,surge daily cases (since mid-feb) showing slowdown,74,13,The surge in daily cases (since mid-Feb) is now showing a slowdown. 👍 https://t.co/oIYmPHTCAG,"[surge, daily, cases, (since, mid-feb), showing, slowdown]","['surge', 'daily', 'case', 'mid', 'feb', 'show', 'slowdown']"
609,1367449794524815362,ShamikaRavi,2021-03-04 12:20:11,en,#covidindia total vaccinations rising (m) important note virus take sundays,214,32,#COVID19India While total vaccinations are rising (&gt;15.6M) important to note that the virus doesn't take Sundays of… https://t.co/3ex9X4HGjm,"[#covidindia, total, vaccinations, rising, (m), important, note, virus, take, sundays]","['covidindia', 'total', 'vaccination', 'rise', 'm', 'important', 'note', 'virus', 'sunday']"
610,1367444530979512321,ShamikaRavi,2021-03-04 11:59:16,en,kunalbahl gautamchopra rohitkbansal runophilia froze secondthen realised different batch #dipsite,9,0,@1kunalbahl @gautamchopra83 @rohitkbansal @runophilia I froze for a second...then realised it's a different batch! #Dipsite,"[kunalbahl, gautamchopra, rohitkbansal, runophilia, froze, secondthen, realised, different, batch, #dipsite]","['kunalbahl', 'gautamchopra', 'rohitkbansal', 'runophilia', 'freeze', 'secondthen', 'realise', 'different', 'batch', 'dipsite']"
611,1367414118630584320,ShamikaRavi,2021-03-04 09:58:25,en,manojnaandi: super useful study shamikaravi apart pollution linked ailments lose immunity due opportunity cost,0,10,RT @manoj_naandi: Super useful study @ShamikaRavi Apart from pollution linked ailments we lose immunity too due to the opportunity cost of…,"[manojnaandi:, super, useful, study, shamikaravi, apart, pollution, linked, ailments, lose, immunity, due, opportunity, cost]","['manojnaandi', 'super', 'useful', 'study', 'shamikaravi', 'apart', 'pollution', 'link', 'ailment', 'lose', 'immunity', 'opportunity', 'cost']"
612,1367395333056000002,ShamikaRavi,2021-03-04 08:43:47,en,analyze hours share,78,5,Will analyze in a few hours &amp; share. https://t.co/P0GUnBHcUL,"[analyze, hours, share]","['analyze', 'hour', 'share']"
613,1367342391171026950,ShamikaRavi,2021-03-04 05:13:24,en,meghkalyan: yaneerbaryam arunakrishnan thanks yaneer going exploring line thought see dr shamikaravi india's da,0,1,"RT @meghkalyan: @yaneerbaryam @Arunakrishnan Thanks Yaneer, for going exploring this line of thought. 
I see Dr. @ShamikaRavi as India's da…","[meghkalyan:, yaneerbaryam, arunakrishnan, thanks, yaneer, going, exploring, line, thought, see, dr, shamikaravi, india's, da]","['meghkalyan', 'yaneerbaryam', 'arunakrishnan', 'thank', 'yaneer', 'go', 'explore', 'line', 'think', 'dr', 'shamikaravi', 'india', 'da']"
614,1367089992435077127,ShamikaRavi,2021-03-03 12:30:28,en,cherukote cup teabut irani chai,7,0,"@cherukote Not just any cup of tea...but ""Irani Chai""👍","[cherukote, cup, teabut, irani, chai]","['cherukote', 'cup', 'teabut', 'irani', 'chai']"
615,1367084188864684037,ShamikaRavi,2021-03-03 12:07:24,en,unlike usual protocol major covid vaccine manufacturers (pfizer moderna astrazeneca) announced ph,2309,520,"Unlike usual protocol, most major COVID19 vaccine manufacturers (Pfizer, Moderna, AstraZeneca...) have announced ph… https://t.co/tQ1UfArC5N","[unlike, usual, protocol, major, covid, vaccine, manufacturers, (pfizer, moderna, astrazeneca), announced, ph]","['unlike', 'usual', 'protocol', 'major', 'covid', 'vaccine', 'manufacturer', 'pfizer', 'moderna', 'astrazeneca', 'announce', 'ph']"
616,1367077475084161028,ShamikaRavi,2021-03-03 11:40:43,en,phase results #covaxin - announced bharatbiotech : demonstrates interim clinical efficacy,5437,748,Phase 3 Results of #COVAXIN - announced by @BharatBiotech : Demonstrates Interim Clinical Efficacy of 81%,"[phase, results, #covaxin, -, announced, bharatbiotech, :, demonstrates, interim, clinical, efficacy]","['phase', 'result', 'covaxin', 'announce', 'bharatbiotech', 'demonstrate', 'interim', 'clinical', 'efficacy']"
617,1367075689170526208,ShamikaRavi,2021-03-03 11:33:37,en,mumbais loss #karachibakery,498,46,Mumbai’s loss! #KarachiBakery https://t.co/R9lKJptiRU,"[mumbais, loss, #karachibakery]","['mumbais', 'loss', 'karachibakery']"
618,1367017302294585344,ShamikaRavi,2021-03-03 07:41:37,en,ani: delhi: president ram nath kovind receives first dose covid vaccine rr hospital,0,1033,RT @ANI: Delhi: President Ram Nath Kovind receives first dose of COVID19 vaccine at RR Hospital https://t.co/5dnJxBRQ9a,"[ani:, delhi:, president, ram, nath, kovind, receives, first, dose, covid, vaccine, rr, hospital]","['ani', 'delhi', 'president', 'ram', 'nath', 'kovind', 'receive', 'dose', 'covid', 'vaccine', 'rr', 'hospital']"
619,1367016794926456833,ShamikaRavi,2021-03-03 07:39:36,en,shamikaravi: imp remember yrs back per capita income haryana less punjab today x punjab- thanks p,0,90,RT @ShamikaRavi: Imp to remember that 20 yrs back per capita income of Haryana was less than Punjab. Today it’s 1.5X of Punjab- thanks to p…,"[shamikaravi:, imp, remember, yrs, back, per, capita, income, haryana, less, punjab, today, x, punjab-, thanks, p]","['shamikaravi', 'imp', 'remember', 'yrs', 'capita', 'income', 'haryana', 'punjab', 'today', 'x', 'punjab-', 'thank', 'p']"
620,1367015670261501955,ShamikaRavi,2021-03-03 07:35:08,en,sonaldedesai: new article gender differences employment covid lockdown delhi ncr region neeradd santanundic,0,14,RT @SonaldeDesai: A new article on gender differences in employment during COVID lockdown in Delhi NCR region with @Neerad_D @Santanu_NDIC…,"[sonaldedesai:, new, article, gender, differences, employment, covid, lockdown, delhi, ncr, region, neeradd, santanundic]","['sonaldedesai', 'new', 'article', 'gender', 'difference', 'employment', 'covid', 'lockdown', 'delhi', 'ncr', 'region', 'neeradd', 'santanundic']"
621,1366964939907158017,ShamikaRavi,2021-03-03 04:13:33,und,knackofflying caashish iyervval abhinaprakash kushalmehra rmantri harshmadhusudan,5,0,@knackofflying @c_aashish @Iyervval @Abhina_Prakash @kushal_mehra @RMantri @harshmadhusudan https://t.co/mY0FjUf2r8.,"[knackofflying, caashish, iyervval, abhinaprakash, kushalmehra, rmantri, harshmadhusudan]","['knackofflying', 'caashish', 'iyervval', 'abhinaprakash', 'kushalmehra', 'rmantri', 'harshmadhusudan']"
622,1366693576353083395,ShamikaRavi,2021-03-02 10:15:15,en,parents got first doses,1441,20,Parents got their first doses.👍🇮🇳 https://t.co/Qo2t4V3z9b,"[parents, got, first, doses]","['parent', 'get', 'dose']"
623,1366648694431379459,ShamikaRavi,2021-03-02 07:16:54,en,'loss learning pandemic' -- children classes - suffered significant learning losses lang,154,40,'Loss of Learning during the Pandemic' -- children in classes 2-6 have suffered significant learning losses in lang… https://t.co/U7LehsgcxI,"['loss, learning, pandemic', --, children, classes, -, suffered, significant, learning, losses, lang]","['loss', 'learn', 'pandemic', 'child', 'class', 'suffer', 'significant', 'learning', 'loss', 'lang']"
624,1366623677685452800,ShamikaRavi,2021-03-02 05:37:30,en,snikhilsocial screen interest limited minecraft bayblades etc nothing involves actual human characters,8,0,"@snikhil_social Screen interest is limited to Minecraft, Bayblades etc... nothing that involves actual human characters.","[snikhilsocial, screen, interest, limited, minecraft, bayblades, etc, nothing, involves, actual, human, characters]","['snikhilsocial', 'screen', 'interest', 'limit', 'minecraft', 'bayblade', 'etc', 'involve', 'actual', 'human', 'character']"
625,1366618975052783617,ShamikaRavi,2021-03-02 05:18:48,en,shamikaravi: disastrous #cropburning health read latest research paper 'crop fires cardiovascular hea,0,243,"RT @ShamikaRavi: This is how disastrous #CropBurning is to our health!
Read our latest research paper on 'Crop Fires and Cardiovascular Hea…","[shamikaravi:, disastrous, #cropburning, health, read, latest, research, paper, 'crop, fires, cardiovascular, hea]","['shamikaravi', 'disastrous', 'cropburning', 'health', 'read', 'late', 'research', 'paper', 'crop', 'fire', 'cardiovascular', 'hea']"
626,1366579293963227138,ShamikaRavi,2021-03-02 02:41:08,en,inewsen: #india offers vaccines hospitals second phase #covid- vaccination efforts remains 'leaps bounds' ahead,0,19,RT @i24NEWS_EN: #India offers vaccines at hospitals as the second phase of #COVID-19 vaccination efforts remains 'leaps and bounds' ahead o…,"[inewsen:, #india, offers, vaccines, hospitals, second, phase, #covid-, vaccination, efforts, remains, 'leaps, bounds', ahead]","['inewsen', 'india', 'offer', 'vaccine', 'hospital', 'second', 'phase', 'covid-', 'vaccination', 'effort', 'remain', 'leaps', 'bound', 'ahead']"
627,1366442072937426945,ShamikaRavi,2021-03-01 17:35:52,ca,total vaccinations:,45,6,Total vaccinations: https://t.co/XZOPzBgP43,"[total, vaccinations:]","['total', 'vaccination']"
628,1366440876675792896,ShamikaRavi,2021-03-01 17:31:06,en,daily confirmed cases:,47,9,Daily confirmed cases: https://t.co/RZd6r8JY3p,"[daily, confirmed, cases:]","['daily', 'confirm', 'case']"
629,1366440858745102336,ShamikaRavi,2021-03-01 17:31:02,en,daily cases daily vaccinations - rising,92,19,Daily cases and Daily vaccinations - both rising. https://t.co/TGcorEod1Y,"[daily, cases, daily, vaccinations, -, rising]","['daily', 'case', 'daily', 'vaccination', 'rise']"
630,1366440850335571970,ShamikaRavi,2021-03-01 17:31:00,en,#covidindia india l active cases growing sharply,564,133,#COVID19India India has 1.7L active cases now and growing sharply at 2.4% https://t.co/kq8TpJiEJW,"[#covidindia, india, l, active, cases, growing, sharply]","['covidindia', 'india', 'l', 'active', 'case', 'grow', 'sharply']"
631,1366436756719951875,ShamikaRavi,2021-03-01 17:14:44,en,atabarrok nothing suspicious,14,0,@ATabarrok Nothing suspicious there.,"[atabarrok, nothing, suspicious]","['atabarrok', 'suspicious']"
632,1366398807655653381,ShamikaRavi,2021-03-01 14:43:56,en,white move first- yr old suddenly doubting game loves,5343,354,“Why should white move first?!”- the 10 yr old is suddenly doubting a game he loves. ♟👦🏽,"[white, move, first-, yr, old, suddenly, doubting, game, loves]","['white', 'first-', 'yr', 'old', 'suddenly', 'doubt', 'game', 'love']"
633,1366355512925724676,ShamikaRavi,2021-03-01 11:51:54,en,relevant lordship,894,113,Why is that relevant your lordship? https://t.co/C5nLYbz1y8,"[relevant, lordship]","['relevant', 'lordship']"
634,1366290394351161344,ShamikaRavi,2021-03-01 07:33:09,en,disastrous #cropburning health read latest research paper 'crop fires cardiovascu,646,243,"This is how disastrous #CropBurning is to our health!
Read our latest research paper on 'Crop Fires and Cardiovascu… https://t.co/GBYIGLA4YY","[disastrous, #cropburning, health, read, latest, research, paper, 'crop, fires, cardiovascu]","['disastrous', 'cropburning', 'health', 'read', 'late', 'research', 'paper', 'crop', 'fire', 'cardiovascu']"
