,id,username,created_at,lang,cleaned_tweets,favorite_count,retweet_count,text,tokens,lemmas
301,1205131202522304512,rakeshrussell52,2019-12-12 14:24:03,hi,harisawan espncricinfo bewakoof thu aur thumara pakistan mulk kya karu jo player bholna aur batha nahi karna,1,0,@HarisAwan110 @ESPNcricinfo Bewakoof thu aur thumara Pakistan mulk kya karu jo player bholna aur batha  nahi karna… https://t.co/1TP1i3ibnK,"[harisawan, espncricinfo, bewakoof, thu, aur, thumara, pakistan, mulk, kya, karu, jo, player, bholna, aur, batha, nahi, karna]","['harisawan', 'espncricinfo', 'bewakoof', 'thu', 'aur', 'thumara', 'pakistan', 'mulk', 'kya', 'karu', 'jo', 'player', 'bholna', 'aur', 'batha', 'nahi', 'karna']"
302,1205071342850080768,rakeshrussell52,2019-12-12 10:26:11,en,masterb igtamil govardhan character hey ram awesome acting movie sir,1,0,@MasterB786 @igtamil Govardhan character in Hey Ram awesome acting in that movie by sir,"[masterb, igtamil, govardhan, character, hey, ram, awesome, acting, movie, sir]","['masterb', 'igtamil', 'govardhan', 'character', 'hey', 'ram', 'awesome', 'act', 'movie', 'sir']"
303,1205070770143031297,rakeshrussell52,2019-12-12 10:23:55,en,espncricinfo babar deserve whereas rest batsman ranked class per,3,1,"@ESPNcricinfo Babar doesn't deserve to be an No.1 , whereas rest of the batsman ranked below him have the class per… https://t.co/yaOmOONf0p","[espncricinfo, babar, deserve, whereas, rest, batsman, ranked, class, per]","['espncricinfo', 'babar', 'deserve', 'rest', 'batsman', 'rank', 'class']"
304,1205070209041620992,rakeshrussell52,2019-12-12 10:21:41,et,newstamil republic tv times india today ivanunga intha mathiri vishayatha pandrathu vazhakam,0,0,@news7tamil Republic tv Times Now India Today ivanunga than intha mathiri vishayatha pandrathu vazhakam,"[newstamil, republic, tv, times, india, today, ivanunga, intha, mathiri, vishayatha, pandrathu, vazhakam]","['newstamil', 'republic', 'tv', 'times', 'india', 'today', 'ivanunga', 'intha', 'mathiri', 'vishayatha', 'pandrathu', 'vazhakam']"
305,1205061058337001472,rakeshrussell52,2019-12-12 09:45:19,en,presstv: cute #koala takes first sips water rescued #australia bushfire,0,18,RT @PressTV: Cute #koala takes her first sips of water after being rescued from #Australia bushfire https://t.co/j2piwQUDcC,"[presstv:, cute, #koala, takes, first, sips, water, rescued, #australia, bushfire]","['presstv', 'cute', 'koala', 'take', 'sip', 'water', 'rescue', 'australia', 'bushfire']"
306,1205057553891090432,rakeshrussell52,2019-12-12 09:31:24,en,pushpasspundits mihirsv jaspreetssahni hockeyind harpreetlamba johnleehockey dragflickscores scorrdhockey,2,0,@pushpasspundits @mihirsv @JaspreetSSahni @hockeyind @HarpreetLamba88 @JohnLeeHockey @dragflickscores @ScorrdHockey… https://t.co/Ozz5OFeOux,"[pushpasspundits, mihirsv, jaspreetssahni, hockeyind, harpreetlamba, johnleehockey, dragflickscores, scorrdhockey]","['pushpasspundits', 'mihirsv', 'jaspreetssahni', 'hockeyind', 'harpreetlamba', 'johnleehockey', 'dragflickscores', 'scorrdhockey']"
307,1204972692710948865,rakeshrussell52,2019-12-12 03:54:11,en,imtiazmadmood: jammu kashmir removed united nations(un) list unresolved disputes giving setback pakistan,0,305,"RT @ImtiazMadmood: Jammu and Kashmir has been removed from the United Nations(UN) list of unresolved disputes, giving a setback to Pakistan…","[imtiazmadmood:, jammu, kashmir, removed, united, nations(un), list, unresolved, disputes, giving, setback, pakistan]","['imtiazmadmood', 'jammu', 'kashmir', 'remove', 'united', 'nations(un', 'list', 'unresolved', 'dispute', 'give', 'setback', 'pakistan']"
308,1204795488723038208,rakeshrussell52,2019-12-11 16:10:03,en,espncricinfo blackcaps vintage kit awesome,0,0,@ESPNcricinfo @BLACKCAPS Vintage 1999 kit awesome,"[espncricinfo, blackcaps, vintage, kit, awesome]","['espncricinfo', 'blackcaps', 'vintage', 'kit', 'awesome']"
309,1204643501989715968,rakeshrussell52,2019-12-11 06:06:06,en,fihhockey: voted india's rising star vivek prasad yet follow link vote: #hockeystarsawa,0,7,"RT @FIH_Hockey: Have you voted for India's Rising Star Vivek Prasad yet?

Follow the link to vote: https://t.co/QS4p7jzdpH

#HockeyStarsAwa…","[fihhockey:, voted, india's, rising, star, vivek, prasad, yet, follow, link, vote:, #hockeystarsawa]","['fihhockey', 'vote', 'india', 'rise', 'star', 'vivek', 'prasad', 'follow', 'link', 'vote', 'hockeystarsawa']"
310,1204458996440059904,rakeshrussell52,2019-12-10 17:52:57,en,bertiandernie: gentle dog preciously tends baby chick,0,12,RT @Berti_and_Ernie: Gentle dog preciously tends to baby chick https://t.co/ng3Q2VCZ4U,"[bertiandernie:, gentle, dog, preciously, tends, baby, chick]","['bertiandernie', 'gentle', 'dog', 'preciously', 'tend', 'baby', 'chick']"
311,1204347189557727232,rakeshrussell52,2019-12-10 10:28:40,en,hockeyind updates regarding indian men's team pro league,0,0,@hockeyind Any updates regarding the Indian men's team for Pro League,"[hockeyind, updates, regarding, indian, men's, team, pro, league]","['hockeyind', 'update', 'indian', 'man', 'team', 'pro', 'league']"
312,1204300088677322752,rakeshrussell52,2019-12-10 07:21:30,fr,afccup chennai fc,2,0,@AFCCup Chennai FC,"[afccup, chennai, fc]","['afccup', 'chennai', 'fc']"
313,1204271010783973376,rakeshrussell52,2019-12-10 05:25:57,en,xposetrophyhunt: feared australia's wild koala population never recover bushfires killed destroy,0,273,"RT @XposeTrophyHunt: It is feared that Australia's wild koala population will never recover after bushfires killed more than 2,000  destroy…","[xposetrophyhunt:, feared, australia's, wild, koala, population, never, recover, bushfires, killed, destroy]","['xposetrophyhunt', 'fear', 'australia', 'wild', 'koala', 'population', 'recover', 'bushfire', 'kill', 'destroy']"
314,1203741083579977728,rakeshrussell52,2019-12-08 18:20:13,en,agcff mabrook bahrain first title enjoy moment,0,0,@AGCFF Mabrook Bahrain for your first title enjoy the moment,"[agcff, mabrook, bahrain, first, title, enjoy, moment]","['agcff', 'mabrook', 'bahrain', 'title', 'enjoy', 'moment']"
315,1203669035969200128,rakeshrussell52,2019-12-08 13:33:55,en,iraqliveupdate: white iraqi apples #balad #madeiniraq #iraq,0,13,"RT @IraqLiveUpdate: White Iraqi Apples from #Balad

#MadeInIraq #Iraq https://t.co/TI0vAGLEVO","[iraqliveupdate:, white, iraqi, apples, #balad, #madeiniraq, #iraq]","['iraqliveupdate', 'white', 'iraqi', 'apples', 'balad', 'madeiniraq', 'iraq']"
316,1203333382081376256,rakeshrussell52,2019-12-07 15:20:09,en,arifaajakia: valid question hindu population muslim states shrinking getting close finished,0,2484,"RT @arifaajakia: There is a very valid question.
Why Hindu population in Muslim States is shrinking, getting close to finished. Why? How?…","[arifaajakia:, valid, question, hindu, population, muslim, states, shrinking, getting, close, finished]","['arifaajakia', 'valid', 'question', 'hindu', 'population', 'muslim', 'state', 'shrink', 'get', 'close', 'finished']"
317,1203322262679482368,rakeshrussell52,2019-12-07 14:35:58,en,ajenglish: plant-based burgers future,0,87,RT @AJEnglish: Are plant-based burgers the future? https://t.co/tRcUBIdXw7,"[ajenglish:, plant-based, burgers, future]","['ajenglish', 'plant', 'base', 'burger', 'future']"
318,1203214448917266433,rakeshrussell52,2019-12-07 07:27:33,en,hockeyind pushpasspundits hey friends think favourite sardar paaji coach junior hockey team,1,0,@hockeyind @pushpasspundits Hey friends what you think of our favourite Sardar paaji as coach of junior hockey team https://t.co/VjCQZZQAwh,"[hockeyind, pushpasspundits, hey, friends, think, favourite, sardar, paaji, coach, junior, hockey, team]","['hockeyind', 'pushpasspundits', 'hey', 'friend', 'think', 'favourite', 'sardar', 'paaji', 'coach', 'junior', 'hockey', 'team']"
319,1203169487517671424,rakeshrussell52,2019-12-07 04:28:54,en,iamkashkr: beautiful #kashmir,0,49,RT @iamkash_kr: Beautiful #Kashmir https://t.co/nKsUqgABie,"[iamkashkr:, beautiful, #kashmir]","['iamkashkr', 'beautiful', 'kashmir']"
320,1203000311389966336,rakeshrussell52,2019-12-06 17:16:39,en,virenrasquinha: happy see indian hockey players nominated fih player year awards thehockeyindia manpre,0,16,RT @virenrasquinha: So happy to see 3 Indian hockey players nominated for the FIH Player of the Year awards 2019 ⁦@TheHockeyIndia⁩ ⁦@manpre…,"[virenrasquinha:, happy, see, indian, hockey, players, nominated, fih, player, year, awards, thehockeyindia, manpre]","['virenrasquinha', 'happy', 'indian', 'hockey', 'player', 'nominate', 'fih', 'player', 'year', 'award', 'thehockeyindia', 'manpre']"
321,1202966693296783360,rakeshrussell52,2019-12-06 15:03:04,en,mxplayer: need birth children mother here's story queen mother figure millions #queenisco,0,715,"RT @MXPlayer: ""You need not birth children to be a mother!"" 
Here's the story of the Queen who was a mother figure to millions.

#QueenIsCo…","[mxplayer:, need, birth, children, mother, here's, story, queen, mother, figure, millions, #queenisco]","['mxplayer', 'need', 'birth', 'child', 'mother', 'story', 'queen', 'mother', 'figure', 'million', 'queenisco']"
322,1202925914712985601,rakeshrussell52,2019-12-06 12:21:02,en,manpreet nominated fih player year award; vivek lalremsiami race rising star award hockeyind,2,0,"Manpreet nominated for FIH Player of Year award; Vivek, Lalremsiami in race for Rising Star award @hockeyind… https://t.co/bTiNM6Ctow","[manpreet, nominated, fih, player, year, award;, vivek, lalremsiami, race, rising, star, award, hockeyind]","['manpreet', 'nominated', 'fih', 'player', 'year', 'award', 'vivek', 'lalremsiami', 'race', 'rise', 'star', 'award', 'hockeyind']"
323,1202817282709213185,rakeshrussell52,2019-12-06 05:09:22,en,imranirampal coach rani,0,0,@imranirampal Where is coach Rani?,"[imranirampal, coach, rani]","['imranirampal', 'coach', 'rani']"
324,1202805126877941760,rakeshrussell52,2019-12-06 04:21:03,en,abhishekbharad: best meme till date hail telengana police share agree #encounter,0,342,"RT @Abhishek_bharad: The Best Meme Till Date. 

Hail Telengana Police. 

Share if agree.

#Encounter https://t.co/Qh1tj2W8Lr","[abhishekbharad:, best, meme, till, date, hail, telengana, police, share, agree, #encounter]","['abhishekbharad', 'good', 'meme', 'till', 'date', 'hail', 'telengana', 'police', 'share', 'agree', 'encounter']"
325,1202652437049298944,rakeshrussell52,2019-12-05 18:14:19,en,bertiandernie: therapy dogs new wonderful job,0,18,RT @Berti_and_Ernie: Therapy dogs have a new and wonderful job https://t.co/9Dzw7Vskhm,"[bertiandernie:, therapy, dogs, new, wonderful, job]","['bertiandernie', 'therapy', 'dog', 'new', 'wonderful', 'job']"
326,1202640693308477440,rakeshrussell52,2019-12-05 17:27:39,en,eurohockeyorg: ehf deeply saddened report passing former ukrainehockey secretary-general ehf order merit vikt,0,3,"RT @eurohockeyorg: The EHF is deeply saddened to report the passing of former @UkraineHockey Secretary-General and EHF Order of Merit, Vikt…","[eurohockeyorg:, ehf, deeply, saddened, report, passing, former, ukrainehockey, secretary-general, ehf, order, merit, vikt]","['eurohockeyorg', 'ehf', 'deeply', 'sadden', 'report', 'pass', 'ukrainehockey', 'secretary', 'general', 'ehf', 'order', 'merit', 'vikt']"
327,1202632375265452032,rakeshrussell52,2019-12-05 16:54:36,en,jaffark sorry loss anyway good luck world cup qualifiers still place world cup possible lions,1,0,"@JaffarK7 Sorry for the loss , anyway good luck for the world cup qualifiers still a place in the World Cup is possible for lions","[jaffark, sorry, loss, anyway, good, luck, world, cup, qualifiers, still, place, world, cup, possible, lions]","['jaffark', 'sorry', 'loss', 'good', 'luck', 'world', 'cup', 'qualifier', 'place', 'world', 'cup', 'possible', 'lion']"
328,1202620572196167681,rakeshrussell52,2019-12-05 16:07:42,en,jeannesteele: #breaking: new video mercyforanimals exposes even animal cruelty commercial fishing industry take acti,0,31,RT @JeanneSteele: #BREAKING: New video from @MercyForAnimals exposes even more animal cruelty in the commercial fishing industry. Take acti…,"[jeannesteele:, #breaking:, new, video, mercyforanimals, exposes, even, animal, cruelty, commercial, fishing, industry, take, acti]","['jeannesteele', 'break', 'new', 'video', 'mercyforanimal', 'expose', 'animal', 'cruelty', 'commercial', 'fishing', 'industry', 'acti']"
329,1202618643353231361,rakeshrussell52,2019-12-05 16:00:02,ar,alisport: # #,0,11,"RT @ali_sport813: ساحة التحرير في بغداد تغص بالمتظاهرين والجماهير العراقية لمتابعة مباراة مننخبنا الوطني مع البحرين. 
#خليجي_24 #العراق_الب…","[alisport:, #, #]",['alisport']
330,1202617357417340928,rakeshrussell52,2019-12-05 15:54:56,en,jaffark really years playing good brand football,0,0,@JaffarK7 Really in few years they are playing an good brand of football,"[jaffark, really, years, playing, good, brand, football]","['jaffark', 'year', 'play', 'good', 'brand', 'football']"
331,1202616906701688833,rakeshrussell52,2019-12-05 15:53:08,en,jaffark bahrain strong defence,1,0,@JaffarK7 Bahrain is very strong in defence,"[jaffark, bahrain, strong, defence]","['jaffark', 'bahrain', 'strong', 'defence']"
332,1202616315086655488,rakeshrussell52,2019-12-05 15:50:47,en,bertiandernie: broken leg can't stop true friendship,0,44,RT @Berti_and_Ernie: A broken leg can't stop a true friendship! https://t.co/QRv2fFCJxa,"[bertiandernie:, broken, leg, can't, stop, true, friendship]","['bertiandernie', 'broken', 'leg', 'stop', 'true', 'friendship']"
333,1202615693960548352,rakeshrussell52,2019-12-05 15:48:19,en,jaffark game going penalties,1,0,@JaffarK7 Are the game going on to penalties?,"[jaffark, game, going, penalties]","['jaffark', 'game', 'go', 'penalty']"
334,1202602973899239425,rakeshrussell52,2019-12-05 14:57:46,en,jaffark simple thing play natural game per plan never give till final minutes,1,0,@JaffarK7 The simple thing is to do play their natural game as per plan and should never give up till the final minutes,"[jaffark, simple, thing, play, natural, game, per, plan, never, give, till, final, minutes]","['jaffark', 'simple', 'thing', 'play', 'natural', 'game', 'plan', 'till', 'final', 'minute']"
335,1202602118902714373,rakeshrussell52,2019-12-05 14:54:23,en,jaffark worry surely come blazing second half,1,0,@JaffarK7 Don't worry surely they will come blazing in second half,"[jaffark, worry, surely, come, blazing, second, half]","['jaffark', 'worry', 'surely', 'come', 'blaze', 'second', 'half']"
336,1202595007246397441,rakeshrussell52,2019-12-05 14:26:07,en,rudawenglish: #kurdistan region presidency denies reports circulating online alleges incoming uae plane filled arms,0,2,"RT @RudawEnglish: The #Kurdistan Region presidency denies reports circulating online, which alleges an incoming UAE plane filled with arms…","[rudawenglish:, #kurdistan, region, presidency, denies, reports, circulating, online, alleges, incoming, uae, plane, filled, arms]","['rudawenglish', 'kurdistan', 'region', 'presidency', 'deny', 'report', 'circulate', 'online', 'allege', 'incoming', 'uae', 'plane', 'fill', 'arm']"
337,1202594902971797507,rakeshrussell52,2019-12-05 14:25:42,en,socceriraq surely goal fest sure,0,0,@SoccerIraq Surely we are on for an goal fest for sure,"[socceriraq, surely, goal, fest, sure]","['socceriraq', 'surely', 'goal', 'fest', 'sure']"
338,1202594719005437956,rakeshrussell52,2019-12-05 14:24:58,en,rudawenglish going,0,0,@RudawEnglish What is going on?,"[rudawenglish, going]","['rudawenglish', 'go']"
339,1202594175788564480,rakeshrussell52,2019-12-05 14:22:49,en,toofaom going witness goal fest,0,0,@toofa_om Are we going to witness an goal fest?,"[toofaom, going, witness, goal, fest]","['toofaom', 'go', 'witness', 'goal', 'fest']"
340,1202591523797258240,rakeshrussell52,2019-12-05 14:12:17,en,socceriraq mohanadmeme meme meme beauty,0,0,@SoccerIraq @mohanad_meme Meme meme you beauty 😘,"[socceriraq, mohanadmeme, meme, meme, beauty]","['socceriraq', 'mohanadmeme', 'meme', 'meme', 'beauty']"
341,1202591304237998080,rakeshrussell52,2019-12-05 14:11:24,en,socceriraq: goal meme mohanadmeme gives #iraq early lead semi-final #irqvbhr #gulfcup,0,27,"RT @SoccerIraq: GOAL! MEME! ⚽

@mohanad_meme gives #Iraq an early lead in the semi-final! 🙌🇮🇶

#IRQvBHR #GulfCup2019
https://t.co/bgD5rC5uGq","[socceriraq:, goal, meme, mohanadmeme, gives, #iraq, early, lead, semi-final, #irqvbhr, #gulfcup]","['socceriraq', 'goal', 'meme', 'mohanadmeme', 'give', 'iraq', 'early', 'lead', 'semi', 'final', 'irqvbhr', 'gulfcup']"
342,1202585525351174144,rakeshrussell52,2019-12-05 13:48:26,en,irqsport live streaming link please,0,0,@IrqSport live streaming link please?,"[irqsport, live, streaming, link, please]","['irqsport', 'live', 'streaming', 'link']"
343,1202584290262781952,rakeshrussell52,2019-12-05 13:43:32,en,zeenews always sexiest guy bollywood industry,4,0,@ZeeNews As always he is the sexiest guy in the Bollywood industry,"[zeenews, always, sexiest, guy, bollywood, industry]","['zeenews', 'sexy', 'guy', 'bollywood', 'industry']"
344,1202564839593263110,rakeshrussell52,2019-12-05 12:26:14,en,iraqliveupdate: tens thousands head #taharirsquare #baghdad join #iraqprotests demanding reform chanting #ayatollahsist,0,19,RT @IraqLiveUpdate: Tens of thousands head to #TaharirSquare in #Baghdad to join #IraqProtests demanding reform and chanting #AyatollahSist…,"[iraqliveupdate:, tens, thousands, head, #taharirsquare, #baghdad, join, #iraqprotests, demanding, reform, chanting, #ayatollahsist]","['iraqliveupdate', 'ten', 'thousand', 'head', 'taharirsquare', 'baghdad', 'join', 'iraqprotest', 'demand', 'reform', 'chant', 'ayatollahsist']"
345,1202544012235640833,rakeshrussell52,2019-12-05 11:03:29,en,imohq: global project launched tackle plastic litter ships fisheries: #plasticlitter #glolitter #pl,0,58,RT @IMOHQ: Global project launched to tackle plastic litter from ships and fisheries: https://t.co/4YZ9HEEgqu #PlasticLitter #GloLitter #pl…,"[imohq:, global, project, launched, tackle, plastic, litter, ships, fisheries:, #plasticlitter, #glolitter, #pl]","['imohq', 'global', 'project', 'launch', 'tackle', 'plastic', 'litter', 'ship', 'fishery', 'plasticlitter', 'glolitter', 'pl']"
346,1202470192304947201,rakeshrussell52,2019-12-05 06:10:09,en,sandrak: kills #families #killanimalcenter #tx #palmvalley #edinburg nursing #moms precious #puppies first pup,0,204,"RT @SandraK93322487: Who kills #Families ❓#KillAnimalCenter #TX #PalmValley #Edinburg 😭Nursing #Moms with precious #puppies 💔
First the pup…","[sandrak:, kills, #families, #killanimalcenter, #tx, #palmvalley, #edinburg, nursing, #moms, precious, #puppies, first, pup]","['sandrak', 'kill', 'family', 'killanimalcenter', 'tx', 'palmvalley', 'edinburg', 'nursing', 'mom', 'precious', 'puppy', 'pup']"
347,1202123905369952256,rakeshrussell52,2019-12-04 07:14:08,en,hockeyind interest come respective governments host events,0,0,@hockeyind All these interest should come from the respective governments to host events,"[hockeyind, interest, come, respective, governments, host, events]","['hockeyind', 'interest', 'come', 'respective', 'government', 'host', 'event']"
348,1202070073701101569,rakeshrussell52,2019-12-04 03:40:13,en,thehockeyindia imranirampal happy birthday rani wish happy healthy life,2,0,@TheHockeyIndia @imranirampal Happy Birthday 🎂 Rani wish you a happy and healthy life,"[thehockeyindia, imranirampal, happy, birthday, rani, wish, happy, healthy, life]","['thehockeyindia', 'imranirampal', 'happy', 'birthday', 'rani', 'wish', 'happy', 'healthy', 'life']"
349,1201868937379627013,rakeshrussell52,2019-12-03 14:20:58,en,hockeyind four teams last edition,0,0,@hockeyind Just four teams in last edition,"[hockeyind, four, teams, last, edition]","['hockeyind', 'team', 'edition']"
350,1201849689655496705,rakeshrussell52,2019-12-03 13:04:29,en,hockeyind team busy international commitments plus pakistan countries play c,2,0,@hockeyind As our team are busy in their international commitments plus Pakistan and other countries doesn't play c… https://t.co/cq74wEkn0v,"[hockeyind, team, busy, international, commitments, plus, pakistan, countries, play, c]","['hockeyind', 'team', 'busy', 'international', 'commitment', 'plus', 'pakistan', 'country', 'play', 'c']"
351,1201790062528122881,rakeshrussell52,2019-12-03 09:07:33,en,livefist: indias st indigenous aircraft carrier new ins vikrant commissioned service operate mig-k j,0,225,"RT @livefist: India’s 1st indigenous aircraft carrier, the new INS Vikrant, to be commissioned into service in 2022, will operate MiG-29K j…","[livefist:, indias, st, indigenous, aircraft, carrier, new, ins, vikrant, commissioned, service, operate, mig-k, j]","['livefist', 'indias', 'st', 'indigenous', 'aircraft', 'carrier', 'new', 'ins', 'vikrant', 'commission', 'service', 'operate', 'mig', 'k', 'j']"
352,1201730382200102913,rakeshrussell52,2019-12-03 05:10:24,en,rudawenglish beautiful,0,0,@RudawEnglish Beautiful,"[rudawenglish, beautiful]","['rudawenglish', 'beautiful']"
353,1201729524527841281,rakeshrussell52,2019-12-03 05:07:00,en,bcciwomen mraj happy birthday champion,0,0,@BCCIWomen @M_Raj03 Happy Birthday 🎂 Champion,"[bcciwomen, mraj, happy, birthday, champion]","['bcciwomen', 'mraj', 'happy', 'birthday', 'champion']"
354,1201729478793162754,rakeshrussell52,2019-12-03 05:06:49,en,bcciwomen: one inspired many girls take sport chase dreams many many happy returns day,0,507,"RT @BCCIWomen: To the one who has inspired so many girls to take up the sport and chase their dreams, many many happy returns of the day @M…","[bcciwomen:, one, inspired, many, girls, take, sport, chase, dreams, many, many, happy, returns, day]","['bcciwomen', 'inspire', 'girl', 'sport', 'chase', 'dream', 'happy', 'return', 'day']"
355,1201729348371279872,rakeshrussell52,2019-12-03 05:06:18,en,agcff kuwaitfa uaent omanfa hard luck teams,0,0,@AGCFF @KuwaitFA @uaent2019 @OmanFA Hard luck teams,"[agcff, kuwaitfa, uaent, omanfa, hard, luck, teams]","['agcff', 'kuwaitfa', 'uaent', 'omanfa', 'hard', 'luck', 'team']"
356,1201729134839205888,rakeshrussell52,2019-12-03 05:05:27,en,irqsport overconfidence paid dividends form defeat shows one remain champion forever,0,0,"@IrqSport Overconfidence paid your dividends in the form of defeat , this shows no one can remain champion forever… https://t.co/ob8vPHifdY","[irqsport, overconfidence, paid, dividends, form, defeat, shows, one, remain, champion, forever]","['irqsport', 'overconfidence', 'pay', 'dividend', 'form', 'defeat', 'show', 'remain', 'champion', 'forever']"
357,1201576919143190531,rakeshrussell52,2019-12-02 19:00:36,en,socceriraq best semi final bahrain play hard till last minute boys,0,0,@SoccerIraq All the best for the semi final against Bahrain play hard till the last minute boys,"[socceriraq, best, semi, final, bahrain, play, hard, till, last, minute, boys]","['socceriraq', 'best', 'semi', 'final', 'bahrain', 'play', 'hard', 'till', 'minute', 'boy']"
358,1201541472031391749,rakeshrussell52,2019-12-02 16:39:45,en,agcff yahoo last tournament finalist bowed,0,0,@AGCFF Yahoo last tournament finalist bowed out,"[agcff, yahoo, last, tournament, finalist, bowed]","['agcff', 'yahoo', 'tournament', 'finalist', 'bow']"
359,1201478951844999168,rakeshrussell52,2019-12-02 12:31:19,en,dna: government amps wildlife conservation efforts; maps 'tiger corridors' across country,0,5,RT @dna: Government amps up wildlife conservation efforts; maps out 32 'tiger corridors' across country https://t.co/W45RRBW5F8,"[dna:, government, amps, wildlife, conservation, efforts;, maps, 'tiger, corridors', across, country]","['dna', 'government', 'amps', 'wildlife', 'conservation', 'effort', 'map', 'tiger', 'corridor', 'country']"
360,1201478758621777920,rakeshrussell52,2019-12-02 12:30:33,in,sunlifetamil romba mukiyam natuku pongaya poi velaya parunga,0,0,@SunLifeTamil Romba mukiyam natuku pongaya poi velaya parunga,"[sunlifetamil, romba, mukiyam, natuku, pongaya, poi, velaya, parunga]","['sunlifetamil', 'romba', 'mukiyam', 'natuku', 'pongaya', 'poi', 'velaya', 'parunga']"
361,1201389855965507584,rakeshrussell52,2019-12-02 06:37:17,en,thehockeyindia: revolutions locomotives history playing wooden sticks soil transitioning onto grass,0,10,"RT @TheHockeyIndia: Revolutions are the locomotives of history. 

From playing with wooden sticks on soil to transitioning onto grass and s…","[thehockeyindia:, revolutions, locomotives, history, playing, wooden, sticks, soil, transitioning, onto, grass]","['thehockeyindia', 'revolution', 'locomotive', 'history', 'play', 'wooden', 'stick', 'soil', 'transition', 'grass']"
362,1201389148973584384,rakeshrussell52,2019-12-02 06:34:28,en,thehockeyindia akashdeeps happy birthday winger,0,0,@TheHockeyIndia @akashdeeps985 Happy Birthday 🎂 winger,"[thehockeyindia, akashdeeps, happy, birthday, winger]","['thehockeyindia', 'akashdeeps', 'happy', 'birthday', 'winger']"
363,1201141687667417091,rakeshrussell52,2019-12-01 14:11:09,en,imranirampal: #blessed#smile#happy#positive#beautiful#sunday#life,0,22,RT @imranirampal: #blessed#smile#happy#positive#beautiful#sunday#life❤️🔥 https://t.co/33lcmlezqn,"[imranirampal:, #blessed#smile#happy#positive#beautiful#sunday#life]","['imranirampal', 'blessed#smile#happy#positive#beautiful#sunday#life']"
364,1201119470296502272,rakeshrussell52,2019-12-01 12:42:52,en,rudawenglish everyone accounted responsible killing protesters martyred,0,0,@RudawEnglish Everyone should be accounted for those responsible for the killing of the protesters who martyred and… https://t.co/K3l0CNCDnF,"[rudawenglish, everyone, accounted, responsible, killing, protesters, martyred]","['rudawenglish', 'account', 'responsible', 'kill', 'protester', 'martyr']"
