,id,username,created_at,lang,cleaned_tweets,favorite_count,retweet_count,text,tokens,lemmas
514,1390022258022879235,garyvee,2021-05-05 19:15:06,en,jessealtman loopifyyy sorry u feel way jesse art meant lot really wanted,9,0,@jesse_altman @Loopifyyy Sorry u feel that way Jesse .. the art meant a lot  to me and I really wanted to do the do… https://t.co/tNcNru6bC5,"[jessealtman, loopifyyy, sorry, u, feel, way, jesse, art, meant, lot, really, wanted]","['jessealtman', 'loopifyyy', 'sorry', 'feel', 'way', 'jesse', 'art', 'mean', 'lot', 'want']"
515,1390012907744808969,garyvee,2021-05-05 18:37:57,en,jesuselkasier humbled,17,0,@Jesus_elkasier4 humbled,"[jesuselkasier, humbled]","['jesuselkasier', 'humble']"
516,1390012819823808515,garyvee,2021-05-05 18:37:36,und,cliffdogg :),3,0,@Cliffdogg_ :),"[cliffdogg, :)]",['cliffdogg']
517,1390012481121230850,garyvee,2021-05-05 18:36:15,en,bitaliens damintci cant wait alien drop :),31,3,@BitAliens @DaMintci i cant wait for my alien to drop :),"[bitaliens, damintci, cant, wait, alien, drop, :)]","['bitaliens', 'damintci', 'not', 'wait', 'alien', 'drop']"
518,1390010971196907522,garyvee,2021-05-05 18:30:15,en,see chance coming pm et want keep updating,684,72,i don't see any chance of this coming out before 9pm ... ET ... I just want to keep UPDATING !!!!!… https://t.co/a0ap2yJ063,"[see, chance, coming, pm, et, want, keep, updating]","['chance', 'come', 'pm', 'et', 'want', 'update']"
519,1389992496923660288,garyvee,2021-05-05 17:16:50,und,leitnerjoe banklesshq dustynotjusty :),5,1,@LeitnerJoe @BanklessHQ @dustynotjusty :),"[leitnerjoe, banklesshq, dustynotjusty, :)]","['leitnerjoe', 'banklesshq', 'dustynotjusty']"
520,1389992432595607555,garyvee,2021-05-05 17:16:35,en,spadaboom solid,7,0,@spadaboom1 Solid,"[spadaboom, solid]","['spadaboom', 'solid']"
521,1389992375787966464,garyvee,2021-05-05 17:16:21,en,good,678,38,So good https://t.co/9S37lfy96W,[good],['good']
522,1389990688591421441,garyvee,2021-05-05 17:09:39,und,logancudlip lol,4,0,@logancudlip Lol,"[logancudlip, lol]","['logancudlip', 'lol']"
523,1389990588087521281,garyvee,2021-05-05 17:09:15,en,purinstinct: im captivated garyvee talking present/future care much crypto nba top shot im feel,0,30,RT @PurInstinct: I’m captivated by @garyvee talking about the present/future. I do not care much for crypto and NBA Top Shot but I’m 💯 feel…,"[purinstinct:, im, captivated, garyvee, talking, present/future, care, much, crypto, nba, top, shot, im, feel]","['purinstinct', 'be', 'captivate', 'garyvee', 'talk', 'present', 'future', 'care', 'crypto', 'nba', 'shoot', 'be', 'feel']"
524,1389990516784308229,garyvee,2021-05-05 17:08:58,en,jackbgrimes humbled,7,1,@jackbgrimes Humbled,"[jackbgrimes, humbled]","['jackbgrimes', 'humble']"
525,1389987366992027655,garyvee,2021-05-05 16:56:27,en,teamgaryvee: live min garyvee x bankless,0,28,"RT @TeamGaryVee: LIVE in 4min @garyvee x Bankless 
https://t.co/2UElIeQzOK","[teamgaryvee:, live, min, garyvee, x, bankless]","['teamgaryvee', 'live', 'min', 'garyvee', 'x', 'bankless']"
526,1389975256790671361,garyvee,2021-05-05 16:08:20,en,jchatterleycnn: finding amzn equivalent #nft garyvee: bet person who's person behind,0,248,"RT @jchatterleyCNN: Finding an $AMZN equivalent #NFT! 

@garyvee: You have to bet on the person. Who's the person behind it? Does she or he…","[jchatterleycnn:, finding, amzn, equivalent, #nft, garyvee:, bet, person, who's, person, behind]","['jchatterleycnn', 'find', 'amzn', 'equivalent', 'nft', 'garyvee', 'bet', 'person', 'person']"
527,1389969366285004800,garyvee,2021-05-05 15:44:55,en,banklesshq: live today garyvee comes bankless talk crypto nfts new nft platform veefriends pm est,0,37,"RT @BanklessHQ: 🚨 LIVE TODAY 🚨

@garyvee comes on Bankless to talk crypto, NFTs, and his new NFT Platform @veefriends.

1pm EST. Be there!…","[banklesshq:, live, today, garyvee, comes, bankless, talk, crypto, nfts, new, nft, platform, veefriends, pm, est]","['banklesshq', 'live', 'today', 'garyvee', 'come', 'bankless', 'talk', 'crypto', 'nfts', 'new', 'nft', 'platform', 'veefriends', 'pm', 'est']"
528,1389961931956658178,garyvee,2021-05-05 15:15:23,en,yahoofinance: live now: garyvee joins yahoo finance discuss he's launching first nft collection veefriends watch http,0,30,"RT @YahooFinance: LIVE NOW: @garyvee joins Yahoo Finance to discuss why he's launching his first NFT collection ""VeeFriends."" Watch at http…","[yahoofinance:, live, now:, garyvee, joins, yahoo, finance, discuss, he's, launching, first, nft, collection, veefriends, watch, http]","['yahoofinance', 'live', 'garyvee', 'join', 'yahoo', 'finance', 'discuss', 'launch', 'nft', 'collection', 'veefriends', 'watch', 'http']"
529,1389961875736104961,garyvee,2021-05-05 15:15:10,en,ones fun,326,28,This ones fun https://t.co/77diUWsCqc https://t.co/nUcCptNGSr,"[ones, fun]","['one', 'fun']"
530,1389961544663019520,garyvee,2021-05-05 15:13:51,en,greenbergcap saltconference vaynermedia era nft trading high high risk classic supply demand,9,1,@greenbergcap @SALTConference @VaynerMedia This era of NFT trading will be high high risk ... classic supply and demand,"[greenbergcap, saltconference, vaynermedia, era, nft, trading, high, high, risk, classic, supply, demand]","['greenbergcap', 'saltconference', 'vaynermedia', 'era', 'nft', 'trade', 'high', 'high', 'risk', 'classic', 'supply', 'demand']"
531,1389961296469237761,garyvee,2021-05-05 15:12:51,und,prymzx go,3,1,@Prymzx Go!,"[prymzx, go]",['prymzx']
532,1389960628606050310,garyvee,2021-05-05 15:10:12,en,davidollad: garyvee watched recorded concluded session cnn got insight thanks sharing alw,0,7,"RT @Davidollad: @garyvee I just watched and recorded your just concluded session @CNN 

Got some insight from it, thanks for sharing as alw…","[davidollad:, garyvee, watched, recorded, concluded, session, cnn, got, insight, thanks, sharing, alw]","['davidollad', 'garyvee', 'watch', 'record', 'conclude', 'session', 'cnn', 'get', 'insight', 'thank', 'share', 'alw']"
533,1389960528370536448,garyvee,2021-05-05 15:09:48,en,tymure veefriends joinswave cute,6,2,@tymure @veefriends @joinswave Cute,"[tymure, veefriends, joinswave, cute]","['tymure', 'veefriends', 'joinswave', 'cute']"
534,1389960021182664713,garyvee,2021-05-05 15:07:47,en,carlosgil veefriends tonight xoxox,5,1,@carlosgil83 @veefriends https://t.co/oJzF1VtLxO tonight Xoxox,"[carlosgil, veefriends, tonight, xoxox]","['carlosgil', 'veefriends', 'tonight', 'xoxox']"
535,1389959854039654404,garyvee,2021-05-05 15:07:08,en,fun part,132,14,This is a fun part of it https://t.co/UBgEdSwhkh,"[fun, part]",['fun']
536,1389959699223744517,garyvee,2021-05-05 15:06:31,en,thedigitalvee bbstudiosguild careful u spend anything youre money time,3,0,@thedigitalvee @BBStudiosGuild Be careful how u spend anything .. you’re money and time ♥️,"[thedigitalvee, bbstudiosguild, careful, u, spend, anything, youre, money, time]","['thedigitalvee', 'bbstudiosguild', 'careful', 'u', 'spend', 'money', 'time']"
537,1389958501707960322,garyvee,2021-05-05 15:01:45,en,time change narrative black cats good luck,702,81,It’s time we change the narrative on black cats 🐈‍⬛.... THEY ARE GOOD LUCK https://t.co/0xX5MWjplP,"[time, change, narrative, black, cats, good, luck]","['time', 'change', 'narrative', 'black', 'cat', 'good', 'luck']"
538,1389958348573978628,garyvee,2021-05-05 15:01:09,und,veefriends:,0,111,RT @veefriends: https://t.co/nMPyn4Xkyh,[veefriends:],['veefriend']
539,1389958301606191111,garyvee,2021-05-05 15:00:57,en,thedigitalvee friend,2,0,@thedigitalvee And to you my friend,"[thedigitalvee, friend]","['thedigitalvee', 'friend']"
540,1389957948949024772,garyvee,2021-05-05 14:59:33,en,fvbrix veefriends teamgaryvee humbled,3,0,@fvbrix @veefriends @TeamGaryVee Humbled,"[fvbrix, veefriends, teamgaryvee, humbled]","['fvbrix', 'veefriends', 'teamgaryvee', 'humble']"
541,1389957808792145928,garyvee,2021-05-05 14:59:00,en,cyberh nfts im humbled,7,0,@cyberh49 @_NFTs I’m humbled,"[cyberh, nfts, im, humbled]","['cyberh', 'nfts', 'be', 'humble']"
542,1389957678433198080,garyvee,2021-05-05 14:58:29,en,gcentralized :) timing life :) email happy :),10,0,@G_centralized :) timing is life :) email me .. so happy :),"[gcentralized, :), timing, life, :), email, happy, :)]","['gcentralize', 'timing', 'life', 'email', 'happy']"
543,1389956485803827202,garyvee,2021-05-05 14:53:45,en,thedigitalvee respect take :) ip creation execution real play conference,1,0,@thedigitalvee I respect that take :) to me the I.P creation and execution is the real play and the conference is t… https://t.co/ogogDsQl00,"[thedigitalvee, respect, take, :), ip, creation, execution, real, play, conference]","['thedigitalvee', 'respect', 'ip', 'creation', 'execution', 'real', 'play', 'conference']"
544,1389956326034378756,garyvee,2021-05-05 14:53:06,en,sharambae cryptobanter humbled,2,0,@Sharambae_ @crypto_banter Humbled,"[sharambae, cryptobanter, humbled]","['sharambae', 'cryptobanter', 'humble']"
545,1389956189908348932,garyvee,2021-05-05 14:52:34,en,nfts really,10,0,@_NFTs It really has,"[nfts, really]",['nfts']
546,1389956048283443204,garyvee,2021-05-05 14:52:00,en,pranksynft youre og,88,2,@pranksyNFT You’re the OG ♥️,"[pranksynft, youre, og]","['pranksynft', 'og']"
547,1389955845971234822,garyvee,2021-05-05 14:51:12,en,birdnft respect pov friend love art doodles mean lot respect pov cheer,5,0,@BIRDNFT I respect your POV my friend and love your art .. my doodles mean a lot to me .. but I respect your POV and cheer for you,"[birdnft, respect, pov, friend, love, art, doodles, mean, lot, respect, pov, cheer]","['birdnft', 'respect', 'pov', 'friend', 'love', 'art', 'doodle', 'mean', 'lot', 'respect', 'pov', 'cheer']"
548,1389955512343662593,garyvee,2021-05-05 14:49:52,en,justtries details scholarship coming,10,0,@JustTries_ Details on scholarship coming,"[justtries, details, scholarship, coming]","['justtries', 'detail', 'scholarship', 'come']"
549,1389950233107439618,garyvee,2021-05-05 14:28:54,und,shanewylie: garyvee,0,3,RT @ShaneWylie4: @garyvee https://t.co/Qok9xzqFZw,"[shanewylie:, garyvee]","['shanewylie', 'garyvee']"
550,1389950221275344898,garyvee,2021-05-05 14:28:51,en,johnburbage: garyvee underrated,0,1,RT @JohnBurbage720: @garyvee So underrated ❤️,"[johnburbage:, garyvee, underrated]","['johnburbage', 'garyvee', 'underrate']"
551,1389950216665710596,garyvee,2021-05-05 14:28:50,und,verlatti: garyvee,0,2,RT @Verlatti: @garyvee https://t.co/jKIQUZVoYy,"[verlatti:, garyvee]","['verlatti', 'garyvee']"
552,1389950091272888323,garyvee,2021-05-05 14:28:20,und,shioritakagi veefriends yes,9,0,@shiori_takagi @veefriends Yes,"[shioritakagi, veefriends, yes]","['shioritakagi', 'veefriends', 'yes']"
553,1389949979792396289,garyvee,2021-05-05 14:27:53,en,im obsessed little friend black cats lucky,320,28,I’m obsessed by our little friend ... black cats 🐈‍⬛ are lucky !!!! https://t.co/DjOw6dbJkm,"[im, obsessed, little, friend, black, cats, lucky]","['be', 'obsess', 'little', 'friend', 'black', 'cat', 'lucky']"
554,1389949550048288774,garyvee,2021-05-05 14:26:11,en,cryptofaye launch lol,4,0,@cryptofaye1 Launch * lol,"[cryptofaye, launch, lol]","['cryptofaye', 'launch', 'lol']"
555,1389949533166112774,garyvee,2021-05-05 14:26:07,en,cryptofaye need get lunch,4,0,@cryptofaye1 I do .. just need to get through this lunch,"[cryptofaye, need, get, lunch]","['cryptofaye', 'need', 'lunch']"
556,1389945599244574721,garyvee,2021-05-05 14:10:29,en,want project inspire meaningful projects,287,34,100% I want this project to inspire meaningful projects https://t.co/3ekbmvW2Pa,"[want, project, inspire, meaningful, projects]","['want', 'project', 'inspire', 'meaningful', 'project']"
557,1389945381534982147,garyvee,2021-05-05 14:09:37,en,danfleyshman attendees max,7,0,"@DanFleyshman 10,255 attendees max ..","[danfleyshman, attendees, max]","['danfleyshman', 'attendee', 'max']"
558,1389944059934949378,garyvee,2021-05-05 14:04:22,en,ryanlnichols smart,24,0,@ryanlnichols Smart,"[ryanlnichols, smart]","['ryanlnichols', 'smart']"
559,1389943818045333508,garyvee,2021-05-05 14:03:24,en,producthunt gabeperez humbled,13,1,@ProductHunt @gabe__perez Humbled,"[producthunt, gabeperez, humbled]","['producthunt', 'gabeperez', 'humble']"
560,1389943684452466689,garyvee,2021-05-05 14:02:52,en,aquaholicin: garyvee learning nfts project getting hyped gonna good ride,0,8,RT @AquaholicIn: @garyvee Learning NFTs because of this project .. getting hyped. Gonna be a good ride,"[aquaholicin:, garyvee, learning, nfts, project, getting, hyped, gonna, good, ride]","['aquaholicin', 'garyvee', 'learning', 'nfts', 'project', 'get', 'hype', 'go', 'to', 'good', 'ride']"
561,1389943562230505474,garyvee,2021-05-05 14:02:23,en,bitaliens: incredible say garyvee one main reasons collection exists life completely changed worked,0,15,"RT @BitAliens: Incredible to say @garyvee is one of the main reasons this collection exists, my life has completely changed having worked s…","[bitaliens:, incredible, say, garyvee, one, main, reasons, collection, exists, life, completely, changed, worked]","['bitaliens', 'incredible', 'garyvee', 'main', 'reason', 'collection', 'exist', 'life', 'completely', 'change', 'work']"
562,1389943487198633991,garyvee,2021-05-05 14:02:05,en,barn owl lit,136,10,The barn owl 🦉 is lit https://t.co/2FLkq4Lk0y,"[barn, owl, lit]","['barn', 'owl', 'light']"
563,1389943263138881541,garyvee,2021-05-05 14:01:12,en,let confusion theres incredible woman men ogs nfts since,946,45,"Let there be no confusion .. there’s 10,000’s of incredible Woman and Men who have been OG’s to NFT’s since 2017 an… https://t.co/V2ijrEhmcy","[let, confusion, theres, incredible, woman, men, ogs, nfts, since]","['let', 'confusion', 's', 'incredible', 'woman', 'man', 'ogs', 'nfts']"
564,1389942954442252289,garyvee,2021-05-05 13:59:58,en,nftginger: thanks garyvee opening eyes millions showing world crypto nfts pivotal tim,0,24,RT @NFTGinger: Thanks @garyvee for opening the eyes 👀 of millions and showing them the world of Crypto and NFTs! This is such a pivotal tim…,"[nftginger:, thanks, garyvee, opening, eyes, millions, showing, world, crypto, nfts, pivotal, tim]","['nftginger', 'thank', 'garyvee', 'open', 'eye', 'million', 'show', 'world', 'crypto', 'nfts', 'pivotal', 'tim']"
565,1389942809919201286,garyvee,2021-05-05 13:59:24,en,alexonaindia means alit,9,0,@AlexOnaindia Means alit to me,"[alexonaindia, means, alit]","['alexonaindia', 'mean', 'alit']"
566,1389942705577504769,garyvee,2021-05-05 13:58:59,en,go discord linked bio substantial giveaways mis,196,16,And if not ... go to the discord .. linked in my bio ... I am doing substantial giveaways on there to those who mis… https://t.co/nm7ZaEb5KF,"[go, discord, linked, bio, substantial, giveaways, mis]","['discord', 'link', 'bio', 'substantial', 'giveaway', 'mis']"
567,1389942465117962244,garyvee,2021-05-05 13:58:02,en,joeswam: nbatopshoteast gary's content even stumbled onto top shot owe big time,0,6,RT @joeswam: @NBATopShotEast It's because of Gary's content that I even stumbled onto Top Shot. I owe him big time for that.,"[joeswam:, nbatopshoteast, gary's, content, even, stumbled, onto, top, shot, owe, big, time]","['joeswam', 'nbatopshoteast', 'gary', 'content', 'stumble', 'shot', 'owe', 'big', 'time']"
568,1389942452321243136,garyvee,2021-05-05 13:57:59,en,martinfrank: garyvee nbatopshoteast joeswam probably found nbatopshot also garyvee rida,0,2,RT @MartinFrank21: @garyvee @NBATopShotEast @joeswam I probably found out about @nbatopshot also because of @garyvee … What a rida🔥🔥🔥,"[martinfrank:, garyvee, nbatopshoteast, joeswam, probably, found, nbatopshot, also, garyvee, rida]","['martinfrank', 'garyvee', 'nbatopshoteast', 'joeswam', 'probably', 'find', 'nbatopshot', 'garyvee', 'rida']"
569,1389942445706776579,garyvee,2021-05-05 13:57:57,en,martinfrank nbatopshoteast joeswam nbatopshot happy,9,0,@MartinFrank21 @NBATopShotEast @joeswam @nbatopshot So happy,"[martinfrank, nbatopshoteast, joeswam, nbatopshot, happy]","['martinfrank', 'nbatopshoteast', 'joeswam', 'nbatopshot', 'happy']"
570,1389941024626257921,garyvee,2021-05-05 13:52:18,en,kindmantras love,9,1,@KindMantras Love,"[kindmantras, love]","['kindmantras', 'love']"
571,1389940992632098819,garyvee,2021-05-05 13:52:11,en,joeswam nbatopshoteast makes smile,41,2,@joeswam @NBATopShotEast This makes me smile,"[joeswam, nbatopshoteast, makes, smile]","['joeswam', 'nbatopshoteast', 'make', 'smile']"
572,1389938659277910016,garyvee,2021-05-05 13:42:54,en,dimensionfan think billsfan saddened disappointment appreciate feedback,3,0,"@dimension20fan1 Why do you think so billsfan , saddened by the disappointment but appreciate the feedback","[dimensionfan, think, billsfan, saddened, disappointment, appreciate, feedback]","['dimensionfan', 'think', 'billsfan', 'sadden', 'disappointment', 'appreciate', 'feedback']"
573,1389938399256195076,garyvee,2021-05-05 13:41:52,en,run little curate around many arenas interest,689,49,I will run https://t.co/fIypJQ45MW but it will be very little about me .. this is where I will curate around so many arenas of interest,"[run, little, curate, around, many, arenas, interest]","['run', 'little', 'curate', 'arena', 'interest']"
574,1389938271631945733,garyvee,2021-05-05 13:41:22,en,iamsted keyboardmonkey veefriends conference little,4,0,@iamsted1 @KeyboardMonkey3 @veefriends The conference https://t.co/B8mxMl93YK will have little to do with me,"[iamsted, keyboardmonkey, veefriends, conference, little]","['iamsted', 'keyboardmonkey', 'veefriends', 'conference', 'little']"
575,1389937894723362821,garyvee,2021-05-05 13:39:52,en,deanas chefdizzyd course cant everyones cup tea,4,0,@deanas32 @ChefDizzyD I of course can’t be everyone’s cup of tea,"[deanas, chefdizzyd, course, cant, everyones, cup, tea]","['deanas', 'chefdizzyd', 'course', 'not', 'everyones', 'cup', 'tea']"
576,1389937840876920836,garyvee,2021-05-05 13:39:39,en,deanas chefdizzyd thank u,3,0,@deanas32 @ChefDizzyD Thank u D,"[deanas, chefdizzyd, thank, u]","['deanas', 'chefdizzyd', 'thank', 'u']"
577,1389937740880429056,garyvee,2021-05-05 13:39:15,en,ruscoeben working amazing team nft,13,0,@RuscoeBen Working with amazing team at NFT42,"[ruscoeben, working, amazing, team, nft]","['ruscoeben', 'work', 'amazing', 'team', 'nft']"
578,1389937525863723009,garyvee,2021-05-05 13:38:24,en,pman economist humbled perry,5,0,@pman555 @economist Humbled Perry,"[pman, economist, humbled, perry]","['pman', 'economist', 'humble', 'perry']"
579,1389937431974227971,garyvee,2021-05-05 13:38:02,en,either sorcerer free applicants,181,14,Either and the sorcerer is Free for 5 applicants https://t.co/GLkwUXjGvQ,"[either, sorcerer, free, applicants]","['sorcerer', 'free', 'applicant']"
580,1389936156985499648,garyvee,2021-05-05 13:32:58,en,live cnn et talking veefriends,214,23,Will be live on CNN at 940am ET talking ⁦@veefriends⁩  https://t.co/fo5B3sCzEq,"[live, cnn, et, talking, veefriends]","['live', 'cnn', 'et', 'talk', 'veefriends']"
581,1389935262386593798,garyvee,2021-05-05 13:29:24,en,economist big ambition mine,15,0,@economist Was a big ambition of mine,"[economist, big, ambition, mine]","['economist', 'big', 'ambition']"
582,1389935167540801537,garyvee,2021-05-05 13:29:02,en,venturecoinist keyboardmonkey means lot,42,0,@VentureCoinist @KeyboardMonkey3 Means a lot to me,"[venturecoinist, keyboardmonkey, means, lot]","['venturecoinist', 'keyboardmonkey', 'mean', 'lot']"
583,1389935095725834241,garyvee,2021-05-05 13:28:45,en,erucrpyto keyboardmonkey thank u,8,0,@Erucrpyto @KeyboardMonkey3 Thank u,"[erucrpyto, keyboardmonkey, thank, u]","['erucrpyto', 'keyboardmonkey', 'thank', 'u']"
584,1389935040625352707,garyvee,2021-05-05 13:28:32,und,garyvee: keyboardmonkey,0,11,RT @garyvee: @KeyboardMonkey3 https://t.co/hGl0wBXxmy,"[garyvee:, keyboardmonkey]","['garyvee', 'keyboardmonkey']"
585,1389934930482941953,garyvee,2021-05-05 13:28:05,en,keyboardmonkey: ok seeing garyvee nft drop / experiences token im actually impressed per,0,30,"RT @KeyboardMonkey3: Ok, now after seeing the @garyvee NFT drop and the 1/1 experiences with each token.. I’m actually impressed.  They per…","[keyboardmonkey:, ok, seeing, garyvee, nft, drop, /, experiences, token, im, actually, impressed, per]","['keyboardmonkey', 'ok', 'see', 'garyvee', 'nft', 'drop', 'experience', 'token', 'be', 'actually', 'impress']"
586,1389934901672218629,garyvee,2021-05-05 13:27:58,und,keyboardmonkey,235,11,@KeyboardMonkey3 https://t.co/hGl0wBXxmy,[keyboardmonkey],['keyboardmonkey']
587,1389934608913944579,garyvee,2021-05-05 13:26:49,und,ragabt,9,0,@Ragab0t https://t.co/RRIjlTDNiM,[ragabt],['ragabt']
588,1389934324464693249,garyvee,2021-05-05 13:25:41,und,lylethecreator,10,0,@LyletheCreator https://t.co/yZg4Er06RR,[lylethecreator],['lylethecreator']
589,1389933993353781256,garyvee,2021-05-05 13:24:22,en,henrywangcal would love get know u u dm ill catch later week,5,0,@henrywangcal Would love to get to know u .. can u dm me .. I’ll catch by later this week,"[henrywangcal, would, love, get, know, u, u, dm, ill, catch, later, week]","['henrywangcal', 'love', 'know', 'u', 'u', 'dm', 'ill', 'catch', 'later', 'week']"
590,1389933101539893251,garyvee,2021-05-05 13:20:49,en,ragnarlothblock apompliano literally made laugh beyond clever wishing u super good things,24,1,@RagnarLothblock @APompliano That literally made me laugh ... beyond clever. Wishing u super good things,"[ragnarlothblock, apompliano, literally, made, laugh, beyond, clever, wishing, u, super, good, things]","['ragnarlothblock', 'apompliano', 'literally', 'laugh', 'clever', 'wish', 'u', 'super', 'good', 'thing']"
591,1389932915799248903,garyvee,2021-05-05 13:20:05,und,socialmediayash digitalpratik veefriends,32,2,@socialmediayash @digitalpratik @veefriends https://t.co/xs86Yv5vG3,"[socialmediayash, digitalpratik, veefriends]","['socialmediayash', 'digitalpratik', 'veefriends']"
592,1389932672458412032,garyvee,2021-05-05 13:19:07,en,llidenskiny im grateful,2,0,@Lliden_Skiny I’m grateful,"[llidenskiny, im, grateful]","['llidenskiny', 'be', 'grateful']"
593,1389932595157389315,garyvee,2021-05-05 13:18:49,en,sarahseweryniak means lot,12,1,@SarahSeweryniak Means A lot,"[sarahseweryniak, means, lot]","['sarahseweryniak', 'mean', 'lot']"
594,1389932557488246789,garyvee,2021-05-05 13:18:40,en,sarahseweryniak: nft's always head-scratcher menever seemed logicalyet garyvee takes right directi,0,36,RT @SarahSeweryniak: NFT's have always been a head-scratcher to me...never seemed logical...yet here @garyvee takes it in the right directi…,"[sarahseweryniak:, nft's, always, head-scratcher, menever, seemed, logicalyet, garyvee, takes, right, directi]","['sarahseweryniak', 'nft', 'head', 'scratcher', 'menever', 'logicalyet', 'garyvee', 'take', 'right', 'directi']"
595,1389932508242927616,garyvee,2021-05-05 13:18:28,en,davidal thank u,2,0,@Davidal04679759 Thank u,"[davidal, thank, u]","['davidal', 'thank', 'u']"
596,1389932045741215746,garyvee,2021-05-05 13:16:38,en,beastoncards im sorry working feverishly,3,0,@BeastonCards I’m so so sorry .. working feverishly,"[beastoncards, im, sorry, working, feverishly]","['beastoncards', 'be', 'sorry', 'work', 'feverishly']"
597,1389932039999270913,garyvee,2021-05-05 13:16:36,und,chefdizzyd,12,0,@ChefDizzyD https://t.co/pqT7DeOx7P,[chefdizzyd],['chefdizzyd']
598,1389931822239338496,garyvee,2021-05-05 13:15:44,en,davidrocknyc: what's picture man piece cardboard worth zero unless man goes something -garyvee,0,47,RT @davidrocknyc: What's a picture of a man on a piece of cardboard worth? Zero. Unless the man goes and does something. -@garyvee,"[davidrocknyc:, what's, picture, man, piece, cardboard, worth, zero, unless, man, goes, something, -garyvee]","['davidrocknyc', 'picture', 'man', 'piece', 'cardboard', 'worth', 'zero', 'man', 'go', '-garyvee']"
599,1389929840799801353,garyvee,2021-05-05 13:07:52,en,thisiskp means world,9,0,@thisiskp_ This means the world to me,"[thisiskp, means, world]","['thisiskp', 'mean', 'world']"
600,1389928860586848256,garyvee,2021-05-05 13:03:58,und,yes :),157,10,🙌 yes :) https://t.co/GQcVks2Mvv,"[yes, :)]",['yes']
601,1389928591962656769,garyvee,2021-05-05 13:02:54,en,intakeanthony thank u anthony,5,0,@InTake_Anthony Thank u Anthony,"[intakeanthony, thank, u, anthony]","['intakeanthony', 'thank', 'u', 'anthony']"
602,1389927905069879306,garyvee,2021-05-05 13:00:10,und,yes,152,7,Yes https://t.co/Gv4fT455F8,[yes],['yes']
603,1389927778334748675,garyvee,2021-05-05 12:59:40,en,nash cryptomanran individual projects yes overall macro technology consumer reality,14,1,@Nash1607 @cryptomanran The individual projects ... yes ... the overall macro technology and consumer reality ... no,"[nash, cryptomanran, individual, projects, yes, overall, macro, technology, consumer, reality]","['nash', 'cryptomanran', 'individual', 'project', 'yes', 'overall', 'macro', 'technology', 'consumer', 'reality']"
604,1389926378959740930,garyvee,2021-05-05 12:54:06,en,squawkcnbc: anytime smart people think something i'm whacky first blush know i'm something really important says,0,133,"RT @SquawkCNBC: ""Anytime smart people think something I'm doing is whacky on first blush I know I'm doing something really important,"" says…","[squawkcnbc:, anytime, smart, people, think, something, i'm, whacky, first, blush, know, i'm, something, really, important, says]","['squawkcnbc', 'anytime', 'smart', 'people', 'think', 'whacky', 'blush', 'know', 'important', 'say']"
605,1389923187639599105,garyvee,2021-05-05 12:41:26,en,therealdilonju multi-day launch :-) ive got friends set,29,0,@therealdilonju1 It’s a multi-day launch :-) I’ve got my friends down under all set  🇦🇺,"[therealdilonju, multi-day, launch, :-), ive, got, friends, set]","['therealdilonju', 'multi', 'day', 'launch', 'have', 'get', 'friend', 'set']"
