,id,username,created_at,lang,cleaned_tweets,favorite_count,retweet_count,text,tokens,lemmas
862,1304464187310047232,amitabhnews18,2020-09-11 16:57:52,en,pm narendramodi dedicate key projects related petroleummin bihar sep durgapur-banka section,4,0,"PM @narendramodi to dedicate 3 key projects related to @PetroleumMin in Bihar on Sep13 
* Durgapur-Banka section of… https://t.co/2U6z3p4x1r","[pm, narendramodi, dedicate, key, projects, related, petroleummin, bihar, sep, durgapur-banka, section]","['pm', 'narendramodi', 'dedicate', 'key', 'project', 'relate', 'petroleummin', 'bihar', 'sep', 'durgapur', 'banka', 'section']"
863,1304463148020150272,amitabhnews18,2020-09-11 16:53:44,en,india us held bilateral inter-sessional meeting official level sep meaindia sides reviewed p,5,2,"India &amp; US held a bilateral 2+2 Inter-sessional meeting at official level on Sep11 @MEAIndia
*Both sides reviewed p… https://t.co/KLm1OxhYZq","[india, us, held, bilateral, inter-sessional, meeting, official, level, sep, meaindia, sides, reviewed, p]","['india', 'hold', 'bilateral', 'inter', 'sessional', 'meeting', 'official', 'level', 'sep', 'meaindia', 'side', 'review', 'p']"
864,1304371039078461440,amitabhnews18,2020-09-11 10:47:44,en,chairmanlawjustice committee byadavbjp submits report mvenkaiahnaidu first report presented panel,13,2,"Chairman,Law&amp;Justice Committee @byadavbjp submits Report  to @MVenkaiahNaidu 
*first report presented by any Panel… https://t.co/JdLgYceYI1","[chairmanlawjustice, committee, byadavbjp, submits, report, mvenkaiahnaidu, first, report, presented, panel]","['chairmanlawjustice', 'committee', 'byadavbjp', 'submit', 'report', 'mvenkaiahnaidu', 'report', 'present', 'panel']"
865,1304348136702263296,amitabhnews18,2020-09-11 09:16:44,en,cnnnews: #justin - inside details rajnath singh's meeting cds service chiefs situation lac discussed amitabhne,0,5,"RT @CNNnews18: #JustIn - Inside details of Rajnath Singh's meeting with CDS and Service chiefs. Situation at the LAC discussed.

@amitabhne…","[cnnnews:, #justin, -, inside, details, rajnath, singh's, meeting, cds, service, chiefs, situation, lac, discussed, amitabhne]","['cnnnews', 'justin', 'inside', 'detail', 'rajnath', 'singh', 'meeting', 'cds', 'service', 'chief', 'situation', 'lac', 'discuss', 'amitabhne']"
866,1304312942599352320,amitabhnews18,2020-09-11 06:56:53,hi,imvivekgupta: # newsindia,0,10,"RT @imvivekgupta: #रिया_चक्रवर्ती समेत पांच लोगो की जमानत याचिका रद्द...
@News18India https://t.co/R4iWSctoFD","[imvivekgupta:, #, newsindia]","['imvivekgupta', 'newsindia']"
867,1304306936842575872,amitabhnews18,2020-09-11 06:33:01,hi,newsindia: #aajkamudda - #india #china #news #newsindia amitabhnews,0,5,"RT @News18India: #AajKaMudda
चीन की हर चाल पर भारत की नज़र, देखिये पूरी ख़बर -

#India #China #news #News18India @amitabhnews18 https://t.c…","[newsindia:, #aajkamudda, -, #india, #china, #news, #newsindia, amitabhnews]","['newsindia', 'aajkamudda', 'india', 'china', 'news', 'newsindia', 'amitabhnews']"
868,1304255217391853574,amitabhnews18,2020-09-11 03:07:30,en,drsjaishankar met wang yi fmchina #sco allow differences become disputes border troops continue dialogue,28,7,".@DrSJaishankar met Wang Yi  FM,China #SCO 
*not allow differences become disputes
*border troops continue dialogue… https://t.co/qsOIQjb26Z","[drsjaishankar, met, wang, yi, fmchina, #sco, allow, differences, become, disputes, border, troops, continue, dialogue]","['drsjaishankar', 'meet', 'wang', 'yi', 'fmchina', 'sco', 'allow', 'difference', 'dispute', 'border', 'troop', 'continue', 'dialogue']"
869,1304068051080364032,amitabhnews18,2020-09-10 14:43:46,hi,mps,2,0,"*MPs को संक्रमण से बचाने के लिए सीटों के बीच पारदर्शी पॉलिकार्बोनेट शीट लगाई गई हैं 
*शून्यकाल प्रतिदिन आधे घंटे 
*… https://t.co/Z9H0gl3aco",[mps],['mps']
870,1304065982952951808,amitabhnews18,2020-09-10 14:35:33,hi,ombirlakota mpsmps,3,1,"मानसून सत्र के लिए की गई व्यवस्था.लोक सभा अध्यक्ष  @ombirlakota 
*लोकसभा कक्ष में 257MPs&amp;172MPs लोकसभा की दीर्घाओं… https://t.co/Ex33CwNm4o","[ombirlakota, mpsmps]","['ombirlakota', 'mpsmps']"
871,1304060497461870595,amitabhnews18,2020-09-10 14:13:45,en,pm narendramodi tele conversation japan pm abeshinzo reviewed ongoing cooperation including mumbai-ahmedab,4,1,"PM @narendramodi tele conversation with Japan PM @AbeShinzo 
*reviewed ongoing cooperation including Mumbai-Ahmedab… https://t.co/H1jLYH31aO","[pm, narendramodi, tele, conversation, japan, pm, abeshinzo, reviewed, ongoing, cooperation, including, mumbai-ahmedab]","['pm', 'narendramodi', 'tele', 'conversation', 'japan', 'pm', 'abeshinzo', 'review', 'ongoing', 'cooperation', 'include', 'mumbai', 'ahmedab']"
872,1304040837953642497,amitabhnews18,2020-09-10 12:55:38,en,pm narendramodi participate grih pravesham inaugurate lakh houses built pmay-g madhya prad,4,2,PM @narendramodi to participate in ‘Grih Pravesham’ &amp; inaugurate 1.75 lakh houses built under PMAY-G in Madhya Prad… https://t.co/XB2MUz81Og,"[pm, narendramodi, participate, grih, pravesham, inaugurate, lakh, houses, built, pmay-g, madhya, prad]","['pm', 'narendramodi', 'participate', 'grih', 'pravesham', 'inaugurate', 'lakh', 'house', 'build', 'pmay', 'g', 'madhya', 'prad']"
873,1303997993834741760,amitabhnews18,2020-09-10 10:05:23,hi,former bjpindia mp #bollywood star sirpareshrawal rashtrapatibhvn nsdindia,5,1,Former @BJP4India MP and #bollywood star @SirPareshRawal को @rashtrapatibhvn द्वारा @nsd_india का अध्यक्ष नियुक्त… https://t.co/bfUEsUkk3g,"[former, bjpindia, mp, #bollywood, star, sirpareshrawal, rashtrapatibhvn, nsdindia]","['bjpindia', 'mp', 'bollywood', 'star', 'sirpareshrawal', 'rashtrapatibhvn', 'nsdindia']"
874,1303976391101353984,amitabhnews18,2020-09-10 08:39:33,en,pm narendramodi address conclave school education st century #nep septh,9,3,"PM @narendramodi to address  Conclave on “School Education in 21st Century” under #NEP2020 at 11 AM on Sep11th 
*… https://t.co/viuUrDyDaE","[pm, narendramodi, address, conclave, school, education, st, century, #nep, septh]","['pm', 'narendramodi', 'address', 'conclave', 'school', 'education', 'st', 'century', 'nep', 'septh']"
875,1303969276706004992,amitabhnews18,2020-09-10 08:11:16,hi,rsprasad #atmanirbharbharat indiapostoffice,8,5,"डाक विभाग ने पाँच सितारा गाँव योजना शुरू की @rsprasad
#AtmaNirbharBharat
* @IndiaPostOffice की सेवाएं&amp;उत्पाद ग्रामी… https://t.co/CAaiEPdFYp","[rsprasad, #atmanirbharbharat, indiapostoffice]","['rsprasad', 'atmanirbharbharat', 'indiapostoffice']"
876,1303757496226463745,amitabhnews18,2020-09-09 18:09:44,en,elitedevelopmental #kheloindia category shooters provided ammunition continue training ho,11,1,"Elite,Developmental &amp; #KheloIndia category shooters will be provided ammunition so they can continue training at ho… https://t.co/xvS4ZBfzmU","[elitedevelopmental, #kheloindia, category, shooters, provided, ammunition, continue, training, ho]","['elitedevelopmental', 'kheloindia', 'category', 'shooter', 'provide', 'ammunition', 'continue', 'train', 'ho']"
877,1303749847246229504,amitabhnews18,2020-09-09 17:39:20,en,pm narendramodi talked king salman saudi arabia appreciated leadership provided saudi arabia #g,6,1,"PM @narendramodi talked to King Salman of Saudi Arabia
*appreciated leadership provided by Saudi Arabia of #G20
*in… https://t.co/En2NNZRwZ8","[pm, narendramodi, talked, king, salman, saudi, arabia, appreciated, leadership, provided, saudi, arabia, #g]","['pm', 'narendramodi', 'talk', 'king', 'salman', 'saudi', 'arabia', 'appreciate', 'leadership', 'provide', 'saudi', 'arabia', 'g']"
878,1303700238260002816,amitabhnews18,2020-09-09 14:22:13,en,pm narendramodi today reviewed ongoing development work #kedarnathdham review included boosting infrastructure,41,6,"PM @narendramodi today reviewed ongoing development work at #KedarnathDham
*review included boosting infrastructure… https://t.co/ue3qO7StUm","[pm, narendramodi, today, reviewed, ongoing, development, work, #kedarnathdham, review, included, boosting, infrastructure]","['pm', 'narendramodi', 'today', 'review', 'ongoing', 'development', 'work', 'kedarnathdham', 'review', 'include', 'boost', 'infrastructure']"
879,1303680926191218689,amitabhnews18,2020-09-09 13:05:28,en,chairmanrs mvenkaiahnaidu conducted mock session house ensure smooth beginning #monsoonsession voting,12,3,"Chairman,RS @MVenkaiahNaidu conducted mock session of House to ensure smooth beginning of #MonsoonSession
*Voting s… https://t.co/JMioKrh8GY","[chairmanrs, mvenkaiahnaidu, conducted, mock, session, house, ensure, smooth, beginning, #monsoonsession, voting]","['chairmanrs', 'mvenkaiahnaidu', 'conduct', 'mock', 'session', 'house', 'ensure', 'smooth', 'begin', 'monsoonsession', 'voting']"
880,1303655529256947712,amitabhnews18,2020-09-09 11:24:33,hi,pm narendramodi interacts mp vendors #pmsvanidhi,1,0,"PM @narendramodi interacts with MP vendors on #PMSVANidhi
*योजना के तहत ब्याज में 7% तक की छूट दी जा रही है 
*मकसद… https://t.co/ZVuwTiP63E","[pm, narendramodi, interacts, mp, vendors, #pmsvanidhi]","['pm', 'narendramodi', 'interact', 'mp', 'vendor', 'pmsvanidhi']"
881,1303637474468532225,amitabhnews18,2020-09-09 10:12:48,en,rs crore released morthindia #covid period simplified payment process,1,0,Over Rs10000 crore released by @MORTHIndia during #COVID19 period under simplified payment process… https://t.co/kkkjL4lAKJ,"[rs, crore, released, morthindia, #covid, period, simplified, payment, process]","['rs', 'crore', 'release', 'morthindia', 'covid', 'period', 'simplify', 'payment', 'process']"
882,1303614012349800448,amitabhnews18,2020-09-09 08:39:35,hi,jduonline jpnadda,3,0,".@Jduonline सांसद हरिवंश ने राज्य सभा के उपसभापति पद के लिए नामांकन किया
* @JPNadda &amp; राम विलास पासवान प्रस्तावक
*… https://t.co/d5Fy5FfG2o","[jduonline, jpnadda]","['jduonline', 'jpnadda']"
883,1303381194063536128,amitabhnews18,2020-09-08 17:14:26,en,nitingadkari confident halving road accident deaths fromlakh/annum target call,3,0,".@nitin_gadkari confident of halving road accident deaths from1.5lakh/annum by 2025 as against target of 2030
*call… https://t.co/GcrkhUkmqP","[nitingadkari, confident, halving, road, accident, deaths, fromlakh/annum, target, call]","['nitingadkari', 'confident', 'halve', 'road', 'accident', 'death', 'fromlakh', 'annum', 'target']"
884,1303287678503284742,amitabhnews18,2020-09-08 11:02:51,en,pradhan mantri garib kalyan package-progress crore poor people received financial assistance rs,3,1,"Pradhan Mantri Garib Kalyan Package-Progress
*More than 42 crore poor people received financial assistance of Rs 68… https://t.co/8ZPQhKNDah","[pradhan, mantri, garib, kalyan, package-progress, crore, poor, people, received, financial, assistance, rs]","['pradhan', 'mantri', 'garib', 'kalyan', 'package', 'progress', 'crore', 'poor', 'people', 'receive', 'financial', 'assistance', 'r']"
885,1303254818572640256,amitabhnews18,2020-09-08 08:52:16,hi,#corona #localforglobal #,212,39,#Corona के चलते 6 महीनों के बाद #localforglobal थीम के साथ 9अक्टूबर से शुरू हो रहे #हुनरहाट में इस बार स्वदेशी खिलौ… https://t.co/7DBasUqHMd,"[#corona, #localforglobal, #]","['corona', 'localforglobal']"
886,1303219302942691328,amitabhnews18,2020-09-08 06:31:09,en,eam drsjaishankar attend rd meeting council foreign ministers #sco held moscow -sep,3,0,EAM  @DrSJaishankar will attend 3rd meeting of Council of Foreign Ministers of #SCO to be held in Moscow on 9-10Sep… https://t.co/h18IWWjWx0,"[eam, drsjaishankar, attend, rd, meeting, council, foreign, ministers, #sco, held, moscow, -sep]","['eam', 'drsjaishankar', 'attend', 'rd', 'meeting', 'council', 'foreign', 'minister', 'sco', 'hold', 'moscow', '-sep']"
887,1303213293360742400,amitabhnews18,2020-09-08 06:07:16,en,indian army adgpi india committed disengagement de-escalating situation lac china continues undert,3,0,"Indian Army @adgpi 
*India committed to disengagement &amp;de-escalating situation on LAC but China continues to undert… https://t.co/bgpSUagpqX","[indian, army, adgpi, india, committed, disengagement, de-escalating, situation, lac, china, continues, undert]","['indian', 'army', 'adgpi', 'india', 'commit', 'disengagement', 'de', 'escalate', 'situation', 'lac', 'china', 'continue', 'undert']"
888,1302986747110805504,amitabhnews18,2020-09-07 15:07:03,en,rd rashtriya poshan maah celebrated september #poshanabhiyan launched smritiirani pm,3,0,"3rd Rashtriya Poshan Maah celebrated in September under #poshanabhiyan 
*Launched in 2018 @smritiirani 
*PM… https://t.co/KzGyEPzbJT","[rd, rashtriya, poshan, maah, celebrated, september, #poshanabhiyan, launched, smritiirani, pm]","['rd', 'rashtriya', 'poshan', 'maah', 'celebrate', 'september', 'poshanabhiyan', 'launch', 'smritiirani', 'pm']"
889,1302975501019930624,amitabhnews18,2020-09-07 14:22:22,hi,x -,64,13,मानसिक बीमारी से पीड़ित लोगों को राहत और सहायता प्रदान करने के लिए आज 24x7 टोल-फ्री मेंटल हेल्थ रिहैबिलिटेशन हेल्प… https://t.co/09yfW0LIVD,"[x, -]",['x']
890,1302861826003054592,amitabhnews18,2020-09-07 06:50:39,hi,nep,4,1,"NEP सही मायने में बिना दबाव के,बिना अभाव&amp;बिना प्रभाव के सीखने के लोकतांत्रिक मूल्यों को हमारी शिक्षा व्वयस्था का हि… https://t.co/Nq7q68ddrZ",[nep],['nep']
891,1302853317362511872,amitabhnews18,2020-09-07 06:16:51,und,pm narendramodi addressed governors conf #nep knowledge economy,6,2,"PM @narendramodi addressed Governors conf on #NEP2020 
*21वीं सदी में भारत को हम एक  Knowledge Economy बनाने के लिए… https://t.co/vXNz1mXF2l","[pm, narendramodi, addressed, governors, conf, #nep, knowledge, economy]","['pm', 'narendramodi', 'address', 'governor', 'conf', 'nep', 'knowledge', 'economy']"
892,1302614959008878592,amitabhnews18,2020-09-06 14:29:42,hi,sep,8,3,मन्दिर की नींव के लिए भूमि में १००फ़ीट गहराई तक कुआँ खोदने वाली २मशीन Sep६ को राम जन्मभूमि परिसर में पहुँचीं… https://t.co/WfpxTBxYVM,[sep],['sep']
893,1302608102361935879,amitabhnews18,2020-09-06 14:02:27,hi,naqvimukhtar #coronavirus,159,20,"केंद्रीय मंत्री @naqvimukhtar ने कहा कि देश के सभी धार्मिक,सामाजिक संस्थाओं &amp; स्थलों ने #coronavirus में संयम,सावधा… https://t.co/3c0jY1ANa3","[naqvimukhtar, #coronavirus]","['naqvimukhtar', 'coronavirus']"
894,1302531955527835648,amitabhnews18,2020-09-06 08:59:52,hi,rashtrapatibhvn pm narendramodi sepam,8,2,".@rashtrapatibhvn &amp;PM
@narendramodi Sep7,10.30am राज्यपालों के सम्मेलन को संबोधित करेंगे
*उच्च शिक्षा के बदलाव में… https://t.co/lXDP9nSYpq","[rashtrapatibhvn, pm, narendramodi, sepam]","['rashtrapatibhvn', 'pm', 'narendramodi', 'sepam']"
895,1302494623386931203,amitabhnews18,2020-09-06 06:31:32,en,govt minmsme expands support artisans making #agarbatti #aatmanirbharbharat automatic agarbatti making,1,1,"Govt @minmsme Expands support to Artisans for making #Agarbatti #AatmaNirbharBharat
*400 Automatic Agarbatti making… https://t.co/7RnC1NMiDP","[govt, minmsme, expands, support, artisans, making, #agarbatti, #aatmanirbharbharat, automatic, agarbatti, making]","['govt', 'minmsme', 'expand', 'support', 'artisan', 'make', 'agarbatti', 'aatmanirbharbharat', 'automatic', 'agarbatti', 'make']"
896,1301941110667845633,amitabhnews18,2020-09-04 17:52:04,hi,abhishekpandey: newsindia amitabhnews arunjuy,0,4,"RT @abhishekpandey2: सुशांत केस पर हर बड़ी खबर पर आपको सबसे विश्वसनीय और सबसे तेज खबर मिलेगी सिर्फ @News18India पर 
@amitabhnews18 @arunjuy…","[abhishekpandey:, newsindia, amitabhnews, arunjuy]","['abhishekpandey', 'newsindia', 'amitabhnews', 'arunjuy']"
897,1301936412414025729,amitabhnews18,2020-09-04 17:33:24,en,attempts find way deadlock #ladakh border raksha mantri rajnathsingh meeting #chinese defence,12,0,"Attempts on to find a way out of  deadlock at #Ladakh border
Raksha Mantri @rajnathsingh meeting #Chinese Defence M… https://t.co/RBKqpyD4Nq","[attempts, find, way, deadlock, #ladakh, border, raksha, mantri, rajnathsingh, meeting, #chinese, defence]","['attempt', 'find', 'way', 'deadlock', 'ladakh', 'border', 'raksha', 'mantri', 'rajnathsingh', 'meet', 'chinese', 'defence']"
898,1301805401164316673,amitabhnews18,2020-09-04 08:52:48,hi,,5,0,"अयोध्या विकास प्राधिकरण ने श्रीराम मंदिर का स्वीकृत नक्शा रामजन्मभूमि तीर्थक्षेत्र ट्रस्ट के महामंत्री चम्पतराय,ट्र… https://t.co/qQnm8MEWzo",[],[]
899,1301549910655819776,amitabhnews18,2020-09-03 15:57:34,en,self reliant peaceful india ensures better world says pm narendramodi usispforum pmoindia said foc,6,1,"A self reliant and peaceful India ensures a better world says PM @narendramodi at @USISPForum 
* @PMOIndia said foc… https://t.co/mxvPMPYbMo","[self, reliant, peaceful, india, ensures, better, world, says, pm, narendramodi, usispforum, pmoindia, said, foc]","['self', 'reliant', 'peaceful', 'india', 'ensure', 'well', 'world', 'say', 'pm', 'narendramodi', 'usispforum', 'pmoindia', 'say', 'foc']"
900,1301545788690972678,amitabhnews18,2020-09-03 15:41:12,en,indiabangladesh relations reached another milestone daukandi (bangladesh)sonamura (tripura) inland waterway pr,2,0,India&amp;Bangladesh relations reached another milestone as Daukandi (Bangladesh)–Sonamura (Tripura) Inland Waterway Pr… https://t.co/KLZ2EXWjri,"[indiabangladesh, relations, reached, another, milestone, daukandi, (bangladesh)sonamura, (tripura), inland, waterway, pr]","['indiabangladesh', 'relation', 'reach', 'milestone', 'daukandi', 'bangladesh)sonamura', 'tripura', 'inland', 'waterway', 'pr']"
901,1301520853604003840,amitabhnews18,2020-09-03 14:02:07,hi,morthindia - km,2,0,".@MORTHIndia ने इस साल अप्रैल-अगस्त  में राष्ट्रीय राजमार्ग के निर्माण लक्ष्य को पार किया
*लगभग 2700km के लक्ष्य की… https://t.co/xFVBZM9pkH","[morthindia, -, km]","['morthindia', 'km']"
902,1301137145109704704,amitabhnews18,2020-09-02 12:37:24,en,dopt accepted proposal sports ministry kirenrijiju grant benefit sports quota appointments athlete,20,4,"DoPT accepted proposal of 
Sports Ministry @KirenRijiju to grant benefit of sports quota in appointments to athlete… https://t.co/cm3d9zQVif","[dopt, accepted, proposal, sports, ministry, kirenrijiju, grant, benefit, sports, quota, appointments, athlete]","['dopt', 'accept', 'proposal', 'sports', 'ministry', 'kirenrijiju', 'grant', 'benefit', 'sport', 'quota', 'appointment', 'athlete']"
903,1301129184584974336,amitabhnews18,2020-09-02 12:05:46,hi,newsindia: # #breakingnews - -,0,18,"RT @News18India: #सुलगते_सवाल 
#BreakingNews 
चीन के ख़िलाफ़ भारत की बड़ी कार्रवाई- चीनी ऐप ""पबजी""समेत 118 ऐप पर प्रतिबंध लगाया- अमिताभ सि…","[newsindia:, #, #breakingnews, -, -]","['newsindia', 'breakingnews']"
904,1301129174820687872,amitabhnews18,2020-09-02 12:05:43,en,surgical strike chinese economy chinese apps banned goimeity rsprasad,4,1,"Surgical strike on Chinese economy. Now more than 200 Chinese apps banned
@GoI_MeitY @rsprasad https://t.co/YbaUYNKJvH","[surgical, strike, chinese, economy, chinese, apps, banned, goimeity, rsprasad]","['surgical', 'strike', 'chinese', 'economy', 'chinese', 'app', 'ban', 'goimeity', 'rsprasad']"
905,1301128294859902976,amitabhnews18,2020-09-02 12:02:13,en,cabinet approves mission karmayogi-national programme civil services capacity building transition rules b,17,1,"Cabinet approves Mission Karmayogi-National Programme for Civil Services Capacity Building
*Transition from Rules b… https://t.co/57StDZBOAi","[cabinet, approves, mission, karmayogi-national, programme, civil, services, capacity, building, transition, rules, b]","['cabinet', 'approve', 'mission', 'karmayogi', 'national', 'programme', 'civil', 'service', 'capacity', 'building', 'transition', 'rule', 'b']"
906,1301119298245517313,amitabhnews18,2020-09-02 11:26:28,en,india first time made top th rank global innovation index india ranked ran,8,0,"India for first time has made it to top 50, 48th Rank in Global Innovation Index 2020
*In 2015 India ranked 81
*Ran… https://t.co/vcGVj1CEBB","[india, first, time, made, top, th, rank, global, innovation, index, india, ranked, ran]","['india', 'time', 'th', 'rank', 'global', 'innovation', 'index', 'india', 'rank', 'run']"
907,1301065344769949698,amitabhnews18,2020-09-02 07:52:05,en,pm narendramodi deliver special key note address usispforum rd annual leadership summit pm ist sep,27,1,PM @narendramodi to deliver Special Key Note Address at  @USISPForum 3rd Annual Leadership Summit at 9PM IST on Sep… https://t.co/c7NDTKgdUM,"[pm, narendramodi, deliver, special, key, note, address, usispforum, rd, annual, leadership, summit, pm, ist, sep]","['pm', 'narendramodi', 'deliver', 'special', 'key', 'note', 'address', 'usispforum', 'rd', 'annual', 'leadership', 'summit', 'pm', 'ist', 'sep']"
908,1301060161235116032,amitabhnews18,2020-09-02 07:31:29,en,th session th #loksabha commence monsep likely conclude oct lok sabha sit,3,0,"*4th Session of 17th #loksabha will commence on Mon,Sep14 
*likely to conclude on Oct 1 
*Lok Sabha will sit from 9… https://t.co/1uQxhzneX0","[th, session, th, #loksabha, commence, monsep, likely, conclude, oct, lok, sabha, sit]","['th', 'session', 'th', 'loksabha', 'commence', 'monsep', 'likely', 'conclude', 'oct', 'lok', 'sabha', 'sit']"
909,1300803497881862144,amitabhnews18,2020-09-01 14:31:36,en,meaindia chinese troops engaged provocative action even july provocative military maneuvers,3,0,".@MEAIndia 
*Chinese troops again engaged in provocative action even on July 31
*provocative military maneuvers in… https://t.co/kORXHcc6vQ","[meaindia, chinese, troops, engaged, provocative, action, even, july, provocative, military, maneuvers]","['meaindia', 'chinese', 'troop', 'engage', 'provocative', 'action', 'july', 'provocative', 'military', 'maneuver']"
910,1300780487137402881,amitabhnews18,2020-09-01 13:00:10,hi,union minister rsprasad writes facebook mark zukerberg,6,3,"Union Minister @rsprasad writes to @Facebook Mark Zukerberg
*चिट्ठी में कई गंभीर चिंताए जताई
*पिछले कुछ महीने में… https://t.co/RRvfWTeFgz","[union, minister, rsprasad, writes, facebook, mark, zukerberg]","['union', 'minister', 'rsprasad', 'write', 'facebook', 'mark', 'zukerberg']"
911,1300731938446082049,amitabhnews18,2020-09-01 09:47:15,hi,newsindia: #breakingnews - #indiach,0,9,"RT @News18India: #BreakingNews
क्या चीन को सबक सिखाने की तैयारी में है भारत ? और क्या रुकेगी चीन की गतिविधियाँ? देखिए ये रिपोर्ट-

#IndiaCh…","[newsindia:, #breakingnews, -, #indiach]","['newsindia', 'breakingnews', 'indiach']"
912,1300731682010537984,amitabhnews18,2020-09-01 09:46:14,hi,newsindia: # lac cds nsa,0,16,"RT @News18India: #मुद्दा_गरम_है 
LAC पर तनाव के बीच  रक्षा मंत्री की सेना प्रमुखों, CDS बिपिन रावत और NSA अजीत डोभाल के साथ महत्वपूर्ण बैठक…","[newsindia:, #, lac, cds, nsa]","['newsindia', 'lac', 'cd', 'nsa']"
