,id,username,created_at,lang,cleaned_tweets,favorite_count,retweet_count,text,tokens,lemmas
573,1286742256142241794,ChrisHammer180,2020-07-24 19:17:15,en,duncanmitchel never keep eyes darts sure comeback likely although looking w,0,0,@DuncanMitchel80 I can never keep my eyes off the darts! Not sure that comeback is likely now although looking at w… https://t.co/AlipSg4AJn,"[duncanmitchel, never, keep, eyes, darts, sure, comeback, likely, although, looking, w]","['duncanmitchel', 'eye', 'dart', 'sure', 'comeback', 'likely', 'look', 'w']"
574,1286690827104813056,ChrisHammer180,2020-07-24 15:52:53,en,thegraspgroup ive already mapped battles final faces ronnie hit,0,0,@TheGraspGroup I’ve already mapped it out. Battles through to the final and faces Ronnie. They both hit 147s in the… https://t.co/tYnSzNtxbD,"[thegraspgroup, ive, already, mapped, battles, final, faces, ronnie, hit]","['thegraspgroup', 'have', 'map', 'battle', 'final', 'face', 'ronnie', 'hit']"
575,1286613661201707008,ChrisHammer180,2020-07-24 10:46:15,en,bossbeechyscoop nickmetcalfe title would greatest sporting story history sport,1,0,@bossbeechyscoop @Nick_Metcalfe If he won the title it would be the greatest sporting story in the history of sport… https://t.co/rDK5ZpDBeB,"[bossbeechyscoop, nickmetcalfe, title, would, greatest, sporting, story, history, sport]","['bossbeechyscoop', 'nickmetcalfe', 'title', 'greatest', 'sporting', 'story', 'history', 'sport']"
576,1286436771367198722,ChrisHammer180,2020-07-23 23:03:21,en,thewhirlwind would fantastic fact still gets many generations snooker fans edge,4,0,@_TheWhirlwind_ That would be fantastic. The fact he still gets so many generations of snooker fans on the edge of… https://t.co/DT8K9wV8vR,"[thewhirlwind, would, fantastic, fact, still, gets, many, generations, snooker, fans, edge]","['thewhirlwind', 'fantastic', 'fact', 'get', 'generation', 'snooker', 'fan', 'edge']"
577,1286402718752546818,ChrisHammer180,2020-07-23 20:48:03,en,duncanmitchel coatesy deeper think though makes peoples champion,1,0,"@DuncanMitchel80 @coatesy1976 The deeper you think about it though, it makes him more of a People’s Champion and a… https://t.co/gm6eQ2YSD1","[duncanmitchel, coatesy, deeper, think, though, makes, peoples, champion]","['duncanmitchel', 'coatesy', 'deep', 'think', 'make', 'people', 'champion']"
578,1286384519587790852,ChrisHammer180,2020-07-23 19:35:43,en,mrbluejt actually see lower page - dont officially make retired,0,0,@mr_BlueJT22 I did actually see that lower down on the page - why don’t they just officially make it retired?,"[mrbluejt, actually, see, lower, page, -, dont, officially, make, retired]","['mrbluejt', 'actually', 'low', 'page', 'not', 'officially', 'retired']"
579,1286377188321824768,ChrisHammer180,2020-07-23 19:06:36,en,michael smith provide boos nine-darter attempt ending,5,0,"Michael Smith having to provide the boos to his own nine-darter attempt ending. 

https://t.co/nEEeMhnZv4","[michael, smith, provide, boos, nine-darter, attempt, ending]","['michael', 'smith', 'provide', 'boo', 'darter', 'attempt', 'end']"
580,1286354997962252288,ChrisHammer180,2020-07-23 17:38:25,en,coatesy could choose one sporting moment change would missed black -,2,0,@coatesy1976 If I could choose one sporting moment to change it would be when he missed that black at 17-17. That s… https://t.co/MYKjHpdJ9T,"[coatesy, could, choose, one, sporting, moment, change, would, missed, black, -]","['coatesy', 'choose', 'sporting', 'moment', 'change', 'miss', 'black']"
581,1286346692401541122,ChrisHammer180,2020-07-23 17:05:25,en,nickmetcalfe gets fourth round tension unbearable,1,0,@Nick_Metcalfe 🤞🙏 If he gets to the fourth round then the tension will be unbearable,"[nickmetcalfe, gets, fourth, round, tension, unbearable]","['nickmetcalfe', 'get', 'fourth', 'round', 'tension', 'unbearable']"
582,1286346004745330688,ChrisHammer180,2020-07-23 17:02:41,en,bignorman years working sporting life he's one world championship qualified i'd,4,0,"@bignorman In all my years working for Sporting Life, he's only been in one World Championship. If he qualified I'd… https://t.co/IoOelg5yjB","[bignorman, years, working, sporting, life, he's, one, world, championship, qualified, i'd]","['bignorman', 'year', 'work', 'sport', 'life', 'world', 'championship', 'qualified']"
583,1286344399086145536,ChrisHammer180,2020-07-23 16:56:18,en,want get carried away jimmy white two wins away crucible please please r,35,4,"I don't want to get too carried away but Jimmy White is now two wins away from the Crucible. Please, please, 2020 r… https://t.co/NqE4PpWRb8","[want, get, carried, away, jimmy, white, two, wins, away, crucible, please, please, r]","['want', 'carry', 'away', 'jimmy', 'white', 'win', 'away', 'crucible', 'r']"
584,1286343014244331522,ChrisHammer180,2020-07-23 16:50:48,en,jude bellingham small list players shirts retired english clubs including bobby moore,1,0,"Jude Bellingham is on a very small list of players to have shirts retired at English clubs, including Bobby Moore.… https://t.co/MbuM9Pxqz4","[jude, bellingham, small, list, players, shirts, retired, english, clubs, including, bobby, moore]","['jude', 'bellingham', 'small', 'list', 'player', 'shirt', 'retired', 'english', 'club', 'include', 'bobby', 'moore']"
585,1286067021805912065,ChrisHammer180,2020-07-22 22:34:06,en,world matchplay odds compared pre-event prices big three durrant: / (/) anderson: / (,5,0,"World Matchplay odds compared to pre-event prices now the big three are out

Durrant: 11/4 (25/1)
Anderson: 11/4 (1… https://t.co/UE54X3YYM9","[world, matchplay, odds, compared, pre-event, prices, big, three, durrant:, /, (/), anderson:, /, (]","['world', 'matchplay', 'odd', 'compare', 'pre', 'event', 'price', 'big', 'durrant', 'anderson']"
586,1286060928681771008,ChrisHammer180,2020-07-22 22:09:53,en,may well share 'what sport like ' feature liverpool finally lift trophy ha,1,1,"May as well share our 'what sport was like in 1990' feature again as Liverpool finally lift the trophy. 

If you ha… https://t.co/fUga8lFUU7","[may, well, share, 'what, sport, like, ', feature, liverpool, finally, lift, trophy, ha]","['share', 'sport', 'like', 'feature', 'liverpool', 'finally', 'lift', 'trophy', 'ha']"
587,1286051501488529409,ChrisHammer180,2020-07-22 21:32:26,en,sportinglifefc: barnsley's second stoppage-time winner row - time clarkeoduor promotion chasing brentford - kept,0,7,RT @SportingLifeFC: 🙌 Barnsley's second stoppage-time winner in a row - this time from @Clarke_Oduor at promotion chasing Brentford - kept…,"[sportinglifefc:, barnsley's, second, stoppage-time, winner, row, -, time, clarkeoduor, promotion, chasing, brentford, -, kept]","['sportinglifefc', 'barnsley', 'second', 'stoppage', 'time', 'winner', 'row', 'time', 'clarkeoduor', 'promotion', 'chase', 'brentford', 'keep']"
588,1286047671787061248,ChrisHammer180,2020-07-22 21:17:13,en,dimitri van den bergh / win world matchplay dart thrown two wins later - still onl,3,0,Dimitri van den Bergh was 200/1 to win the World Matchplay before a dart was thrown. Two wins later - and still onl… https://t.co/uutYJjtWYu,"[dimitri, van, den, bergh, /, win, world, matchplay, dart, thrown, two, wins, later, -, still, onl]","['dimitri', 'van', 'den', 'bergh', 'win', 'world', 'matchplay', 'dart', 'throw', 'win', 'later', 'onl']"
589,1285904823137820673,ChrisHammer180,2020-07-22 11:49:35,en,dandartsdawson like feeling discover band many heard within year theyre number,1,0,@DanDartsDawson Like that feeling when you discover a band not many have heard of then within a year they’re number… https://t.co/CZ97pOLqeP,"[dandartsdawson, like, feeling, discover, band, many, heard, within, year, theyre, number]","['dandartsdawson', 'like', 'feel', 'discover', 'band', 'hear', 'year', 'number']"
590,1285900302609244160,ChrisHammer180,2020-07-22 11:31:37,en,aaronturner laura fantastic especially co commentary john bounce well,3,0,"@AaronTurner501 Laura has been fantastic, especially the co commentary with John as they bounce off each other so well. 👍","[aaronturner, laura, fantastic, especially, co, commentary, john, bounce, well]","['aaronturner', 'laura', 'fantastic', 'especially', 'co', 'commentary', 'john', 'bounce']"
591,1285897822559260672,ChrisHammer180,2020-07-22 11:21:46,en,jayshaw consolation assure people watching inte,0,0,@JayShaw180 If it’s any consolation I can assure you that the other 99.9% of people who have been watching the inte… https://t.co/rOP8jbb6Jx,"[jayshaw, consolation, assure, people, watching, inte]","['jayshaw', 'consolation', 'assure', 'people', 'watch', 'inte']"
592,1285700275190341632,ChrisHammer180,2020-07-21 22:16:47,en,tomc sure what's worst - decision batsman suddenly deciding try back bails broken,2,0,@TomC_22 Not sure what's worst - the decision or the batsman suddenly deciding to try and back in after the bails have been broken!,"[tomc, sure, what's, worst, -, decision, batsman, suddenly, deciding, try, back, bails, broken]","['tomc', 'sure', 'bad', 'decision', 'batsman', 'suddenly', 'decide', 'try', 'bail', 'broken']"
593,1285692687291682817,ChrisHammer180,2020-07-21 21:46:38,en,drama forgot tipped legs mvg v whitlock / immoral winner i've ever,28,1,"In all the drama, I forgot I tipped under 15.5 legs in MVG v Whitlock at 6/4. The most immoral winner I've ever had.","[drama, forgot, tipped, legs, mvg, v, whitlock, /, immoral, winner, i've, ever]","['drama', 'forget', 'tip', 'leg', 'mvg', 'v', 'whitlock', 'immoral', 'winner']"
594,1285681743568211968,ChrisHammer180,2020-07-21 21:03:09,en,prediction: time next year people associate status quo krzysztof ratajski argos adverts,4,0,"Prediction: By this time next year, people will associate Status Quo more with Krzysztof Ratajski than they do with Argos adverts.","[prediction:, time, next, year, people, associate, status, quo, krzysztof, ratajski, argos, adverts]","['prediction', 'time', 'year', 'people', 'associate', 'status', 'quo', 'krzysztof', 'ratajski', 'argos', 'advert']"
595,1285680530839801857,ChrisHammer180,2020-07-21 20:58:19,en,that's truly astonishing simon whitlock / beat michael van gerwen could got /,6,5,"That's truly astonishing. Not only was Simon Whitlock 7/1 to beat Michael van Gerwen, but you could have got 125/1… https://t.co/6ijC1siCLk","[that's, truly, astonishing, simon, whitlock, /, beat, michael, van, gerwen, could, got, /]","['truly', 'astonishing', 'simon', 'whitlock', 'beat', 'michael', 'van', 'gerwen', 'get']"
596,1285633290775547904,ChrisHammer180,2020-07-21 17:50:37,en,love sportsmanship nathan aspinall fierce competitor anyone stop havin,33,4,"Love the sportsmanship from Nathan Aspinall here. As fierce a competitor as anyone, but this doesn't stop him havin… https://t.co/VfQ7HclWSw","[love, sportsmanship, nathan, aspinall, fierce, competitor, anyone, stop, havin]","['love', 'sportsmanship', 'nathan', 'aspinall', 'fierce', 'competitor', 'stop', 'have']"
597,1284956918042238976,ChrisHammer180,2020-07-19 21:02:57,en,peter wright losing - glasses takes hits checkout goes win -,6,1,"Peter Wright was losing 8-5 with his glasses on. Takes them off, hits a 144 checkout and goes on to win 10-8.

https://t.co/esbZpKTDgU","[peter, wright, losing, -, glasses, takes, hits, checkout, goes, win, -]","['peter', 'wright', 'lose', 'glass', 'take', 'hit', 'checkout', 'go', 'win']"
598,1284951143777554436,ChrisHammer180,2020-07-19 20:40:00,en,world champion makes feel bit better game,14,1,When the world champion makes you feel a bit better about your own game https://t.co/60OQy9XC1u,"[world, champion, makes, feel, bit, better, game]","['world', 'champion', 'make', 'feel', 'bit', 'well', 'game']"
599,1284879637668073473,ChrisHammer180,2020-07-19 15:55:52,en,player wins first major world matchplay crowd dreaded 'asterisk' attach,4,1,"If a player wins their first major at this World Matchplay with no crowd, will there be a dreaded 'asterisk' attach… https://t.co/LApgLKngC4","[player, wins, first, major, world, matchplay, crowd, dreaded, 'asterisk', attach]","['player', 'win', 'major', 'world', 'matchplay', 'crowd', 'dread', 'asterisk', 'attach']"
600,1284594992741318657,ChrisHammer180,2020-07-18 21:04:47,en,really like atmosphere pdc able create never thought i'd hear roar justi,3,0,I do really like the atmosphere the PDC have been able to create but I never thought I'd hear such a roar for Justi… https://t.co/W1oELgnc91,"[really, like, atmosphere, pdc, able, create, never, thought, i'd, hear, roar, justi]","['like', 'atmosphere', 'pdc', 'able', 'create', 'think', 'hear', 'roar', 'justi']"
601,1284574665629995010,ChrisHammer180,2020-07-18 19:44:01,en,winning match intense world matchplay applauding two fans dressed woody jesse big sc,4,1,Winning a match that intense in the World Matchplay then applauding two fans dressed as Woody and Jesse on a big sc… https://t.co/DlExsCBYEM,"[winning, match, intense, world, matchplay, applauding, two, fans, dressed, woody, jesse, big, sc]","['win', 'match', 'intense', 'world', 'matchplay', 'applaud', 'fan', 'dress', 'woody', 'jesse', 'big', 'sc']"
602,1284569801185267713,ChrisHammer180,2020-07-18 19:24:41,en,carlyfletch theredbit i'd annoyed correct i'm wrong seemed,0,0,@CarlyFletch @TheRedBit180 Some of those 5s I'd be annoyed with! Correct me if I'm wrong but it seemed as if most o… https://t.co/3KCM3jcVN2,"[carlyfletch, theredbit, i'd, annoyed, correct, i'm, wrong, seemed]","['carlyfletch', 'theredbit', 'annoy', 'correct', 'wrong']"
603,1284568450153746432,ChrisHammer180,2020-07-18 19:19:19,en,theredbit tweet something similar stunning player watch he's kind enough hit massi,2,0,@TheRedBit180 Was just about to tweet something similar! Stunning player to watch and he's kind enough to hit massi… https://t.co/bOlBcB6o3a,"[theredbit, tweet, something, similar, stunning, player, watch, he's, kind, enough, hit, massi]","['theredbit', 'tweet', 'similar', 'stunning', 'player', 'watch', 'kind', 'hit', 'massi']"
604,1284521341278916609,ChrisHammer180,2020-07-18 16:12:07,en,set crowdless walk-ons world matchplay says can't fun,3,2,All set for some crowdless walk-ons at the World Matchplay. Who says it can't be as fun... https://t.co/EtCnE28UHM,"[set, crowdless, walk-ons, world, matchplay, says, can't, fun]","['set', 'crowdless', 'walk', 'ons', 'world', 'matchplay', 'say', 'fun']"
605,1284240411998007296,ChrisHammer180,2020-07-17 21:35:48,en,billylumsden reebok day wonderful article great read congratulations,1,0,"@Billylumsden10 I was at the Reebok too that day. Wonderful article, great read and congratulations!","[billylumsden, reebok, day, wonderful, article, great, read, congratulations]","['billylumsden', 'reebok', 'day', 'wonderful', 'article', 'great', 'read', 'congratulation']"
606,1283882249105092609,ChrisHammer180,2020-07-16 21:52:36,en,world matchplay betting preview complete usual i'm looking outsiders come hard ca,4,1,"World Matchplay betting preview complete and, as usual, I'm looking at the outsiders to come through. So hard to ca… https://t.co/vqYcYNm5ll","[world, matchplay, betting, preview, complete, usual, i'm, looking, outsiders, come, hard, ca]","['world', 'matchplay', 'betting', 'preview', 'complete', 'usual', 'look', 'outsider', 'come', 'hard']"
607,1283508941884919813,ChrisHammer180,2020-07-15 21:09:12,en,michael van gerwen justin pipe - players profiled assessed ahead world matchplay,11,4,"From Michael van Gerwen to Justin Pipe - all 32 players profiled and assessed ahead of the World Matchplay.

https://t.co/Yx6A1wKnYR","[michael, van, gerwen, justin, pipe, -, players, profiled, assessed, ahead, world, matchplay]","['michael', 'van', 'gerwen', 'justin', 'pipe', 'player', 'profile', 'assess', 'ahead', 'world', 'matchplay']"
608,1283099294057275392,ChrisHammer180,2020-07-14 18:01:25,en,tickerscricket one,0,0,@tickerscricket How about this one https://t.co/S4nxFmwTx5,"[tickerscricket, one]",['tickerscricket']
609,1283091889261088771,ChrisHammer180,2020-07-14 17:31:59,en,mick mccarthy trending excuse remember greatest line,59,7,"Mick McCarthy trending. Any excuse to remember his greatest line

https://t.co/MP8O6bH9l0","[mick, mccarthy, trending, excuse, remember, greatest, line]","['mick', 'mccarthy', 'trend', 'excuse', 'remember', 'great', 'line']"
610,1283071232586452993,ChrisHammer180,2020-07-14 16:09:54,en,cannot - i've said - cannot write script like cannot write script like,5,1,"""You cannot - I've said it before - you cannot write a script like this. You cannot write a script like this. After… https://t.co/A5PGp45msq","[cannot, -, i've, said, -, cannot, write, script, like, cannot, write, script, like]","['say', 'write', 'script', 'like', 'write', 'script', 'like']"
611,1283059314723364867,ChrisHammer180,2020-07-14 15:22:33,en,weeklydartscast least friendly boos got post grand slam even must still,1,0,"@WeeklyDartscast At least now it’s more “friendly boos” than what he got post grand slam but even so, it must still… https://t.co/UJwmoFjgGK","[weeklydartscast, least, friendly, boos, got, post, grand, slam, even, must, still]","['weeklydartscast', 'friendly', 'boo', 'get', 'post', 'grand', 'slam']"
612,1283034510683234306,ChrisHammer180,2020-07-14 13:43:59,en,gerwyn price prepare supportive atmosphere he's ever played world matchplay pdc co,4,0,Gerwyn Price can prepare for the most supportive atmosphere he's ever played in at the World Matchplay after PDC co… https://t.co/MegVA9Eys3,"[gerwyn, price, prepare, supportive, atmosphere, he's, ever, played, world, matchplay, pdc, co]","['gerwyn', 'price', 'prepare', 'supportive', 'atmosphere', 'play', 'world', 'matchplay', 'pdc', 'co']"
613,1282993772633235458,ChrisHammer180,2020-07-14 11:02:06,en,previously unheard clive tyldesley clip england fans went wild hear silence simplicity comme,10,1,Previously unheard Clive Tyldesley clip as England fans went too wild to hear. When silence and simplicity in comme… https://t.co/FqLYyTzHaG,"[previously, unheard, clive, tyldesley, clip, england, fans, went, wild, hear, silence, simplicity, comme]","['previously', 'unheard', 'clive', 'tyldesley', 'clip', 'england', 'fan', 'go', 'wild', 'hear', 'silence', 'simplicity', 'comme']"
614,1282943145681051650,ChrisHammer180,2020-07-14 07:40:56,en,foot spud webb turned man defied gravity win slam dunk contest year michael,6,2,5 foot 7 Spud Webb has now turned 57. The man who defied gravity to win the Slam Dunk Contest a year before Michael… https://t.co/P1Y0gFV2Gv,"[foot, spud, webb, turned, man, defied, gravity, win, slam, dunk, contest, year, michael]","['foot', 'spud', 'webb', 'turn', 'man', 'defy', 'gravity', 'win', 'slam', 'dunk', 'contest', 'year', 'michael']"
615,1282397953156579329,ChrisHammer180,2020-07-12 19:34:32,en,wishing daveclarktv best he'll sorely missed every darts fan here's one moment he'll never fo,44,8,"Wishing @DaveClarkTV all the very best, he'll be sorely missed by every darts fan. Here's one moment he'll never fo… https://t.co/bmaHUixvc1","[wishing, daveclarktv, best, he'll, sorely, missed, every, darts, fan, here's, one, moment, he'll, never, fo]","['wish', 'daveclarktv', 'good', 'sorely', 'miss', 'dart', 'fan', 'moment', 'fo']"
616,1282369676597530624,ChrisHammer180,2020-07-12 17:42:10,en,marks morning wins title evening could happen pub congratulat,5,1,"Marks in the morning, wins the title and £10,000 in the evening.

If only this could happen in the pub. Congratulat… https://t.co/NaanUYjC5v","[marks, morning, wins, title, evening, could, happen, pub, congratulat]","['marks', 'morning', 'win', 'title', 'evening', 'happen', 'pub', 'congratulat']"
617,1282361504357064704,ChrisHammer180,2020-07-12 17:09:42,en,dougan devonpetersen strong feeling one players win title going,1,0,@dougan90 @devon_petersen I had a strong feeling that one of the players who had to win a title was going to do it… https://t.co/gyJ7oQHM1r,"[dougan, devonpetersen, strong, feeling, one, players, win, title, going]","['dougan', 'devonpetersen', 'strong', 'feel', 'player', 'win', 'title', 'go']"
618,1282358696870400000,ChrisHammer180,2020-07-12 16:58:33,en,devon petersen comes social media later inspirational day darts ended agonisingly,16,3,"When Devon Petersen comes on social media later after an inspirational day of darts that ended so agonisingly, I re… https://t.co/mBlENN2DhY","[devon, petersen, comes, social, media, later, inspirational, day, darts, ended, agonisingly]","['devon', 'petersen', 'come', 'social', 'medium', 'later', 'inspirational', 'day', 'dart', 'end', 'agonisingly']"
619,1282356149174632448,ChrisHammer180,2020-07-12 16:48:25,en,warrenallsworth wasnt closer four million astounding standard really hard lines great pic,1,0,"@warrenallsworth Wasn’t it closer to four million?! Astounding standard and really hard lines, that was a great pic… https://t.co/WRjGcttrCR","[warrenallsworth, wasnt, closer, four, million, astounding, standard, really, hard, lines, great, pic]","['warrenallsworth', 'not', 'close', 'million', 'astounding', 'standard', 'hard', 'line', 'great', 'pic']"
620,1282345469360910336,ChrisHammer180,2020-07-12 16:05:59,en,bencoleygolf congratulations ben fantastic tipping,0,0,@BenColeyGolf Congratulations Ben! Fantastic tipping once again!,"[bencoleygolf, congratulations, ben, fantastic, tipping]","['bencoleygolf', 'congratulation', 'ben', 'fantastic', 'tipping']"
621,1282051985047527424,ChrisHammer180,2020-07-11 20:39:47,en,sportinglife: race qualify world matchplay shaping one event officialpdc summer series,0,1,RT @SportingLife: 🎯🤔 How is the race to qualify for the World Matchplay shaping up with just one event in the @OfficialPDC Summer Series to…,"[sportinglife:, race, qualify, world, matchplay, shaping, one, event, officialpdc, summer, series]","['sportinglife', 'race', 'qualify', 'world', 'matchplay', 'shape', 'event', 'officialpdc', 'summer', 'series']"
622,1282009814353227776,ChrisHammer180,2020-07-11 17:52:12,en,officialpdc: nine-darter rob cross strikes perfection summer series darts well truly back,0,337,"RT @OfficialPDC: 🚨NINE-DARTER! 🚨

ROB CROSS STRIKES PERFECTION AT THE SUMMER SERIES!! 

Darts well and truly, is back. https://t.co/JGaxlBC…","[officialpdc:, nine-darter, rob, cross, strikes, perfection, summer, series, darts, well, truly, back]","['officialpdc', 'darter', 'rob', 'cross', 'strike', 'perfection', 'summer', 'series', 'dart', 'truly']"
623,1282008811289616387,ChrisHammer180,2020-07-11 17:48:13,en,nine-darter another day drama incredible think that's th perfect leg year that's lost four,4,0,A nine-darter on another day of drama. Incredible to think that's the 14th perfect leg of a year that's lost four m… https://t.co/yofq8AMFj2,"[nine-darter, another, day, drama, incredible, think, that's, th, perfect, leg, year, that's, lost, four]","['darter', 'day', 'drama', 'incredible', 'think', 'th', 'perfect', 'leg', 'year', 'lose']"
624,1281878670395740162,ChrisHammer180,2020-07-11 09:11:05,en,jack charlton celebrating ray houghton's winner republic ireland italy usa true legend b,5,2,Jack Charlton celebrating Ray Houghton's winner for Republic of Ireland against Italy at USA 94. A true legend on b… https://t.co/RBtmmsZRnx,"[jack, charlton, celebrating, ray, houghton's, winner, republic, ireland, italy, usa, true, legend, b]","['jack', 'charlton', 'celebrate', 'ray', 'houghton', 'winner', 'republic', 'ireland', 'italy', 'usa', 'true', 'legend', 'b']"
625,1281721355327733762,ChrisHammer180,2020-07-10 22:45:58,en,thewhirlwind jimmywhite ive seen one youtube coming within second potting black l,1,0,@_TheWhirlwind_ @jimmywhite147 I’ve seen one on YouTube of him coming within a second of potting the black having l… https://t.co/FRa85ZVGnm,"[thewhirlwind, jimmywhite, ive, seen, one, youtube, coming, within, second, potting, black, l]","['thewhirlwind', 'jimmywhite', 'have', 'see', 'youtube', 'come', 'second', 'potting', 'black', 'l']"
626,1281682824786071558,ChrisHammer180,2020-07-10 20:12:52,en,jimmy white's big break record attempt clear table three reds remaining seconds win con,194,38,Jimmy White's Big Break record attempt to clear the table with three reds remaining in just 70 seconds to win a con… https://t.co/De1tZnyuHl,"[jimmy, white's, big, break, record, attempt, clear, table, three, reds, remaining, seconds, win, con]","['jimmy', 'white', 'big', 'break', 'record', 'attempt', 'clear', 'table', 'red', 'remain', 'second', 'win', 'con']"
627,1281670997494595585,ChrisHammer180,2020-07-10 19:25:52,en,againztallodds long totally hooked,0,0,@AgainztAllOdds It won't be long before you're totally hooked on it!,"[againztallodds, long, totally, hooked]","['againztallodds', 'long', 'totally', 'hooked']"
628,1281650285585166336,ChrisHammer180,2020-07-10 18:03:34,en,againztallodds hi starts saturday july runs sunday july draw takes place coming sund,0,0,"@AgainztAllOdds Hi, it starts on Saturday July 18 and runs to Sunday July 26. The draw takes place this coming Sund… https://t.co/WJSioLWZBg","[againztallodds, hi, starts, saturday, july, runs, sunday, july, draw, takes, place, coming, sund]","['againztallodds', 'hi', 'start', 'saturday', 'july', 'run', 'sunday', 'july', 'draw', 'take', 'place', 'come', 'sund']"
629,1281635387576913922,ChrisHammer180,2020-07-10 17:04:22,en,mvg wins second title summer series breathtaking darts jose de sousa day averaging,5,1,"MVG wins his second title of the Summer Series but it was breathtaking darts from Jose De Sousa all day, averaging… https://t.co/DkuUll6jrb","[mvg, wins, second, title, summer, series, breathtaking, darts, jose, de, sousa, day, averaging]","['mvg', 'win', 'second', 'title', 'summer', 'series', 'breathtaking', 'dart', 'jose', 'de', 'sousa', 'day', 'average']"
