,id,username,created_at,lang,cleaned_tweets,favorite_count,retweet_count,text,tokens,lemmas
855,1248604781356048384,annasmithjourno,2020-04-10 13:32:32,en,today's film recommendation warm witty nz comedy hunt wilderpeople lovely folk,6,1,"Today's film recommendation is the warm, witty NZ comedy HUNT FOR THE WILDERPEOPLE. A few of you lovely folk have s… https://t.co/kq8Q7O94J7","[today's, film, recommendation, warm, witty, nz, comedy, hunt, wilderpeople, lovely, folk]","['today', 'film', 'recommendation', 'warm', 'witty', 'nz', 'comedy', 'hunt', 'wilderpeople', 'lovely', 'folk']"
856,1248373059574067203,annasmithjourno,2020-04-09 22:11:45,en,woff: loved please let folks girlsonfilmpod crowd know watch later still follow #watchparty #madeindag,0,1,RT @WO50FF: We loved it! Please let folks in your @GirlsOnFilm_Pod crowd know they can watch later &amp; still follow #watchparty or #MadeInDag…,"[woff:, loved, please, let, folks, girlsonfilmpod, crowd, know, watch, later, still, follow, #watchparty, #madeindag]","['woff', 'love', 'let', 'folk', 'girlsonfilmpod', 'crowd', 'know', 'watch', 'later', 'follow', 'watchparty', 'madeindag']"
857,1248348431938174984,annasmithjourno,2020-04-09 20:33:54,en,pixieglas: annasmithjourno netflixuk bbciplayer girlsonfilmpod we've done #watchalong reframedfilm woff lovel,0,2,RT @pixieglas: @annasmithjourno @NetflixUK @BBCiPlayer @GirlsOnFilm_Pod We've just done the a #WatchAlong @ReframedFilm with @WO50FF. Lovel…,"[pixieglas:, annasmithjourno, netflixuk, bbciplayer, girlsonfilmpod, we've, done, #watchalong, reframedfilm, woff, lovel]","['pixieglas', 'annasmithjourno', 'netflixuk', 'bbciplayer', 'girlsonfilmpod', 'watchalong', 'reframedfilm', 'woff', 'lovel']"
858,1248336015867219971,annasmithjourno,2020-04-09 19:44:33,en,today's film rec made dagenham - inspiring funny true-story britflick female factory workers fight,10,3,"Today's film rec is MADE IN DAGENHAM - an inspiring, funny, true-story Britflick about female factory workers fight… https://t.co/AAYmj4jAJf","[today's, film, rec, made, dagenham, -, inspiring, funny, true-story, britflick, female, factory, workers, fight]","['today', 'film', 'rec', 'dagenham', 'inspiring', 'funny', 'true', 'story', 'britflick', 'female', 'factory', 'worker', 'fight']"
859,1248147874736726017,annasmithjourno,2020-04-09 07:16:57,en,girlsonfilmpod: running streaming options fancy months free #mubi movies sign #girlsonfilm patron,0,2,RT @GirlsOnFilm_Pod: Running out of streaming options? Fancy MONTHS of free #MUBI movies? Sign up to be a #GirlsOnFilm patron and all will…,"[girlsonfilmpod:, running, streaming, options, fancy, months, free, #mubi, movies, sign, #girlsonfilm, patron]","['girlsonfilmpod', 'run', 'stream', 'option', 'fancy', 'month', 'free', 'mubi', 'movie', 'sign', 'girlsonfilm', 'patron']"
860,1247968097874726915,annasmithjourno,2020-04-08 19:22:35,en,ashantiomkar girlsonfilmpod madonna plashetschool always especially desperately seeking susan bravo,0,0,@AshantiOmkar @GirlsOnFilm_Pod @Madonna @PlashetSchool Always! And especially in Desperately Seeking Susan. Bravo S… https://t.co/mePL1LpmVn,"[ashantiomkar, girlsonfilmpod, madonna, plashetschool, always, especially, desperately, seeking, susan, bravo]","['ashantiomkar', 'girlsonfilmpod', 'madonna', 'plashetschool', 'especially', 'desperately', 'seek', 'susan', 'bravo']"
861,1247965449431719937,annasmithjourno,2020-04-08 19:12:03,en,ashantiomkar girlsonfilmpod madonna school lucky,0,0,@AshantiOmkar @GirlsOnFilm_Pod @Madonna At school! Lucky you,"[ashantiomkar, girlsonfilmpod, madonna, school, lucky]","['ashantiomkar', 'girlsonfilmpod', 'madonna', 'school', 'lucky']"
862,1247938259658866689,annasmithjourno,2020-04-08 17:24:01,en,carolmorley great news,2,0,@_CarolMorley Great news!,"[carolmorley, great, news]","['carolmorley', 'great', 'news']"
863,1247937710054129665,annasmithjourno,2020-04-08 17:21:50,en,hi carolmorley cat jumped keyboard tried tweet following message: 'orfe',13,1,"Hi @_CarolMorley, our cat just jumped on my keyboard and tried to tweet you with the following message: '09orfe'. D… https://t.co/m8QMjfpDw9","[hi, carolmorley, cat, jumped, keyboard, tried, tweet, following, message:, 'orfe']","['hi', 'carolmorley', 'cat', 'jump', 'keyboard', 'try', 'tweet', 'follow', 'message', 'orfe']"
864,1247931753702068228,annasmithjourno,2020-04-08 16:58:10,en,today's film recommendation: desperately seeking susan spoke young woman yet seen,10,1,Today's film recommendation: DESPERATELY SEEKING SUSAN. I just spoke to a young woman who hasn't yet seen it &amp; was… https://t.co/i394gjfupU,"[today's, film, recommendation:, desperately, seeking, susan, spoke, young, woman, yet, seen]","['today', 'film', 'recommendation', 'desperately', 'seek', 'susan', 'speak', 'young', 'woman', 'see']"
865,1247856360202678272,annasmithjourno,2020-04-08 11:58:34,en,here's feature best travel documentary films watch home,19,7,Here's my feature on 10 of the best travel documentary films to watch at home https://t.co/kx68bJbSoR,"[here's, feature, best, travel, documentary, films, watch, home]","['feature', 'good', 'travel', 'documentary', 'film', 'watch', 'home']"
866,1247579140796137474,annasmithjourno,2020-04-07 17:37:00,en,today's film recommendation good posture witty coming-of-age indie set nyc directed dolly wells,22,6,"Today's film recommendation is GOOD POSTURE, a witty coming-of-age indie set in NYC &amp; directed by Dolly Wells. You… https://t.co/iqAAwbO82U","[today's, film, recommendation, good, posture, witty, coming-of-age, indie, set, nyc, directed, dolly, wells]","['today', 'film', 'recommendation', 'good', 'posture', 'witty', 'come', 'age', 'indie', 'set', 'nyc', 'direct', 'dolly', 'wells']"
867,1247487878604771329,annasmithjourno,2020-04-07 11:34:22,en,lindamarric: pick podcasts help lockdown via jewishchron,0,3,RT @Linda_Marric: Here is my pick of the podcasts to help you through lockdown. https://t.co/i2OQs4uiqf via @jewishchron,"[lindamarric:, pick, podcasts, help, lockdown, via, jewishchron]","['lindamarric', 'pick', 'podcast', 'help', 'lockdown', 'jewishchron']"
868,1247476889557651458,annasmithjourno,2020-04-07 10:50:42,en,latest ep girlsonfilmpod i'm joined emily mortimer dolly wells talk #dollandem,31,11,"In the latest ep of @GirlsOnFilm_Pod I'm joined by Emily Mortimer and Dolly Wells to talk about #DollandEm,… https://t.co/6dTMI38HcZ","[latest, ep, girlsonfilmpod, i'm, joined, emily, mortimer, dolly, wells, talk, #dollandem]","['late', 'ep', 'girlsonfilmpod', 'join', 'emily', 'mortimer', 'dolly', 'wells', 'talk', 'dollandem']"
869,1247220008582885378,annasmithjourno,2020-04-06 17:49:56,en,today's movie recommendation natural: untold story alice guy blach primevideouk narrated,18,5,"Today's movie recommendation is BE NATURAL: THE UNTOLD STORY OF ALICE GUY BLACHÉ, now on @PrimeVideoUK. Narrated by… https://t.co/PYShSlLEz0","[today's, movie, recommendation, natural:, untold, story, alice, guy, blach, primevideouk, narrated]","['today', 'movie', 'recommendation', 'natural', 'untold', 'story', 'alice', 'guy', 'blach', 'primevideouk', 'narrate']"
870,1247210088147890183,annasmithjourno,2020-04-06 17:10:31,en,thank ashantiomkar cant wait everyone see misbehaviouruk,4,1,Thank you @AshantiOmkar! We can’t wait for everyone to see @MisbehaviourUK https://t.co/W6UWiIsIBz,"[thank, ashantiomkar, cant, wait, everyone, see, misbehaviouruk]","['thank', 'ashantiomkar', 'not', 'wait', 'misbehaviouruk']"
871,1247099941018832900,annasmithjourno,2020-04-06 09:52:50,en,film news in: misbehaviouruk launching early digital download film available,31,13,Film news just in: @MisbehaviourUK will be launching early on  digital download. The film will be available from  1… https://t.co/OgLhxrv9Ce,"[film, news, in:, misbehaviouruk, launching, early, digital, download, film, available]","['film', 'news', 'misbehaviouruk', 'launch', 'early', 'digital', 'download', 'film', 'available']"
872,1246876671833243649,annasmithjourno,2020-04-05 19:05:39,en,today's movie rec terminator: dark fate - ground-breaking female three hander still pinching,7,2,Today's movie rec is TERMINATOR: DARK FATE - a ground-breaking female three hander. Am still pinching myself about… https://t.co/nGryQPwwMP,"[today's, movie, rec, terminator:, dark, fate, -, ground-breaking, female, three, hander, still, pinching]","['today', 'movie', 'rec', 'terminator', 'dark', 'fate', 'ground', 'break', 'female', 'hander', 'pinch']"
873,1246801845105934337,annasmithjourno,2020-04-05 14:08:18,en,miafilms: join birdseyeviewff pm evening facebook zoom discuss pathos-filled #hereforlife latest film,0,13,RT @miafilms: Join @BirdsEyeViewFF from 6pm this evening on Facebook or Zoom to discuss the pathos-filled #HereForLife the latest film by d…,"[miafilms:, join, birdseyeviewff, pm, evening, facebook, zoom, discuss, pathos-filled, #hereforlife, latest, film]","['miafilms', 'join', 'birdseyeviewff', 'pm', 'evening', 'facebook', 'zoom', 'discuss', 'pathos', 'fill', 'hereforlife', 'late', 'film']"
874,1246487946116640769,annasmithjourno,2020-04-04 17:20:59,en,fredatalkingpix netflixuk another great performance well-cast film,0,0,@FredaTalkingPix @NetflixUK Another great performance! Such a well-cast film.,"[fredatalkingpix, netflixuk, another, great, performance, well-cast, film]","['fredatalkingpix', 'netflixuk', 'great', 'performance', 'cast', 'film']"
875,1246486083359178752,annasmithjourno,2020-04-04 17:13:35,en,lindamarric yes he's absolutely brilliant,1,0,"@Linda_Marric Yes, he's absolutely brilliant in this.","[lindamarric, yes, he's, absolutely, brilliant]","['lindamarric', 'yes', 'absolutely', 'brilliant']"
876,1246484952868425728,annasmithjourno,2020-04-04 17:09:05,en,today's film recommendation ingrid goes west sharp dark comedy people struggling connect mod,19,4,"Today's film recommendation is INGRID GOES WEST, a sharp, dark comedy about people struggling to connect in the mod… https://t.co/XsZgKryzmL","[today's, film, recommendation, ingrid, goes, west, sharp, dark, comedy, people, struggling, connect, mod]","['today', 'film', 'recommendation', 'ingrid', 'go', 'west', 'sharp', 'dark', 'comedy', 'people', 'struggle', 'connect', 'mod']"
877,1246115700088987649,annasmithjourno,2020-04-03 16:41:49,en,today's film recommendation lady bird wry witty coming-of-age film fabulous #gretagerwig good,3,1,"Today's film recommendation is LADY BIRD, a wry, witty coming-of-age film from the fabulous #GretaGerwig. Good for… https://t.co/6vcdFPfa3Y","[today's, film, recommendation, lady, bird, wry, witty, coming-of-age, film, fabulous, #gretagerwig, good]","['today', 'film', 'recommendation', 'lady', 'bird', 'wry', 'witty', 'come', 'age', 'film', 'fabulous', 'gretagerwig', 'good']"
878,1246084921950601219,annasmithjourno,2020-04-03 14:39:31,en,kermodemovie: enjoyed new series secrets cinema enjoy old series starts time ne,0,55,"RT @KermodeMovie: If you enjoyed the new series of SECRETS OF CINEMA, then you can enjoy the old series all over again! Starts same time ne…","[kermodemovie:, enjoyed, new, series, secrets, cinema, enjoy, old, series, starts, time, ne]","['kermodemovie', 'enjoy', 'new', 'series', 'secrets', 'cinema', 'enjoy', 'old', 'series', 'start', 'time', 'ne']"
879,1246056589213171713,annasmithjourno,2020-04-03 12:46:56,en,girlsonfilmpod: great review perfect candidate lindamarric - check latest ep hear evegabereau,0,3,"RT @GirlsOnFilm_Pod: Great review of THE PERFECT CANDIDATE by @Linda_Marric - check out our latest ep to hear more from her, @evegabereau,…","[girlsonfilmpod:, great, review, perfect, candidate, lindamarric, -, check, latest, ep, hear, evegabereau]","['girlsonfilmpod', 'great', 'review', 'perfect', 'candidate', 'lindamarric', 'check', 'late', 'ep', 'hear', 'evegabereau']"
880,1246032430378745856,annasmithjourno,2020-04-03 11:10:56,en,girlsonfilmpod: #homealone send us #homemovieposters - weve brilliant efforts far (like one) https:/,0,2,"RT @GirlsOnFilm_Pod: Are you #homealone? 
Send us your #homemovieposters - we’ve had some brilliant efforts so far (like this one!) https:/…","[girlsonfilmpod:, #homealone, send, us, #homemovieposters, -, weve, brilliant, efforts, far, (like, one), https:/]","['girlsonfilmpod', 'homealone', 'send', 'homemovieposter', 'have', 'brilliant', 'effort', 'far', 'like', 'https:/']"
881,1246032389274505216,annasmithjourno,2020-04-03 11:10:46,en,breedonator: hows girlsonfilmpod lighting tricky dressing gown back drop worked like charm #homemovieposters,0,2,RT @Breedonator: How’s this @GirlsOnFilm_Pod ? Lighting was tricky but the dressing gown back drop worked like a charm ! #homemovieposters…,"[breedonator:, hows, girlsonfilmpod, lighting, tricky, dressing, gown, back, drop, worked, like, charm, #homemovieposters]","['breedonator', 's', 'girlsonfilmpod', 'lighting', 'tricky', 'dress', 'gown', 'drop', 'work', 'like', 'charm', 'homemovieposter']"
882,1246025993149612033,annasmithjourno,2020-04-03 10:45:21,en,tonight #theperfectcandidate night - looking forward seeing #curzonlivingroom qa haifaamansour,0,0,Tonight is #ThePerfectCandidate night - looking forward to seeing the #CurzonLivingRoom Q&amp;A with @HaifaaMansour https://t.co/iQMJqdcnBt,"[tonight, #theperfectcandidate, night, -, looking, forward, seeing, #curzonlivingroom, qa, haifaamansour]","['tonight', 'theperfectcandidate', 'night', 'look', 'forward', 'see', 'curzonlivingroom', 'qa', 'haifaamansour']"
883,1245818272047644672,annasmithjourno,2020-04-02 20:59:56,und,ellieburgin: #homemovieposters,0,1,RT @ellie_burgin1: #homemovieposters https://t.co/zLSNbq5gE1,"[ellieburgin:, #homemovieposters]","['ellieburgin', 'homemovieposter']"
884,1245776641378394114,annasmithjourno,2020-04-02 18:14:31,en,girlsonfilmpod: new bar set #homemovieposters rival tweet us best effort,0,3,RT @GirlsOnFilm_Pod: New bar set for #homemovieposters — can you rival this? Tweet us your best effort! https://t.co/jMUWgxQMZ5,"[girlsonfilmpod:, new, bar, set, #homemovieposters, rival, tweet, us, best, effort]","['girlsonfilmpod', 'new', 'bar', 'set', 'homemovieposter', 'rival', 'tweet', 'good', 'effort']"
885,1245775961599217679,annasmithjourno,2020-04-02 18:11:49,en,another excellent entry girlsonfilmpod #homemovieposters lockdown challenge good luck #homealone,1,0,Another excellent entry into our @GirlsOnFilm_Pod  #homemovieposters lockdown challenge! Good luck being #homealone… https://t.co/HMdyMOCiWo,"[another, excellent, entry, girlsonfilmpod, #homemovieposters, lockdown, challenge, good, luck, #homealone]","['excellent', 'entry', 'girlsonfilmpod', 'homemovieposters', 'lockdown', 'challenge', 'good', 'luck', 'homealone']"
886,1245728946504728576,annasmithjourno,2020-04-02 15:05:00,en,meaning watch #theperfectcandidate (as featured girlsonfilmpod) stream th,6,3,If you've been meaning to watch #ThePerfectCandidate (as featured on @GirlsOnFilm_Pod) then why not stream it at th… https://t.co/jXcv6Tj51u,"[meaning, watch, #theperfectcandidate, (as, featured, girlsonfilmpod), stream, th]","['mean', 'watch', 'theperfectcandidate', 'feature', 'girlsonfilmpod', 'stream', 'th']"
887,1245712118395043843,annasmithjourno,2020-04-02 13:58:07,en,today's film recommendation captain fantastic witty poignant comedy-drama featuring delightful viggo morte,10,1,"Today's film recommendation is CAPTAIN FANTASTIC, a witty, poignant comedy-drama featuring a delightful Viggo Morte… https://t.co/TlJsvXxRPm","[today's, film, recommendation, captain, fantastic, witty, poignant, comedy-drama, featuring, delightful, viggo, morte]","['today', 'film', 'recommendation', 'captain', 'fantastic', 'witty', 'poignant', 'comedy', 'drama', 'feature', 'delightful', 'viggo', 'morte']"
888,1245703945059786752,annasmithjourno,2020-04-02 13:25:39,en,curzoncinemas: third edition #curzonlivingroom qas confirmed wadjda director haifaa al mansour join us talk abo,0,21,RT @CurzonCinemas: The third edition of #CurzonLivingRoom Q&amp;As is now confirmed! WADJDA director Haifaa Al Mansour will join us to talk abo…,"[curzoncinemas:, third, edition, #curzonlivingroom, qas, confirmed, wadjda, director, haifaa, al, mansour, join, us, talk, abo]","['curzoncinemas', 'edition', 'curzonlivingroom', 'qas', 'confirm', 'wadjda', 'director', 'haifaa', 'al', 'mansour', 'join', 'talk', 'abo']"
889,1245702151613157377,annasmithjourno,2020-04-02 13:18:31,en,thatheatherd girlsonfilmpod love else wants make #homemovieposters send girlsonfilmpod,2,0,@ThatHeatherD @GirlsOnFilm_Pod Love this! Who else wants to make their own #homemovieposters? Send it to @GirlsOnFilm_Pod,"[thatheatherd, girlsonfilmpod, love, else, wants, make, #homemovieposters, send, girlsonfilmpod]","['thatheatherd', 'girlsonfilmpod', 'love', 'want', 'homemovieposter', 'send', 'girlsonfilmpod']"
890,1245700068222676997,annasmithjourno,2020-04-02 13:10:14,en,thatheatherd: girlsonfilmpod girlsonfilmpod #homemovieposters fight club (wash hands),0,2,"RT @ThatHeatherD: @GirlsOnFilm_Pod @GirlsOnFilm_Pod #homemovieposters FIGHT CLUB 
(Wash your hands!) https://t.co/alkiZR4WJa","[thatheatherd:, girlsonfilmpod, girlsonfilmpod, #homemovieposters, fight, club, (wash, hands)]","['thatheatherd', 'girlsonfilmpod', 'girlsonfilmpod', 'homemovieposters', 'fight', 'club', 'wash', 'hand']"
891,1245683939018145792,annasmithjourno,2020-04-02 12:06:09,en,thrilled latest girlsonfilmpod guest haifaamansour curzoncinemas qa online p,5,1,"Thrilled that our latest @GirlsOnFilm_Pod guest, @HaifaaMansour, will be doing a @curzoncinemas Q&amp;A online at 8.30p… https://t.co/rTvcDlA1lF","[thrilled, latest, girlsonfilmpod, guest, haifaamansour, curzoncinemas, qa, online, p]","['thrill', 'late', 'girlsonfilmpod', 'guest', 'haifaamansour', 'curzoncinemas', 'qa', 'online', 'p']"
892,1245660865061322752,annasmithjourno,2020-04-02 10:34:28,en,girlsonfilmpod: we've inspired #quarantineart masterpieces feed morning - celluloid re-,0,1,RT @GirlsOnFilm_Pod: We've been inspired by some of the #quarantineart masterpieces on our feed this morning - so how about a celluloid re-…,"[girlsonfilmpod:, we've, inspired, #quarantineart, masterpieces, feed, morning, -, celluloid, re-]","['girlsonfilmpod', 'inspire', 'quarantineart', 'masterpiece', 'feed', 'morning', 'celluloid', 're-']"
893,1245340622896222215,annasmithjourno,2020-04-01 13:21:56,en,fac girlsonfilmpod metrouknews yeah got lucky even know,2,0,"@FAC_103 @GirlsOnFilm_Pod @MetroUKNews Yeah you got lucky, I didn't even know it was on there!","[fac, girlsonfilmpod, metrouknews, yeah, got, lucky, even, know]","['fac', 'girlsonfilmpod', 'metrouknews', 'yeah', 'get', 'lucky', 'know']"
894,1245339613952200704,annasmithjourno,2020-04-01 13:17:55,en,fac girlsonfilmpod good shout colossal 'trainwreck meets godzilla some' according,3,0,"@FAC_103 @GirlsOnFilm_Pod Good shout re Colossal. 'Trainwreck meets Godzilla, and then some', according to my… https://t.co/Yk2cK1WsLC","[fac, girlsonfilmpod, good, shout, colossal, 'trainwreck, meets, godzilla, some', according]","['fac', 'girlsonfilmpod', 'good', 'shout', 'colossal', 'trainwreck', 'meet', 'godzilla', 'accord']"
895,1245336983104368641,annasmithjourno,2020-04-01 13:07:28,en,today's film recommendation tonya - pacy irreverent insight skating scandal terrific turns fro,24,8,"Today's film recommendation is I, TONYA - a pacy, irreverent insight into a skating scandal with terrific turns fro… https://t.co/mA3DcbxgQC","[today's, film, recommendation, tonya, -, pacy, irreverent, insight, skating, scandal, terrific, turns, fro]","['today', 'film', 'recommendation', 'tonya', 'pacy', 'irreverent', 'insight', 'skating', 'scandal', 'terrific', 'turn', 'fro']"
896,1245311132505694208,annasmithjourno,2020-04-01 11:24:45,en,edfests: deeply saddened announce year's august festivals edartfest edfringe edbookfest edintfest edinburgh,0,727,"RT @edfests: We are deeply saddened to announce that this year's August Festivals, @EdArtFest @edfringe @edbookfest @edintfest &amp; @Edinburgh…","[edfests:, deeply, saddened, announce, year's, august, festivals, edartfest, edfringe, edbookfest, edintfest, edinburgh]","['edfest', 'deeply', 'saddened', 'announce', 'year', 'august', 'festival', 'edartfest', 'edfringe', 'edbookfest', 'edintfest', 'edinburgh']"
897,1245299346742169605,annasmithjourno,2020-04-01 10:37:55,en,annasmithjourno: introducing first #isolationpod girlsonfilmpod - straight homes director haifaamansour,0,6,RT @annasmithjourno: Introducing the first #IsolationPod from @GirlsOnFilm_Pod - straight from our homes to yours. Director @HaifaaMansour…,"[annasmithjourno:, introducing, first, #isolationpod, girlsonfilmpod, -, straight, homes, director, haifaamansour]","['annasmithjourno', 'introduce', 'isolationpod', 'girlsonfilmpod', 'straight', 'home', 'director', 'haifaamansour']"
898,1245076976039329794,annasmithjourno,2020-03-31 19:54:18,en,shame mins minfilmfest,1,0,"Shame it’s 95 mins, @90minfilmfest!","[shame, mins, minfilmfest]","['shame', 'min', 'minfilmfest']"
899,1245016523279867905,annasmithjourno,2020-03-31 15:54:05,en,olsencassidy anyway vis really gorgeous cast spent ages comfort,0,0,"@olsencassidy Anyway, Vis really is that gorgeous and most of the cast spent ages there, if that is any comfort!","[olsencassidy, anyway, vis, really, gorgeous, cast, spent, ages, comfort]","['olsencassidy', 'vis', 'gorgeous', 'cast', 'spend', 'age', 'comfort']"
900,1245015414347833344,annasmithjourno,2020-03-31 15:49:40,en,olsencassidy yes heard visit brief may shot scene (and balance thin,0,0,"@olsencassidy Yes, I heard her visit was very brief so they may have shot the scene in both (and on balance, I thin… https://t.co/7icWKjiNDh","[olsencassidy, yes, heard, visit, brief, may, shot, scene, (and, balance, thin]","['olsencassidy', 'yes', 'hear', 'visit', 'brief', 'shoot', 'scene', 'balance', 'thin']"
901,1245013004170801158,annasmithjourno,2020-03-31 15:40:06,en,olsencassidy interesting visited vis filmed several locals said seen cher arriving,2,0,"@olsencassidy Interesting! When I visited Vis, where it was filmed, several locals said they had seen Cher arriving… https://t.co/DzZqx9o4hV","[olsencassidy, interesting, visited, vis, filmed, several, locals, said, seen, cher, arriving]","['olsencassidy', 'interesting', 'visit', 'vis', 'film', 'local', 'say', 'see', 'cher', 'arrive']"
902,1244999534863953920,annasmithjourno,2020-03-31 14:46:34,en,today's film rec keeping room powerful female-driven western one fave films,3,1,"Today's film rec is THE KEEPING ROOM, a powerful female-driven western that was one of my fave films of 2016.… https://t.co/eRcCUZQJjj","[today's, film, rec, keeping, room, powerful, female-driven, western, one, fave, films]","['today', 'film', 'rec', 'keep', 'room', 'powerful', 'female', 'drive', 'western', 'fave', 'film']"
903,1244680760013004803,annasmithjourno,2020-03-30 17:39:52,en,exactly recommendation todays movie choice barbarella could lift mood inspire conflicted f,4,1,"Not exactly a recommendation, but today’s movie choice, BARBARELLA could both lift your mood &amp; inspire conflicted f… https://t.co/j2jI4Ht7Ah","[exactly, recommendation, todays, movie, choice, barbarella, could, lift, mood, inspire, conflicted, f]","['exactly', 'recommendation', 'todays', 'movie', 'choice', 'barbarella', 'lift', 'mood', 'inspire', 'conflicted', 'f']"
904,1244597786445783040,annasmithjourno,2020-03-30 12:10:10,en,great see girlsonfilmpod news pages brilliant filmstoriespod,2,1,Great to see @GirlsOnFilm_Pod in the news pages of the brilliant @filmstoriespod https://t.co/WUvJzSIbOd,"[great, see, girlsonfilmpod, news, pages, brilliant, filmstoriespod]","['great', 'girlsonfilmpod', 'news', 'page', 'brilliant', 'filmstoriespod']"
905,1244262068062171136,annasmithjourno,2020-03-29 13:56:08,en,brits looking quality independent film watch home today review three new digital releases l,5,3,Brits! Looking for a quality independent film to watch at home today? We review three new digital releases on the l… https://t.co/kxiuuDvuam,"[brits, looking, quality, independent, film, watch, home, today, review, three, new, digital, releases, l]","['brits', 'look', 'quality', 'independent', 'film', 'watch', 'home', 'today', 'review', 'new', 'digital', 'release', 'l']"
906,1244239270455500802,annasmithjourno,2020-03-29 12:25:33,en,today's film recommendation pincushionfilm written directed deborah haywood live tweeting,11,4,"Today's film recommendation is @PinCushionFilm, written and directed by Deborah Haywood, who will be live tweeting… https://t.co/3iY9oq5Cqz","[today's, film, recommendation, pincushionfilm, written, directed, deborah, haywood, live, tweeting]","['today', 'film', 'recommendation', 'pincushionfilm', 'write', 'direct', 'deborah', 'haywood', 'live', 'tweet']"
907,1243897134765801473,annasmithjourno,2020-03-28 13:46:02,en,pixieglas girlsonfilmpod modernfilmsent thank claire thanks signing support,1,0,"@pixieglas @GirlsOnFilm_Pod @ModernFilmsEnt Thank you Claire, and thanks again for signing up to support… https://t.co/k7J9V51oFn","[pixieglas, girlsonfilmpod, modernfilmsent, thank, claire, thanks, signing, support]","['pixieglas', 'girlsonfilmpod', 'modernfilmsent', 'thank', 'claire', 'thank', 'sign', 'support']"
908,1243892598579871745,annasmithjourno,2020-03-28 13:28:00,en,today's home movie recommendation truth listen review new ep girlsonfilmpod,10,3,Today's home movie recommendation is THE TRUTH. Listen to my review in the new ep of @GirlsOnFilm_Pod with… https://t.co/HzLuZsd3Aa,"[today's, home, movie, recommendation, truth, listen, review, new, ep, girlsonfilmpod]","['today', 'home', 'movie', 'recommendation', 'truth', 'listen', 'review', 'new', 'ep', 'girlsonfilmpod']"
