,id,username,created_at,lang,cleaned_tweets,favorite_count,retweet_count,text,tokens,lemmas
307,1389531162402381826,malpani,2021-05-04 10:43:40,en,#byju's #whitehatjr blink bullying tactics backfired badly hope issue public apology,21,4,"#Byju's and #WhiteHatJr blink!
Their bullying tactics have backfired badly!
I hope they issue a public apology and… https://t.co/hQeSdQCwLg","[#byju's, #whitehatjr, blink, bullying, tactics, backfired, badly, hope, issue, public, apology]","['byju', 'whitehatjr', 'blink', 'bullying', 'tactic', 'backfire', 'badly', 'hope', 'issue', 'public', 'apology']"
308,1389530508103544833,malpani,2021-05-04 10:41:04,en,whatever personal opinion #kanganaranaut politics may allowing #twitter censor indian',71,14,"Whatever your personal opinion about #KanganaRanaut
and her politics may be, allowing #Twitter to censor an Indian'… https://t.co/Ei4VWMQ68K","[whatever, personal, opinion, #kanganaranaut, politics, may, allowing, #twitter, censor, indian']","['personal', 'opinion', 'kanganaranaut', 'politic', 'allow', 'twitter', 'censor', 'indian']"
309,1389529543149428740,malpani,2021-05-04 10:37:13,en,crisis - panic - wrong decisions,21,1,Crisis - &gt; Panic - &gt; Wrong decisions,"[crisis, -, panic, -, wrong, decisions]","['crisis', 'panic', 'wrong', 'decision']"
310,1389526336251654145,malpani,2021-05-04 10:24:29,en,love connecting social impact entrepreneurs work together amplify impact,17,2,I love connecting social impact entrepreneurs so they can work together and amplify their impact,"[love, connecting, social, impact, entrepreneurs, work, together, amplify, impact]","['love', 'connect', 'social', 'impact', 'entrepreneur', 'work', 'amplify', 'impact']"
311,1389525107161239553,malpani,2021-05-04 10:19:36,en,boredroomcomedy people brainwashed happen,1,0,@BoredRoomComedy People have been too brainwashed for this to happen,"[boredroomcomedy, people, brainwashed, happen]","['boredroomcomedy', 'people', 'brainwash', 'happen']"
312,1389524883281903616,malpani,2021-05-04 10:18:42,en,banks trying poach #citibank india retail customers,15,2,Banks are trying to poach #citibank India retail customers,"[banks, trying, poach, #citibank, india, retail, customers]","['bank', 'try', 'poach', 'citibank', 'india', 'retail', 'customer']"
313,1389523251722739713,malpani,2021-05-04 10:12:13,en,#whitehatjr made pradeep poonia famous,36,1,#WhiteHatJr made Pradeep Poonia famous! https://t.co/Polyk4Ozh7,"[#whitehatjr, made, pradeep, poonia, famous]","['whitehatjr', 'pradeep', 'poonia', 'famous']"
314,1389518769299460101,malpani,2021-05-04 09:54:25,en,labelling everyone agree crackpot says iq,18,1,Labelling everyone who doesn't agree with you as a crackpot says more about your IQ then theirs,"[labelling, everyone, agree, crackpot, says, iq]","['label', 'agree', 'crackpot', 'say', 'iq']"
315,1389517619846270976,malpani,2021-05-04 09:49:51,en,people get uncomfortable anyone questions imposition practices masking social distan,9,1,"Why do people get so uncomfortable when anyone questions the imposition of practices such as masking, social distan… https://t.co/1GwXRT5qSe","[people, get, uncomfortable, anyone, questions, imposition, practices, masking, social, distan]","['people', 'uncomfortable', 'question', 'imposition', 'practice', 'mask', 'social', 'distan']"
316,1389516881552347138,malpani,2021-05-04 09:46:55,en,anyone wear mask considered public enemy days,10,1,Anyone who doesn't wear a mask is considered to be Public Enemy No 1 these days,"[anyone, wear, mask, considered, public, enemy, days]","['wear', 'mask', 'consider', 'public', 'enemy', 'day']"
317,1389516719572586498,malpani,2021-05-04 09:46:16,en,lose friends make enemies wear mask,12,0,"How to lose friends and make enemies

Don't wear a mask","[lose, friends, make, enemies, wear, mask]","['lose', 'friend', 'enemy', 'wear', 'mask']"
318,1389516088405266435,malpani,2021-05-04 09:43:46,en,colemans st law medicine receiving treatment existing disease develop new symptoms,13,0,"Coleman’s 1st Law Of Medicine 
If you are receiving treatment for an existing disease and you develop new symptoms… https://t.co/YLhikFOhTN","[colemans, st, law, medicine, receiving, treatment, existing, disease, develop, new, symptoms]","['colemans', 'st', 'law', 'medicine', 'receive', 'treatment', 'exist', 'disease', 'develop', 'new', 'symptom']"
319,1389515015699451904,malpani,2021-05-04 09:39:30,en,fears trump facts,9,0,Fears trump Facts https://t.co/xT7T7tHess,"[fears, trump, facts]","['fear', 'trump', 'fact']"
320,1389514297512955905,malpani,2021-05-04 09:36:39,en,masks two-edged sword,11,3,Masks are a two-edged sword https://t.co/4WiUe5LDST,"[masks, two-edged, sword]","['mask', 'edged', 'sword']"
321,1389513325361471492,malpani,2021-05-04 09:32:47,en,pay peanuts get monkeys,43,9,"When you pay peanuts, you get monkeys! https://t.co/GdXvWyenls","[pay, peanuts, get, monkeys]","['pay', 'peanut', 'monkey']"
322,1389512511138013185,malpani,2021-05-04 09:29:33,en,happened uv boxes people selling kill dreaded #coronavirus,14,2,What happened to all the UV boxes which people were selling to kill the dreaded #Coronavirus?,"[happened, uv, boxes, people, selling, kill, dreaded, #coronavirus]","['happen', 'uv', 'box', 'people', 'sell', 'kill', 'dread', 'coronavirus']"
323,1389512104827305985,malpani,2021-05-04 09:27:56,en,#covid- patients non-spreaders transmit #coronavirus anyone around -,26,0,"Most #COVID-19 patients are non-spreaders
They don't transmit the #Coronavirus to anyone around them - with or with… https://t.co/vPdvmFlMBg","[#covid-, patients, non-spreaders, transmit, #coronavirus, anyone, around, -]","['covid-', 'patient', 'non', 'spreader', 'transmit', 'coronavirus']"
324,1389510003589926912,malpani,2021-05-04 09:19:35,en,options managing #coronavirus improved still use crude measures used years ago,7,0,"Our options for managing #Coronavirus haven't improved.
We still use the same crude measures used 100 years ago

Ma… https://t.co/OdOnvxe6pK","[options, managing, #coronavirus, improved, still, use, crude, measures, used, years, ago]","['option', 'manage', 'coronavirus', 'improve', 'use', 'crude', 'measure', 'year', 'ago']"
325,1389508172579147776,malpani,2021-05-04 09:12:18,en,neerajmohanvp objecting high-handedness social media platforms act extra-constitutional super-censors,0,0,"@neerajmohanvp No. Am objecting to the high-handedness of social media platforms, who act as extra-constitutional super-censors.","[neerajmohanvp, objecting, high-handedness, social, media, platforms, act, extra-constitutional, super-censors]","['neerajmohanvp', 'object', 'high', 'handedness', 'social', 'medium', 'platform', 'act', 'extra', 'constitutional', 'super', 'censor']"
326,1389507866357207043,malpani,2021-05-04 09:11:05,en,theadityaaj modern pcs lots spare computing resources,1,0,@TheAdityaAJ Modern PCs have lots of spare computing resources,"[theadityaaj, modern, pcs, lots, spare, computing, resources]","['theadityaaj', 'modern', 'pc', 'lot', 'spare', 'computing', 'resource']"
327,1389507637738307584,malpani,2021-05-04 09:10:11,en,medical consultations either end smiles tears,7,0,Medical consultations either end in smiles or tears,"[medical, consultations, either, end, smiles, tears]","['medical', 'consultation', 'end', 'smile', 'tears']"
328,1389502289723887618,malpani,2021-05-04 08:48:56,en,learnx seem great jumping wrong conclusions farewell,1,0,"@learn_x1 You seem to be great at jumping to wrong conclusions !
Farewell !","[learnx, seem, great, jumping, wrong, conclusions, farewell]","['learnx', 'great', 'jump', 'wrong', 'conclusion', 'farewell']"
329,1389502133335072768,malpani,2021-05-04 08:48:18,en,prashant wirecard,0,0,@prashant817 Wirecard.,"[prashant, wirecard]","['prashant', 'wirecard']"
330,1389501893710209031,malpani,2021-05-04 08:47:21,en,bhagatprashant tahir death certificate causes legal disputes future people getting smarter,0,0,@bhagat_prashant @tahir2944 Not having a death certificate causes legal disputes in the future . People are getting smarter !,"[bhagatprashant, tahir, death, certificate, causes, legal, disputes, future, people, getting, smarter]","['bhagatprashant', 'tahir', 'death', 'certificate', 'cause', 'legal', 'dispute', 'future', 'people', 'get', 'smart']"
331,1389501702349332482,malpani,2021-05-04 08:46:36,en,adityaya trying judge - welcoming,1,0,@adit_ya_ya Not trying to judge her - just welcoming her !,"[adityaya, trying, judge, -, welcoming]","['adityaya', 'try', 'judge', 'welcome']"
332,1389501542437294080,malpani,2021-05-04 08:45:58,en,informative questions ones whose answer uncertain,11,0,The most informative questions are the ones whose answer we are most uncertain about,"[informative, questions, ones, whose, answer, uncertain]","['informative', 'question', 'one', 'answer', 'uncertain']"
333,1389499205782147072,malpani,2021-05-04 08:36:40,en,advantage many tabs open always pick left days ago,10,1,The advantage of having so many tabs open is you can always pick up where you left off 5 days ago ! https://t.co/PCpRSTxGG1,"[advantage, many, tabs, open, always, pick, left, days, ago]","['advantage', 'tab', 'open', 'pick', 'left', 'day', 'ago']"
334,1389498641455345666,malpani,2021-05-04 08:34:26,en,world philanthropy get boost since donate independently,8,0,"The world of philanthropy will get a boost, since they can both donate independently now ! https://t.co/ALYOzk7ntk","[world, philanthropy, get, boost, since, donate, independently]","['world', 'philanthropy', 'boost', 'donate', 'independently']"
335,1389498360747335680,malpani,2021-05-04 08:33:19,en,bhagatprashant tahir death certificates issued health officer,0,0,@bhagat_prashant @tahir2944 Death certificates are issued by the Health Officer,"[bhagatprashant, tahir, death, certificates, issued, health, officer]","['bhagatprashant', 'tahir', 'death', 'certificates', 'issue', 'health', 'officer']"
336,1389498257202503680,malpani,2021-05-04 08:32:54,en,#linkedin suspended account #twitter suspended pradeep poonia join gang #kanganaranaut,14,2,"#LinkedIn suspended my account 
#Twitter suspended Pradeep Poonia
Join the gang #KanganaRanaut ! https://t.co/p0OStcAiRK","[#linkedin, suspended, account, #twitter, suspended, pradeep, poonia, join, gang, #kanganaranaut]","['linkedin', 'suspend', 'account', 'twitter', 'suspend', 'pradeep', 'poonia', 'join', 'gang', 'kanganaranaut']"
337,1389497443251757056,malpani,2021-05-04 08:29:40,en,bhagatprashant tahir get death certificates legal document,0,0,@bhagat_prashant @tahir2944 Don't they get Death Certificates ? This is a legal document,"[bhagatprashant, tahir, get, death, certificates, legal, document]","['bhagatprashant', 'tahir', 'death', 'certificate', 'legal', 'document']"
338,1389497290277019649,malpani,2021-05-04 08:29:04,en,sidsawant protect - sake others,1,0,@sidsawant01 They did it to protect themselves - not for the sake of others,"[sidsawant, protect, -, sake, others]","['sidsawant', 'protect', 'sake']"
339,1389496134222090242,malpani,2021-05-04 08:24:28,en,making sense term sheets shas via inc,5,1,Making Sense Of Term Sheets And SHAs https://t.co/AgTeZbHGAm via @inc42,"[making, sense, term, sheets, shas, via, inc]","['make', 'sense', 'term', 'sheet', 'shas', 'inc']"
340,1389486686095040513,malpani,2021-05-04 07:46:56,en,unethical businesses thrive hiring front-line staff immature ( moral compass well-developed),18,4,Unethical businesses thrive by hiring front-line staff who are immature ( their moral compass isn't well-developed)… https://t.co/wGEDrsKZ8O,"[unethical, businesses, thrive, hiring, front-line, staff, immature, (, moral, compass, well-developed)]","['unethical', 'business', 'thrive', 'hire', 'line', 'staff', 'immature', 'moral', 'compass', 'develop']"
341,1389486205104902146,malpani,2021-05-04 07:45:01,en,end business day uneducated ignorant #byju's bread butter,47,3,"At the end of the business day, the uneducated and ignorant are #Byju's bread and butter.","[end, business, day, uneducated, ignorant, #byju's, bread, butter]","['end', 'business', 'day', 'uneducated', 'ignorant', 'byju', 'bread', 'butter']"
342,1389485852468727808,malpani,2021-05-04 07:43:37,en,communication = conveyance convergence transmit message get buy-in,8,4,"Communication = Conveyance + Convergence
Transmit the message
Get buy-in","[communication, =, conveyance, convergence, transmit, message, get, buy-in]","['communication', '=', 'conveyance', 'convergence', 'transmit', 'message', 'buy']"
343,1389485666648543232,malpani,2021-05-04 07:42:52,en,prepare virtual meetings asynchronously brainstorming writing prior meeting enables effective collab,4,1,Prepare for virtual meetings asynchronously. Brainstorming in writing prior to the meeting enables effective collab… https://t.co/iS7LM4dZRk,"[prepare, virtual, meetings, asynchronously, brainstorming, writing, prior, meeting, enables, effective, collab]","['prepare', 'virtual', 'meeting', 'asynchronously', 'brainstorm', 'write', 'prior', 'meeting', 'enable', 'effective', 'collab']"
344,1389485285096910854,malpani,2021-05-04 07:41:22,en,build strong teams deliver results achieving goals promote personal growth build team cohesion,13,2,"How to build strong teams
1. Deliver results by achieving goals
2. Promote personal growth 
3. Build team cohesion,… https://t.co/Q5TW0phjxG","[build, strong, teams, deliver, results, achieving, goals, promote, personal, growth, build, team, cohesion]","['build', 'strong', 'team', 'deliver', 'result', 'achieve', 'goal', 'promote', 'personal', 'growth', 'build', 'team', 'cohesion']"
345,1389484923136876544,malpani,2021-05-04 07:39:55,en,easier trust people trust,7,1,It's easier to trust people who trust you,"[easier, trust, people, trust]","['easy', 'trust', 'people', 'trust']"
346,1389484859739967490,malpani,2021-05-04 07:39:40,en,trust two-way street,9,1,Trust is a two-way street,"[trust, two-way, street]","['trust', 'way', 'street']"
347,1389484760385261568,malpani,2021-05-04 07:39:16,en,amitpants ct scan tests confirmatory,0,0,@amitpants The CT scan tests are not confirmatory,"[amitpants, ct, scan, tests, confirmatory]","['amitpants', 'ct', 'scan', 'test', 'confirmatory']"
348,1389484634107375618,malpani,2021-05-04 07:38:46,en,get senior end spending bigger chunks time solving people problems,15,0,"As you get more senior, you end up spending bigger chunks of your  time solving people problems !","[get, senior, end, spending, bigger, chunks, time, solving, people, problems]","['senior', 'end', 'spend', 'big', 'chunk', 'time', 'solve', 'people', 'problem']"
349,1389483525133402114,malpani,2021-05-04 07:34:22,en,prescribing information therapy online ivf comic book hindi free designed help patients,4,0,"Prescribing Information Therapy online Our IVF Comic Book is in Hindi.
 It's free and is designed to help patients… https://t.co/U3fmf5JLoN","[prescribing, information, therapy, online, ivf, comic, book, hindi, free, designed, help, patients]","['prescribe', 'information', 'therapy', 'online', 'ivf', 'comic', 'book', 'hindi', 'free', 'design', 'help', 'patient']"
350,1389482890862415874,malpani,2021-05-04 07:31:51,en,using frugal technology help poor kids learn #covid- crisis,19,6,https://t.co/poLCWklIvl is using Frugal technology to help poor kids to learn during this #COVID-19 crisis… https://t.co/0lq5TDHmil,"[using, frugal, technology, help, poor, kids, learn, #covid-, crisis]","['frugal', 'technology', 'help', 'poor', 'kid', 'learn', 'covid-', 'crisis']"
351,1389481998570299393,malpani,2021-05-04 07:28:18,en,helping kids orphanage make radio,12,1,Helping kids at the orphanage to make their own radio at https://t.co/6U6AXZBeXK https://t.co/f4YGYHkrGS,"[helping, kids, orphanage, make, radio]","['help', 'kids', 'orphanage', 'radio']"
352,1389481825802723335,malpani,2021-05-04 07:27:37,en,hands learning,3,1,Hands on Learning at https://t.co/6U6AXZBeXK https://t.co/TPcQYFSVdX,"[hands, learning]","['hand', 'learn']"
353,1389465653459898368,malpani,2021-05-04 06:23:21,en,journalists compete describing horrific effect #covid- think hyperbole increases impact,17,4,Journalists compete for describing the horrific effect of #COVID-19. They think that hyperbole increases the impact… https://t.co/gvgzEjFESP,"[journalists, compete, describing, horrific, effect, #covid-, think, hyperbole, increases, impact]","['journalist', 'compete', 'describe', 'horrific', 'effect', 'covid-', 'think', 'hyperbole', 'increase', 'impact']"
354,1389303122414080000,malpani,2021-05-03 19:37:31,und,viswanathsarey aramanujaa,2,0,@Viswanath_Sarey @aramanujaa,"[viswanathsarey, aramanujaa]","['viswanathsarey', 'aramanujaa']"
355,1389302945473200129,malpani,2021-05-03 19:36:48,en,plsdontlie doctor label false negative ask tests crp hrct,1,0,"@plsdontlie Then your doctor will label it as a false negative and ask for more tests, such as CRP and HRCT","[plsdontlie, doctor, label, false, negative, ask, tests, crp, hrct]","['plsdontlie', 'doctor', 'label', 'false', 'negative', 'ask', 'test', 'crp', 'hrct']"
356,1389302559349743617,malpani,2021-05-03 19:35:16,en,practo cover-up hard imagine anyone making big goof,2,0,@Practo Is this a cover-up? Hard to imagine anyone making such a big goof up?,"[practo, cover-up, hard, imagine, anyone, making, big, goof]","['practo', 'cover', 'hard', 'imagine', 'make', 'big', 'goof']"
357,1389302298111877123,malpani,2021-05-03 19:34:14,en,aruntankha observation,1,0,"@arun_tankha No, it didn't. Just an observation","[aruntankha, observation]","['aruntankha', 'observation']"
358,1389302154238648322,malpani,2021-05-03 19:33:40,en,bhagatprashant tahir stop dying,0,0,@bhagat_prashant @tahir2944 How does that stop them from dying of it?,"[bhagatprashant, tahir, stop, dying]","['bhagatprashant', 'tahir', 'stop', 'die']"
359,1389302041852272642,malpani,2021-05-03 19:33:13,en,ganeshrajguru true well,0,0,@ganeshrajguru Will be true in 2023 as well,"[ganeshrajguru, true, well]","['ganeshrajguru', 'true']"
360,1389301816660135941,malpani,2021-05-03 19:32:19,en,sanjogjz sadly precious little reliable indian data learn truth decade,1,0,"@SanjogJZ Sadly, there is precious little reliable Indian data.
And we will learn the truth only after a decade or… https://t.co/5U4oc31RNi","[sanjogjz, sadly, precious, little, reliable, indian, data, learn, truth, decade]","['sanjogjz', 'sadly', 'precious', 'little', 'reliable', 'indian', 'datum', 'learn', 'truth', 'decade']"
361,1389301536866504709,malpani,2021-05-03 19:31:13,en,shreyasb sign,0,0,@shreyasb94 So why not sign it?,"[shreyasb, sign]","['shreyasb', 'sign']"
362,1389267468485468162,malpani,2021-05-03 17:15:50,en,aatmsiddhi sure please email signal noise ratio much better prepare better call,0,0,@aatmsiddhi Sure. Please email me. The signal to noise ratio is much better and I can prepare better for the call,"[aatmsiddhi, sure, please, email, signal, noise, ratio, much, better, prepare, better, call]","['aatmsiddhi', 'sure', 'email', 'signal', 'noise', 'ratio', 'better', 'prepare', 'well']"
363,1389267289954918408,malpani,2021-05-03 17:15:07,en,glad respected doctors talking sense test 'just sure' please tests cause harm,53,21,"Am glad respected doctors are talking sense!
Don't do a test 'just to be sure' please
Tests can cause harm! https://t.co/E91AfuFiRE","[glad, respected, doctors, talking, sense, test, 'just, sure', please, tests, cause, harm]","['glad', 'respected', 'doctor', 'talk', 'sense', 'test', 'sure', 'test', 'cause', 'harm']"
364,1389264555474255872,malpani,2021-05-03 17:04:15,en,way look #covid- changes dramatically someone know dies,81,7,The way you look at #COVID-19 changes dramatically when someone you know dies of it,"[way, look, #covid-, changes, dramatically, someone, know, dies]","['way', 'look', 'covid-', 'change', 'dramatically', 'know', 'die']"
365,1389264158407815173,malpani,2021-05-03 17:02:41,en,clever idea great solution problem plagues teachers,19,3,"https://t.co/ieHN7HQn71
This is such a clever idea!
A great solution for a problem which plagues all teachers","[clever, idea, great, solution, problem, plagues, teachers]","['clever', 'idea', 'great', 'solution', 'problem', 'plague', 'teacher']"
366,1389262673146048521,malpani,2021-05-03 16:56:47,en,nimishjoker tap existing demand trying create expensive exercise,0,0,@nimishjoker91 Tap into existing demand. Trying to create it is an expensive exercise!,"[nimishjoker, tap, existing, demand, trying, create, expensive, exercise]","['nimishjoker', 'tap', 'exist', 'demand', 'try', 'create', 'expensive', 'exercise']"
367,1389262518854381570,malpani,2021-05-03 16:56:10,en,nimishjoker yes easy waste tons money trying,0,0,"@nimishjoker91 Yes, which is why it's easy to waste tons of money trying to do this","[nimishjoker, yes, easy, waste, tons, money, trying]","['nimishjoker', 'yes', 'easy', 'waste', 'ton', 'money', 'try']"
368,1389262304483545096,malpani,2021-05-03 16:55:19,en,nimishjoker sound like digital marketing agency,0,0,@nimishjoker91 You sound like a digital marketing agency!,"[nimishjoker, sound, like, digital, marketing, agency]","['nimishjoker', 'sound', 'like', 'digital', 'marketing', 'agency']"
369,1389262008604758019,malpani,2021-05-03 16:54:08,en,cricketics people reporting anecdotal evidence enough,0,0,@Cricketics1 So why aren't more people reporting this? Anecdotal evidence is not enough,"[cricketics, people, reporting, anecdotal, evidence, enough]","['cricketic', 'people', 'report', 'anecdotal', 'evidence']"
370,1389261734993567746,malpani,2021-05-03 16:53:03,en,vc - funded companies like #practo always happy make quick buck,14,3,VC - funded companies like #Practo are always happy to make a quick buck! https://t.co/o10MllqOxb,"[vc, -, funded, companies, like, #practo, always, happy, make, quick, buck]","['vc', 'fund', 'company', 'like', 'practo', 'happy', 'quick', 'buck']"
371,1389261331002318854,malpani,2021-05-03 16:51:27,en,tweeshna ensure authenticity,0,0,@tweeshna To ensure authenticity!,"[tweeshna, ensure, authenticity]","['tweeshna', 'ensure', 'authenticity']"
372,1389260848145653760,malpani,2021-05-03 16:49:32,en,upasana true specific,2,0,@U_pasana True. I should have been more specific!,"[upasana, true, specific]","['upasana', 'true', 'specific']"
373,1389260643652362249,malpani,2021-05-03 16:48:43,en,ravyas nisarnaveen maybe care feathers give,1,0,@ravyas75 @nisar_naveen Maybe he doesn't care about the feathers we give him?,"[ravyas, nisarnaveen, maybe, care, feathers, give]","['ravyas', 'nisarnaveen', 'maybe', 'care', 'feather']"
374,1389233093806989320,malpani,2021-05-03 14:59:14,en,unsigned,21,2,Why is this unsigned? https://t.co/6P8CyD0npG,[unsigned],['unsigned']
375,1389232841544798209,malpani,2021-05-03 14:58:14,en,looking educators academic advisory board ensure comics,5,2,We are looking for Educators for our Academic Advisory Board at https://t.co/0DLh0UQy75 to ensure that our comics a… https://t.co/PxDfZbapnm,"[looking, educators, academic, advisory, board, ensure, comics]","['look', 'educators', 'academic', 'advisory', 'board', 'ensure', 'comic_strip']"
376,1389232218279596035,malpani,2021-05-03 14:55:46,en,tahir isolation medical care,1,0,@tahir2944 Isolation ≠ medical care,"[tahir, isolation, medical, care]","['tahir', 'isolation', 'medical', 'care']"
377,1389231599238057987,malpani,2021-05-03 14:53:18,en,indian teachers #twitter,46,2,Why aren't more Indian teachers on #Twitter?,"[indian, teachers, #twitter]","['indian', 'teacher', 'twitter']"
378,1389231494405574657,malpani,2021-05-03 14:52:53,en,nimishjoker vague intangible,0,0,@nimishjoker91 Too vague and intangible,"[nimishjoker, vague, intangible]","['nimishjoker', 'vague', 'intangible']"
379,1389227379126530051,malpani,2021-05-03 14:36:32,en,chessyvith money brains,0,0,@ChessyVith More money than brains 😄,"[chessyvith, money, brains]","['chessyvith', 'money', 'brain']"
380,1389227263279788033,malpani,2021-05-03 14:36:04,en,tahir sad one bothering analyse fascinating natural experiments,1,0,@tahir2944 It's so sad that no one is bothering to analyse these fascinating natural experiments,"[tahir, sad, one, bothering, analyse, fascinating, natural, experiments]","['tahir', 'sad', 'bothering', 'analyse', 'fascinating', 'natural', 'experiment']"
381,1389218922574979078,malpani,2021-05-03 14:02:56,en,people dying #covid mean every death covid,8,0,Just because  people are dying of #COVID19  does not mean that every death is because of COVID ! https://t.co/ByQU6u5Iy7,"[people, dying, #covid, mean, every, death, covid]","['people', 'die', 'covid', 'mean', 'death', 'covid']"
382,1389218499961233420,malpani,2021-05-03 14:01:15,en,government lost cognitive trust emotional trust,42,1,The Government has lost both our cognitive trust and emotional trust,"[government, lost, cognitive, trust, emotional, trust]","['government', 'lose', 'cognitive', 'trust', 'emotional', 'trust']"
383,1389218212676456455,malpani,2021-05-03 14:00:06,en,trying different formats make learning fun free,5,1,Trying out different formats to make learning fun and free ! https://t.co/QaHVfHNcPE,"[trying, different, formats, make, learning, fun, free]","['try', 'different', 'format', 'learn', 'fun', 'free']"
384,1389218047928389638,malpani,2021-05-03 13:59:27,en,medical care good patients mean medical care good everyone,21,5,Just because medical care is good for some patients does not mean that medical care is good for everyone. https://t.co/iGNmqppdg0,"[medical, care, good, patients, mean, medical, care, good, everyone]","['medical', 'care', 'good', 'patient', 'mean', 'medical', 'care', 'good']"
