,id,username,created_at,lang,cleaned_tweets,favorite_count,retweet_count,text,tokens,lemmas
622,1388481800725430272,malpani,2021-05-01 13:13:52,en,obsolete idea degree essential success leaked vulnerable desperate popul,14,2,The obsolete idea that a degree is essential for success has leaked down to the most vulnerable and desperate popul… https://t.co/RDq67VHBpj,"[obsolete, idea, degree, essential, success, leaked, vulnerable, desperate, popul]","['obsolete', 'idea', 'degree', 'essential', 'success', 'leak', 'vulnerable', 'desperate', 'popul']"
623,1388481572731428875,malpani,2021-05-01 13:12:58,en,edutech startups like #byju's #vedantu target specific populations groups bread butte,5,2,"Edutech Startups like #Byju's and #Vedantu  target specific populations, and these groups are their bread and butte… https://t.co/M9E8Y7A6pk","[edutech, startups, like, #byju's, #vedantu, target, specific, populations, groups, bread, butte]","['edutech', 'startup', 'like', 'byju', 'vedantu', 'target', 'specific', 'population', 'group', 'bread', 'butte']"
624,1388481239863025673,malpani,2021-05-01 13:11:38,en,edutech startups like #byju's #vedantu give generously education lifelong debt,25,2,"Edutech startups like #Byju's and #Vedantu give generously.
Not an Education, but lifelong debt","[edutech, startups, like, #byju's, #vedantu, give, generously, education, lifelong, debt]","['edutech', 'startup', 'like', 'byju', 'vedantu', 'generously', 'education', 'lifelong', 'debt']"
625,1388478905284120576,malpani,2021-05-01 13:02:22,en,godexxhealth tawanug th th,1,0,@Godexxhealth @tawanug And then a 4th and a 5th..,"[godexxhealth, tawanug, th, th]","['godexxhealth', 'tawanug', 'th', 'th']"
626,1388478778179874817,malpani,2021-05-01 13:01:52,en,ishanjain karanbhatia many strains coexist need evidence better mapping strains distribution,0,0,"@ishanjain_ @KaranBhatia_ Many strains coexist. We need more evidence, and better mapping of the strains and their distribution","[ishanjain, karanbhatia, many, strains, coexist, need, evidence, better, mapping, strains, distribution]","['ishanjain', 'karanbhatia', 'strain', 'coexist', 'need', 'evidence', 'well', 'mapping', 'strain', 'distribution']"
627,1388478473782534150,malpani,2021-05-01 13:00:39,en,shreyapattar invaluable natural experiments help us better prepared next epidem,2,0,"@ShreyaPattar These are invaluable Natural Experiments, which can help us to be better prepared for the next epidem… https://t.co/nhEF7pTMx9","[shreyapattar, invaluable, natural, experiments, help, us, better, prepared, next, epidem]","['shreyapattar', 'invaluable', 'natural', 'experiment', 'help', 'better', 'prepare', 'epidem']"
628,1388478248967831555,malpani,2021-05-01 12:59:45,en,harshastic doctors omniscient mutated need rna sequencing done prove,2,0,"@Harsh_astic_ Doctors aren't omniscient!
And if it has mutated, we need RNA sequencing done to prove this!","[harshastic, doctors, omniscient, mutated, need, rna, sequencing, done, prove]","['harshastic', 'doctor', 'omniscient', 'mutated', 'need', 'rna', 'sequencing', 'prove']"
629,1388478029643403269,malpani,2021-05-01 12:58:53,en,skjsaurabh said first lockdown well remember,3,0,"@skjsaurabh They said that for the first Lockdown as well, remember?","[skjsaurabh, said, first, lockdown, well, remember]","['skjsaurabh', 'say', 'lockdown', 'remember']"
630,1388477920700616714,malpani,2021-05-01 12:58:27,en,aramanujaa able continue living changed upset equilibrium,2,0,@aramanujaa So why aren't we able to continue living with it? What changed to upset the equilibrium?,"[aramanujaa, able, continue, living, changed, upset, equilibrium]","['aramanujaa', 'able', 'continue', 'live', 'change', 'upset', 'equilibrium']"
631,1388477776081027076,malpani,2021-05-01 12:57:53,en,one email newsletter subscriber worth social media followers,19,2,One email newsletter subscriber is worth 10 social media followers,"[one, email, newsletter, subscriber, worth, social, media, followers]","['email', 'newsletter', 'subscriber', 'worth', 'social', 'medium', 'follower']"
632,1388477564277063684,malpani,2021-05-01 12:57:02,en,ishandutta yes absolute number susceptible people gone thanks first wave right,0,0,"@ishandutta101 Yes, but the absolute number of susceptible people has gone down thanks to the first wave, right?","[ishandutta, yes, absolute, number, susceptible, people, gone, thanks, first, wave, right]","['ishandutta', 'yes', 'absolute', 'number', 'susceptible', 'people', 'go', 'thank', 'wave', 'right']"
633,1388477334320152577,malpani,2021-05-01 12:56:07,en,okarthik explain second waves,0,0,@okarthik42 How do you explain second waves?,"[okarthik, explain, second, waves]","['okarthik', 'explain', 'second', 'wave']"
634,1388477171300110339,malpani,2021-05-01 12:55:28,en,privileged every day become sunday,36,3,"For the privileged few , every day has become a Sunday","[privileged, every, day, become, sunday]","['privileged', 'day', 'sunday']"
635,1388475038429368321,malpani,2021-05-01 12:47:00,en,exponential rise accompanied exponential decay that's hard understand numbers,4,0,"Exponential rise is accompanied by exponential decay, and that's why it's so hard to understand the numbers https://t.co/XMUQDb1xjg","[exponential, rise, accompanied, exponential, decay, that's, hard, understand, numbers]","['exponential', 'rise', 'accompany', 'exponential', 'decay', 'hard', 'understand', 'number']"
636,1388473485702230018,malpani,2021-05-01 12:40:50,en,india judges wrong,21,0,"In India, our Judges can do no wrong!","[india, judges, wrong]","['india', 'judge', 'wrong']"
637,1388473268579946497,malpani,2021-05-01 12:39:58,en,last time oxygen ran hospital government arrested doctor duty going arres,27,9,"The last time oxygen ran out in a hospital, the Government arrested the doctor on duty.
Who are they going to arres… https://t.co/zESoGxsZuv","[last, time, oxygen, ran, hospital, government, arrested, doctor, duty, going, arres]","['time', 'oxygen', 'run', 'hospital', 'government', 'arrest', 'doctor', 'duty', 'go', 'arre']"
638,1388470588038025218,malpani,2021-05-01 12:29:19,en,nisarnaveen know block,5,0,@nisar_naveen Then I know whom to block 😂,"[nisarnaveen, know, block]","['nisarnaveen', 'know', 'block']"
639,1388463492601024514,malpani,2021-05-01 12:01:07,en,great country people important others locking doctors crisis teach,150,59,"In our great country, some people are more important than others!
Locking up doctors during this crisis will teach… https://t.co/MTG08N4u0e","[great, country, people, important, others, locking, doctors, crisis, teach]","['great', 'country', 'people', 'important', 'lock', 'doctor', 'crisis', 'teach']"
640,1388434778697867270,malpani,2021-05-01 10:07:01,en,investors wired find holes businesses that's add value - helping fill,7,1,"Investors are wired to find holes in businesses.
That's how we add value - by helping you to fill them in","[investors, wired, find, holes, businesses, that's, add, value, -, helping, fill]","['investor', 'wire', 'find', 'hole', 'business', 'add', 'value', 'help', 'fill']"
641,1388434574980567048,malpani,2021-05-01 10:06:13,en,investors tend sceptical burned fingers often,3,1,Investors tend to be sceptical because we have burned our fingers so often,"[investors, tend, sceptical, burned, fingers, often]","['investor', 'tend', 'sceptical', 'burn', 'finger']"
642,1388434400468029442,malpani,2021-05-01 10:05:31,en,meet investors unless raising funds time consuming distraction,5,1,"Don't meet investors unless you are raising funds.
They can be a time consuming distraction","[meet, investors, unless, raising, funds, time, consuming, distraction]","['meet', 'investor', 'raise', 'fund', 'time', 'consume', 'distraction']"
643,1388433108370792448,malpani,2021-05-01 10:00:23,en,tawanug vaccines help boost immune system,1,0,"@tawanug So how will vaccines help? They just boost the immune system, don't they?","[tawanug, vaccines, help, boost, immune, system]","['tawanug', 'vaccine', 'help', 'boost', 'immune', 'system']"
644,1388432908973576192,malpani,2021-05-01 09:59:35,en,raunak people afraid first time around going afraid time around well,1,0,@raunak246 The people who were afraid the first time around are going to be afraid this time around as well,"[raunak, people, afraid, first, time, around, going, afraid, time, around, well]","['raunak', 'people', 'afraid', 'time', 'go', 'afraid', 'time']"
645,1388432761560526850,malpani,2021-05-01 09:59:00,en,karanbhatia covid-,2,0,@KaranBhatia_ So it's COVID-21?,"[karanbhatia, covid-]","['karanbhatia', 'covid-']"
646,1388432586796527619,malpani,2021-05-01 09:58:19,ca,medical education indoctrinates doctors,10,2,Medical education indoctrinates doctors,"[medical, education, indoctrinates, doctors]","['medical', 'education', 'indoctrinate', 'doctor']"
647,1388432358542434312,malpani,2021-05-01 09:57:24,en,stories tell past accurate stories try spin future,6,1,The stories we tell about the past are more accurate than the stories we try to spin about the future,"[stories, tell, past, accurate, stories, try, spin, future]","['story', 'tell', 'past', 'accurate', 'story', 'try', 'spin', 'future']"
648,1388432161204703232,malpani,2021-05-01 09:56:37,en,make sense past mean predict future,7,2,Just because we can make sense about the past doesn't mean that we can predict the future,"[make, sense, past, mean, predict, future]","['sense', 'past', 'mean', 'predict', 'future']"
649,1388430619068092419,malpani,2021-05-01 09:50:30,en,raunak numbers can't increase though still sub-set ones exposed first wave,1,0,"@raunak246 The numbers can't increase though, can they? It will still be a sub-set of the ones exposed during the first wave!","[raunak, numbers, can't, increase, though, still, sub-set, ones, exposed, first, wave]","['raunak', 'number', 'increase', 'sub', 'set', 'one', 'expose', 'wave']"
650,1388430202506600451,malpani,2021-05-01 09:48:50,en,topic close heart affects us see online #twitter space pm today,24,10,"This is a topic which is close to my heart and affects all of us!
See you online at #Twitter space at 10 pm today https://t.co/k47Lrx1KPQ","[topic, close, heart, affects, us, see, online, #twitter, space, pm, today]","['topic', 'close', 'heart', 'affect', 'online', 'twitter', 'space', 'pm', 'today']"
651,1388429590553575424,malpani,2021-05-01 09:46:24,en,someone explain second wave cause damage first first wave entire,26,1,"Can someone explain to me why a second wave should cause more damage than the first? 
In the first wave, the entire… https://t.co/QawfeCJYgI","[someone, explain, second, wave, cause, damage, first, first, wave, entire]","['explain', 'second', 'wave', 'cause', 'damage', 'wave', 'entire']"
652,1388428997122428928,malpani,2021-05-01 09:44:03,en,tsgowrishankar what's website,2,1,@tsgowrishankar What's their website?,"[tsgowrishankar, what's, website]","['tsgowrishankar', 'website']"
653,1388426659074772994,malpani,2021-05-01 09:34:45,en,rs creating trust relationship referral reputation,25,2,"The 3 Rs for Creating Trust
Relationship
Referral
Reputation","[rs, creating, trust, relationship, referral, reputation]","['rs', 'create', 'trust', 'relationship', 'referral', 'reputation']"
654,1388424559057989633,malpani,2021-05-01 09:26:25,en,tweeting easy tweeting fulfill business goal hard,20,2,"Tweeting is easy
Tweeting to fulfill a business goal is hard","[tweeting, easy, tweeting, fulfill, business, goal, hard]","['tweet', 'easy', 'tweet', 'fulfill', 'business', 'goal', 'hard']"
655,1388423800782397441,malpani,2021-05-01 09:23:24,en,business local,7,2,All business is local,"[business, local]","['business', 'local']"
656,1388422602645901313,malpani,2021-05-01 09:18:38,en,tsgowrishankar let images tug heart stop head thinking clearly please,0,0,@tsgowrishankar Don't let images which tug at your heart stop your head from thinking clearly please,"[tsgowrishankar, let, images, tug, heart, stop, head, thinking, clearly, please]","['tsgowrishankar', 'let', 'image', 'tug', 'heart', 'stop', 'head', 'think', 'clearly']"
657,1388422289138405376,malpani,2021-05-01 09:17:24,en,internetjeevi srinisivabalan thanks much eye-opener know outcome,1,0,@internetjeevi @SriniSivabalan Thanks so much! This is an eye-opener. Do you know the outcome of these?,"[internetjeevi, srinisivabalan, thanks, much, eye-opener, know, outcome]","['internetjeevi', 'srinisivabalan', 'thank', 'eye', 'opener', 'know', 'outcome']"
658,1388421881175306243,malpani,2021-05-01 09:15:46,en,what's favourite charity donate,13,1,What's your favourite charity to donate to?,"[what's, favourite, charity, donate]","['favourite', 'charity', 'donate']"
659,1388421782185541632,malpani,2021-05-01 09:15:23,en,what's exciting project working,37,1,What's the most exciting project you are working on?,"[what's, exciting, project, working]","['exciting', 'project', 'work']"
660,1388420295296389122,malpani,2021-05-01 09:09:28,en,going let virus paralyze us inactivity,11,3,Are we going to let a virus paralyze us into inactivity?,"[going, let, virus, paralyze, us, inactivity]","['go', 'let', 'virus', 'paralyze', 'inactivity']"
661,1388420170671001605,malpani,2021-05-01 09:08:58,en,himanshu adds confusion,0,0,@himanshu27795 Just adds to the confusion 😂,"[himanshu, adds, confusion]","['himanshu', 'add', 'confusion']"
662,1388420030568701952,malpani,2021-05-01 09:08:25,en,internetjeevi srinisivabalan start listing journalists jailed talking #covid,0,0,@internetjeevi @SriniSivabalan Why not start by listing 3 journalists who have been jailed for talking about #COVID19?,"[internetjeevi, srinisivabalan, start, listing, journalists, jailed, talking, #covid]","['internetjeevi', 'srinisivabalan', 'start', 'list', 'journalist', 'jail', 'talk', 'covid']"
663,1388419753153228801,malpani,2021-05-01 09:07:19,en,siddhantjain ones also post social media right social media people talking others,0,0,"@siddhantjain92 They are the ones who also post on social media, right?
Social media is people talking to others!","[siddhantjain, ones, also, post, social, media, right, social, media, people, talking, others]","['siddhantjain', 'one', 'post', 'social', 'medium', 'right', 'social', 'medium', 'people', 'talk']"
664,1388419545233125383,malpani,2021-05-01 09:06:29,en,littlegtweets patient real life doctor advice third test,0,0,"@LittleGTweets So what does the patient do in real life?
And what does the doctor advice?
Do a third test, and then… https://t.co/6udSQfp3Uo","[littlegtweets, patient, real, life, doctor, advice, third, test]","['littlegtweets', 'patient', 'real', 'life', 'doctor', 'advice', 'test']"
665,1388419146497421315,malpani,2021-05-01 09:04:54,en,tsgowrishankar wish true anyone coronavirus positive dies counted covid death,0,0,"@tsgowrishankar I wish that was true, but anyone who is Coronavirus positive and dies is counted as a COVID death","[tsgowrishankar, wish, true, anyone, coronavirus, positive, dies, counted, covid, death]","['tsgowrishankar', 'wish', 'true', 'coronavirus', 'positive', 'die', 'count', 'covid', 'death']"
666,1388418865693007874,malpani,2021-05-01 09:03:47,en,best way good good,8,2,The best way to be good is to do good,"[best, way, good, good]","['good', 'way', 'good', 'good']"
667,1388415111241506819,malpani,2021-05-01 08:48:52,en,siddhantjain yes social media amplifies messages lose perspective seems everyone around,0,0,"@siddhantjain92 Yes, social media amplifies messages and we lose perspective, because it seems that everyone around… https://t.co/MYOgPqSFd5","[siddhantjain, yes, social, media, amplifies, messages, lose, perspective, seems, everyone, around]","['siddhantjain', 'yes', 'social', 'medium', 'amplify', 'message', 'lose', 'perspective']"
668,1388414718256156672,malpani,2021-05-01 08:47:18,en,longer freedom breathe fresh natural oxygen outdoors,30,3,We no longer have the freedom to breathe fresh natural oxygen outdoors!,"[longer, freedom, breathe, fresh, natural, oxygen, outdoors]","['long', 'freedom', 'breathe', 'fresh', 'natural', 'oxygen', 'outdoors']"
669,1388412174066798594,malpani,2021-05-01 08:37:12,en,siddhantjain based gut feel might want read easy fool,0,0,@siddhantjain92 Based on what? Some gut feel of yours? You might want to read more about how easy it is to fool yourself!,"[siddhantjain, based, gut, feel, might, want, read, easy, fool]","['siddhantjain', 'base', 'gut', 'feel', 'want', 'read', 'easy', 'fool']"
670,1388408401365929988,malpani,2021-05-01 08:22:12,en,rationalise personal inconveniences forced put (such forced stay home) we'r,12,4,We rationalise the personal inconveniences we are forced to put up (such as being forced to stay home) because we'r… https://t.co/k9O8whypxa,"[rationalise, personal, inconveniences, forced, put, (such, forced, stay, home), we'r]","['rationalise', 'personal', 'inconvenience', 'force', 'force', 'stay', 'home', ""we'r""]"
671,1388407113865596928,malpani,2021-05-01 08:17:05,en,every illness today #covid- proven otherwise dr devi shetty medical carte blanche doctors ov,10,3,"""Every illness today is #COVID-19 until proven otherwise!"" Dr Devi Shetty. 
Medical carte blanche for doctors to ov… https://t.co/e4aTeULmG0","[every, illness, today, #covid-, proven, otherwise, dr, devi, shetty, medical, carte, blanche, doctors, ov]","['illness', 'today', 'covid-', 'prove', 'dr', 'devi', 'shetty', 'medical', 'carte', 'blanche', 'doctors', 'ov']"
672,1388406265009766401,malpani,2021-05-01 08:13:43,en,vaneshmali accidntlwriter taherdhanera people think links reinforce beliefs authen,4,1,@vaneshmali @AccidntlWriter @taherdhanera People only think that the links which reinforce their beliefs are authen… https://t.co/VpWKIXDNPm,"[vaneshmali, accidntlwriter, taherdhanera, people, think, links, reinforce, beliefs, authen]","['vaneshmali', 'accidntlwriter', 'taherdhanera', 'people', 'think', 'link', 'reinforce', 'belief', 'authen']"
673,1388406040002060291,malpani,2021-05-01 08:12:49,en,vaneshmali anyone ever made preposterous claim polio vaccine come effective va,7,0,"@vaneshmali Has anyone ever made this preposterous claim about the polio vaccine?? 
How come all other effective va… https://t.co/6yIVa0pXXc","[vaneshmali, anyone, ever, made, preposterous, claim, polio, vaccine, come, effective, va]","['vaneshmali', 'preposterous', 'claim', 'polio', 'vaccine', 'come', 'effective', 'va']"
674,1388405806136135682,malpani,2021-05-01 08:11:54,en,logicalsingh yes claims efficacy vaccine getting progressively diluted come ot,1,1,"@logical_singh Yes, the claims about the efficacy of the vaccine are getting progressively diluted.
How come all ot… https://t.co/AD9kP5FTxd","[logicalsingh, yes, claims, efficacy, vaccine, getting, progressively, diluted, come, ot]","['logicalsingh', 'yes', 'claim', 'efficacy', 'vaccine', 'get', 'progressively', 'dilute', 'come', 'ot']"
675,1388405439784570883,malpani,2021-05-01 08:10:26,fr,sanketvd april april,0,0,@sanketvd April 30 and April 29,"[sanketvd, april, april]","['sanketvd', 'april', 'april']"
676,1388405323543715844,malpani,2021-05-01 08:09:59,en,sumsaxena true negative false negative true positive confused,0,0,"@sum_saxena So this is a True Negative? Or a False Negative? Or a True Positive?
Am very confused!","[sumsaxena, true, negative, false, negative, true, positive, confused]","['sumsaxena', 'true', 'negative', 'false', 'negative', 'true', 'positive', 'confused']"
677,1388405071608631298,malpani,2021-05-01 08:08:59,en,accidntlwriter taherdhanera google zindabad,1,0,@AccidntlWriter @taherdhanera Google zindabad!,"[accidntlwriter, taherdhanera, google, zindabad]","['accidntlwriter', 'taherdhanera', 'google', 'zindabad']"
678,1388404952838537217,malpani,2021-05-01 08:08:30,en,abhijon know reached holy grail,2,0,@abhi_jon_99 And how will we know when we have reached that holy grail?,"[abhijon, know, reached, holy, grail]","['abhijon', 'know', 'reach', 'holy', 'grail']"
679,1388404791689154563,malpani,2021-05-01 08:07:52,en,accidntlwriter taherdhanera thanks proving point efficacy manufacturers claimed,3,0,@AccidntlWriter @taherdhanera Thanks for proving my point. So its efficacy is not what the manufacturers claimed it… https://t.co/pT2PpSbJt8,"[accidntlwriter, taherdhanera, thanks, proving, point, efficacy, manufacturers, claimed]","['accidntlwriter', 'taherdhanera', 'thank', 'prove', 'point', 'efficacy', 'manufacturer', 'claim']"
680,1388404469612748805,malpani,2021-05-01 08:06:35,en,madhavirathi pharma companies claimed bragging effective vaccines,4,0,@MadhaviRathi1 Is that what the pharma companies claimed when bragging about how effective their vaccines are?,"[madhavirathi, pharma, companies, claimed, bragging, effective, vaccines]","['madhavirathi', 'pharma', 'company', 'claim', 'brag', 'effective', 'vaccine']"
681,1388403436681523202,malpani,2021-05-01 08:02:29,en,accidntlwriter taherdhanera might want read press releases issued vaccines approved public use,2,0,@AccidntlWriter @taherdhanera You might want to read the press releases issued when the vaccines were approved for public use!,"[accidntlwriter, taherdhanera, might, want, read, press, releases, issued, vaccines, approved, public, use]","['accidntlwriter', 'taherdhanera', 'want', 'read', 'press', 'release', 'issue', 'vaccine', 'approve', 'public', 'use']"
682,1388403185170096135,malpani,2021-05-01 08:01:29,en,#rt-pcr report trust done patient different labs asymptomatic patient,12,3,"Which #RT-PCR report do we trust?
Done for the same patient from different Labs!
Asymptomatic patient. https://t.co/CTbm1wqe8a","[#rt-pcr, report, trust, done, patient, different, labs, asymptomatic, patient]","['rt', 'pcr', 'report', 'trust', 'patient', 'different', 'lab', 'asymptomatic', 'patient']"
683,1388402248997216257,malpani,2021-05-01 07:57:46,en,aryankochhar rchannaiah yes everyone intelligent enough understand,3,0,@aryan_kochhar @rchannaiah Yes. Not everyone is intelligent enough to understand it,"[aryankochhar, rchannaiah, yes, everyone, intelligent, enough, understand]","['aryankochhar', 'rchannaiah', 'yes', 'intelligent', 'understand']"
684,1388402124841623554,malpani,2021-05-01 07:57:16,en,whysocuriouscha compounding effect sadly,3,0,@whysocuriouscha It has a compounding effect sadly!,"[whysocuriouscha, compounding, effect, sadly]","['whysocuriouscha', 'compound', 'effect', 'sadly']"
685,1388402011989630977,malpani,2021-05-01 07:56:49,en,track dalys caused #lockdown vs #covid-,3,3,How we track DALYs caused by the #Lockdown vs #COVID-19? https://t.co/2vKplAITx4,"[track, dalys, caused, #lockdown, vs, #covid-]","['track', 'dalys', 'cause', 'lockdown', 'vs', 'covid-']"
686,1388401519439929348,malpani,2021-05-01 07:54:52,en,#lockdown loneliness kill,16,2,"In a #Lockdown, loneliness can kill","[#lockdown, loneliness, kill]","['lockdown', 'loneliness', 'kill']"
687,1388400993721741317,malpani,2021-05-01 07:52:46,en,rchannaiah comment unintelligible sorry,4,0,"@rchannaiah Your comment was unintelligible, sorry","[rchannaiah, comment, unintelligible, sorry]","['rchannaiah', 'comment', 'unintelligible', 'sorry']"
688,1388400748648538122,malpani,2021-05-01 07:51:48,en,patients co-morbidities (fancy word pre-existing illness) higher risk getting #covid-,7,3,Patients with co-morbidities (fancy word for pre-existing illness) are at higher risk for getting #COVID-19. Now if… https://t.co/4vc7dhFNBo,"[patients, co-morbidities, (fancy, word, pre-existing, illness), higher, risk, getting, #covid-]","['patient', 'co', 'morbidity', 'fancy', 'word', 'pre', 'existing', 'illness', 'high', 'risk', 'get', 'covid-']"
689,1388399954985570308,malpani,2021-05-01 07:48:39,en,whiteratsr covid- #covid- really know better assigning cause death,0,0,"@WhiteRatSr1 From COVID-19? Or with #COVID-19? Do we really know?
Shouldn't we be better at assigning cause of death?","[whiteratsr, covid-, #covid-, really, know, better, assigning, cause, death]","['whiteratsr', 'covid-', 'covid-', 'know', 'well', 'assign', 'cause', 'death']"
690,1388399604756975617,malpani,2021-05-01 07:47:15,en,vaccine effective allow people vaccinated travel freely,119,14,"If the vaccine is 99.99% effective,  then why not allow people who have been vaccinated to travel as freely as they… https://t.co/1kDEO7dP9Z","[vaccine, effective, allow, people, vaccinated, travel, freely]","['vaccine', 'effective', 'allow', 'people', 'vaccinate', 'travel', 'freely']"
691,1388398160842674177,malpani,2021-05-01 07:41:31,en,siddharthaa tender loving care safe free effective pharma advertises doctor prescribes,5,0,"@siddharthaa7 Tender Loving Care 
It's safe, free and effective
But no pharma advertises it and no doctor prescribes it !","[siddharthaa, tender, loving, care, safe, free, effective, pharma, advertises, doctor, prescribes]","['siddharthaa', 'tender', 'loving', 'care', 'safe', 'free', 'effective', 'pharma', 'advertise', 'doctor', 'prescribe']"
692,1388397120835801089,malpani,2021-05-01 07:37:23,en,primary thesis malpani ventures back early stage founders want build business frugally (read,6,1,Our primary thesis at Malpani Ventures is to back early stage founders who want to build business frugally (read –… https://t.co/iyxoLwkr2o,"[primary, thesis, malpani, ventures, back, early, stage, founders, want, build, business, frugally, (read]","['primary', 'thesis', 'malpani', 'venture', 'early', 'stage', 'founder', 'want', 'build', 'business', 'frugally', 'read']"
693,1388395952105345025,malpani,2021-05-01 07:32:44,en,e-cell iiit nr presents keynote session get investor fund dr anirudddha malpani (found,8,2,"E-Cell, IIIT NR presents a Keynote Session on ""How to get an investor to fund you?"" by Dr Anirudddha Malpani (Found… https://t.co/upYUfffZuU","[e-cell, iiit, nr, presents, keynote, session, get, investor, fund, dr, anirudddha, malpani, (found]","['e', 'cell', 'iiit', 'nr', 'present', 'keynote', 'session', 'investor', 'fund', 'dr', 'anirudddha', 'malpani', 'find']"
