,id,username,created_at,lang,cleaned_tweets,favorite_count,retweet_count,text,tokens,lemmas
850,1179054453380354051,rakeshrussell52,2019-10-01 15:24:22,en,thehockeyindia indiasports cmoodisha sportsodisha mediasai sjoerdmarijne gbhockey girls surely,0,0,@TheHockeyIndia @IndiaSports @CMO_Odisha @sports_odisha @Media_SAI @SjoerdMarijne @GBHockey So our girls are surely… https://t.co/tBcUWBMDV3,"[thehockeyindia, indiasports, cmoodisha, sportsodisha, mediasai, sjoerdmarijne, gbhockey, girls, surely]","['thehockeyindia', 'indiasports', 'cmoodisha', 'sportsodisha', 'mediasai', 'sjoerdmarijne', 'gbhockey', 'girl', 'surely']"
851,1179028742376587265,rakeshrussell52,2019-10-01 13:42:12,en,thehockeyindia indiasports sportsodisha cmoodisha mediasai hope remains scoring goals remains withou,0,0,@TheHockeyIndia @IndiaSports @sports_odisha @CMO_Odisha @Media_SAI Hope he remains scoring goals and remains withou… https://t.co/zImMcBUB5e,"[thehockeyindia, indiasports, sportsodisha, cmoodisha, mediasai, hope, remains, scoring, goals, remains, withou]","['thehockeyindia', 'indiasports', 'sportsodisha', 'cmoodisha', 'mediasai', 'hope', 'remain', 'score', 'goal', 'remain', 'withou']"
852,1179028391338504192,rakeshrussell52,2019-10-01 13:40:48,en,redsparrow useless fellow doesnt brains talks must obsession hashish,1,0,@redsparrow1010 Useless fellow doesnt have any brains what he talks he must be under the obsession of hashish,"[redsparrow, useless, fellow, doesnt, brains, talks, must, obsession, hashish]","['redsparrow', 'useless', 'fellow', 'not', 'brain', 'talk', 'obsession', 'hashish']"
853,1179028131446845441,rakeshrussell52,2019-10-01 13:39:46,en,redsparrow old bastard loved girls,1,0,@redsparrow1010 Old bastard is loved by these girls,"[redsparrow, old, bastard, loved, girls]","['redsparrow', 'old', 'bastard', 'love', 'girl']"
854,1179012428492726273,rakeshrussell52,2019-10-01 12:37:22,en,thehockeyindia sreejesh simranhockey good spirited comeback young belgium team experienced,3,0,@TheHockeyIndia @16Sreejesh @simranhockey Good spirited comeback from the young Belgium team against an experienced… https://t.co/VpuKa5cj06,"[thehockeyindia, sreejesh, simranhockey, good, spirited, comeback, young, belgium, team, experienced]","['thehockeyindia', 'sreejesh', 'simranhockey', 'good', 'spirited', 'comeback', 'young', 'belgium', 'team', 'experience']"
855,1179007780457308162,rakeshrussell52,2019-10-01 12:18:54,en,thehockeyindia sreejesh simranhockey many mins left,0,0,@TheHockeyIndia @16Sreejesh @simranhockey How many mins left ?,"[thehockeyindia, sreejesh, simranhockey, many, mins, left]","['thehockeyindia', 'sreejesh', 'simranhockey', 'min', 'leave']"
856,1179001574724497409,rakeshrussell52,2019-10-01 11:54:14,en,thehockeyindia sreejesh come boys still many minutes left,0,0,@TheHockeyIndia @16Sreejesh Come on boys still many minutes left you can do it,"[thehockeyindia, sreejesh, come, boys, still, many, minutes, left]","['thehockeyindia', 'sreejesh', 'come', 'boy', 'minute', 'leave']"
857,1178990116167045120,rakeshrussell52,2019-10-01 11:08:42,en,thehockeyindia mandeepsingh belredlions indiasports cmoodisha sportsodisha mediasai reidgj congrats f,0,0,@TheHockeyIndia @mandeepsingh995 @BELRedLions @IndiaSports @CMO_Odisha @sports_odisha @Media_SAI @reidgj Congrats f… https://t.co/4XXSytsxRC,"[thehockeyindia, mandeepsingh, belredlions, indiasports, cmoodisha, sportsodisha, mediasai, reidgj, congrats, f]","['thehockeyindia', 'mandeepsingh', 'belredlions', 'indiasports', 'cmoodisha', 'sportsodisha', 'mediasai', 'reidgj', 'congrats', 'f']"
858,1178976135809421313,rakeshrussell52,2019-10-01 10:13:09,en,thehockeyindia indiasports sportsodisha cmoodisha mediasai manpreetpawar imranirampal waiting,0,0,@TheHockeyIndia @IndiaSports @sports_odisha @CMO_Odisha @Media_SAI @manpreetpawar07 @imranirampal I am waiting,"[thehockeyindia, indiasports, sportsodisha, cmoodisha, mediasai, manpreetpawar, imranirampal, waiting]","['thehockeyindia', 'indiasports', 'sportsodisha', 'cmoodisha', 'mediasai', 'manpreetpawar', 'imranirampal', 'wait']"
859,1178969136988225542,rakeshrussell52,2019-10-01 09:45:21,und,fihhockey thehockeyindia usa,1,0,@FIH_Hockey @TheHockeyIndia USA,"[fihhockey, thehockeyindia, usa]","['fihhockey', 'thehockeyindia', 'usa']"
860,1178916893559681025,rakeshrussell52,2019-10-01 06:17:45,en,thehockeyindia cmoodisha naveenodisha olympics right,1,0,@TheHockeyIndia @CMO_Odisha @Naveen_Odisha 2030 olympics ? 2032 right,"[thehockeyindia, cmoodisha, naveenodisha, olympics, right]","['thehockeyindia', 'cmoodisha', 'naveenodisha', 'olympics', 'right']"
861,1178882149610475520,rakeshrussell52,2019-10-01 03:59:41,en,thehockeyindia thebigdog indiasports cmoodisha mediasai sportsodisha happy birthday chris,1,0,@TheHockeyIndia @TheBigDog_5 @IndiaSports @CMO_Odisha @Media_SAI @sports_odisha Happy Birthday 🎂Chris,"[thehockeyindia, thebigdog, indiasports, cmoodisha, mediasai, sportsodisha, happy, birthday, chris]","['thehockeyindia', 'thebigdog', 'indiasports', 'cmoodisha', 'mediasai', 'sportsodisha', 'happy', 'birthday', 'chris']"
862,1178728748041945088,rakeshrussell52,2019-09-30 17:50:07,in,newstamil chennaiipl msdhoni unnaya engaluku pidikathu nee yaaruda csk pidikathunu soldrathuku nayinda monae,0,0,@news7tamil @ChennaiIPL @msdhoni Unnaya engaluku pidikathu nee yaaruda CSK pidikathunu soldrathuku nayinda monae,"[newstamil, chennaiipl, msdhoni, unnaya, engaluku, pidikathu, nee, yaaruda, csk, pidikathunu, soldrathuku, nayinda, monae]","['newstamil', 'chennaiipl', 'msdhoni', 'unnaya', 'engaluku', 'pidikathu', 'nee', 'yaaruda', 'csk', 'pidikathunu', 'soldrathuku', 'nayinda', 'monae']"
863,1178677880080879616,rakeshrussell52,2019-09-30 14:28:00,en,redsparrow surely game changer,1,0,@redsparrow1010 Surely there are an game changer,"[redsparrow, surely, game, changer]","['redsparrow', 'surely', 'game', 'changer']"
864,1178666011836350464,rakeshrussell52,2019-09-30 13:40:50,en,redsparrow ya also turkey america loggerheads,0,0,@redsparrow1010 Ya but in that also Turkey and America are at loggerheads,"[redsparrow, ya, also, turkey, america, loggerheads]","['redsparrow', 'turkey', 'america', 'loggerheads']"
865,1178664176572436480,rakeshrussell52,2019-09-30 13:33:32,en,redsparrow yes america support saudis russians support iranians,1,0,@redsparrow1010 Yes America will be in support of Saudis and Russians will support Iranians,"[redsparrow, yes, america, support, saudis, russians, support, iranians]","['redsparrow', 'yes', 'america', 'support', 'saudis', 'russians', 'support', 'iranians']"
866,1178663145528627201,rakeshrussell52,2019-09-30 13:29:27,en,redsparrow houthis banging saudis like imagine war happens iran that's saudi ar,1,0,@redsparrow1010 Houthis themselves banging Saudis like this imagine if war happens between Iran that's all Saudi Ar… https://t.co/X6WCG6DtPJ,"[redsparrow, houthis, banging, saudis, like, imagine, war, happens, iran, that's, saudi, ar]","['redsparrow', 'houthis', 'bang', 'saudis', 'like', 'imagine', 'war', 'happen', 'iran', 'saudi', 'ar']"
867,1178662076593524738,rakeshrussell52,2019-09-30 13:25:12,en,redsparrow mbs embarassment expected say captured iraqi somalian mercenaries,1,0,@redsparrow1010 MBS had its embarassment as he expected as all say most of them captured are Iraqi and Somalian mercenaries,"[redsparrow, mbs, embarassment, expected, say, captured, iraqi, somalian, mercenaries]","['redsparrow', 'mbs', 'embarassment', 'expect', 'capture', 'iraqi', 'somalian', 'mercenary']"
868,1178629636520955904,rakeshrussell52,2019-09-30 11:16:17,en,#fiholympicqualifiers days go cant wait see make,2,0,#FIHOlympicQualifiers 25 days to go cant wait to see who will make it,"[#fiholympicqualifiers, days, go, cant, wait, see, make]","['fiholympicqualifier', 'day', 'not', 'wait']"
869,1178628819587985408,rakeshrussell52,2019-09-30 11:13:03,und,redsparrow,1,0,@redsparrow1010 https://t.co/iBXsXlKU3F,[redsparrow],['redsparrow']
870,1178627825345056769,rakeshrussell52,2019-09-30 11:09:06,en,thehockeyindia indiasports cmoodisha sportsodisha mediasai girls look physically fit muscular,0,0,@TheHockeyIndia @IndiaSports @CMO_Odisha @sports_odisha @Media_SAI Our girls look physically fit and muscular,"[thehockeyindia, indiasports, cmoodisha, sportsodisha, mediasai, girls, look, physically, fit, muscular]","['thehockeyindia', 'indiasports', 'cmoodisha', 'sportsodisha', 'mediasai', 'girl', 'look', 'physically', 'fit', 'muscular']"
871,1178589521987792896,rakeshrussell52,2019-09-30 08:36:53,en,thehockeyindia indiasports cmoodisha sportsodisha mediasai two national federations make,0,0,@TheHockeyIndia @IndiaSports @CMO_Odisha @sports_odisha @Media_SAI Its up to the two national federations to make a… https://t.co/aYqRGRvxFe,"[thehockeyindia, indiasports, cmoodisha, sportsodisha, mediasai, two, national, federations, make]","['thehockeyindia', 'indiasports', 'cmoodisha', 'sportsodisha', 'mediasai', 'national', 'federation']"
872,1178355388451672064,rakeshrussell52,2019-09-29 17:06:32,en,sreejesh obohockey three three wins chetta great work done want home series fans w,1,0,@16Sreejesh @obohockey Three out of three wins chetta great work done but we want home series so that we fans can w… https://t.co/bN6hUQMM87,"[sreejesh, obohockey, three, three, wins, chetta, great, work, done, want, home, series, fans, w]","['sreejesh', 'obohockey', 'win', 'chetta', 'great', 'work', 'want', 'home', 'series', 'fan', 'w']"
873,1178336386937606145,rakeshrussell52,2019-09-29 15:51:01,en,thehockeyindia sjoerdmarijne shot goal pc,0,0,@TheHockeyIndia @SjoerdMarijne Shot on goal or PC?,"[thehockeyindia, sjoerdmarijne, shot, goal, pc]","['thehockeyindia', 'sjoerdmarijne', 'shoot', 'goal', 'pc']"
874,1178307691824836608,rakeshrussell52,2019-09-29 13:57:00,en,thehockeyindia akashdeeps manpreetpawar svsunil indiasports cmoodisha sportsodisha mediasai,4,0,@TheHockeyIndia @akashdeeps985 @manpreetpawar07 @SVSunil24 @IndiaSports @CMO_Odisha @sports_odisha @Media_SAI… https://t.co/FSnvJAW8Uq,"[thehockeyindia, akashdeeps, manpreetpawar, svsunil, indiasports, cmoodisha, sportsodisha, mediasai]","['thehockeyindia', 'akashdeeps', 'manpreetpawar', 'svsunil', 'indiasports', 'cmoodisha', 'sportsodisha', 'mediasai']"
875,1178307160171630593,rakeshrussell52,2019-09-29 13:54:53,en,thehockeyindia: akashdeeps manpreetpawar svsunil indiasports cmoodisha sportsodisha mediasai ramandeep harmanpr,0,29,RT @TheHockeyIndia: @akashdeeps985 @manpreetpawar07 @SVSunil24 @IndiaSports @CMO_Odisha @sports_odisha @Media_SAI @ramandeep_31 @13harmanpr…,"[thehockeyindia:, akashdeeps, manpreetpawar, svsunil, indiasports, cmoodisha, sportsodisha, mediasai, ramandeep, harmanpr]","['thehockeyindia', 'akashdeeps', 'manpreetpawar', 'svsunil', 'indiasports', 'cmoodisha', 'sportsodisha', 'mediasai', 'ramandeep', 'harmanpr']"
876,1178306249609187328,rakeshrussell52,2019-09-29 13:51:16,und,tamberajveer: tarekfatah narendramodi,0,38,RT @TambeRajveer: @TarekFatah @narendramodi https://t.co/XKUq3a03t2,"[tamberajveer:, tarekfatah, narendramodi]","['tamberajveer', 'tarekfatah', 'narendramodi']"
877,1178305919542673409,rakeshrussell52,2019-09-29 13:49:57,und,redsparrow,1,0,@redsparrow1010 https://t.co/MknYxHvC23,[redsparrow],['redsparrow']
878,1178296459386507264,rakeshrussell52,2019-09-29 13:12:22,en,thehockeyindia akashdeeps manpreetpawar svsunil indiasports cmoodisha sportsodisha mediasai,1,0,@TheHockeyIndia @akashdeeps985 @manpreetpawar07 @SVSunil24 @IndiaSports @CMO_Odisha @sports_odisha @Media_SAI… https://t.co/lUUqcOShY1,"[thehockeyindia, akashdeeps, manpreetpawar, svsunil, indiasports, cmoodisha, sportsodisha, mediasai]","['thehockeyindia', 'akashdeeps', 'manpreetpawar', 'svsunil', 'indiasports', 'cmoodisha', 'sportsodisha', 'mediasai']"
879,1178214278580428800,rakeshrussell52,2019-09-29 07:45:48,en,andibeth: wonderful newskeena #safe #rescuedout (/) #carsonshelter #la #ca can't tell u thrilled amhallel,0,263,"RT @andibeth012: WONDERFUL NEWS💖KEENA is #SAFE🙌😍🥳
#RESCUED🎊🎉🎊OUT (09/28) #CarsonShelter #LA #CA🥳 I can't tell U how THRILLED I AM!😀🙏💃HALLEL…","[andibeth:, wonderful, newskeena, #safe, #rescuedout, (/), #carsonshelter, #la, #ca, can't, tell, u, thrilled, amhallel]","['andibeth', 'wonderful', 'newskeena', 'safe', 'rescuedout', 'carsonshelter', 'la', 'tell', 'thrill', 'amhallel']"
880,1178002983826550784,rakeshrussell52,2019-09-28 17:46:12,en,qamarulhaq heard oman touring pakistan play four matches lahore germany next month best team,0,0,@qamarulhaq97 Heard Oman is touring Pakistan to play four matches in Lahore and in Germany next month all the best for your team,"[qamarulhaq, heard, oman, touring, pakistan, play, four, matches, lahore, germany, next, month, best, team]","['qamarulhaq', 'hear', 'oman', 'tour', 'pakistan', 'play', 'match', 'lahore', 'germany', 'month', 'good', 'team']"
881,1178002743685894145,rakeshrussell52,2019-09-28 17:45:14,en,qamarulhaq wait till india qualifies next year india playing pro league helpful olympic next year,0,0,"@qamarulhaq97 Wait till India qualifies , and next year India playing Pro League will be helpful in Olympic next year","[qamarulhaq, wait, till, india, qualifies, next, year, india, playing, pro, league, helpful, olympic, next, year]","['qamarulhaq', 'wait', 'till', 'india', 'qualify', 'year', 'india', 'play', 'pro', 'league', 'helpful', 'olympic', 'year']"
882,1178002043270647808,rakeshrussell52,2019-09-28 17:42:27,en,redsparrow paid crowds openely threatening blood bath uff noticed al jazeera telecast,1,0,@redsparrow1010 Paid crowds openely threatening blood bath uff and if you noticed in Al Jazeera they telecast only… https://t.co/PzC1ovnK8h,"[redsparrow, paid, crowds, openely, threatening, blood, bath, uff, noticed, al, jazeera, telecast]","['redsparrow', 'pay', 'crowd', 'openely', 'threaten', 'blood', 'bath', 'uff', 'notice', 'al', 'jazeera', 'telecast']"
883,1177994258659209216,rakeshrussell52,2019-09-28 17:11:31,en,jpace prasannaharitas thehockeyindia harmanpreet reidgj mandeepsingh manpreetpawar rupinderbob,1,0,@jpace1986 @prasannaharitas @TheHockeyIndia @13harmanpreet @reidgj @mandeepsingh995 @manpreetpawar07 @rupinderbob3… https://t.co/flmETM3QUf,"[jpace, prasannaharitas, thehockeyindia, harmanpreet, reidgj, mandeepsingh, manpreetpawar, rupinderbob]","['jpace', 'prasannaharitas', 'thehockeyindia', 'harmanpreet', 'reidgj', 'mandeepsingh', 'manpreetpawar', 'rupinderbob']"
884,1177981730268934144,rakeshrussell52,2019-09-28 16:21:44,en,harmanpreet scores brace india thrashes spain - via sportstarweb anubhavdps per,4,0,Harmanpreet scores brace as India thrashes Spain 6-1  https://t.co/1LrrR83q1S via @sportstarweb @anubhavdps As per… https://t.co/DPotZVqysI,"[harmanpreet, scores, brace, india, thrashes, spain, -, via, sportstarweb, anubhavdps, per]","['harmanpreet', 'scores', 'brace', 'india', 'thrash', 'spain', 'sportstarweb', 'anubhavdps']"
885,1177979225506107392,rakeshrussell52,2019-09-28 16:11:47,en,redsparrow yesterday saw live speech telecasted shameless stooge al jazeera disgusting speech,1,0,@redsparrow1010 Yesterday i saw his live speech telecasted by the shameless stooge Al Jazeera his disgusting speech… https://t.co/HTVh0OazED,"[redsparrow, yesterday, saw, live, speech, telecasted, shameless, stooge, al, jazeera, disgusting, speech]","['redsparrow', 'yesterday', 'see', 'live', 'speech', 'telecast', 'shameless', 'stooge', 'al', 'jazeera', 'disgusting', 'speech']"
886,1177978684667379712,rakeshrussell52,2019-09-28 16:09:38,und,qamarulhaq,0,0,@qamarulhaq97 https://t.co/Y731sBAPrl,[qamarulhaq],['qamarulhaq']
887,1177978389128368129,rakeshrussell52,2019-09-28 16:08:28,und,redsparrow,1,0,@redsparrow1010 https://t.co/DUyoCOeqTJ,[redsparrow],['redsparrow']
888,1177974812112670720,rakeshrussell52,2019-09-28 15:54:15,en,anubhavdps thehockeyindia harmanpreet reidgj mandeepsingh go click esp ind match link teams column show,0,0,@anubhavdps @TheHockeyIndia @13harmanpreet @reidgj @mandeepsingh995 Go and click the ESP IND match link in that teams column it will show,"[anubhavdps, thehockeyindia, harmanpreet, reidgj, mandeepsingh, go, click, esp, ind, match, link, teams, column, show]","['anubhavdps', 'thehockeyindia', 'harmanpreet', 'reidgj', 'mandeepsingh', 'click', 'esp', 'ind', 'match', 'link', 'team', 'column']"
889,1177973601787449346,rakeshrussell52,2019-09-28 15:49:27,en,anubhavdps thehockeyindia harmanpreet reidgj mandeepsingh team tab see,0,0,@anubhavdps @TheHockeyIndia @13harmanpreet @reidgj @mandeepsingh995 In team tab you can see it,"[anubhavdps, thehockeyindia, harmanpreet, reidgj, mandeepsingh, team, tab, see]","['anubhavdps', 'thehockeyindia', 'harmanpreet', 'reidgj', 'mandeepsingh', 'team', 'tab']"
890,1177973003138695170,rakeshrussell52,2019-09-28 15:47:04,en,prasannaharitas thehockeyindia harmanpreet reidgj mandeepsingh manpreetpawar rupinderbob,6,0,@prasannaharitas @TheHockeyIndia @13harmanpreet @reidgj @mandeepsingh995 @manpreetpawar07 @rupinderbob3… https://t.co/FXIjoJIPGf,"[prasannaharitas, thehockeyindia, harmanpreet, reidgj, mandeepsingh, manpreetpawar, rupinderbob]","['prasannaharitas', 'thehockeyindia', 'harmanpreet', 'reidgj', 'mandeepsingh', 'manpreetpawar', 'rupinderbob']"
891,1177972234264043520,rakeshrussell52,2019-09-28 15:44:00,en,thehockeyindia harmanpreet reidgj mandeepsingh manpreetpawar rupinderbob indiasports sportsodisha,1,0,@TheHockeyIndia @13harmanpreet @reidgj @mandeepsingh995 @manpreetpawar07 @rupinderbob3 @IndiaSports @sports_odisha… https://t.co/ZE1DVh6e0o,"[thehockeyindia, harmanpreet, reidgj, mandeepsingh, manpreetpawar, rupinderbob, indiasports, sportsodisha]","['thehockeyindia', 'harmanpreet', 'reidgj', 'mandeepsingh', 'manpreetpawar', 'rupinderbob', 'indiasports', 'sportsodisha']"
892,1177971889999794178,rakeshrussell52,2019-09-28 15:42:38,en,anubhavdps thehockeyindia harmanpreet reidgj mandeepsingh hey check link,0,1,@anubhavdps @TheHockeyIndia @13harmanpreet @reidgj @mandeepsingh995 Hey you can check with this link… https://t.co/aCuNOLtdoH,"[anubhavdps, thehockeyindia, harmanpreet, reidgj, mandeepsingh, hey, check, link]","['anubhavdps', 'thehockeyindia', 'harmanpreet', 'reidgj', 'mandeepsingh', 'hey', 'check', 'link']"
893,1177968904938741760,rakeshrussell52,2019-09-28 15:30:47,en,thehockeyindia harmanpreet reidgj mandeepsingh bobby back bang,0,0,@TheHockeyIndia @13harmanpreet @reidgj @mandeepsingh995 Bobby is back with an bang,"[thehockeyindia, harmanpreet, reidgj, mandeepsingh, bobby, back, bang]","['thehockeyindia', 'harmanpreet', 'reidgj', 'mandeepsingh', 'bobby', 'bang']"
894,1177966915970449408,rakeshrussell52,2019-09-28 15:22:52,en,thehockeyindia harmanpreet reidgj leading - spain easy thing played competitive,2,0,"@TheHockeyIndia @13harmanpreet @reidgj Leading 4-1 against Spain is not an easy thing , as they played competitive… https://t.co/edFgpsbTdq","[thehockeyindia, harmanpreet, reidgj, leading, -, spain, easy, thing, played, competitive]","['thehockeyindia', 'harmanpreet', 'reidgj', 'leading', 'spain', 'easy', 'thing', 'play', 'competitive']"
895,1177964550143926272,rakeshrussell52,2019-09-28 15:13:28,en,thehockeyindia harmanpreet reidgj australian hit run game desi attacking mode working wonders,0,0,@TheHockeyIndia @13harmanpreet @reidgj Australian hit and run game with our desi attacking mode working wonders,"[thehockeyindia, harmanpreet, reidgj, australian, hit, run, game, desi, attacking, mode, working, wonders]","['thehockeyindia', 'harmanpreet', 'reidgj', 'australian', 'hit', 'run', 'game', 'desi', 'attacking', 'mode', 'working', 'wonder']"
896,1177963971220893696,rakeshrussell52,2019-09-28 15:11:10,en,saatvikshah thehockeyindia gbhockey indiasports cmoodisha sportsodisha mediasai imranirampal main players,1,0,@saatvikshah2 @TheHockeyIndia @GBHockey @IndiaSports @CMO_Odisha @sports_odisha @Media_SAI @imranirampal All are main players,"[saatvikshah, thehockeyindia, gbhockey, indiasports, cmoodisha, sportsodisha, mediasai, imranirampal, main, players]","['saatvikshah', 'thehockeyindia', 'gbhockey', 'indiasports', 'cmoodisha', 'sportsodisha', 'mediasai', 'imranirampal', 'main', 'player']"
897,1177962577734668295,rakeshrussell52,2019-09-28 15:05:38,en,thehockeyindia harmanpreet boys lunch,2,0,@TheHockeyIndia @13harmanpreet What our boys had for lunch ?,"[thehockeyindia, harmanpreet, boys, lunch]","['thehockeyindia', 'harmanpreet', 'boys', 'lunch']"
898,1177942599287525377,rakeshrussell52,2019-09-28 13:46:15,en,thehockeyindia indiasports cmoodisha sportsodisha mediasai manpreetpawar tough game spain,0,0,@TheHockeyIndia @IndiaSports @CMO_Odisha @sports_odisha @Media_SAI @manpreetpawar07 Tough game against Spain but if… https://t.co/vbXW33KIQn,"[thehockeyindia, indiasports, cmoodisha, sportsodisha, mediasai, manpreetpawar, tough, game, spain]","['thehockeyindia', 'indiasports', 'cmoodisha', 'sportsodisha', 'mediasai', 'manpreetpawar', 'tough', 'game', 'spain']"
899,1177939434752204800,rakeshrussell52,2019-09-28 13:33:40,en,thehockeyindia: game mode : #teamindia start following players lets go get #indiakagame #belgiumtour ht,0,2,"RT @TheHockeyIndia: GAME MODE : 🔛

#TeamIndia will start with the following 11 players! Let’s go, get them 👊🏼

#IndiaKaGame #BelgiumTour ht…","[thehockeyindia:, game, mode, :, #teamindia, start, following, players, lets, go, get, #indiakagame, #belgiumtour, ht]","['thehockeyindia', 'game', 'mode', 'teamindia', 'start', 'follow', 'player', 'let', 'indiakagame', 'belgiumtour', 'ht']"
900,1177658787458478080,rakeshrussell52,2019-09-27 18:58:29,en,thehockeyindia: gbhockey indiasports cmoodisha sportsodisha mediasai ft: - goal scorers india: - sharmila - gurji,0,15,"RT @TheHockeyIndia: @GBHockey @IndiaSports @CMO_Odisha @sports_odisha @Media_SAI FT: 🇬🇧 1-2 🇮🇳

Goal Scorers for India:
- Sharmila 
- Gurji…","[thehockeyindia:, gbhockey, indiasports, cmoodisha, sportsodisha, mediasai, ft:, -, goal, scorers, india:, -, sharmila, -, gurji]","['thehockeyindia', 'gbhockey', 'indiasports', 'cmoodisha', 'sportsodisha', 'mediasai', 'ft', 'goal', 'scorer', 'india', 'sharmila', 'gurji']"
901,1177658541378691072,rakeshrussell52,2019-09-27 18:57:30,en,thehockeyindia gbhockey indiasports cmoodisha sportsodisha mediasai imranirampal boom boom go girls,2,0,@TheHockeyIndia @GBHockey @IndiaSports @CMO_Odisha @sports_odisha @Media_SAI @imranirampal Boom Boom go girls what… https://t.co/KxHRHHOHH2,"[thehockeyindia, gbhockey, indiasports, cmoodisha, sportsodisha, mediasai, imranirampal, boom, boom, go, girls]","['thehockeyindia', 'gbhockey', 'indiasports', 'cmoodisha', 'sportsodisha', 'mediasai', 'imranirampal', 'boom', 'boom', 'girl']"
902,1177620032265703424,rakeshrussell52,2019-09-27 16:24:29,en,selfpass: studying recent footage top nations belgium netherlands germany build-up behaviours try summarise,0,1,"RT @self_pass: Studying recent footage from top nations Belgium, Netherlands and Germany and their build-up behaviours to try to summarise…","[selfpass:, studying, recent, footage, top, nations, belgium, netherlands, germany, build-up, behaviours, try, summarise]","['selfpass', 'study', 'recent', 'footage', 'nation', 'belgium', 'netherlands', 'germany', 'build', 'behaviour', 'try', 'summarise']"
903,1177619983129427968,rakeshrussell52,2019-09-27 16:24:17,en,selfpass pre tournament preparations training work ethics,0,0,"@self_pass Their pre tournament preparations, training and their work ethics ?","[selfpass, pre, tournament, preparations, training, work, ethics]","['selfpass', 'pre', 'tournament', 'preparation', 'train', 'work', 'ethic']"
904,1177619276351459328,rakeshrussell52,2019-09-27 16:21:29,pt,fihhockey absolutafem rfehockey barcelona,0,0,@FIH_Hockey @AbsolutaFem @rfe_hockey 1992 Barcelona,"[fihhockey, absolutafem, rfehockey, barcelona]","['fihhockey', 'absolutafem', 'rfehockey', 'barcelona']"
905,1177610851542392833,rakeshrussell52,2019-09-27 15:48:00,en,farhanahmed tarekfatah imrankhanpti hey aaloo faced fellow shut damn mouth bikharis people,0,0,@Farhan_Ahmed80 @TarekFatah @ImranKhanPTI Hey Aaloo faced fellow shut the damn mouth of yours bikharis you people a… https://t.co/UETogObBfh,"[farhanahmed, tarekfatah, imrankhanpti, hey, aaloo, faced, fellow, shut, damn, mouth, bikharis, people]","['farhanahmed', 'tarekfatah', 'imrankhanpti', 'hey', 'aaloo', 'face', 'fellow', 'shut', 'damn', 'mouth', 'bikharis', 'people']"
906,1177609894041542656,rakeshrussell52,2019-09-27 15:44:12,en,tarekfatah imrankhanpti nonsense speech sir talks kashmiris rohingyas gutts talk,54,5,@TarekFatah @ImranKhanPTI Nonsense speech sir he talks about Kashmiris rohingyas but doesn't have the gutts to talk… https://t.co/A22Tc48DkE,"[tarekfatah, imrankhanpti, nonsense, speech, sir, talks, kashmiris, rohingyas, gutts, talk]","['tarekfatah', 'imrankhanpti', 'nonsense', 'speech', 'sir', 'talk', 'kashmiris', 'rohingyas', 'gutt', 'talk']"
907,1177560910790922240,rakeshrussell52,2019-09-27 12:29:33,en,icc hey icc know sub continent particularly month monsoon rains coul,0,0,@ICC Hey @ICC don't you know in Sub Continent in particularly in these month it will be monsoon with rains how coul… https://t.co/ywaAZeeLvS,"[icc, hey, icc, know, sub, continent, particularly, month, monsoon, rains, coul]","['icc', 'hey', 'icc', 'know', 'sub', 'continent', 'particularly', 'month', 'monsoon', 'rain', 'coul']"
908,1177465000828366852,rakeshrussell52,2019-09-27 06:08:27,en,thehockeyindia: icymi: candid images #belvind th september prove absolute cracker match take,0,1,RT @TheHockeyIndia: ICYMI: These candid images from #BELvIND on 26th September 2019 prove what an absolute cracker of a match it was! Take…,"[thehockeyindia:, icymi:, candid, images, #belvind, th, september, prove, absolute, cracker, match, take]","['thehockeyindia', 'icymi', 'candid', 'image', 'belvind', 'th', 'september', 'prove', 'absolute', 'cracker', 'match']"
