,id,username,created_at,lang,cleaned_tweets,favorite_count,retweet_count,text,tokens,lemmas
612,1192770354193690624,rakeshrussell52,2019-11-08 11:46:27,eu,qamarulhaq hockeyind pushpasspundits ashchandler idea,1,0,@qamarulhaq97 @hockeyind @pushpasspundits @AshChandler82 No idea,"[qamarulhaq, hockeyind, pushpasspundits, ashchandler, idea]","['qamarulhaq', 'hockeyind', 'pushpasspundits', 'ashchandler', 'idea']"
613,1192762712926736384,rakeshrussell52,2019-11-08 11:16:05,en,thehockeyindia indiasports cmoodisha sportsodisha mediasai fihhockey absolutamasc oranjehockey live,0,0,@TheHockeyIndia @IndiaSports @CMO_Odisha @sports_odisha @Media_SAI @FIH_Hockey @AbsolutaMasc @oranjehockey Live to… https://t.co/QuN5DDYmsr,"[thehockeyindia, indiasports, cmoodisha, sportsodisha, mediasai, fihhockey, absolutamasc, oranjehockey, live]","['thehockeyindia', 'indiasports', 'cmoodisha', 'sportsodisha', 'mediasai', 'fihhockey', 'absolutamasc', 'oranjehockey', 'live']"
614,1192762019637690368,rakeshrussell52,2019-11-08 11:13:20,und,hockeyind pushpasspundits ashchandler,1,0,@hockeyind @pushpasspundits @AshChandler82 https://t.co/HRv2zr1cvQ,"[hockeyind, pushpasspundits, ashchandler]","['hockeyind', 'pushpasspundits', 'ashchandler']"
615,1192718039688478722,rakeshrussell52,2019-11-08 08:18:34,en,maninderjitmike updates world cup announcement,0,0,@ManinderjitMike Any updates on World Cup announcement?,"[maninderjitmike, updates, world, cup, announcement]","['maninderjitmike', 'updates', 'world', 'cup', 'announcement']"
616,1192681890941227008,rakeshrussell52,2019-11-08 05:54:56,en,jaspreetssahni time host announcements hockey world cup announced fih sir,0,0,@JaspreetSSahni At what time host announcements of hockey World Cup will be announced by FIH sir?,"[jaspreetssahni, time, host, announcements, hockey, world, cup, announced, fih, sir]","['jaspreetssahni', 'time', 'host', 'announcement', 'hockey', 'world', 'cup', 'announce', 'fih', 'sir']"
617,1192400200989433856,rakeshrussell52,2019-11-07 11:15:36,en,ashchandler thing happens bring back game country youths that's sure,1,0,@AshChandler82 Just that thing happens that will bring back the game into our country youths that's for sure,"[ashchandler, thing, happens, bring, back, game, country, youths, that's, sure]","['ashchandler', 'thing', 'happen', 'bring', 'game', 'country', 'youth', 'sure']"
618,1192378013435883520,rakeshrussell52,2019-11-07 09:47:26,en,ashchandler nowadays cricket india sports becoming famous giving,2,0,"@AshChandler82 Nowadays Cricket is not the same as before in India , as other sports are becoming famous and giving… https://t.co/RGNaD0rn0G","[ashchandler, nowadays, cricket, india, sports, becoming, famous, giving]","['ashchandler', 'nowadays', 'cricket', 'india', 'sport', 'famous', 'giving']"
619,1192027662325178368,rakeshrussell52,2019-11-06 10:35:16,en,anitachauhan: uighur muslim women forced sleep chinese han men male chinese officials monitoring homes #uighurs reg,0,249,"RT @anita_chauhan80: Uighur Muslim Women Forced To Sleep With Chinese Han Men.

Male Chinese officials monitoring the homes of #Uighurs reg…","[anitachauhan:, uighur, muslim, women, forced, sleep, chinese, han, men, male, chinese, officials, monitoring, homes, #uighurs, reg]","['anitachauhan', 'uighur', 'muslim', 'woman', 'force', 'sleep', 'chinese', 'han', 'man', 'male', 'chinese', 'official', 'monitor', 'home', 'uighurs', 'reg']"
620,1191955273432342528,rakeshrussell52,2019-11-06 05:47:37,en,thebridgein jogging also good right,0,0,@TheBridge_IN Jogging is also good right?,"[thebridgein, jogging, also, good, right]","['thebridgein', 'jogging', 'good', 'right']"
621,1191932039483842560,rakeshrussell52,2019-11-06 04:15:17,en,socceriraq fifacom iraqfa good news,0,0,@SoccerIraq @FIFAcom @IRAQFA Not a good news,"[socceriraq, fifacom, iraqfa, good, news]","['socceriraq', 'fifacom', 'iraqfa', 'good', 'news']"
622,1191758660331900928,rakeshrussell52,2019-11-05 16:46:21,en,fihhockey world cup announcement streamed live fb page youtube,0,0,@FIH_Hockey Will the World Cup announcement will be streamed live on FB page or in youtube?,"[fihhockey, world, cup, announcement, streamed, live, fb, page, youtube]","['fihhockey', 'world', 'cup', 'announcement', 'stream', 'live', 'fb', 'page', 'youtube']"
623,1191701602354089985,rakeshrussell52,2019-11-05 12:59:37,en,fihhockey: thanks teams involved fih hockey olympic qualifiers offered fans great hockey #gifto,0,3,"RT @FIH_Hockey: Thanks to all teams involved in the FIH Hockey Olympic qualifiers for having offered to all fans such great hockey!

#GiftO…","[fihhockey:, thanks, teams, involved, fih, hockey, olympic, qualifiers, offered, fans, great, hockey, #gifto]","['fihhockey', 'thank', 'team', 'involve', 'fih', 'hockey', 'olympic', 'qualifiers', 'offer', 'fan', 'great', 'hockey', 'gifto']"
624,1191393067963564032,rakeshrussell52,2019-11-04 16:33:37,en,dhanrajpillay: well done indian womans hockey team congratulations players coaching staff well played second half,0,12,"RT @dhanrajpillay1: Well done, Indian 👕 Womans Hockey Team, Congratulations to all the players and coaching staff, well played second half…","[dhanrajpillay:, well, done, indian, womans, hockey, team, congratulations, players, coaching, staff, well, played, second, half]","['dhanrajpillay', 'indian', 'womans', 'hockey', 'team', 'congratulation', 'player', 'coach', 'staff', 'play', 'second', 'half']"
625,1191383697137659905,rakeshrussell52,2019-11-04 15:56:22,en,hockey insider: indias multi-million offer host world cup causes turbulence among bidders - firstpost,5,3,The Hockey Insider: India’s multi-million offer to host World Cup causes turbulence among bidders - Firstpost… https://t.co/xQfrCezapQ,"[hockey, insider:, indias, multi-million, offer, host, world, cup, causes, turbulence, among, bidders, -, firstpost]","['hockey', 'insider', 'indias', 'multi', 'million', 'offer', 'host', 'world', 'cup', 'cause', 'turbulence', 'bidder', 'firstpost']"
626,1191381750661861376,rakeshrussell52,2019-11-04 15:48:38,ar,presstv,1,0,@PressTV زعفران,[presstv],['presstv']
627,1191381216420753409,rakeshrussell52,2019-11-04 15:46:31,en,gazwaihind hadhlil majorpoonia pmoindia adgpi narendramodi amitshah rjraunac rssorg balochistan beco,0,0,@Gazwaihind @HAdhlil1 @MajorPoonia @PMOIndia @adgpi @narendramodi @AmitShah @rjraunac @RSSorg Balochistan will beco… https://t.co/8Y3TsMHPrI,"[gazwaihind, hadhlil, majorpoonia, pmoindia, adgpi, narendramodi, amitshah, rjraunac, rssorg, balochistan, beco]","['gazwaihind', 'hadhlil', 'majorpoonia', 'pmoindia', 'adgpi', 'narendramodi', 'amitshah', 'rjraunac', 'rssorg', 'balochistan', 'beco']"
628,1191378421374320642,rakeshrussell52,2019-11-04 15:35:25,en,presstv mostly available indian state jammu kashmir,1,0,@PressTV It's mostly available in my Indian state of Jammu and Kashmir,"[presstv, mostly, available, indian, state, jammu, kashmir]","['presstv', 'available', 'indian', 'state', 'jammu', 'kashmir']"
629,1191377834649870336,rakeshrussell52,2019-11-04 15:33:05,en,hadhlil majorpoonia pmoindia adgpi narendramodi amitshah rjraunac rssorg dreams,1,0,@HAdhlil1 @MajorPoonia @PMOIndia @adgpi @narendramodi @AmitShah @rjraunac @RSSorg In your dreams,"[hadhlil, majorpoonia, pmoindia, adgpi, narendramodi, amitshah, rjraunac, rssorg, dreams]","['hadhlil', 'majorpoonia', 'pmoindia', 'adgpi', 'narendramodi', 'amitshah', 'rjraunac', 'rssorg', 'dream']"
630,1191376489154899969,rakeshrussell52,2019-11-04 15:27:44,en,hadhlil majorpoonia pmoindia adgpi narendramodi amitshah rjraunac rssorg surely see pakistan break many parts,4,0,@HAdhlil1 @MajorPoonia @PMOIndia @adgpi @narendramodi @AmitShah @rjraunac @RSSorg Surely we will see Pakistan break into many parts,"[hadhlil, majorpoonia, pmoindia, adgpi, narendramodi, amitshah, rjraunac, rssorg, surely, see, pakistan, break, many, parts]","['hadhlil', 'majorpoonia', 'pmoindia', 'adgpi', 'narendramodi', 'amitshah', 'rjraunac', 'rssorg', 'surely', 'pakistan', 'break', 'part']"
631,1191376202247757825,rakeshrussell52,2019-11-04 15:26:35,en,majorpoonia pmoindia adgpi narendramodi amitshah rjraunac rssorg jai hind waiting day take pok gilgit,7,0,"@MajorPoonia @PMOIndia @adgpi @narendramodi @AmitShah @rjraunac @RSSorg Jai Hind, waiting for the day when we take POK and Gilgit","[majorpoonia, pmoindia, adgpi, narendramodi, amitshah, rjraunac, rssorg, jai, hind, waiting, day, take, pok, gilgit]","['majorpoonia', 'pmoindia', 'adgpi', 'narendramodi', 'amitshah', 'rjraunac', 'rssorg', 'jai', 'hind', 'waiting', 'day', 'pok', 'gilgit']"
632,1191280246495924224,rakeshrussell52,2019-11-04 09:05:18,en,olympicchannel rfehockey tokyo fihhockey india wish indian team win medal,0,0,@olympicchannel @rfe_hockey @Tokyo2020 @FIH_Hockey India 🇮🇳🇮🇳🇮🇳 i wish Indian team to win a medal,"[olympicchannel, rfehockey, tokyo, fihhockey, india, wish, indian, team, win, medal]","['olympicchannel', 'rfehockey', 'tokyo', 'fihhockey', 'india', 'wish', 'indian', 'team', 'win', 'medal']"
633,1191248335530688512,rakeshrussell52,2019-11-04 06:58:30,en,dugongturtleaus: apologies sick shit important people comprehend rife extreme cruelty australias endangered,0,589,"RT @DugongTurtleAus: Apologies for this sick shit but it’s important people comprehend the rife, extreme cruelty on Australia’s endangered…","[dugongturtleaus:, apologies, sick, shit, important, people, comprehend, rife, extreme, cruelty, australias, endangered]","['dugongturtleaus', 'apology', 'sick', 'shit', 'important', 'people', 'comprehend', 'rife', 'extreme', 'cruelty', 'australias', 'endanger']"
634,1191246158808506368,rakeshrussell52,2019-11-04 06:49:51,en,dheenashankar semma padam semma acting thala movie ravi kumar sir bought best ajith th,0,0,"@Dheena_shankar Semma padam semma acting by thala in this movie , Ravi Kumar sir bought the best out of Ajith in th… https://t.co/oTwviPfPq6","[dheenashankar, semma, padam, semma, acting, thala, movie, ravi, kumar, sir, bought, best, ajith, th]","['dheenashankar', 'semma', 'padam', 'semma', 'act', 'thala', 'movie', 'ravi', 'kumar', 'sir', 'buy', 'good', 'ajith', 'th']"
635,1191235083614576641,rakeshrussell52,2019-11-04 06:05:50,en,ahmedalbasheer throwaway iran supporters iraq come iraqis never,0,0,@ahmedalbasheer1 Throwaway Iran and it's supporters out of Iraq come on Iraqis it's now or never,"[ahmedalbasheer, throwaway, iran, supporters, iraq, come, iraqis, never]","['ahmedalbasheer', 'throwaway', 'iran', 'supporter', 'iraq', 'come', 'iraqis']"
636,1191234577907343360,rakeshrussell52,2019-11-04 06:03:50,en,jaspreetssahni clutchplay chance hil come,0,0,@JaspreetSSahni @clutchplay Any chance of HIL will come up?,"[jaspreetssahni, clutchplay, chance, hil, come]","['jaspreetssahni', 'clutchplay', 'chance', 'hil', 'come']"
637,1191234333719154700,rakeshrussell52,2019-11-04 06:02:51,en,thehockeyindia indiasports cmoodisha sportsodisha mediasai chief coach,0,0,@TheHockeyIndia @IndiaSports @CMO_Odisha @sports_odisha @Media_SAI How about the Chief coach?,"[thehockeyindia, indiasports, cmoodisha, sportsodisha, mediasai, chief, coach]","['thehockeyindia', 'indiasports', 'cmoodisha', 'sportsodisha', 'mediasai', 'chief', 'coach']"
638,1191232783735066624,rakeshrussell52,2019-11-04 05:56:42,en,tokyo qualification sealed india hockey teams look iron flaws - sports - hindustan times,2,0,"Tokyo qualification sealed, India hockey teams now look to iron out flaws - other sports - Hindustan Times https://t.co/PU1vWUNhms","[tokyo, qualification, sealed, india, hockey, teams, look, iron, flaws, -, sports, -, hindustan, times]","['tokyo', 'qualification', 'seal', 'india', 'hockey', 'team', 'look', 'iron', 'flaw', 'sports', 'hindustan', 'time']"
639,1191227919026147328,rakeshrussell52,2019-11-04 05:37:22,en,jaspreetssahni clutchplay sir india talent hunt program like cricket plann,0,0,@JaspreetSSahni @clutchplay Sir in India we don't have the talent hunt program just like in Cricket they have plann… https://t.co/YylZ7q7ZNY,"[jaspreetssahni, clutchplay, sir, india, talent, hunt, program, like, cricket, plann]","['jaspreetssahni', 'clutchplay', 'sir', 'india', 'talent', 'hunt', 'program', 'like', 'cricket', 'plann']"
640,1191200822819844096,rakeshrussell52,2019-11-04 03:49:42,en,ranjalaaldin iran deserve interfe other's affairs happens,1,1,"@RanjAlaaldin Iran you deserve this , when you interfe in other's affairs this is what happens","[ranjalaaldin, iran, deserve, interfe, other's, affairs, happens]","['ranjalaaldin', 'iran', 'deserve', 'interfe', 'affair', 'happen']"
641,1191199665766580224,rakeshrussell52,2019-11-04 03:45:06,en,realpreityzinta mujeebr son teaching mom good one preity zinta mam keep,0,0,@realpreityzinta @Mujeeb_R88 Son teaching mom a good one Preity Zinta mam keep it up,"[realpreityzinta, mujeebr, son, teaching, mom, good, one, preity, zinta, mam, keep]","['realpreityzinta', 'mujeebr', 'son', 'teach', 'mom', 'good', 'preity', 'zinta', 'mam']"
642,1191198841153810432,rakeshrussell52,2019-11-04 03:41:49,en,misrasundeep hope sir fih comes better planning execute league lower ranked teams,0,0,@MisraSundeep Hope sir  FIH comes up with better planning to execute this league for lower ranked teams,"[misrasundeep, hope, sir, fih, comes, better, planning, execute, league, lower, ranked, teams]","['misrasundeep', 'hope', 'sir', 'fih', 'come', 'well', 'plan', 'execute', 'league', 'lower', 'rank', 'team']"
643,1191194918678491136,rakeshrussell52,2019-11-04 03:26:14,hi,bollywoodirect kadhal desam,0,0,@Bollywoodirect Kadhal Desam,"[bollywoodirect, kadhal, desam]","['bollywoodirect', 'kadhal', 'desam']"
644,1191194668731551744,rakeshrussell52,2019-11-04 03:25:15,en,misrasundeep hello sir pro league format lower ranked teams starting next year decis,0,0,@MisraSundeep Hello sir will there be a Pro League format for lower ranked teams starting next year? Will the decis… https://t.co/xKSvVfvPaU,"[misrasundeep, hello, sir, pro, league, format, lower, ranked, teams, starting, next, year, decis]","['misrasundeep', 'hello', 'sir', 'pro', 'league', 'format', 'lower', 'ranked', 'team', 'start', 'year', 'decis']"
645,1191193938050326528,rakeshrussell52,2019-11-04 03:22:20,en,misrasundeep yes sir india part pro league since played six months surely,1,0,"@MisraSundeep Yes sir by now India part of Pro League, since it will be played for six months we will surely have a… https://t.co/PBjDcfI7Tv","[misrasundeep, yes, sir, india, part, pro, league, since, played, six, months, surely]","['misrasundeep', 'yes', 'sir', 'india', 'pro', 'league', 'play', 'month', 'surely']"
646,1191191968161751040,rakeshrussell52,2019-11-04 03:14:31,en,andydb fihhockey tokyo olympicchannel olympics surely friday know quali,0,0,@ANDYDB7 @FIH_Hockey @Tokyo2020 @olympicchannel @Olympics Surely by this Friday we will know what will be the quali… https://t.co/8nT3MO3SMI,"[andydb, fihhockey, tokyo, olympicchannel, olympics, surely, friday, know, quali]","['andydb', 'fihhockey', 'tokyo', 'olympicchannel', 'olympics', 'surely', 'friday', 'know', 'quali']"
647,1191191267100639232,rakeshrussell52,2019-11-04 03:11:43,en,fihhockey irishhockey fieldhockeycan irewomenhockey olympicchannel olympics tokyo really watch,0,0,@FIH_Hockey @irishhockey @FieldHockeyCan @IreWomenHockey @olympicchannel @Olympics @Tokyo2020 Really watch out for… https://t.co/chznhAMiNj,"[fihhockey, irishhockey, fieldhockeycan, irewomenhockey, olympicchannel, olympics, tokyo, really, watch]","['fihhockey', 'irishhockey', 'fieldhockeycan', 'irewomenhockey', 'olympicchannel', 'olympics', 'tokyo', 'watch']"
648,1191190977584648192,rakeshrussell52,2019-11-04 03:10:34,en,fihhockey: fih hockey olympic qualifiers match : ireland vs canada highlights #roadtotokyo #giftofhockey #tokyo irishhockey,0,43,"RT @FIH_Hockey: FIH Hockey Olympic qualifiers, Match 28: Ireland vs Canada highlights

#RoadToTokyo #GiftOfHockey #Tokyo2020

@irishhockey…","[fihhockey:, fih, hockey, olympic, qualifiers, match, :, ireland, vs, canada, highlights, #roadtotokyo, #giftofhockey, #tokyo, irishhockey]","['fihhockey', 'fih', 'hockey', 'olympic', 'qualifiers', 'match', 'ireland', 'vs', 'canada', 'highlight', 'roadtotokyo', 'giftofhockey', 'tokyo', 'irishhockey']"
649,1191042535315001344,rakeshrussell52,2019-11-03 17:20:43,en,hockeyind team line ups confirmed men list below: argentina australia belgium canada,1,0,"@hockeyind Team line ups confirmed for men here the list below:
1. Argentina
2. Australia
3. Belgium
4. Canada 
5.… https://t.co/BScnjZ73VA","[hockeyind, team, line, ups, confirmed, men, list, below:, argentina, australia, belgium, canada]","['hockeyind', 'team', 'line', 'up', 'confirm', 'man', 'list', 'argentina', 'australia', 'belgium', 'canada']"
650,1190959149896519680,rakeshrussell52,2019-11-03 11:49:22,en,iraqiproplayers matches played basra per schedule changed since anti government,0,0,@IraqiProPlayers Will matches be played at Basra as per schedule? Or will it be changed? since the anti government… https://t.co/GaenbcnH66,"[iraqiproplayers, matches, played, basra, per, schedule, changed, since, anti, government]","['iraqiproplayers', 'match', 'play', 'basra', 'schedule', 'change', 'anti', 'government']"
651,1190860538374324224,rakeshrussell52,2019-11-03 05:17:32,en,ashchandler misrasundeep harjeet complete player since playing dutch league made com,2,0,@AshChandler82 @MisraSundeep Harjeet will now be an complete player since playing in Dutch league will made him com… https://t.co/bm530Hs48A,"[ashchandler, misrasundeep, harjeet, complete, player, since, playing, dutch, league, made, com]","['ashchandler', 'misrasundeep', 'harjeet', 'complete', 'player', 'play', 'dutch', 'league', 'com']"
652,1190859963855278083,rakeshrussell52,2019-11-03 05:15:15,en,misrasundeep surely top teams part pro league vast pool players play matches hope none,0,0,"@MisraSundeep So surely all top teams part of Pro League will have vast pool of players to play matches , hope none… https://t.co/JlTBWD57RM","[misrasundeep, surely, top, teams, part, pro, league, vast, pool, players, play, matches, hope, none]","['misrasundeep', 'surely', 'team', 'pro', 'league', 'vast', 'pool', 'player', 'play', 'match', 'hope']"
653,1190841783040630784,rakeshrussell52,2019-11-03 04:03:00,en,ashchandler misrasundeep yes next year surely rankings based matches based test matches bi,1,0,@AshChandler82 @MisraSundeep Yes next year surely rankings will be based on matches based so these test matches bi… https://t.co/qGQ7FGSiNA,"[ashchandler, misrasundeep, yes, next, year, surely, rankings, based, matches, based, test, matches, bi]","['ashchandler', 'misrasundeep', 'yes', 'year', 'surely', 'ranking', 'base', 'match', 'base', 'test', 'match', 'bi']"
654,1190840432084713472,rakeshrussell52,2019-11-03 03:57:38,en,anubhavdps misrasundeep ya especially midfield needs stability hope chinglen sumit harjeet return sta,1,0,@anubhavdps @MisraSundeep Ya especially in midfield needs stability hope Chinglen Sumit and Harjeet return will sta… https://t.co/pX9bdoo0uh,"[anubhavdps, misrasundeep, ya, especially, midfield, needs, stability, hope, chinglen, sumit, harjeet, return, sta]","['anubhavdps', 'misrasundeep', 'ya', 'especially', 'midfield', 'need', 'stability', 'hope', 'chinglen', 'sumit', 'harjeet', 'return', 'sta']"
655,1190689515410640897,rakeshrussell52,2019-11-02 17:57:57,en,imranirampal: real honour featured cover theweeklive magazine,0,116,RT @imranirampal: It’s a real honour for me to be featured on the cover of @TheWeekLive magazine. https://t.co/ijKdZRj3bb,"[imranirampal:, real, honour, featured, cover, theweeklive, magazine]","['imranirampal', 'real', 'honour', 'feature', 'cover', 'theweeklive', 'magazine']"
656,1190679208034390017,rakeshrussell52,2019-11-02 17:16:59,in,fihhockey gbhockey hockeymalaysia go malaysia,1,0,@FIH_Hockey @_GBHockey @hockeymalaysia Go Malaysia,"[fihhockey, gbhockey, hockeymalaysia, go, malaysia]","['fihhockey', 'gbhockey', 'hockeymalaysia', 'malaysia']"
657,1190676459720826882,rakeshrussell52,2019-11-02 17:06:04,en,virenrasquinha surely sir hope team's comes medal contenders bring hope olympic medal reign,2,0,@virenrasquinha Surely sir hope both our team's comes as an medal contenders and bring hope the Olympic medal reign… https://t.co/27dOCpNMHr,"[virenrasquinha, surely, sir, hope, team's, comes, medal, contenders, bring, hope, olympic, medal, reign]","['virenrasquinha', 'surely', 'sir', 'hope', 'team', 'come', 'medal', 'contender', 'bring', 'hope', 'olympic', 'medal', 'reign']"
658,1190672765134635010,rakeshrussell52,2019-11-02 16:51:23,en,fihhockey gbhockey malaysiahockey come speedy tigers,0,0,@FIH_Hockey @GBHockey @malaysiahockey Come on Speedy tigers,"[fihhockey, gbhockey, malaysiahockey, come, speedy, tigers]","['fihhockey', 'gbhockey', 'malaysiahockey', 'come', 'speedy', 'tiger']"
659,1190672304147185669,rakeshrussell52,2019-11-02 16:49:33,ht,narendramodi nandri modi sir,0,0,@narendramodi Nandri Modi sir,"[narendramodi, nandri, modi, sir]","['narendramodi', 'nandri', 'modi', 'sir']"
660,1190671686229585920,rakeshrussell52,2019-11-02 16:47:06,en,anshulchavhan thehockeyindia men's women's teams must work hard medal contender next year olympics,0,0,@anshul_chavhan @TheHockeyIndia Now our men's and women's teams must work hard to be an medal contender in next year Olympics,"[anshulchavhan, thehockeyindia, men's, women's, teams, must, work, hard, medal, contender, next, year, olympics]","['anshulchavhan', 'thehockeyindia', 'man', 'woman', 'team', 'work', 'hard', 'medal', 'contender', 'year', 'olympics']"
661,1190671025467322368,rakeshrussell52,2019-11-02 16:44:28,en,fihhockey: fih hockey olympic qualifiers match : india vs usa highlights #roadtotokyo #giftofhockey #tokyo thehockeyindia u,0,37,"RT @FIH_Hockey: FIH Hockey Olympic qualifiers, Match 16: India vs USA highlights

#RoadToTokyo #GiftOfHockey #Tokyo2020

@TheHockeyIndia @U…","[fihhockey:, fih, hockey, olympic, qualifiers, match, :, india, vs, usa, highlights, #roadtotokyo, #giftofhockey, #tokyo, thehockeyindia, u]","['fihhockey', 'fih', 'hockey', 'olympic', 'qualifiers', 'match', 'india', 'vs', 'usa', 'highlight', 'roadtotokyo', 'giftofhockey', 'tokyo', 'thehockeyindia', 'u']"
662,1190670915362643968,rakeshrussell52,2019-11-02 16:44:02,en,fihhockey gbhockey malaysiahockey mouth watering clash,0,0,@FIH_Hockey @GBHockey @malaysiahockey An mouth watering clash,"[fihhockey, gbhockey, malaysiahockey, mouth, watering, clash]","['fihhockey', 'gbhockey', 'malaysiahockey', 'mouth', 'watering', 'clash']"
663,1190670719136350208,rakeshrussell52,2019-11-02 16:43:15,en,fihhockey: #indvusa #roadtotokyo #giftofhockey never gave last second usafieldhockey played wonderful hockey,0,14,"RT @FIH_Hockey: #INDvUSA #RoadToTokyo #GiftOfHockey 
""We never gave up until the last second and @USAFieldHockey played wonderful hockey to…","[fihhockey:, #indvusa, #roadtotokyo, #giftofhockey, never, gave, last, second, usafieldhockey, played, wonderful, hockey]","['fihhockey', 'indvusa', 'roadtotokyo', 'giftofhockey', 'give', 'second', 'usafieldhockey', 'play', 'wonderful', 'hockey']"
664,1190670511530840064,rakeshrussell52,2019-11-02 16:42:26,en,lilianacruz usafieldhockey anyway team bright future ahead best team,0,0,@Liliana__Cruz @USAFieldHockey Anyway your team has an bright future ahead all the best for the team,"[lilianacruz, usafieldhockey, anyway, team, bright, future, ahead, best, team]","['lilianacruz', 'usafieldhockey', 'team', 'bright', 'future', 'ahead', 'good', 'team']"
665,1190669358260867073,rakeshrussell52,2019-11-02 16:37:51,en,lilianacruz usafieldhockey well sense frustration woo woo made olympics,0,0,@Liliana__Cruz @USAFieldHockey Well i can sense frustration woo woo as we made it to Olympics 😂😂😂,"[lilianacruz, usafieldhockey, well, sense, frustration, woo, woo, made, olympics]","['lilianacruz', 'usafieldhockey', 'sense', 'frustration', 'woo', 'woo', 'olympics']"
666,1190667704870375425,rakeshrussell52,2019-11-02 16:31:17,en,misrasundeep yes surely played well two matches yes developing nation field hockey su,0,0,"@MisraSundeep Yes surely 👏they played well in these two matches , yes they are developing nation in field hockey su… https://t.co/eoRAuVZif0","[misrasundeep, yes, surely, played, well, two, matches, yes, developing, nation, field, hockey, su]","['misrasundeep', 'yes', 'surely', 'play', 'match', 'yes', 'develop', 'nation', 'field', 'hockey', 'su']"
667,1190666717585793025,rakeshrussell52,2019-11-02 16:27:21,en,fihhockey thehockeyindia fieldhockeyrus see tokyo indian men's team,0,0,@FIH_Hockey @TheHockeyIndia @fieldhockey_rus See you in Tokyo Indian men's team,"[fihhockey, thehockeyindia, fieldhockeyrus, see, tokyo, indian, men's, team]","['fihhockey', 'thehockeyindia', 'fieldhockeyrus', 'tokyo', 'indian', 'men', 'team']"
668,1190666143259746304,rakeshrussell52,2019-11-02 16:25:04,en,thehockeyindia: starsportsindia indiasports cmoodisha sportsodisha mediasai fihhockey tokyo ramandeep lalithockey,0,145,RT @TheHockeyIndia: @StarSportsIndia @IndiaSports @CMO_Odisha @sports_odisha @Media_SAI @FIH_Hockey @Tokyo2020 @ramandeep_31 @lalithockey @…,"[thehockeyindia:, starsportsindia, indiasports, cmoodisha, sportsodisha, mediasai, fihhockey, tokyo, ramandeep, lalithockey]","['thehockeyindia', 'starsportsindia', 'indiasports', 'cmoodisha', 'sportsodisha', 'mediasai', 'fihhockey', 'tokyo', 'ramandeep', 'lalithockey']"
669,1190666124221804544,rakeshrussell52,2019-11-02 16:25:00,en,thehockeyindia starsportsindia indiasports cmoodisha sportsodisha mediasai fihhockey tokyo,6,0,@TheHockeyIndia @StarSportsIndia @IndiaSports @CMO_Odisha @sports_odisha @Media_SAI @FIH_Hockey @Tokyo2020… https://t.co/ni0HjvAWtw,"[thehockeyindia, starsportsindia, indiasports, cmoodisha, sportsodisha, mediasai, fihhockey, tokyo]","['thehockeyindia', 'starsportsindia', 'indiasports', 'cmoodisha', 'sportsodisha', 'mediasai', 'fihhockey', 'tokyo']"
