,id,username,created_at,lang,cleaned_tweets,favorite_count,retweet_count,text,tokens,lemmas
313,1370518473009463302,alexdtang,2021-03-12 23:34:01,en,gavinsbaker: ) greenspringvc interesting model well regarded venture fund funds invests top tier early stage,0,5,"RT @GavinSBaker: 1) @GreenspringVC has an interesting model.

Well regarded venture fund of funds that invests in some top tier early stage…","[gavinsbaker:, ), greenspringvc, interesting, model, well, regarded, venture, fund, funds, invests, top, tier, early, stage]","['gavinsbaker', 'greenspringvc', 'interesting', 'model', 'regarded', 'venture', 'fund', 'fund', 'invest', 'tier', 'early', 'stage']"
314,1370509267313233924,alexdtang,2021-03-12 22:57:26,en,danrose: learned leadership scaling sheryl sandberg direct manager yrs spent countless hours together,0,1234,"RT @DanRose999: I learned about leadership &amp; scaling from Sheryl Sandberg. My direct manager for 10+ yrs, we spent countless hours together…","[danrose:, learned, leadership, scaling, sheryl, sandberg, direct, manager, yrs, spent, countless, hours, together]","['danrose', 'learn', 'leadership', 'scale', 'sheryl', 'sandberg', 'direct', 'manager', 'yrs', 'spend', 'countless', 'hour']"
315,1370509187734716417,alexdtang,2021-03-12 22:57:07,en,jaimalik: wondering everyone wants invest / vc today stats pitchbook provide answer: exits,0,117,"RT @Jai__Malik: If you're wondering why everyone wants to invest / be in VC today, these stats from @PitchBook provide an answer:

Exits in…","[jaimalik:, wondering, everyone, wants, invest, /, vc, today, stats, pitchbook, provide, answer:, exits]","['jaimalik', 'wonder', 'want', 'invest', 'vc', 'today', 'stat', 'pitchbook', 'provide', 'answer', 'exit']"
316,1370461162681335811,alexdtang,2021-03-12 19:46:17,en,bainalerts: options abound #pe firms choosing right strategy starts five key areas inquiry,0,4,"RT @BainAlerts: Options abound for #PE firms, but choosing the right strategy starts with five key areas of inquiry. https://t.co/4mYfbjgdfX","[bainalerts:, options, abound, #pe, firms, choosing, right, strategy, starts, five, key, areas, inquiry]","['bainalert', 'option', 'abound', 'pe', 'firm', 'choose', 'right', 'strategy', 'start', 'key', 'area', 'inquiry']"
317,1370458818140897280,alexdtang,2021-03-12 19:36:58,en,jasonlk: venture math always equal humble brags roblox: altos ventures ownership partners share carry way,0,10,"RT @jasonlk: Venture math not always equal to humble brags

Roblox:

Altos Ventures, 24% ownership
2 partners to share carry

The way to do…","[jasonlk:, venture, math, always, equal, humble, brags, roblox:, altos, ventures, ownership, partners, share, carry, way]","['jasonlk', 'venture', 'math', 'equal', 'humble', 'brag', 'roblox', 'altos', 'ventures', 'ownership', 'partner', 'share', 'carry', 'way']"
318,1370425622430900230,alexdtang,2021-03-12 17:25:04,en,notzachdavidson: emerging manager movement great terms democratizing vc asset class social capital burned mi,0,2,"RT @NotZachDavidson: The emerging manager movement is great in terms of democratizing the VC asset class.

But the social capital burned mi…","[notzachdavidson:, emerging, manager, movement, great, terms, democratizing, vc, asset, class, social, capital, burned, mi]","['notzachdavidson', 'emerge', 'manager', 'movement', 'great', 'term', 'democratize', 'vc', 'asset', 'class', 'social', 'capital', 'burn', 'mi']"
319,1370402710986629122,alexdtang,2021-03-12 15:54:01,en,roichristie: bain co global private equity report:,0,11,RT @ROIChristie: 👀 Bain &amp; Co 2021 Global Private Equity Report: https://t.co/qWf2kz4Iz8,"[roichristie:, bain, co, global, private, equity, report:]","['roichristie', 'bain', 'co', 'global', 'private', 'equity', 'report']"
320,1370314874337816578,alexdtang,2021-03-12 10:04:59,en,chrisfralic: excellent write altosvcs aplee literally one best business enough people know abou,0,2,"RT @chrisfralic: Excellent write up on @altosvc’s  @aplee who is literally one of the best in the business, and not enough people know abou…","[chrisfralic:, excellent, write, altosvcs, aplee, literally, one, best, business, enough, people, know, abou]","['chrisfralic', 'excellent', 'write', 'altosvcs', 'aplee', 'literally', 'good', 'business', 'people', 'know', 'abou']"
321,1370314074983170049,alexdtang,2021-03-12 10:01:49,en,jasonlk: perhaps # mistake see startups make arr hiring vp sales good good st,0,36,"RT @jasonlk: Perhaps the #1 mistake I see startups make after $1m ARR is hiring a VP of Sales that is good ...

But not good for &gt;their&lt; st…","[jasonlk:, perhaps, #, mistake, see, startups, make, arr, hiring, vp, sales, good, good, st]","['jasonlk', 'mistake', 'startup', 'arr', 'hire', 'vp', 'sale', 'good', 'good', 'st']"
322,1370307198887333891,alexdtang,2021-03-12 09:34:29,en,shaanvp: wild story instagram food accounts making year selling cookies heard,0,289,"RT @ShaanVP: This is the WILD story of a Instagram food accounts  that are making 10M+ a year SELLING COOKIES 

if you haven't heard about…","[shaanvp:, wild, story, instagram, food, accounts, making, year, selling, cookies, heard]","['shaanvp', 'wild', 'story', 'instagram', 'food', 'account', 'make', 'year', 'sell', 'cookie', 'hear']"
323,1370306474451288064,alexdtang,2021-03-12 09:31:37,en,roichristie: / random walk wall street secret sauce books (cfa book) super forecasters misbehavior thinking fast slow thin,0,1,"RT @ROIChristie: 2/2 

Random Walk Down Wall Street
Secret Sauce Books (CFA book?)
Super Forecasters 
Misbehavior
Thinking Fast &amp; Slow
Thin…","[roichristie:, /, random, walk, wall, street, secret, sauce, books, (cfa, book), super, forecasters, misbehavior, thinking, fast, slow, thin]","['roichristie', 'random', 'walk', 'wall', 'street', 'secret', 'sauce', 'book', 'cfa', 'book', 'super', 'forecaster', 'misbehavior', 'think', 'fast', 'slow', 'thin']"
324,1370306454951968770,alexdtang,2021-03-12 09:31:32,en,roichristie: / responses 'what's favorite book investing' joinclubhouse opened monocleman tonight: pri,0,10,"RT @ROIChristie: 1/2 Responses to 'what's your favorite book on investing' in the @joinClubhouse opened with @MonocleMan1 tonight:

The Pri…","[roichristie:, /, responses, 'what's, favorite, book, investing', joinclubhouse, opened, monocleman, tonight:, pri]","['roichristie', 'response', 'favorite', 'book', 'invest', 'joinclubhouse', 'open', 'monocleman', 'tonight', 'pri']"
325,1370243996505800704,alexdtang,2021-03-12 05:23:21,en,jvrionis: building startups hard especially beginning made unusualvc help founders every way possible,0,4,"RT @jvrionis: Building startups is hard. Especially at the VERY beginning.

We made @unusual_vc to help founders in every way possible.

To…","[jvrionis:, building, startups, hard, especially, beginning, made, unusualvc, help, founders, every, way, possible]","['jvrionis', 'building', 'startup', 'hard', 'especially', 'begin', 'unusualvc', 'help', 'founder', 'way', 'possible']"
326,1370243320073617412,alexdtang,2021-03-12 05:20:40,en,kateclarktweets: altos ventures under-the-radar venture capital firm invested roblox part million rou,0,74,"RT @KateClarkTweets: Altos Ventures, a very under-the-radar venture capital firm, invested in @Roblox in 2008 as part of a $2.8 million rou…","[kateclarktweets:, altos, ventures, under-the-radar, venture, capital, firm, invested, roblox, part, million, rou]","['kateclarktweets', 'altos', 'venture', 'radar', 'venture', 'capital', 'firm', 'invest', 'roblox', 'million', 'rou']"
327,1370242298001428480,alexdtang,2021-03-12 05:16:36,en,saastr: starting around private equity came saas much aggressively created third party liquidity: selling,0,2,"RT @saastr: Starting around 2012, Private Equity came into SaaS much more aggressively and created a third party to liquidity: selling your…","[saastr:, starting, around, private, equity, came, saas, much, aggressively, created, third, party, liquidity:, selling]","['saastr', 'start', 'private', 'equity', 'come', 'saas', 'aggressively', 'create', 'party', 'liquidity', 'sell']"
328,1370224033518784513,alexdtang,2021-03-12 04:04:01,en,louisliju: spot unicorn: walk zoom eugenezhang,0,2,"RT @louisliju: “How to Spot a Unicorn: Walk before You Zoom” by @eugene_zhang
https://t.co/B2I5iQnO3N","[louisliju:, spot, unicorn:, walk, zoom, eugenezhang]","['louisliju', 'spot', 'unicorn', 'walk', 'zoom', 'eugenezhang']"
329,1370110745552244736,alexdtang,2021-03-11 20:33:51,en,charlienyc: top vcs battle thunderdome primetimevc dunkhippo jaimalik thevaluesvc macconwell watch fu,0,11,"RT @CharlieNYC: 4 Top VCs Battle
  in the ThunderDome
      on @PrimeTimeVC  

@dunkhippo33 @Jai__Malik @TheValuesVC @MacConwell 

Watch Fu…","[charlienyc:, top, vcs, battle, thunderdome, primetimevc, dunkhippo, jaimalik, thevaluesvc, macconwell, watch, fu]","['charlienyc', 'vcs', 'battle', 'thunderdome', 'primetimevc', 'dunkhippo', 'jaimalik', 'thevaluesvc', 'macconwell', 'watch', 'fu']"
330,1370061245487984644,alexdtang,2021-03-11 17:17:10,en,jaydimonte internship bdc played throughout capital structure vc growth equity oppor,1,0,@jaydimonte My internship was at a BDC so we played throughout the capital structure for vc and growth equity oppor… https://t.co/pyGY94knJJ,"[jaydimonte, internship, bdc, played, throughout, capital, structure, vc, growth, equity, oppor]","['jaydimonte', 'internship', 'bdc', 'play', 'capital', 'structure', 'vc', 'growth', 'equity', 'oppor']"
331,1370051993008488450,alexdtang,2021-03-11 16:40:24,en,techcrunch: epidemic sound raises b valuation 'soundtrack internet' ingridlunden,0,23,RT @TechCrunch: Epidemic Sound raises $450M at a $1.4B valuation to 'soundtrack the internet' https://t.co/g1eGzoQhSD by @ingridlunden,"[techcrunch:, epidemic, sound, raises, b, valuation, 'soundtrack, internet', ingridlunden]","['techcrunch', 'epidemic', 'sound', 'raise', 'b', 'valuation', 'soundtrack', 'internet', 'ingridlunden']"
332,1370049959475679238,alexdtang,2021-03-11 16:32:19,en,marcemccarthy: todays techcrunch meetup lexithevc patriciawexler lauragestefani (an all-star team) judging pitch-of,0,6,"RT @marcemccarthy: At today’s @TechCrunch meetup, @lexithevc @patriciawexler @Lauragestefani (an all-star team!) will be judging a pitch-of…","[marcemccarthy:, todays, techcrunch, meetup, lexithevc, patriciawexler, lauragestefani, (an, all-star, team), judging, pitch-of]","['marcemccarthy', 'todays', 'techcrunch', 'meetup', 'lexithevc', 'patriciawexler', 'lauragestefani', 'star', 'team', 'judge', 'pitch']"
333,1370048666065633282,alexdtang,2021-03-11 16:27:10,en,jaydimonte active deal learning think like investor/underwrite deal would top thing,1,0,@jaydimonte Doing an active deal and learning to think like an investor/underwrite a deal would be top thing for in… https://t.co/uSnAex0B3m,"[jaydimonte, active, deal, learning, think, like, investor/underwrite, deal, would, top, thing]","['jaydimonte', 'active', 'deal', 'learning', 'think', 'like', 'investor', 'underwrite', 'deal', 'thing']"
334,1370046194945261568,alexdtang,2021-03-11 16:17:21,en,mattturck christianhjorg shaig see elon musk types well successful entrepreneurs self f,0,0,@mattturck @ChristianHJorg @shaig You will see more “Elon Musk” types as well. Successful entrepreneurs will self f… https://t.co/f4iopaBl6h,"[mattturck, christianhjorg, shaig, see, elon, musk, types, well, successful, entrepreneurs, self, f]","['mattturck', 'christianhjorg', 'shaig', 'elon', 'musk', 'type', 'successful', 'entrepreneur', 'self', 'f']"
335,1370044770698027009,alexdtang,2021-03-11 16:11:42,en,christianhjorg mattturck shaig already nervous yet excited see pitchbook report vc perfor,1,0,@ChristianHJorg @mattturck @shaig I am already nervous yet excited to see what @PitchBook will report for vc perfor… https://t.co/7PCMEdkeYU,"[christianhjorg, mattturck, shaig, already, nervous, yet, excited, see, pitchbook, report, vc, perfor]","['christianhjorg', 'mattturck', 'shaig', 'nervous', 'excited', 'pitchbook', 'report', 'vc', 'perfor']"
336,1370040013866602509,alexdtang,2021-03-11 15:52:48,en,nickkokonas: year ago today ahead chicago shutdown tock moved remote work here's photo moment spoke,0,5,"RT @nickkokonas: A year ago today, ahead of the Chicago shutdown, @tock moved to remote work. Here's a photo of the moment I spoke with our…","[nickkokonas:, year, ago, today, ahead, chicago, shutdown, tock, moved, remote, work, here's, photo, moment, spoke]","['nickkokonas', 'year', 'ago', 'today', 'ahead', 'chicago', 'shutdown', 'tock', 'move', 'remote', 'work', 'photo', 'moment', 'speak']"
337,1370039271751622664,alexdtang,2021-03-11 15:49:51,en,christianhjorg mattturck re-living dotcom boom public markets unforgiving vc mentor onc,0,0,@ChristianHJorg @mattturck Re-living the DotCom Boom.  Public markets are very unforgiving.   I had a VC mentor onc… https://t.co/KrQHP7kiVA,"[christianhjorg, mattturck, re-living, dotcom, boom, public, markets, unforgiving, vc, mentor, onc]","['christianhjorg', 'mattturck', 'living', 'dotcom', 'boom', 'public', 'market', 'unforgiving', 'vc', 'mentor', 'onc']"
338,1369830492367958017,alexdtang,2021-03-11 02:00:14,en,apompliano: secret building wealth: spend less make get debt save - months cash invest invest,0,589,"RT @APompliano: The secret to building wealth:

1. Spend less than you make
2. Get out of debt
3. Save 3-6 months of cash
4. Invest, Invest…","[apompliano:, secret, building, wealth:, spend, less, make, get, debt, save, -, months, cash, invest, invest]","['apompliano', 'secret', 'building', 'wealth', 'spend', 'debt', 'save', 'month', 'cash', 'invest', 'invest']"
339,1369812231777574912,alexdtang,2021-03-11 00:47:40,en,joinevca: we're excited partner svbfinancial report bring transparency pre-partner venture compensation,0,3,RT @joinEVCA: We're excited to partner with @SVB_Financial on this report to bring transparency to pre-partner venture compensation.,"[joinevca:, we're, excited, partner, svbfinancial, report, bring, transparency, pre-partner, venture, compensation]","['joinevca', 'excite', 'partner', 'svbfinancial', 'report', 'bring', 'transparency', 'pre', 'partner', 'venture', 'compensation']"
340,1369792013143580672,alexdtang,2021-03-10 23:27:20,en,wintmead: track record key part every vc's fundraising process however always obvious lps actually want se,0,7,"RT @wintmead: A track record is a key part of every VC's fundraising process. However, it’s not always obvious what LPs actually want to se…","[wintmead:, track, record, key, part, every, vc's, fundraising, process, however, always, obvious, lps, actually, want, se]","['wintmead', 'track', 'record', 'key', 'vc', 'fundraising', 'process', 'obvious', 'lp', 'actually', 'want', 'se']"
341,1369732543931686915,alexdtang,2021-03-10 19:31:01,en,accelerateft: tomorrow kgworkman co-founder ceo owletbabycare connected nursery ecosystem offers data-driven technol,0,2,"RT @AccelerateFT: TOMORROW, @kgworkman, Co-Founder &amp; CEO of @owletbabycare, the connected nursery ecosystem that offers data-driven technol…","[accelerateft:, tomorrow, kgworkman, co-founder, ceo, owletbabycare, connected, nursery, ecosystem, offers, data-driven, technol]","['accelerateft', 'tomorrow', 'kgworkman', 'co', 'founder', 'ceo', 'owletbabycare', 'connect', 'nursery', 'ecosystem', 'offer', 'data', 'drive', 'technol']"
342,1369732403078574084,alexdtang,2021-03-10 19:30:27,en,modestproposal: great chart great message great low key flex tweet,0,4,RT @modestproposal1: Great chart. Great message. Great low key flex. A+ tweet. https://t.co/DB1vqE5Oh7,"[modestproposal:, great, chart, great, message, great, low, key, flex, tweet]","['modestproposal', 'great', 'chart', 'great', 'message', 'great', 'low', 'key', 'flex', 'tweet']"
343,1369731548589735942,alexdtang,2021-03-10 19:27:04,en,dougludlow: amount money flowing silicon valley staggering right case point announced bigge,0,80,"RT @dougludlow: The amount of money flowing in Silicon Valley is STAGGERING right now.

Case in point, we JUST announced what was the bigge…","[dougludlow:, amount, money, flowing, silicon, valley, staggering, right, case, point, announced, bigge]","['dougludlow', 'money', 'flow', 'silicon', 'valley', 'staggering', 'right', 'case', 'point', 'announce', 'bigge']"
344,1369720949961064452,alexdtang,2021-03-10 18:44:57,en,greylockvc: congrats roblox todays ipo milestone published greylockvc's investment memo advocated write one,0,35,"RT @GreylockVC: Congrats @Roblox on today’s IPO milestone! We published @GreylockVC's investment memo, where we advocated that we write one…","[greylockvc:, congrats, roblox, todays, ipo, milestone, published, greylockvc's, investment, memo, advocated, write, one]","['greylockvc', 'congrats', 'roblox', 'todays', 'ipo', 'milestone', 'publish', 'greylockvc', 'investment', 'memo', 'advocate', 'write']"
345,1369710802261905413,alexdtang,2021-03-10 18:04:37,en,rambhupatiraju: march th () gfc market bottomed excellent article lessons gfc seth klarman w,0,72,"RT @RamBhupatiraju: March 9th (2009) is when the GFC Market bottomed. 

Excellent article on ""20 lessons from the GFC"" from Seth Klarman, w…","[rambhupatiraju:, march, th, (), gfc, market, bottomed, excellent, article, lessons, gfc, seth, klarman, w]","['rambhupatiraju', 'march', 'th', 'gfc', 'market', 'bottom', 'excellent', 'article', 'lesson', 'gfc', 'seth', 'klarman', 'w']"
346,1369659257054986254,alexdtang,2021-03-10 14:39:48,en,jhmuk: samirkaji incase see,0,8,"RT @JHM_UK: @Samirkaji incase you didn't see https://t.co/DD4Kz1SPlc 
🔌","[jhmuk:, samirkaji, incase, see]","['jhmuk', 'samirkaji', 'incase']"
347,1369596801200893957,alexdtang,2021-03-10 10:31:37,en,yazid: naval figure / build / work on: parents used say whats practical books,0,173,"RT @Yazid: .@naval on how to figure out what to do / what to build / what to work on:

Our parents used to say “Do what’s practical.”
Books…","[yazid:, naval, figure, /, build, /, work, on:, parents, used, say, whats, practical, books]","['yazid', 'naval', 'figure', 'build', 'work', 'parent', 's', 'practical', 'book']"
348,1369518839168442370,alexdtang,2021-03-10 05:21:50,en,nikillinit: tiger global basically built digital health etf last months - cedar innovaccer tytocare olive komodo hea,0,10,"RT @nikillinit: tiger global has basically built a digital health ETF in the last 6 months - Cedar, Innovaccer, Tytocare, Olive, Komodo Hea…","[nikillinit:, tiger, global, basically, built, digital, health, etf, last, months, -, cedar, innovaccer, tytocare, olive, komodo, hea]","['nikillinit', 'tiger', 'global', 'basically', 'build', 'digital', 'health', 'etf', 'month', 'cedar', 'innovaccer', 'tytocare', 'olive', 'komodo', 'hea']"
349,1369472380091969538,alexdtang,2021-03-10 02:17:13,cy,stoolpresidente: #chicago #barstoolsportsbook penn,0,401,RT @stoolpresidente: #chicago #BarstoolSportsbook $penn https://t.co/NvXiIN7F61,"[stoolpresidente:, #chicago, #barstoolsportsbook, penn]","['stoolpresidente', 'chicago', 'barstoolsportsbook', 'penn']"
350,1369373175625232401,alexdtang,2021-03-09 19:43:01,en,marketplunger: michael burry (michaeljburry) investing strategy: - care little general market - sheer outrageous value,0,176,"RT @marketplunger1: Michael Burry (@michaeljburry) Investing Strategy: 

- Care little about general market
- Sheer outrageous value is its…","[marketplunger:, michael, burry, (michaeljburry), investing, strategy:, -, care, little, general, market, -, sheer, outrageous, value]","['marketplunger', 'michael', 'burry', 'michaeljburry', 'invest', 'strategy', 'care', 'little', 'general', 'market', 'sheer', 'outrageous', 'value']"
351,1369319160040284169,alexdtang,2021-03-09 16:08:23,en,synbiobeta: herms mycoworksinc launch sylvania first object made fine mycelium patented technology mycoworks,0,2,"RT @SynBioBeta: Hermès and @MycoWorksInc launch Sylvania, the first object made with Fine Mycelium, the patented technology from MycoWorks…","[synbiobeta:, herms, mycoworksinc, launch, sylvania, first, object, made, fine, mycelium, patented, technology, mycoworks]","['synbiobeta', 'herms', 'mycoworksinc', 'launch', 'sylvania', 'object', 'fine', 'mycelium', 'patent', 'technology', 'mycowork']"
352,1369297286304591881,alexdtang,2021-03-09 14:41:28,en,goodmarketinghq: two underrated words copywriting: involves reader gives control let's persuade thems,0,118,"RT @GoodMarketingHQ: Two underrated words in copywriting: “If you...”

• Involves the reader
• Gives up control
• Let's them persuade thems…","[goodmarketinghq:, two, underrated, words, copywriting:, involves, reader, gives, control, let's, persuade, thems]","['goodmarketinghq', 'underrated', 'word', 'copywriting', 'involve', 'reader', 'give', 'control', 'let', 'persuade', 'them']"
353,1369280236689428482,alexdtang,2021-03-09 13:33:43,en,hadley: one thing lot seed/early vcs forget cost capital really high good seed fund x-x net fees/cos,0,4,RT @Hadley: One thing a lot of seed/early VC’s forget is that our cost of capital is really high. A good seed fund is 3x-5x net of fees/cos…,"[hadley:, one, thing, lot, seed/early, vcs, forget, cost, capital, really, high, good, seed, fund, x-x, net, fees/cos]","['hadley', 'thing', 'lot', 'seed', 'early', 'vcs', 'forget', 'cost', 'capital', 'high', 'good', 'seed', 'fund', 'x', 'x', 'net', 'fee', 'cos']"
354,1369263547168010240,alexdtang,2021-03-09 12:27:23,en,kgao: wolfejosh valuable investment make (),0,52,RT @kgao1412: .@wolfejosh on the most valuable investment you can make (2008) https://t.co/cmlCmYaliS,"[kgao:, wolfejosh, valuable, investment, make, ()]","['kgao', 'wolfejosh', 'valuable', 'investment']"
355,1369262341242691586,alexdtang,2021-03-09 12:22:36,en,thestalwart: fed's tight monetary policy fueled silicon valley boom today's markets newsletter write tig,0,267,"RT @TheStalwart: HOW THE FED'S TIGHT MONETARY POLICY FUELED THE SILICON VALLEY BOOM

In today's @markets newsletter, I write how it was tig…","[thestalwart:, fed's, tight, monetary, policy, fueled, silicon, valley, boom, today's, markets, newsletter, write, tig]","['thestalwart', 'fed', 'tight', 'monetary', 'policy', 'fuel', 'silicon', 'valley', 'boom', 'today', 'market', 'newsletter', 'write', 'tig']"
356,1369106763270782978,alexdtang,2021-03-09 02:04:23,en,bw: forget gamestop want real risk invest supercars,0,3,"RT @BW: Forget GameStop. If you want real risk, invest in supercars https://t.co/qZy5Nxr7jk","[bw:, forget, gamestop, want, real, risk, invest, supercars]","['bw', 'forget', 'gamestop', 'want', 'real', 'risk', 'invest', 'supercar']"
357,1369020426735747075,alexdtang,2021-03-08 20:21:19,en,samirkaji: pensions endowments nearly assets alternatives yale vc lt returns ria,0,10,"RT @Samirkaji: Pensions &amp; Endowments have nearly 30% of their assets into alternatives. 

Yale is up to 22% in VC with LT returns &gt;20%

RIA…","[samirkaji:, pensions, endowments, nearly, assets, alternatives, yale, vc, lt, returns, ria]","['samirkaji', 'pension', 'endowment', 'nearly', 'asset', 'alternative', 'yale', 'vc', 'lt', 'return', 'ria']"
358,1368984293339521026,alexdtang,2021-03-08 17:57:44,en,bznotes: / evolv going public bit personal sandyhook elementary school mass shooting took lives,0,17,"RT @bznotes: 1/ Evolv is going public. 

This is a bit personal. After the Sandyhook Elementary School mass shooting that took 26 lives, I…","[bznotes:, /, evolv, going, public, bit, personal, sandyhook, elementary, school, mass, shooting, took, lives]","['bznote', 'evolv', 'go', 'public', 'bit', 'personal', 'sandyhook', 'elementary', 'school', 'mass', 'shooting', 'take', 'life']"
359,1368710073866928135,alexdtang,2021-03-07 23:48:05,en,lpolovets: good description luck startups /n piece important: reason vcs like funding startup,0,23,RT @lpolovets: This is a good description of luck in startups. The 1/2^N piece is important: it's the reason VCs don't like funding startup…,"[lpolovets:, good, description, luck, startups, /n, piece, important:, reason, vcs, like, funding, startup]","['lpolovet', 'good', 'description', 'luck', 'startup', '/n', 'piece', 'important', 'reason', 'vcs', 'like', 'fund', 'startup']"
360,1368546942494638082,alexdtang,2021-03-07 12:59:52,en,jposhaughnessy: wow software continues eat world,0,56,"RT @jposhaughnessy: Wow.

And software continues to eat the world...","[jposhaughnessy:, wow, software, continues, eat, world]","['jposhaughnessy', 'wow', 'software', 'continue', 'eat', 'world']"
361,1368546126970945538,alexdtang,2021-03-07 12:56:37,en,secretcapital: company's fcf margins much higher ni margins sure sign investing thei,0,11,"RT @SecretCapital_: When a company's FCF margins are much higher than their NI margins, is that a sure sign they are investing through thei…","[secretcapital:, company's, fcf, margins, much, higher, ni, margins, sure, sign, investing, thei]","['secretcapital', 'company', 'fcf', 'margin', 'high', 'ni', 'margin', 'sure', 'sign', 'invest', 'thei']"
362,1368545712233975814,alexdtang,2021-03-07 12:54:58,en,gavinsbaker: superb dinobecirovic clubhouse curious see spaces ultimately addresses discovery great framew,0,4,"RT @GavinSBaker: This was superb from @dinobecirovic on Clubhouse.

Curious to see how Spaces ultimately addresses discovery.

Great framew…","[gavinsbaker:, superb, dinobecirovic, clubhouse, curious, see, spaces, ultimately, addresses, discovery, great, framew]","['gavinsbaker', 'superb', 'dinobecirovic', 'clubhouse', 'curious', 'space', 'ultimately', 'address', 'discovery', 'great', 'framew']"
