,id,username,created_at,lang,cleaned_tweets,favorite_count,retweet_count,text,tokens,lemmas
0,1390116881177141249,alexdtang,2021-05-06 01:31:06,en,fintechjunkie: /: listening minute vc podcast w/davidtisch guest threw important concept,0,11,RT @fintechjunkie: 1/21: I was listening to the 20 Minute VC podcast w/@davidtisch as a guest.  He threw out an important concept that most…,"[fintechjunkie:, /:, listening, minute, vc, podcast, w/davidtisch, guest, threw, important, concept]","['fintechjunkie', 'listen', 'minute', 'vc', 'podcast', 'w', 'davidtisch', 'guest', 'throw', 'important', 'concept']"
1,1390108640795840529,alexdtang,2021-05-06 00:58:21,en,billda: wearfigs filed go public probably favorite dtc ipo time revenue ebitda margin (swo,0,37,"RT @BillDA: .@wearfigs just filed to go public, and it's probably my favorite DTC IPO of all time.

💸$263M revenue
😍 26% EBITDA margin (swo…","[billda:, wearfigs, filed, go, public, probably, favorite, dtc, ipo, time, revenue, ebitda, margin, (swo]","['billda', 'wearfigs', 'file', 'public', 'probably', 'favorite', 'dtc', 'ipo', 'time', 'revenue', 'ebitda', 'margin', 'swo']"
2,1390044920468099072,alexdtang,2021-05-05 20:45:09,en,trungtphan: / redditor runs high net worth circles writes gradations rich explains minute detail dif,0,1446,"RT @TrungTPhan: 1/ A Redditor who runs in high net worth circles writes on the ""gradations of rich"". 

He explains in minute detail the dif…","[trungtphan:, /, redditor, runs, high, net, worth, circles, writes, gradations, rich, explains, minute, detail, dif]","['trungtphan', 'redditor', 'run', 'high', 'net', 'worth', 'circle', 'write', 'gradation', 'rich', 'explain', 'minute', 'detail', 'dif']"
3,1390037745398132738,alexdtang,2021-05-05 20:16:38,en,openlp: lots chatter lately regarding #qsbs exemption biden's tax plan downstream effects early-stage investing,0,4,"RT @Open_LP: Lots of chatter lately regarding the #QSBS exemption in Biden's tax plan and downstream effects on early-stage investing.

Her…","[openlp:, lots, chatter, lately, regarding, #qsbs, exemption, biden's, tax, plan, downstream, effects, early-stage, investing]","['openlp', 'lot', 'chatter', 'lately', 'qsbs', 'exemption', 'biden', 'tax', 'plan', 'downstream', 'effect', 'early', 'stage', 'investing']"
4,1390002433682771968,alexdtang,2021-05-05 17:56:19,en,avc: half vcs beat stock market,0,20,RT @avc: Half Of All VCs Beat The Stock Market https://t.co/PF8hVMD0XS,"[avc:, half, vcs, beat, stock, market]","['avc', 'half', 'vcs', 'beat', 'stock', 'market']"
5,1389996746932203520,alexdtang,2021-05-05 17:33:44,en,cdouvos: great article mtemkin one interesting paradoxes moment #vc openlp vc performing better th,0,6,"RT @cdouvos: A great article by @MTemkin about one of the interesting paradoxes of the moment in #VC  @Open_LP 

VC is performing better th…","[cdouvos:, great, article, mtemkin, one, interesting, paradoxes, moment, #vc, openlp, vc, performing, better, th]","['cdouvos', 'great', 'article', 'mtemkin', 'interesting', 'paradox', 'moment', 'vc', 'openlp', 'vc', 'perform', 'better', 'th']"
6,1389932997231751171,alexdtang,2021-05-05 13:20:24,en,jposhaughnessy: two thoughts eleanor roosevelt wouldnt worry much others think realized sel,0,37,"RT @jposhaughnessy: Two thoughts from Eleanor Roosevelt

""You wouldn’t worry so much about what others think of you if you realized how sel…","[jposhaughnessy:, two, thoughts, eleanor, roosevelt, wouldnt, worry, much, others, think, realized, sel]","['jposhaughnessy', 'thought', 'eleanor', 'roosevelt', 'not', 'worry', 'think', 'realize', 'sel']"
7,1389777451857989633,alexdtang,2021-05-05 03:02:19,en,trengriffin: aswath damodaran: identifiable expenses internally generated intangible assets create value longer pe,0,7,"RT @trengriffin: Aswath Damodaran: ""identifiable expenses on internally generated intangible assets that will create value over a longer pe…","[trengriffin:, aswath, damodaran:, identifiable, expenses, internally, generated, intangible, assets, create, value, longer, pe]","['trengriffin', 'aswath', 'damodaran', 'identifiable', 'expense', 'internally', 'generate', 'intangible', 'asset', 'create', 'value', 'longer', 'pe']"
8,1389776870854508545,alexdtang,2021-05-05 03:00:01,en,alexrkonrad: vanta ceo christina cacioppo deliberately kept low profile compliance software startup reve,0,63,"RT @alexrkonrad: Vanta CEO Christina Cacioppo deliberately kept a low profile with her compliance software startup. Then, with $10M in reve…","[alexrkonrad:, vanta, ceo, christina, cacioppo, deliberately, kept, low, profile, compliance, software, startup, reve]","['alexrkonrad', 'vanta', 'ceo', 'christina', 'cacioppo', 'deliberately', 'keep', 'low', 'profile', 'compliance', 'software', 'startup', 'reve']"
9,1389775657043963907,alexdtang,2021-05-05 02:55:12,en,michelleabbs: beyond thrilled flagler streetscape project soon home tech hub innovation district hope see,0,23,RT @MichelleAbbs: Beyond thrilled about the Flagler Streetscape Project. Soon to be home to our tech hub &amp; innovation district! Hope to see…,"[michelleabbs:, beyond, thrilled, flagler, streetscape, project, soon, home, tech, hub, innovation, district, hope, see]","['michelleabbs', 'thrilled', 'flagler', 'streetscape', 'project', 'soon', 'home', 'tech', 'hub', 'innovation', 'district', 'hope']"
10,1389704857863479297,alexdtang,2021-05-04 22:13:52,en,jspujji: turned k company worth billion broke every rule along way thread time one favorite,0,357,"RT @jspujji: She turned $70K into a company worth over $30 BILLION and broke every rule along the way.  

Thread time about one my favorite…","[jspujji:, turned, k, company, worth, billion, broke, every, rule, along, way, thread, time, one, favorite]","['jspujji', 'turn', 'k', 'company', 'worth', 'billion', 'break', 'rule', 'way', 'thread', 'time', 'favorite']"
11,1389695257487552516,alexdtang,2021-05-04 21:35:43,en,galeforcevc: i'm grateful amazing years irishangels excited help recruit new md i'll continue manage vitalizevc,0,4,RT @galeforceVC: I'm grateful for 9 amazing years @IrishAngels and am excited to help recruit a new MD! I'll continue to manage @VitalizeVC…,"[galeforcevc:, i'm, grateful, amazing, years, irishangels, excited, help, recruit, new, md, i'll, continue, manage, vitalizevc]","['galeforcevc', 'grateful', 'amazing', 'year', 'irishangel', 'excited', 'help', 'recruit', 'new', 'md', 'continue', 'manage', 'vitalizevc']"
12,1389651980763664385,alexdtang,2021-05-04 18:43:45,en,cjohndesign: fyi live redirecting #miamitechevents google sheet easier right #miamitech #miamit,0,4,"RT @cjohndesign: FYI, “https://t.co/FpJqUogkb3” is live redirecting to the #miamitechevents Google sheet. Easier, right? #miamitech #miamit…","[cjohndesign:, fyi, live, redirecting, #miamitechevents, google, sheet, easier, right, #miamitech, #miamit]","['cjohndesign', 'fyi', 'live', 'redirect', 'miamitechevents', 'google', 'sheet', 'easy', 'right', 'miamitech', 'miamit']"
13,1389647433316151299,alexdtang,2021-05-04 18:25:41,und,zebulgar:,0,35,RT @zebulgar: https://t.co/konIX42lEz,[zebulgar:],['zebulgar']
14,1389640675684196357,alexdtang,2021-05-04 17:58:50,en,samirkaji underwrite best ability yet something crazy happens changes trajectory,5,0,@Samirkaji You underwrite to the best of your ability yet something crazy happens and changes the trajectory of the… https://t.co/r9ha3auEGu,"[samirkaji, underwrite, best, ability, yet, something, crazy, happens, changes, trajectory]","['samirkaji', 'underwrite', 'good', 'ability', 'crazy', 'happen', 'change', 'trajectory']"
15,1388966778592808963,alexdtang,2021-05-02 21:21:00,en,emergeamericas: official #emergeamericas kicking #miamitechweek registration open knightfdn rmoas,0,7,RT @eMergeAmericas: It's official! #eMergeAmericas 2022 is kicking off  #MiamiTechWeek 2022!  💥 Registration is now open! @knightfdn @rmoas…,"[emergeamericas:, official, #emergeamericas, kicking, #miamitechweek, registration, open, knightfdn, rmoas]","['emergeamericas', 'official', 'emergeamericas', 'kicking', 'miamitechweek', 'registration', 'open', 'knightfdn', 'rmoas']"
16,1388965574567419909,alexdtang,2021-05-02 21:16:13,en,zebulgar: ladies gentlemen thank absolutely vibrant inaugural miami tech week i'm excited announce miami te,0,116,"RT @zebulgar: Ladies and Gentlemen

Thank you all for an absolutely vibrant inaugural Miami Tech Week

And I'm excited to announce Miami Te…","[zebulgar:, ladies, gentlemen, thank, absolutely, vibrant, inaugural, miami, tech, week, i'm, excited, announce, miami, te]","['zebulgar', 'lady', 'gentleman', 'thank', 'absolutely', 'vibrant', 'inaugural', 'miami', 'tech', 'week', 'excited', 'announce', 'miami', 'te']"
17,1388850089960087556,alexdtang,2021-05-02 13:37:19,en,edwardsdeming: greg jensen co-cio bridgewater: today stocks pricing revenue growth margin expan,0,62,"RT @edwards_deming: Greg Jensen, co-CIO at Bridgewater: “Today, 10% of stocks are pricing in more than 20%+ revenue growth and margin expan…","[edwardsdeming:, greg, jensen, co-cio, bridgewater:, today, stocks, pricing, revenue, growth, margin, expan]","['edwardsdeming', 'greg', 'jensen', 'co', 'cio', 'bridgewater', 'today', 'stock', 'price', 'revenue', 'growth', 'margin', 'expan']"
18,1388282427768983553,alexdtang,2021-05-01 00:01:38,en,ajt: week miami would like double hand,0,3,RT @ajt: After this week in Miami I would like to double down on this hand,"[ajt:, week, miami, would, like, double, hand]","['ajt', 'week', 'miami', 'like', 'double', 'hand']"
19,1388244858326982664,alexdtang,2021-04-30 21:32:21,en,dafrankel: recently shared thread urging founders preserve exit optionality limiting amount capital raise,0,100,RT @dafrankel: I recently shared a thread urging founders to preserve their exit optionality by limiting the amount of capital they raise.…,"[dafrankel:, recently, shared, thread, urging, founders, preserve, exit, optionality, limiting, amount, capital, raise]","['dafrankel', 'recently', 'share', 'thread', 'urge', 'founder', 'preserve', 'exit', 'optionality', 'limit', 'capital', 'raise']"
20,1387954715623923715,alexdtang,2021-04-30 02:19:25,en,joepompliano: despite # overall pick trey lance make less kyle pitts (#) ja'marr chase (#) taxes man (,0,69,"RT @JoePompliano: Despite being the #3 overall pick, Trey Lance will make less than Kyle Pitts (#4) and Ja'Marr Chase (#5).

Taxes, man.

(…","[joepompliano:, despite, #, overall, pick, trey, lance, make, less, kyle, pitts, (#), ja'marr, chase, (#), taxes, man, (]","['joepompliano', 'despite', 'overall', 'pick', 'trey', 'lance', 'kyle', 'pitts', ""ja'marr"", 'chase', 'taxis', 'man']"
21,1387950017579823106,alexdtang,2021-04-30 02:00:45,en,chicagobears: reaction:,0,463,RT @ChicagoBears: The reaction: https://t.co/NAV4gsi9kO,"[chicagobears:, reaction:]","['chicagobears', 'reaction']"
22,1387950006271987714,alexdtang,2021-04-30 02:00:43,en,chicagobears: announcement:,0,1176,RT @ChicagoBears: The announcement: https://t.co/ViZx5eeDkA,"[chicagobears:, announcement:]","['chicagobears', 'announcement']"
23,1387946771268132866,alexdtang,2021-04-30 01:47:51,en,chicagobears: welcome chicago bears justnfields #bearsdraft,0,15359,"RT @ChicagoBears: Welcome to THE Chicago Bears, @justnfields!

#BearsDraft | 🐻⬇️ https://t.co/niJ9Eu1lJJ","[chicagobears:, welcome, chicago, bears, justnfields, #bearsdraft]","['chicagobears', 'welcome', 'chicago', 'bear', 'justnfields', 'bearsdraft']"
24,1387934342886871043,alexdtang,2021-04-30 00:58:28,en,alexgarciaatx: nike's marketing iconic phil knight laid groundwork nike's high-performance marketing,0,669,"RT @alexgarcia_atx: Nike's marketing is iconic.

In 1992, Phil Knight laid the groundwork for Nike's high-performance marketing.

To this d…","[alexgarciaatx:, nike's, marketing, iconic, phil, knight, laid, groundwork, nike's, high-performance, marketing]","['alexgarciaatx', 'nike', 'marketing', 'iconic', 'phil', 'knight', 'lay', 'groundwork', 'nike', 'high', 'performance', 'marketing']"
25,1387912272018825221,alexdtang,2021-04-29 23:30:46,en,espn: updated,0,669,RT @espn: Updated 🏆 https://t.co/66oU7me6dV,"[espn:, updated]","['espn', 'update']"
26,1387912123288891398,alexdtang,2021-04-29 23:30:11,en,italic: shoes- theyre protecting feet stubbing toes lego stuff like that- also stylish,0,2,RT @italic: Shoes- they’re not just for protecting your feet from stubbing your toes and LEGO and stuff like that- they can also be stylish…,"[italic:, shoes-, theyre, protecting, feet, stubbing, toes, lego, stuff, like, that-, also, stylish]","['italic', 'shoes-', 'protect', 'foot', 'stub', 'toe', 'lego', 'stuff', 'like', 'stylish']"
27,1387911258666582026,alexdtang,2021-04-29 23:26:44,en,andrewfielding: plan calendars scheduled ask vc dunkhippo may th joinclubhouse,0,2,RT @andrewfielding: Plan your calendars — just scheduled Ask a VC with @dunkhippo33 in May 24th on @joinClubhouse https://t.co/p2sRHy2TI5,"[andrewfielding:, plan, calendars, scheduled, ask, vc, dunkhippo, may, th, joinclubhouse]","['andrewfielding', 'plan', 'calendar', 'schedule', 'ask', 'vc', 'dunkhippo', 'th', 'joinclubhouse']"
28,1387909292783775748,alexdtang,2021-04-29 23:18:56,en,harryhurst wait get tax bill,0,0,@harryhurst Just wait until they get their tax bill.,"[harryhurst, wait, get, tax, bill]","['harryhurst', 'wait', 'tax', 'bill']"
29,1387908844844691465,alexdtang,2021-04-29 23:17:09,en,thisiszann: best angel investors micro vcs miami,0,9,RT @thisiszann: 🌴 Who are the best angel investors &amp; micro VCs in Miami? 3️⃣0️⃣5️⃣,"[thisiszann:, best, angel, investors, micro, vcs, miami]","['thisiszann', 'good', 'angel', 'investor', 'micro', 'vcs', 'miami']"
30,1387841556200181763,alexdtang,2021-04-29 18:49:46,en,bznotes: best advice,0,2,RT @bznotes: Best advice. https://t.co/Z768Glvao1,"[bznotes:, best, advice]","['bznote', 'good', 'advice']"
31,1387812856058585090,alexdtang,2021-04-29 16:55:43,en,northmantrader: trick chicks know,0,145,RT @NorthmanTrader: If that doesn't do the trick with the chicks I don't know what does. https://t.co/FrVweXNFsx,"[northmantrader:, trick, chicks, know]","['northmantrader', 'trick', 'chick', 'know']"
32,1387797613928501248,alexdtang,2021-04-29 15:55:09,en,francissuarez: sorry sorrylol,0,76,RT @FrancisSuarez: Sorry not sorry...lol,"[francissuarez:, sorry, sorrylol]","['francissuarez', 'sorry', 'sorrylol']"
33,1387736145015021576,alexdtang,2021-04-29 11:50:54,en,pardesoteric: everyone miami right miami tech week conference official event vibe,0,14,"RT @pardesoteric: Why is everyone in Miami right now? For Miami Tech Week, which is not a conference or an official event, but a ✨vibe.✨ My…","[pardesoteric:, everyone, miami, right, miami, tech, week, conference, official, event, vibe]","['pardesoteric', 'miami', 'right', 'miami', 'tech', 'week', 'conference', 'official', 'event', 'vibe']"
34,1387734820885762052,alexdtang,2021-04-29 11:45:38,en,jasonlk cap table needs structured founders well motivated well fi,0,0,@jasonlk This is why the cap table needs to be structured so the founders are well motivated to do well and have fi… https://t.co/Ecg9Jjb2eb,"[jasonlk, cap, table, needs, structured, founders, well, motivated, well, fi]","['jasonlk', 'cap', 'table', 'need', 'structured', 'founder', 'motivate', 'fi']"
35,1387733802865332224,alexdtang,2021-04-29 11:41:36,en,jasonlk: related post here:,0,3,"RT @jasonlk: A related post here:

https://t.co/QcsnjkHL5b","[jasonlk:, related, post, here:]","['jasonlk', 'related', 'post']"
36,1387733789732917252,alexdtang,2021-04-29 11:41:32,en,jasonlk: yes vc hard worry about: - site going - hacked - cofounder quitting - key vp,0,32,"RT @jasonlk: Yes VC is hard

But you don't have to worry about:

- Site going down
- Being hacked
- Your cofounder quitting
- Your key VP m…","[jasonlk:, yes, vc, hard, worry, about:, -, site, going, -, hacked, -, cofounder, quitting, -, key, vp]","['jasonlk', 'yes', 'vc', 'hard', 'worry', 'site', 'go', 'hack', 'cofounder', 'quitting', 'key', 'vp']"
37,1387613185067393027,alexdtang,2021-04-29 03:42:18,en,nasamoon: ive got world window michael collins snapped photo lunar module returning command module,0,4300,"RT @NASAMoon: “I’ve got the world in my window.” 

Michael Collins snapped this photo of the lunar module returning to the command module a…","[nasamoon:, ive, got, world, window, michael, collins, snapped, photo, lunar, module, returning, command, module]","['nasamoon', 'have', 'get', 'world', 'window', 'michael', 'collins', 'snap', 'photo', 'lunar', 'module', 'return', 'command', 'module']"
38,1387608193916936203,alexdtang,2021-04-29 03:22:28,en,garrytan: hype factor = capital raised / annual recurring revenue target good particularly well ipo,0,24,"RT @garrytan: Hype Factor = Capital Raised / Annual Recurring Revenue

1 to 2 is target
2 to 3 is good, particularly well before an IPO
3to…","[garrytan:, hype, factor, =, capital, raised, /, annual, recurring, revenue, target, good, particularly, well, ipo]","['garrytan', 'hype', 'factor', '=', 'capital', 'raise', 'annual', 'recur', 'revenue', 'target', 'good', 'particularly', 'ipo']"
39,1387603337672077318,alexdtang,2021-04-29 03:03:10,en,jasonlk: probably limiting growth saas capital efficient m-m arr heres why:,0,1,"RT @jasonlk: You are probably limiting growth in SaaS if you are &gt;too&lt; capital efficient after $5m-$10m ARR

Here’s why:
 https://t.co/fW60…","[jasonlk:, probably, limiting, growth, saas, capital, efficient, m-m, arr, heres, why:]","['jasonlk', 'probably', 'limit', 'growth', 'saas', 'capital', 'efficient', 'm', 'm', 'arr', 'heres']"
40,1387595898369216518,alexdtang,2021-04-29 02:33:37,en,fintechjunkie: /: uncommon #vc chat early stage #startup within weeks get introduced - #sta,0,80,RT @fintechjunkie: 1/21: It’s not uncommon for a #VC to chat with an early stage #startup and within weeks get introduced to 3-4 other #sta…,"[fintechjunkie:, /:, uncommon, #vc, chat, early, stage, #startup, within, weeks, get, introduced, -, #sta]","['fintechjunkie', 'uncommon', 'vc', 'chat', 'early', 'stage', 'startup', 'week', 'introduce', 'sta']"
41,1387593911175110658,alexdtang,2021-04-29 02:25:43,en,vcstarterkit: pitch deck data room,0,252,RT @vcstarterkit: The pitch deck             The data room https://t.co/kaf1BjH0vN,"[vcstarterkit:, pitch, deck, data, room]","['vcstarterkit', 'pitch', 'deck', 'datum', 'room']"
42,1387593839284740097,alexdtang,2021-04-29 02:25:26,en,goodmarketinghq: favourite formula writing features benefits / write feature / ask find benef,0,191,"RT @GoodMarketingHQ: My favourite formula for writing “features &amp; benefits”

1/ Write down the feature
2/ Ask, “so what?” to find the benef…","[goodmarketinghq:, favourite, formula, writing, features, benefits, /, write, feature, /, ask, find, benef]","['goodmarketinghq', 'favourite', 'formula', 'writing', 'feature', 'benefit', 'write', 'feature', 'ask', 'find', 'benef']"
43,1387590343021973504,alexdtang,2021-04-29 02:11:32,en,online pharmacy capsule raised million round ceo eric kinariwala said values six-year-old startu,1,1,Online pharmacy Capsule raised $300 million in a round that CEO Eric Kinariwala said values the six-year-old startu… https://t.co/IM6rHUFQ0F,"[online, pharmacy, capsule, raised, million, round, ceo, eric, kinariwala, said, values, six-year-old, startu]","['online', 'pharmacy', 'capsule', 'raise', 'million', 'round', 'ceo', 'eric', 'kinariwala', 'say', 'value', 'year', 'old', 'startu']"
44,1387568314600275975,alexdtang,2021-04-29 00:44:00,en,bhawktommyhawk: could go wrong #mascotswap nhlblackhawks bennythebull chicagobulls nhl nba,0,97,"RT @BhawkTommyHawk: What could go wrong? 🤷‍♂️
#MascotSwap

@NHLBlackhawks @bennythebull @chicagobulls @NHL @NBA  
https://t.co/XUn8iKqZON","[bhawktommyhawk:, could, go, wrong, #mascotswap, nhlblackhawks, bennythebull, chicagobulls, nhl, nba]","['bhawktommyhawk', 'wrong', 'mascotswap', 'nhlblackhawks', 'bennythebull', 'chicagobulls', 'nhl', 'nba']"
45,1387442618376851459,alexdtang,2021-04-28 16:24:32,en,eervin: garygenslersec nice job grateful mitopencourse granting public access cc onr,0,4,"RT @eervin1: @GaryGenslerSEC did such a nice job with these.   Grateful to @MITOpenCourse for granting the public access to these. 
cc @Onr…","[eervin:, garygenslersec, nice, job, grateful, mitopencourse, granting, public, access, cc, onr]","['eervin', 'garygenslersec', 'nice', 'job', 'grateful', 'mitopencourse', 'grant', 'public', 'access', 'cc', 'onr']"
46,1387439818716635139,alexdtang,2021-04-28 16:13:24,en,tracecohen: early-stage venture becoming growth investors game via crunchbasenews buying lotto ticke,0,1,"RT @Trace_Cohen: Is Early-Stage Venture Becoming A Growth Investor’s Game? https://t.co/2wRxHbvaaP via @crunchbasenews 

Buying lotto ticke…","[tracecohen:, early-stage, venture, becoming, growth, investors, game, via, crunchbasenews, buying, lotto, ticke]","['tracecohen', 'early', 'stage', 'venture', 'growth', 'investor', 'game', 'crunchbasenews', 'buying', 'lotto', 'ticke']"
47,1387432467829862404,alexdtang,2021-04-28 15:44:12,en,francissuarez: couldnt prouder moment living proof miami movement real building together,0,137,RT @FrancisSuarez: I couldn’t be prouder of this moment. This is living proof that the Miami Movement is real. What we’re building together…,"[francissuarez:, couldnt, prouder, moment, living, proof, miami, movement, real, building, together]","['francissuarez', 'not', 'prouder', 'moment', 'live', 'proof', 'miami', 'movement', 'real', 'build']"
48,1387426507631497221,alexdtang,2021-04-28 15:20:31,en,yoda: makes happy anti-silicon valley wealth spread,0,1,"RT @yoda: this makes me very happy. not anti-silicon valley, but the wealth should be spread out https://t.co/DhlQrMDnrR https://t.co/8UsKB…","[yoda:, makes, happy, anti-silicon, valley, wealth, spread]","['yoda', 'make', 'happy', 'anti', 'silicon', 'valley', 'wealth', 'spread']"
49,1387400159127085057,alexdtang,2021-04-28 13:35:49,en,gavinsbaker: numbers really staggering multiple - billion outcomes million invested capital,0,15,"RT @GavinSBaker: The numbers really are staggering.

Multiple $8-$12 billion outcomes on ~$200 million of invested capital. https://t.co/yM…","[gavinsbaker:, numbers, really, staggering, multiple, -, billion, outcomes, million, invested, capital]","['gavinsbaker', 'number', 'staggering', 'multiple', 'billion', 'outcome', 'million', 'invest', 'capital']"
50,1387399580548059138,alexdtang,2021-04-28 13:33:31,en,marceloclaure: wow show another place world happening go #miami francissuarez,0,14,RT @marceloclaure: Wow.  Show me another place in the world where this is happening. Go #Miami @FrancisSuarez,"[marceloclaure:, wow, show, another, place, world, happening, go, #miami, francissuarez]","['marceloclaure', 'wow', 'place', 'world', 'happen', 'miami', 'francissuarez']"
51,1387399021644468231,alexdtang,2021-04-28 13:31:18,en,clarencebethea rmb experience taught growing mm revenue technology business less two years,0,0,@Clarence_Bethea @RMB2 Experience has taught me growing a $100MM revenue technology business in less than two years… https://t.co/WjZcJxOz6j,"[clarencebethea, rmb, experience, taught, growing, mm, revenue, technology, business, less, two, years]","['clarencebethea', 'rmb', 'experience', 'teach', 'grow', 'mm', 'revenue', 'technology', 'business', 'year']"
52,1387394623966961664,alexdtang,2021-04-28 13:13:49,en,clarencebethea rmb unit economics scaling cash needs meet financing strateg,0,0,@Clarence_Bethea @RMB2 It’s about the unit economics with scaling. Does your cash needs meet your financing strateg… https://t.co/wQjYQxfDOC,"[clarencebethea, rmb, unit, economics, scaling, cash, needs, meet, financing, strateg]","['clarencebethea', 'rmb', 'unit', 'economic', 'scale', 'cash', 'need', 'meet', 'financing', 'strateg']"
53,1387365501114798080,alexdtang,2021-04-28 11:18:06,en,trengriffin: rishigosalia billbrewsterscg two different types variant perception involved argument examples:,0,2,RT @trengriffin: @RishiGosalia @BillBrewsterSCG There are two different types of variant perception involved in your argument. Examples:…,"[trengriffin:, rishigosalia, billbrewsterscg, two, different, types, variant, perception, involved, argument, examples:]","['trengriffin', 'rishigosalia', 'billbrewsterscg', 'different', 'type', 'variant', 'perception', 'involve', 'argument', 'example']"
54,1387364675898204162,alexdtang,2021-04-28 11:14:49,en,honam: thread many amazing quotes capturing one incredibly important idea worth read,0,1,RT @honam: This thread has so many amazing quotes capturing one incredibly important idea. Worth a read.,"[honam:, thread, many, amazing, quotes, capturing, one, incredibly, important, idea, worth, read]","['honam', 'thread', 'amazing', 'quote', 'capture', 'incredibly', 'important', 'idea', 'worth', 'read']"
55,1387361892688072706,alexdtang,2021-04-28 11:03:45,en,breadcrumbsre: investing inflationary environment,0,6,RT @breadcrumbsre: On investing in an inflationary environment https://t.co/s6DlsJzB8v https://t.co/41Gsxy4vTf,"[breadcrumbsre:, investing, inflationary, environment]","['breadcrumbsre', 'invest', 'inflationary', 'environment']"
56,1387256637144981504,alexdtang,2021-04-28 04:05:30,en,stockthoughts: excellent description music industry value chain works sleepwellcap (who extremely underfollowed bt,0,12,"RT @stockthoughts81: Excellent description of how the music industry value chain works by @SleepwellCap (who is extremely underfollowed, bt…","[stockthoughts:, excellent, description, music, industry, value, chain, works, sleepwellcap, (who, extremely, underfollowed, bt]","['stockthought', 'excellent', 'description', 'music', 'industry', 'value', 'chain', 'work', 'sleepwellcap', 'extremely', 'underfollowe', 'bt']"
