,id,username,created_at,lang,cleaned_tweets,favorite_count,retweet_count,text,tokens,lemmas
596,1283436073905983488,annasmithjourno,2020-07-15 16:19:39,en,latitudefest thanks emailed,0,0,"@LatitudeFest Thanks, have emailed!","[latitudefest, thanks, emailed]","['latitudefest', 'thank', 'email']"
597,1283411067473977344,annasmithjourno,2020-07-15 14:40:17,en,latitudefest hi what's best email get latitude staffer moment pls thanks,0,0,"@LatitudeFest Hi there, what's the best email to get through to a Latitude staffer at the moment pls? Thanks!","[latitudefest, hi, what's, best, email, get, latitude, staffer, moment, pls, thanks]","['latitudefest', 'hi', 'good', 'email', 'latitude', 'staffer', 'moment', 'pls', 'thank']"
598,1283400697262804993,annasmithjourno,2020-07-15 13:59:05,en,emergencefilm girlsonfilmpod heather got email thank :),1,0,@emergencefilm @GirlsOnFilm_Pod That was Heather! Got your email thank you :),"[emergencefilm, girlsonfilmpod, heather, got, email, thank, :)]","['emergencefilm', 'girlsonfilmpod', 'heather', 'get', 'email', 'thank']"
599,1282953122558738432,annasmithjourno,2020-07-14 08:20:35,en,looking home viewing inspiration watch reviews #spaceshipearth #arkansas #litigante,7,1,"Looking for home viewing inspiration? You can watch my reviews of #SpaceshipEarth, #Arkansas, #Litigante &amp;… https://t.co/rH8krXzxGR","[looking, home, viewing, inspiration, watch, reviews, #spaceshipearth, #arkansas, #litigante]","['look', 'home', 'view', 'inspiration', 'watch', 'review', 'spaceshipearth', 'arkansas', 'litigante']"
600,1282771560940670976,annasmithjourno,2020-07-13 20:19:07,en,enchantedbyfilm: listening beccaeharrison conversation annasmithjourno queer film girlsonfilmpod pride specia,0,5,RT @enchantedbyfilm: Listening to @BeccaEHarrison in conversation with @annasmithjourno on queer film for the @GirlsOnFilm_Pod Pride specia…,"[enchantedbyfilm:, listening, beccaeharrison, conversation, annasmithjourno, queer, film, girlsonfilmpod, pride, specia]","['enchantedbyfilm', 'listen', 'beccaeharrison', 'conversation', 'annasmithjourno', 'queer', 'film', 'girlsonfilmpod', 'pride', 'specia']"
601,1282611605507919873,annasmithjourno,2020-07-13 09:43:31,en,girlsonfilmpod: here's brill beccaeharrison akhavandesiree's appropriate behavior #girlsonfilm #pride special pr,0,11,RT @GirlsOnFilm_Pod: Here's the brill @BeccaEHarrison on @akhavandesiree's Appropriate Behavior in our #GirlsOnFilm #pride special with @pr…,"[girlsonfilmpod:, here's, brill, beccaeharrison, akhavandesiree's, appropriate, behavior, #girlsonfilm, #pride, special, pr]","['girlsonfilmpod', 'brill', 'beccaeharrison', 'akhavandesiree', 'appropriate', 'behavior', 'girlsonfilm', 'pride', 'special', 'pr']"
602,1282328898282369024,annasmithjourno,2020-07-12 15:00:08,en,kermodemovie: excellent job annasmithjourno hosting film review bbc news channel smart sharp informative check,0,3,"RT @KermodeMovie: Excellent job by @annasmithjourno hosting THE FILM REVIEW on @BBC News channel. Smart, sharp, informative. Check it out o…","[kermodemovie:, excellent, job, annasmithjourno, hosting, film, review, bbc, news, channel, smart, sharp, informative, check]","['kermodemovie', 'excellent', 'job', 'annasmithjourno', 'host', 'film', 'review', 'bbc', 'news', 'channel', 'smart', 'sharp', 'informative', 'check']"
603,1281565917978202113,annasmithjourno,2020-07-10 12:28:19,en,delighted covering great kermodemovie weekend's film review bbcnews - first showing,82,10,Delighted to be covering for the great @KermodeMovie on this weekend's The Film Review on @BBCNews - first showing… https://t.co/8gDeb8VSZB,"[delighted, covering, great, kermodemovie, weekend's, film, review, bbcnews, -, first, showing]","['delighted', 'cover', 'great', 'kermodemovie', 'weekend', 'film', 'review', 'bbcnews', 'showing']"
604,1280591459603877888,annasmithjourno,2020-07-07 19:56:10,en,asianculturevul: new: great chat becauseimfreida annasmithjourno - super finale loveliff #loveliffathome,0,2,"RT @asianculturevul: NEW: Great chat @BecauseImFreida and @annasmithjourno - super finale to @LoveLIFF #loveliffathome 
https://t.co/1EjHtS…","[asianculturevul:, new:, great, chat, becauseimfreida, annasmithjourno, -, super, finale, loveliff, #loveliffathome]","['asianculturevul', 'new', 'great', 'chat', 'becauseimfreida', 'annasmithjourno', 'super', 'finale', 'loveliff', 'loveliffathome']"
605,1280574553119436807,annasmithjourno,2020-07-07 18:49:00,en,panaceaprods: commemorating launch thriller 'baby mine' starring #alexandersiddig - check interview wanna kno,0,3,RT @PanaceaProds: Commemorating the launch of my thriller 'Baby Mine' starring #AlexanderSiddig - check out this interview if you wanna kno…,"[panaceaprods:, commemorating, launch, thriller, 'baby, mine', starring, #alexandersiddig, -, check, interview, wanna, kno]","['panaceaprods', 'commemorate', 'launch', 'thriller', 'baby', 'star', 'alexandersiddig', 'check', 'interview', 'wanna', 'kno']"
606,1280574021059387392,annasmithjourno,2020-07-07 18:46:53,en,primevideouk: pride special episode girlsonfilmpod week special guest bellathorne dropping talk,0,48,"RT @primevideouk: It's a Pride special episode of @GirlsOnFilm_Pod this week, with special guest @bellathorne dropping in to talk about the…","[primevideouk:, pride, special, episode, girlsonfilmpod, week, special, guest, bellathorne, dropping, talk]","['primevideouk', 'pride', 'special', 'episode', 'girlsonfilmpod', 'week', 'special', 'guest', 'bellathorne', 'drop', 'talk']"
607,1280558751771222016,annasmithjourno,2020-07-07 17:46:12,en,lalalooms: launching #ayouni online worldwide st july - pre order film - subs availab,0,15,RT @lalalooms: We will be launching #Ayouni online worldwide on 1st July - pre order the film now at https://t.co/dyzMasXK5C - subs availab…,"[lalalooms:, launching, #ayouni, online, worldwide, st, july, -, pre, order, film, -, subs, availab]","['lalalooms', 'launch', 'ayouni', 'online', 'worldwide', 'st', 'july', 'pre', 'order', 'film', 'sub', 'availab']"
608,1280085856531951616,annasmithjourno,2020-07-06 10:27:05,en,girlsonfilmpod: youd like see #girlsonfilm pick british podcast award year youve got noon vote us,0,1,"RT @GirlsOnFilm_Pod: If you’d like to see #GirlsOnFilm pick up a British Podcast Award this year, you’ve got until 12 noon to vote for us i…","[girlsonfilmpod:, youd, like, see, #girlsonfilm, pick, british, podcast, award, year, youve, got, noon, vote, us]","['girlsonfilmpod', 'would', 'like', 'girlsonfilm', 'pick', 'british', 'podcast', 'award', 'year', 'have', 'get', 'noon', 'vote']"
609,1279832830667886592,annasmithjourno,2020-07-05 17:41:39,en,edfilmfest: ravishing -minute audiovisual essay human mortality extinction legacy - poignant,0,8,"RT @edfilmfest: ""A ravishing 70-minute audiovisual essay on human mortality, extinction and legacy - all the more poignant for being its ma…","[edfilmfest:, ravishing, -minute, audiovisual, essay, human, mortality, extinction, legacy, -, poignant]","['edfilmf', 'ravishing', '-minute', 'audiovisual', 'essay', 'human', 'mortality', 'extinction', 'legacy', 'poignant']"
610,1279744576174030848,annasmithjourno,2020-07-05 11:50:58,en,loveliff: today marks years us joining twitter celebrate first tweet day one exciting ever r,0,7,RT @LoveLIFF: Today marks 10 years of us joining Twitter so to celebrate 🎉 our first tweet of the day is one of our most exciting ever! A r…,"[loveliff:, today, marks, years, us, joining, twitter, celebrate, first, tweet, day, one, exciting, ever, r]","['loveliff', 'today', 'mark', 'year', 'join', 'twitter', 'celebrate', 'tweet', 'day', 'exciting', 'r']"
611,1278766185648205825,annasmithjourno,2020-07-02 19:03:11,en,congratulations girlsonfilmpod bfi guest nishaganatra groundbreaking work:,9,3,Congratulations to our @girlsonfilm_pod @BFI guest @NishaGanatra for this groundbreaking work:… https://t.co/0spuVGoMsb,"[congratulations, girlsonfilmpod, bfi, guest, nishaganatra, groundbreaking, work:]","['congratulations', 'girlsonfilmpod', 'bfi', 'guest', 'nishaganatra', 'groundbreaking', 'work']"
612,1278759359540011011,annasmithjourno,2020-07-02 18:36:04,en,today's film recommendation lynn lucy devastating thought-provoking drama #bfiplayer,6,3,"Today's film recommendation is LYNN + LUCY, a devastating and thought-provoking drama. It's on the #BFIPlayer from… https://t.co/wtb65Sd0o6","[today's, film, recommendation, lynn, lucy, devastating, thought-provoking, drama, #bfiplayer]","['today', 'film', 'recommendation', 'lynn', 'lucy', 'devastating', 'thought', 'provoke', 'drama', 'bfiplayer']"
613,1278700470236782593,annasmithjourno,2020-07-02 14:42:03,en,sophiekendrick: happy birthday kermodemovie raising lukewarm glass green room wine today we'll bac,0,2,"RT @SophieKendrick: Happy birthday @KermodeMovie! 🍻🎬📽️🎟️🎂 I will be raising a lukewarm glass of Green Room wine to you today.

We'll be bac…","[sophiekendrick:, happy, birthday, kermodemovie, raising, lukewarm, glass, green, room, wine, today, we'll, bac]","['sophiekendrick', 'happy', 'birthday', 'kermodemovie', 'raise', 'lukewarm', 'glass', 'green', 'room', 'wine', 'today', 'bac']"
614,1278639782281859073,annasmithjourno,2020-07-02 10:40:54,en,girlsonfilmpod: new #girlsonfilm #pride special primevideouk actor bellathorne talks power social,0,6,"RT @GirlsOnFilm_Pod: NEW #GirlsOnFilm out now!
In a #Pride special with @primevideouk, actor
@bellathorne talks about the power of social m…","[girlsonfilmpod:, new, #girlsonfilm, #pride, special, primevideouk, actor, bellathorne, talks, power, social]","['girlsonfilmpod', 'new', 'girlsonfilm', 'pride', 'special', 'primevideouk', 'actor', 'bellathorne', 'talk', 'power', 'social']"
615,1278320831609933824,annasmithjourno,2020-07-01 13:33:30,en,outlandercostum hi publicist email could contact please regarding potential interview thanks,0,0,"@OutlanderCostum Hi there, do you have a publicist or email I could contact you on please regarding a potential interview? Thanks!","[outlandercostum, hi, publicist, email, could, contact, please, regarding, potential, interview, thanks]","['outlandercostum', 'hi', 'publicist', 'email', 'contact', 'potential', 'interview', 'thank']"
616,1278023039179984898,annasmithjourno,2020-06-30 17:50:11,en,next ep girlsonfilmpod #pride special primevideouk featuring frank interview actor,7,3,"The next ep of @GirlsOnFilm_Pod will be a #PRIDE special with @primevideouk, featuring a frank interview with actor… https://t.co/aChX6RLqDM","[next, ep, girlsonfilmpod, #pride, special, primevideouk, featuring, frank, interview, actor]","['ep', 'girlsonfilmpod', 'pride', 'special', 'primevideouk', 'feature', 'frank', 'interview', 'actor']"
617,1277636730468917248,annasmithjourno,2020-06-29 16:15:08,en,girlsonfilmpod: britpodawards fast approaching like see #girlsonfilm gong vote us,0,3,"RT @GirlsOnFilm_Pod: The @britpodawards are fast approaching...
If you'd like to see #GirlsOnFilm up for a gong, you can vote for us here i…","[girlsonfilmpod:, britpodawards, fast, approaching, like, see, #girlsonfilm, gong, vote, us]","['girlsonfilmpod', 'britpodawards', 'fast', 'approach', 'like', 'girlsonfilm', 'gong', 'vote']"
618,1277611656034607104,annasmithjourno,2020-06-29 14:35:30,en,loveliff: oh hi becauseimfreida see sunday watch special #loveliffathome interview superstar actress thi,0,3,RT @LoveLIFF: 😀Oh hi there @BecauseImFreida see you Sunday! Watch our very special #LoveLIFFatHome interview with the superstar actress thi…,"[loveliff:, oh, hi, becauseimfreida, see, sunday, watch, special, #loveliffathome, interview, superstar, actress, thi]","['loveliff', 'oh', 'hi', 'becauseimfreida', 'sunday', 'watch', 'special', 'loveliffathome', 'interview', 'superstar', 'actress', 'thi']"
619,1277579105916137473,annasmithjourno,2020-06-29 12:26:09,en,loveliff: leading ladies big screen screening exclusive interviews indian women made global impact,0,33,"RT @LoveLIFF: LEADING LADIES OF THE BIG SCREEN 
We’re screening exclusive interviews with 4 Indian women who have made a global impact in t…","[loveliff:, leading, ladies, big, screen, screening, exclusive, interviews, indian, women, made, global, impact]","['loveliff', 'lead', 'lady', 'big', 'screen', 'screen', 'exclusive', 'interview', 'indian', 'woman', 'global', 'impact']"
620,1277312987922128897,annasmithjourno,2020-06-28 18:48:42,en,today's movie recommendation god's country 'a ravishing drama brings poetic beauty harsh env,19,2,Today's movie recommendation is GOD'S OWN COUNTRY. It's 'a ravishing drama that brings poetic beauty to a harsh env… https://t.co/kVakK5uzRU,"[today's, movie, recommendation, god's, country, 'a, ravishing, drama, brings, poetic, beauty, harsh, env]","['today', 'movie', 'recommendation', 'god', 'country', 'ravishing', 'drama', 'bring', 'poetic', 'beauty', 'harsh', 'env']"
621,1276934209978982401,annasmithjourno,2020-06-27 17:43:34,en,girlsonfilmpod: happy pride latest #girlsonfilm #datingamber special - here's snippet star lolapetticrew conve,0,5,"RT @GirlsOnFilm_Pod: Happy Pride! 🏳️‍🌈
The latest #GirlsOnFilm is a #DatingAmber special - here's a snippet of star @LolaPetticrew in conve…","[girlsonfilmpod:, happy, pride, latest, #girlsonfilm, #datingamber, special, -, here's, snippet, star, lolapetticrew, conve]","['girlsonfilmpod', 'happy', 'pride', 'late', 'girlsonfilm', 'datingamber', 'special', 'snippet', 'star', 'lolapetticrew', 'conve']"
622,1276487673922936837,annasmithjourno,2020-06-26 12:09:12,en,primevideouk: new episode girlsonfilmpod - join lolapetticrew seej talking things dating amber anna,0,11,RT @primevideouk: The new episode of @GirlsOnFilm_pod is out now - join @lolapetticrew and @Seej talking all things Dating Amber with @anna…,"[primevideouk:, new, episode, girlsonfilmpod, -, join, lolapetticrew, seej, talking, things, dating, amber, anna]","['primevideouk', 'new', 'episode', 'girlsonfilmpod', 'join', 'lolapetticrew', 'seej', 'talk', 'thing', 'date', 'amber', 'anna']"
623,1276168749020778497,annasmithjourno,2020-06-25 15:01:54,en,annasmithjourno: watched brand new youtube episode girlsonfilmpod bfi showing here: http,0,18,RT @annasmithjourno: Have you watched our brand new YouTube episode of @GirlsOnFilm_Pod at @BFI? Showing here: https://t.co/N8DIw6tMPu http…,"[annasmithjourno:, watched, brand, new, youtube, episode, girlsonfilmpod, bfi, showing, here:, http]","['annasmithjourno', 'watch', 'brand', 'new', 'youtube', 'episode', 'girlsonfilmpod', 'bfi', 'show', 'http']"
624,1276125256906878976,annasmithjourno,2020-06-25 12:09:05,en,ashantiomkar: excited loveliff welovebiff online #openingnight uber talented ayushmann,0,7,RT @AshantiOmkar: Excited about the @LoveLIFF @weLoveBIFF online #openingnight at https://t.co/J7Z0KDFGA3 with the uber talented @ayushmann…,"[ashantiomkar:, excited, loveliff, welovebiff, online, #openingnight, uber, talented, ayushmann]","['ashantiomkar', 'excited', 'loveliff', 'welovebiff', 'online', 'openingnight', 'uber', 'talented', 'ayushmann']"
625,1276116189719248898,annasmithjourno,2020-06-25 11:33:03,en,jandunnfilm: wepuk directorsuk wftvuk please help spread word th anniversary #screening weekend directed written,0,5,"RT @JanDunnFilm: @WEP_UK @DirectorsUk @WFTV_UK please help spread the word 30th Anniversary #screening this weekend directed by, written by…","[jandunnfilm:, wepuk, directorsuk, wftvuk, please, help, spread, word, th, anniversary, #screening, weekend, directed, written]","['jandunnfilm', 'wepuk', 'directorsuk', 'wftvuk', 'help', 'spread', 'word', 'th', 'anniversary', 'screening', 'weekend', 'direct', 'write']"
626,1276096730266767366,annasmithjourno,2020-06-25 10:15:43,en,can't say 'ist' something mpeakeofficial tells journey f,12,5,"""You can't just say you're an 'ist' if you're not doing something."" @MPeakeOfficial tells me about her journey to f… https://t.co/4QlkNZvHPQ","[can't, say, 'ist', something, mpeakeofficial, tells, journey, f]","['ist', 'mpeakeofficial', 'tell', 'journey', 'f']"
627,1275832853985624066,annasmithjourno,2020-06-24 16:47:10,en,girlsonfilmpod: brand new #girlsonfilm pod #datingamber special annasmithjourno chats films star lolapetticrew,0,9,"RT @GirlsOnFilm_Pod: !Brand new #GirlsOnFilm pod!
In a #DatingAmber special, @annasmithjourno chats to the film’s star @LolaPetticrew and @…","[girlsonfilmpod:, brand, new, #girlsonfilm, pod, #datingamber, special, annasmithjourno, chats, films, star, lolapetticrew]","['girlsonfilmpod', 'brand', 'new', 'girlsonfilm', 'pod', 'datingamber', 'special', 'annasmithjourno', 'chat', 'film', 'star', 'lolapetticrew']"
628,1275700917468266497,annasmithjourno,2020-06-24 08:02:54,en,watched brand new youtube episode girlsonfilmpod bfi showing here:,37,18,Have you watched our brand new YouTube episode of @GirlsOnFilm_Pod at @BFI? Showing here: https://t.co/N8DIw6tMPu https://t.co/siMrsDix90,"[watched, brand, new, youtube, episode, girlsonfilmpod, bfi, showing, here:]","['watch', 'brand', 'new', 'youtube', 'episode', 'girlsonfilmpod', 'bfi', 'show']"
629,1275492392314056707,annasmithjourno,2020-06-23 18:14:18,en,bfi: final guest tonight's #girlsonfilm nicholaaburley stars upcoming #lynnandlucy,0,2,"RT @BFI: The final guest of tonight's #GirlsOnFilm is @NicholaABurley, who stars in the upcoming #LynnAndLucy https://t.co/PitRYWeVUa","[bfi:, final, guest, tonight's, #girlsonfilm, nicholaaburley, stars, upcoming, #lynnandlucy]","['bfi', 'final', 'guest', 'tonight', 'girlsonfilm', 'nicholaaburley', 'star', 'upcome', 'lynnandlucy']"
630,1275489833536847878,annasmithjourno,2020-06-23 18:04:08,en,last ammaasante girlsonfilmpod episode recorded live audience weareallbright club,3,2,"We last had @AmmaAsante on @GirlsOnFilm_Pod episode 11, recorded with a live audience at @weareAllBright club in Ma… https://t.co/DWVcR6in3j","[last, ammaasante, girlsonfilmpod, episode, recorded, live, audience, weareallbright, club]","['ammaasante', 'girlsonfilmpod', 'episode', 'record', 'live', 'audience', 'weareallbright', 'club']"
631,1275483197611139072,annasmithjourno,2020-06-23 17:37:46,en,bfi: #girlsonfilm incomparable mpeakeofficial,0,5,"RT @BFI: Now on #GirlsOnFilm, the incomparable @MPeakeOfficial https://t.co/U9wS7yM6eX","[bfi:, #girlsonfilm, incomparable, mpeakeofficial]","['bfi', 'girlsonfilm', 'incomparable', 'mpeakeofficial']"
632,1275482948213637120,annasmithjourno,2020-06-23 17:36:46,en,bfi: tune #girlsonfilm annasmithjourno,0,5,RT @BFI: Tune in NOW for #GirlsOnFilm with @annasmithjourno https://t.co/2XDlAniEc9,"[bfi:, tune, #girlsonfilm, annasmithjourno]","['bfi', 'tune', 'girlsonfilm', 'annasmithjourno']"
633,1275482912276742144,annasmithjourno,2020-06-23 17:36:38,en,bfi: bfi player recommendations annasmithjourno girlhood brother devil,0,4,"RT @BFI: BFI Player Recommendations from @annasmithjourno 

Girlhood https://t.co/0LNTSekB1J  

My Brother the Devil https://t.co/izO2RXKC8…","[bfi:, bfi, player, recommendations, annasmithjourno, girlhood, brother, devil]","['bfi', 'bfi', 'player', 'recommendation', 'annasmithjourno', 'girlhood', 'brother', 'devil']"
634,1275478766651871232,annasmithjourno,2020-06-23 17:20:09,en,girlsonfilmpod: see bfi youtube channel minutes tonights #girlsonfilm amazing guests watch here:,0,9,"RT @GirlsOnFilm_Pod: See you on the @BFI YouTube channel in 15 minutes for tonight’s #GirlsOnFilm with these amazing guests! 

Watch here:…","[girlsonfilmpod:, see, bfi, youtube, channel, minutes, tonights, #girlsonfilm, amazing, guests, watch, here:]","['girlsonfilmpod', 'bfi', 'youtube', 'channel', 'minutes', 'tonights', 'girlsonfilm', 'amazing', 'guest', 'watch']"
635,1275453880944320512,annasmithjourno,2020-06-23 15:41:16,en,girlsonfilmpod: counting hours til bfi youtube episode tonight :pm set reminder here:,0,8,RT @GirlsOnFilm_Pod: Counting down the hours til our @BFI YouTube episode tonight at 6:30pm! Set a reminder here: https://t.co/eoP1x7Z1wu…,"[girlsonfilmpod:, counting, hours, til, bfi, youtube, episode, tonight, :pm, set, reminder, here:]","['girlsonfilmpod', 'count', 'hour', 'til', 'bfi', 'youtube', 'episode', 'tonight', 'pm', 'set', 'reminder']"
636,1275446317594992641,annasmithjourno,2020-06-23 15:11:13,en,keen get filmmaking director ammaasante great advice tune bfi youtube c,4,4,"Are you keen to get into filmmaking? Director 
@AmmaAsante has some great advice for you. Tune into 
@BFI YouTube c… https://t.co/NvlIPBfaIt","[keen, get, filmmaking, director, ammaasante, great, advice, tune, bfi, youtube, c]","['keen', 'filmmake', 'director', 'ammaasante', 'great', 'advice', 'tune', 'bfi', 'youtube', 'c']"
637,1275437249581047809,annasmithjourno,2020-06-23 14:35:11,en,showroomcinema girlsonfilmpod ammaasante mpeakeofficial nicholaaburley thanks sharing showroomcinema,2,0,"@showroomcinema @GirlsOnFilm_Pod @AmmaAsante @MPeakeOfficial @NicholaABurley Thanks for sharing, @showroomcinema!","[showroomcinema, girlsonfilmpod, ammaasante, mpeakeofficial, nicholaaburley, thanks, sharing, showroomcinema]","['showroomcinema', 'girlsonfilmpod', 'ammaasante', 'mpeakeofficial', 'nicholaaburley', 'thank', 'share', 'showroomcinema']"
638,1275434366684942338,annasmithjourno,2020-06-23 14:23:44,en,girlsonfilmpod: looking forward #radioactives digital release star #rosamundpike guest #girlsonfilm bfi yout,0,5,RT @GirlsOnFilm_Pod: Looking forward to #Radioactive’s digital release? Its star #RosamundPike is our guest on #GirlsOnFilm on the BFI YouT…,"[girlsonfilmpod:, looking, forward, #radioactives, digital, release, star, #rosamundpike, guest, #girlsonfilm, bfi, yout]","['girlsonfilmpod', 'look', 'forward', 'radioactive', 'digital', 'release', 'star', 'rosamundpike', 'guest', 'girlsonfilm', 'bfi', 'yout']"
639,1275395035228495872,annasmithjourno,2020-06-23 11:47:26,en,girlsonfilmpod: calls refugecharitys national domestic abuse helpline increased lockdown heres preview,0,25,RT @GirlsOnFilm_Pod: Calls to @RefugeCharity’s National Domestic Abuse Helpline have increased by 66% during lockdown. Here’s a preview of…,"[girlsonfilmpod:, calls, refugecharitys, national, domestic, abuse, helpline, increased, lockdown, heres, preview]","['girlsonfilmpod', 'call', 'refugecharitys', 'national', 'domestic', 'abuse', 'helpline', 'increase', 'lockdown', 'heres', 'preview']"
640,1275370647590449152,annasmithjourno,2020-06-23 10:10:32,en,here's exclusive preview #rosamundpike tonight's girlsonfilmpod show bfi youtube show goes live,29,6,Here's an exclusive preview of #RosamundPike on tonight's @GirlsOnFilm_Pod show on @BFI YouTube. The show goes live… https://t.co/7qtnmugrsH,"[here's, exclusive, preview, #rosamundpike, tonight's, girlsonfilmpod, show, bfi, youtube, show, goes, live]","['exclusive', 'preview', 'rosamundpike', 'tonight', 'girlsonfilmpod', 'bfi', 'youtube', 'go', 'live']"
641,1275134688445837313,annasmithjourno,2020-06-22 18:32:55,en,carolmorley thank supporting girlsonfilmpod word go x,3,0,@_CarolMorley Thank you for supporting @GirlsOnFilm_Pod from the word go! x,"[carolmorley, thank, supporting, girlsonfilmpod, word, go, x]","['carolmorley', 'thank', 'support', 'girlsonfilmpod', 'word', 'x']"
642,1275129817915101186,annasmithjourno,2020-06-22 18:13:34,en,maxine peake talking working great carolmorley show - tune pm tues rd,16,5,Maxine Peake will be talking about working with the great @_CarolMorley in this show - tune in 6.30pm Tues 23rd to… https://t.co/aqTo6S8SZq,"[maxine, peake, talking, working, great, carolmorley, show, -, tune, pm, tues, rd]","['maxine', 'peake', 'talk', 'work', 'great', 'carolmorley', 'tune', 'pm', 'tues', 'rd']"
643,1275128943700475905,annasmithjourno,2020-06-22 18:10:05,en,girlsonfilmpod: stay loop #girlsonfilm plotting planning new fortnightly newsletter - coming soon,0,4,RT @GirlsOnFilm_Pod: Stay in the loop about what #GirlsOnFilm are plotting and planning with our new fortnightly newsletter - coming soon!…,"[girlsonfilmpod:, stay, loop, #girlsonfilm, plotting, planning, new, fortnightly, newsletter, -, coming, soon]","['girlsonfilmpod', 'stay', 'loop', 'girlsonfilm', 'plotting', 'plan', 'new', 'fortnightly', 'newsletter', 'come', 'soon']"
644,1275102539067817985,annasmithjourno,2020-06-22 16:25:10,en,girlsonfilmpod: director ammaasante shares response recent events surrounding #blacklivesmatter movement latest #gi,0,16,RT @GirlsOnFilm_Pod: Director @AmmaAsante shares her response to recent events surrounding the #BlackLivesMatter movement in our latest #Gi…,"[girlsonfilmpod:, director, ammaasante, shares, response, recent, events, surrounding, #blacklivesmatter, movement, latest, #gi]","['girlsonfilmpod', 'director', 'ammaasante', 'share', 'response', 'recent', 'event', 'surround', 'blacklivesmatter', 'movement', 'late', 'gi']"
645,1275101298371842048,annasmithjourno,2020-06-22 16:20:14,en,bfi: join annasmithjourno tomorrow night catches rosamund pike nicholaaburley mpeakeofficial ammaasante,0,8,"RT @BFI: Join @annasmithjourno tomorrow night as she catches up with Rosamund Pike, @NicholaABurley, @MPeakeOfficial and @AmmaAsante on the…","[bfi:, join, annasmithjourno, tomorrow, night, catches, rosamund, pike, nicholaaburley, mpeakeofficial, ammaasante]","['bfi', 'join', 'annasmithjourno', 'tomorrow', 'night', 'catch', 'rosamund', 'pike', 'nicholaaburley', 'mpeakeofficial', 'ammaasante']"
646,1275078476530212864,annasmithjourno,2020-06-22 14:49:33,en,girlsonfilmpod: male composer ask women can't write action music catch latest #girlsonfilm pod,0,8,"RT @GirlsOnFilm_Pod: ""I have had a male composer ask me why women can't write action music..."" 

Catch up with the latest #GirlsOnFilm pod…","[girlsonfilmpod:, male, composer, ask, women, can't, write, action, music, catch, latest, #girlsonfilm, pod]","['girlsonfilmpod', 'male', 'composer', 'ask', 'woman', 'write', 'action', 'music', 'catch', 'late', 'girlsonfilm', 'pod']"
