,id,username,created_at,lang,cleaned_tweets,favorite_count,retweet_count,text,tokens,lemmas
839,1296149877005651968,alexdtang,2020-08-19 18:19:46,en,bgurley: must read considering going public spac merger terms getting better better due competition even,0,32,RT @bgurley: Must read if you are considering going public through SPAC merger. Terms are getting better &amp; better due to competition. Even…,"[bgurley:, must, read, considering, going, public, spac, merger, terms, getting, better, better, due, competition, even]","['bgurley', 'read', 'consider', 'go', 'public', 'spac', 'merger', 'term', 'get', 'well', 'well', 'competition']"
840,1296052627491500032,alexdtang,2020-08-19 11:53:20,en,jmj: markups easy exits hard,0,23,RT @jmj: Markups are easy. Exits are hard.,"[jmj:, markups, easy, exits, hard]","['jmj', 'markup', 'easy', 'exit', 'hard']"
841,1295939201804926977,alexdtang,2020-08-19 04:22:37,en,ecomchasedimond: saw facebook good share barbara corcoran denied shark tank season http,0,61,"RT @ecomchasedimond: Saw this on Facebook. 

It’s too good not to share here.

Barbara Corcoran being denied from Shark Tank Season 1. http…","[ecomchasedimond:, saw, facebook, good, share, barbara, corcoran, denied, shark, tank, season, http]","['ecomchasedimond', 'see', 'facebook', 'good', 'share', 'barbara', 'corcoran', 'deny', 'shark', 'tank', 'season', 'http']"
842,1295843905259307012,alexdtang,2020-08-18 22:03:57,en,denehyxxl: early stage founders: firms tell seed signed term sheet great lead,0,64,RT @DenehyXXL: Early stage founders: I had 25+ firms tell me no in our Seed and that was *with* a signed term sheet from a great lead and t…,"[denehyxxl:, early, stage, founders:, firms, tell, seed, signed, term, sheet, great, lead]","['denehyxxl', 'early', 'stage', 'founder', 'firm', 'tell', 'seed', 'sign', 'term', 'sheet', 'great', 'lead']"
843,1295416037513601025,alexdtang,2020-08-17 17:43:45,en,zerohedge: usps filed patent blockchain based secure voting system,0,946,RT @zerohedge: The USPS Just Filed A Patent For A Blockchain Based Secure Voting System https://t.co/cVm6sj71iV,"[zerohedge:, usps, filed, patent, blockchain, based, secure, voting, system]","['zerohedge', 'usps', 'file', 'patent', 'blockchain', 'base', 'secure', 'voting', 'system']"
844,1295135116281417728,alexdtang,2020-08-16 23:07:28,en,jasonlk: fifth non-partners get promoted general partner firms enough partners already hard become,0,46,"RT @jasonlk: “Fifth, very few non-partners get “promoted” to general partner. Most firms have enough partners already”

It's Hard to Become…","[jasonlk:, fifth, non-partners, get, promoted, general, partner, firms, enough, partners, already, hard, become]","['jasonlk', 'fifth', 'non', 'partner', 'promote', 'general', 'partner', 'firm', 'partner', 'hard']"
845,1295115405598564352,alexdtang,2020-08-16 21:49:09,en,daveambrose: well respected midas list investor week based sf seeing many mm mm posts early,0,2,"RT @daveambrose: from a well respected, Midas List investor this week based in SF

“seeing so many $20mm on $100mm posts for very early to…","[daveambrose:, well, respected, midas, list, investor, week, based, sf, seeing, many, mm, mm, posts, early]","['daveambrose', 'respected', 'midas', 'list', 'investor', 'week', 'base', 'sf', 'see', 'mm', 'mm', 'post', 'early']"
846,1294719649171595264,alexdtang,2020-08-15 19:36:33,en,minalhasan: one smartest founders know: sold startups years raised seed series built relationships,0,467,"RT @minal_hasan: One of smartest founders I know: sold 4 startups for $800M in 12 years. Raised Seed or Series A only.

Built relationships…","[minalhasan:, one, smartest, founders, know:, sold, startups, years, raised, seed, series, built, relationships]","['minalhasan', 'smart', 'founder', 'know', 'sell', 'startup', 'year', 'raise', 'seed', 'series', 'build', 'relationship']"
847,1294210584397910017,alexdtang,2020-08-14 09:53:43,en,infoarbitrage: successful vc firms like best startups emerge key factors: high-performance team alignm,0,72,"RT @infoarbitrage: The most successful VC firms, like the best startups, emerge from a few key factors: a high-performance team with alignm…","[infoarbitrage:, successful, vc, firms, like, best, startups, emerge, key, factors:, high-performance, team, alignm]","['infoarbitrage', 'successful', 'vc', 'firm', 'like', 'good', 'startup', 'emerge', 'key', 'factor', 'high', 'performance', 'team', 'alignm']"
848,1294107089921507331,alexdtang,2020-08-14 03:02:28,und,ivanthek: #tbt,0,4,RT @IvanTheK: #TBT https://t.co/cXRcBuvUfX,"[ivanthek:, #tbt]","['ivanthek', 'tbt']"
849,1293972642106683394,alexdtang,2020-08-13 18:08:13,tl,johnhcochrane: grumpy economist: tiktok dust,0,5,RT @JohnHCochrane: The Grumpy Economist: TikTok dust up https://t.co/jQP1gGJ3eV,"[johnhcochrane:, grumpy, economist:, tiktok, dust]","['johnhcochrane', 'grumpy', 'economist', 'tiktok', 'dust']"
850,1293744493498445831,alexdtang,2020-08-13 03:01:38,en,techcrunch: conduit launches help founders find actually useful angels vcs dannycrichton,0,6,RT @TechCrunch: Conduit launches to help founders find actually useful angels and VCs https://t.co/2hiZnBc56Y by @dannycrichton,"[techcrunch:, conduit, launches, help, founders, find, actually, useful, angels, vcs, dannycrichton]","['techcrunch', 'conduit', 'launch', 'help', 'founder', 'find', 'actually', 'useful', 'angel', 'vcs', 'dannycrichton']"
851,1293730891349602305,alexdtang,2020-08-13 02:07:35,en,katieroof: shoes news investors still giving allbirds,0,6,RT @Katie_Roof: Shoes news! Investors are still giving allbirds more $$$,"[katieroof:, shoes, news, investors, still, giving, allbirds]","['katieroof', 'shoes', 'news', 'investor', 'give', 'allbird']"
852,1293690331934986243,alexdtang,2020-08-12 23:26:25,en,chriscantino: bootstrapping nine-figure exit five years numbers: year : k revenue year : k year : year,0,119,"RT @chriscantino: Bootstrapping a nine-figure exit in five years, by the numbers:

Year 1: $150k revenue
Year 2: $500k
Year 3: $1.5M
Year 4…","[chriscantino:, bootstrapping, nine-figure, exit, five, years, numbers:, year, :, k, revenue, year, :, k, year, :, year]","['chriscantino', 'bootstrappe', 'figure', 'exit', 'year', 'number', 'year', 'k', 'revenue', 'year', 'k', 'year', 'year']"
853,1293619335391567872,alexdtang,2020-08-12 18:44:18,en,roichristie: food thought: institutions could hit return target bonds ( vol) return require,0,33,"RT @ROIChristie: Food for thought: In 1995, institutions could hit a 7.5% return target with 100% bonds (4.1% vol). Same return now require…","[roichristie:, food, thought:, institutions, could, hit, return, target, bonds, (, vol), return, require]","['roichristie', 'food', 'thought', 'institution', 'hit', 'return', 'target', 'bond', 'vol', 'return', 'require']"
854,1293386284174585856,alexdtang,2020-08-12 03:18:14,en,kauffmanfellows: venture capitalists covid- study (booth hbs ubc stanford) -,0,6,"RT @KauffmanFellows: Venture Capitalists in COVID-19 Study (Booth, HBS, UBC, Stanford) - https://t.co/KSfVa8gpyE","[kauffmanfellows:, venture, capitalists, covid-, study, (booth, hbs, ubc, stanford), -]","['kauffmanfellows', 'venture', 'capitalist', 'covid-', 'study', 'booth', 'hbs', 'ubc', 'stanford']"
855,1293385542319702021,alexdtang,2020-08-12 03:15:17,en,litcapital smart franchise owner,4,0,@litcapital Smart franchise owner,"[litcapital, smart, franchise, owner]","['litcapital', 'smart', 'franchise', 'owner']"
856,1293204900114042883,alexdtang,2020-08-11 15:17:29,en,tropicalupdate: bubble bubble bubble official weather term yea,0,8,RT @tropicalupdate: Bubble Bubble Bubble... it's now an official weather term yea!!!,"[tropicalupdate:, bubble, bubble, bubble, official, weather, term, yea]","['tropicalupdate', 'bubble', 'bubble', 'bubble', 'official', 'weather', 'term', 'yea']"
857,1292836974546628611,alexdtang,2020-08-10 14:55:29,en,markgoldberg: / recent buzz around spacs thought id share experience working ipo tesla (as junior,0,1039,"RT @Mark_Goldberg_: 1/ With all the recent buzz around SPACs, I thought I’d share my experience working on the IPO for @Tesla (as junior an…","[markgoldberg:, /, recent, buzz, around, spacs, thought, id, share, experience, working, ipo, tesla, (as, junior]","['markgoldberg', 'recent', 'buzz', 'spacs', 'think', 'would', 'share', 'experience', 'work', 'ipo', 'tesla', 'junior']"
858,1292064247820812289,alexdtang,2020-08-08 11:44:56,en,businessinsider: three startups recently accused misstating financial information highlighting little com,0,8,"RT @businessinsider: These three startups were recently accused of misstating their financial information, highlighting how little such com…","[businessinsider:, three, startups, recently, accused, misstating, financial, information, highlighting, little, com]","['businessinsider', 'startup', 'recently', 'accuse', 'misstate', 'financial', 'information', 'highlight', 'little', 'com']"
859,1292047590373167106,alexdtang,2020-08-08 10:38:45,en,fastcompany: decontaminate n mask instant pot,0,22,RT @FastCompany: How to decontaminate an N95 mask in an Instant Pot https://t.co/8UbRlXq88s,"[fastcompany:, decontaminate, n, mask, instant, pot]","['fastcompany', 'decontaminate', 'n', 'mask', 'instant', 'pot']"
860,1292044991230083072,alexdtang,2020-08-08 10:28:25,en,jess: nothing counts liquid - advice long time investor,0,64,"RT @jess: ""Nothing counts until it's liquid."" - advice from a long time investor.","[jess:, nothing, counts, liquid, -, advice, long, time, investor]","['jess', 'count', 'liquid', 'advice', 'long', 'time', 'investor']"
861,1291937902385979394,alexdtang,2020-08-08 03:22:53,en,mvc: m's investments past year taylor swift #investinthemidwest,0,7,"RT @M25vc: M25's investments in the past year as Taylor Swift
#InvestintheMidwest","[mvc:, m's, investments, past, year, taylor, swift, #investinthemidwest]","['mvc', 'm', 'investment', 'past', 'year', 'taylor', 'swift', 'investinthemidwest']"
862,1291894430820175872,alexdtang,2020-08-08 00:30:09,en,minalhasan: heard start-up pitches week common thread: founders want know exactly criteria vcs look deciding,0,113,RT @minal_hasan: Heard 18 start-up pitches this week! Common thread: founders want to know exactly what criteria VCs look at when deciding…,"[minalhasan:, heard, start-up, pitches, week, common, thread:, founders, want, know, exactly, criteria, vcs, look, deciding]","['minalhasan', 'hear', 'start', 'pitch', 'week', 'common', 'thread', 'founder', 'want', 'know', 'exactly', 'criteria', 'vcs', 'look', 'decide']"
863,1291894277409210369,alexdtang,2020-08-08 00:29:32,en,asanwal fundraise sell communicate; influences hire/recruit,1,0,@asanwal If you can fundraise you can sell and communicate; which influences who you hire/recruit.,"[asanwal, fundraise, sell, communicate;, influences, hire/recruit]","['asanwal', 'fundraise', 'sell', 'communicate', 'influence', 'hire', 'recruit']"
864,1291857114839883776,alexdtang,2020-08-07 22:01:52,ca,projectstartups: () catapult ventures gv (cvc) arboretum ventures foresite capital five elms capital unitus ventures,0,1,"RT @projectstartups: (5)
☑️ Catapult Ventures
☑️ GV (CVC)
☑️ Arboretum Ventures
☑️ Foresite Capital
☑️ Five Elms Capital
☑️ Unitus Ventures…","[projectstartups:, (), catapult, ventures, gv, (cvc), arboretum, ventures, foresite, capital, five, elms, capital, unitus, ventures]","['projectstartups', 'catapult', 'venture', 'gv', 'cvc', 'arboretum', 'ventures', 'foresite', 'capital', 'elm', 'capital', 'unitus', 'venture']"
865,1291856375564439553,alexdtang,2020-08-07 21:58:56,en,techcrunch: democratization finance breaking rules vc week's equitypod dannycrichton nmasc alex u,0,29,"RT @TechCrunch: The democratization of finance is breaking the rules of VC. On this week's @equitypod, @dannycrichton, @nmasc_, and @alex u…","[techcrunch:, democratization, finance, breaking, rules, vc, week's, equitypod, dannycrichton, nmasc, alex, u]","['techcrunch', 'democratization', 'finance', 'break', 'rule', 'vc', 'week', 'equitypod', 'dannycrichton', 'nmasc', 'alex', 'u']"
866,1291686907366256642,alexdtang,2020-08-07 10:45:31,en,samirkaji: yesterday tweeted fund managers project returns fund decks (particularly claim x retur,0,25,"RT @Samirkaji: Yesterday, I tweeted that fund managers should be not project returns in fund decks (particularly those that claim 5X+ retur…","[samirkaji:, yesterday, tweeted, fund, managers, project, returns, fund, decks, (particularly, claim, x, retur]","['samirkaji', 'yesterday', 'tweet', 'fund', 'manager', 'project', 'return', 'fund', 'deck', 'particularly', 'claim', 'x', 'retur']"
867,1291686733856342016,alexdtang,2020-08-07 10:44:50,en,samirkaji: fundraising decks prior fund generally see irr/moic saw really interesting version,0,5,"RT @Samirkaji: In most fundraising decks where there is a prior fund, I generally see IRR/MOIC, but saw a really interesting version where…","[samirkaji:, fundraising, decks, prior, fund, generally, see, irr/moic, saw, really, interesting, version]","['samirkaji', 'fundraising', 'deck', 'prior', 'fund', 'generally', 'irr', 'moic', 'see', 'interesting', 'version']"
868,1291559073578655745,alexdtang,2020-08-07 02:17:33,en,moatedgrowth: prof sanjay bakshi: find companies building strong moat hidden public view: identify: g,0,23,"RT @moatedgrowth: Prof Sanjay Bakshi: 

Find companies that are building a “strong moat” which is hidden from public view:

Identify:

1. G…","[moatedgrowth:, prof, sanjay, bakshi:, find, companies, building, strong, moat, hidden, public, view:, identify:, g]","['moatedgrowth', 'prof', 'sanjay', 'bakshi', 'find', 'company', 'build', 'strong', 'moat', 'hide', 'public', 'view', 'identify', 'g']"
869,1291522864974303237,alexdtang,2020-08-06 23:53:41,en,katepmcandrew: bryce call pre-seed new,0,1,RT @katepmcandrew: @bryce call it pre-seed and it's the new. https://t.co/HTZotonCHV,"[katepmcandrew:, bryce, call, pre-seed, new]","['katepmcandrew', 'bryce', 'pre', 'seed', 'new']"
870,1291480093576122370,alexdtang,2020-08-06 21:03:43,en,morganhousel similar observation graduate school experimental data: result data point,1,0,"@morganhousel We had a similar observation during graduate school with experimental data:
1 result was a data point… https://t.co/QXWHFdlIi1","[morganhousel, similar, observation, graduate, school, experimental, data:, result, data, point]","['morganhousel', 'similar', 'observation', 'graduate', 'school', 'experimental', 'datum', 'result', 'datum', 'point']"
871,1291154011555540993,alexdtang,2020-08-05 23:27:59,en,seandelaney: separates elite performers rest fantastic read week's guest mjmauboussin full episode,0,25,"RT @SeanDeLaney23: What separates from elite performers from the rest? A fantastic read from this week's guest @mjmauboussin.
Full episode…","[seandelaney:, separates, elite, performers, rest, fantastic, read, week's, guest, mjmauboussin, full, episode]","['seandelaney', 'separate', 'elite', 'performer', 'rest', 'fantastic', 'read', 'week', 'guest', 'mjmauboussin', 'episode']"
872,1291152012210573317,alexdtang,2020-08-05 23:20:02,en,postmarket: nobel laureate economist richard thaler board redbird capital spac well known author wi,0,29,"RT @Post_Market: Nobel laureate economist Richard Thaler is on the board of the RedBird Capital SPAC

He is the well known author of the Wi…","[postmarket:, nobel, laureate, economist, richard, thaler, board, redbird, capital, spac, well, known, author, wi]","['postmarket', 'nobel', 'laureate', 'economist', 'richard', 'thaler', 'board', 'redbird', 'capital', 'spac', 'know', 'author', 'wi']"
873,1291098194462507009,alexdtang,2020-08-05 19:46:11,en,auren chrisyeh dont forget mevc draper fisher jurvetson,1,0,@auren @chrisyeh Don’t forget meVC Draper Fisher Jurvetson in 1999!,"[auren, chrisyeh, dont, forget, mevc, draper, fisher, jurvetson]","['auren', 'chrisyeh', 'not', 'forget', 'mevc', 'draper', 'fisher', 'jurvetson']"
874,1291077396884529152,alexdtang,2020-08-05 18:23:33,en,robbponti: dis release mulan exclusively disney additional someone reading stratechery,0,17,RT @RobbPonti: $DIS to release Mulan exclusively on Disney+ for an additional $30. Someone has been reading @stratechery https://t.co/qBn2x…,"[robbponti:, dis, release, mulan, exclusively, disney, additional, someone, reading, stratechery]","['robbponti', 'dis', 'release', 'mulan', 'exclusively', 'disney', 'additional', 'read', 'stratechery']"
875,1290850868477267969,alexdtang,2020-08-05 03:23:24,en,smartfootball: always time four verticals,0,24,RT @smartfootball: It’s always time for four verticals,"[smartfootball:, always, time, four, verticals]","['smartfootball', 'time', 'vertical']"
876,1290849441545674754,alexdtang,2020-08-05 03:17:44,en,mjmauboussin: latest short book fascinating topic: public private equity united states: long-term look,0,200,"RT @mjmauboussin: Our latest is a short book on a fascinating topic: ""Public to Private Equity in the United States: A Long-Term Look."" A m…","[mjmauboussin:, latest, short, book, fascinating, topic:, public, private, equity, united, states:, long-term, look]","['mjmauboussin', 'late', 'short', 'book', 'fascinating', 'topic', 'public', 'private', 'equity', 'united', 'states', 'long', 'term', 'look']"
877,1290806538769240065,alexdtang,2020-08-05 00:27:15,en,caitlinbolnick: vcs slowly becoming comfortable virtual deals zoom pitch meeting becomes important loo,0,33,"RT @caitlinbolnick1: VCs are slowly becoming more comfortable with virtual deals, so the Zoom pitch meeting becomes more important. And loo…","[caitlinbolnick:, vcs, slowly, becoming, comfortable, virtual, deals, zoom, pitch, meeting, becomes, important, loo]","['caitlinbolnick', 'vcs', 'slowly', 'comfortable', 'virtual', 'deal', 'zoom', 'pitch', 'meeting', 'important', 'loo']"
878,1290661702221037571,alexdtang,2020-08-04 14:51:43,en,trengriffin: new michael mauboussin report gold mine data example: one important feature venture capital,0,42,"RT @trengriffin: This new Michael Mauboussin report is a gold mine of data. For example: 

""One important feature of venture capital is the…","[trengriffin:, new, michael, mauboussin, report, gold, mine, data, example:, one, important, feature, venture, capital]","['trengriffin', 'new', 'michael', 'mauboussin', 'report', 'gold', 'datum', 'example', 'important', 'feature', 'venture', 'capital']"
879,1290501232700735490,alexdtang,2020-08-04 04:14:04,en,trengriffin: earnings wealth creation levered cash-flow growth used go shareholder meetings,0,11,"RT @trengriffin: “It’s not about earnings, it’s about wealth creation and levered cash-flow growth. I used to go to shareholder meetings an…","[trengriffin:, earnings, wealth, creation, levered, cash-flow, growth, used, go, shareholder, meetings]","['trengriffin', 'earning', 'wealth', 'creation', 'lever', 'cash', 'flow', 'growth', 'shareholder', 'meeting']"
880,1290500547930255361,alexdtang,2020-08-04 04:11:21,en,tdisportsclips: august : -year-old nolan ryan hits -year-old robin ventura pitch ventura charges mound,0,714,"RT @TDISportsClips: August 4, 1993: After 46-year-old Nolan Ryan hits 26-year-old Robin Ventura with a pitch, Ventura charges the mound. It…","[tdisportsclips:, august, :, -year-old, nolan, ryan, hits, -year-old, robin, ventura, pitch, ventura, charges, mound]","['tdisportsclips', 'august', '-year', 'old', 'nolan', 'ryan', 'hit', '-year', 'old', 'robin', 'ventura', 'pitch', 'ventura', 'charge', 'mound']"
881,1290408411679653890,alexdtang,2020-08-03 22:05:14,en,bdeeter: huge news cloud unlike celebration weve five-year history sept th bessemervp salesforce,0,9,"RT @bdeeter: Huge news! @cloud100 will be unlike any celebration we’ve had in our five-year history. On Sept 16th, @BessemerVP, @Salesforce…","[bdeeter:, huge, news, cloud, unlike, celebration, weve, five-year, history, sept, th, bessemervp, salesforce]","['bdeeter', 'huge', 'news', 'cloud', 'unlike', 'celebration', 'have', 'year', 'history', 'sept', 'th', 'bessemervp', 'salesforce']"
882,1290369993008451587,alexdtang,2020-08-03 19:32:34,en,dalailama: young children naturally honest open appreciate affection scientists say human beings social animals,0,6444,"RT @DalaiLama: Young children are naturally honest, open and appreciate affection. Some scientists say that human beings are social animals…","[dalailama:, young, children, naturally, honest, open, appreciate, affection, scientists, say, human, beings, social, animals]","['dalailama', 'young', 'child', 'naturally', 'honest', 'open', 'appreciate', 'affection', 'scientist', 'human', 'being', 'social', 'animal']"
883,1290148605219631104,alexdtang,2020-08-03 04:52:51,en,ewfa: peter lynch's category companies category company belong #investing,0,73,"RT @EWFA_: Peter Lynch's 6 Category of Companies.

Which category does your company belong?

#investing https://t.co/TPGOhhJ7KO","[ewfa:, peter, lynch's, category, companies, category, company, belong, #investing]","['ewfa', 'peter', 'lynch', 'category', 'company', 'category', 'company', 'belong', 'invest']"
884,1290145227907330048,alexdtang,2020-08-03 04:39:26,en,msuster: knew liked matt first time met similar thinking take expect pushing hard operatio,0,3,RT @msuster: I knew I liked Matt first time I met him. Similar thinking. If you take $ from me expect me to be pushing hard for an operatio…,"[msuster:, knew, liked, matt, first, time, met, similar, thinking, take, expect, pushing, hard, operatio]","['msuster', 'know', 'like', 'matt', 'time', 'meet', 'similar', 'thinking', 'expect', 'push', 'hard', 'operatio']"
885,1290136851546873856,alexdtang,2020-08-03 04:06:09,en,harrystebbings: looking weekend reading fricking awesome annarchyy crv literally discusses,0,33,"RT @HarryStebbings: If you are looking for some weekend reading, this is fricking awesome from @annarchyy @CRV and literally discusses my 3…","[harrystebbings:, looking, weekend, reading, fricking, awesome, annarchyy, crv, literally, discusses]","['harrystebbings', 'look', 'weekend', 'read', 'fricking', 'awesome', 'annarchyy', 'crv', 'literally', 'discuss']"
886,1289530106860302336,alexdtang,2020-08-01 11:55:10,en,trengriffin: / watching earnings releases past two weeks see businesses key intangible assets,0,48,RT @trengriffin: 1/ If you were watching earnings releases the past two weeks and didn't see that businesses with key intangible assets out…,"[trengriffin:, /, watching, earnings, releases, past, two, weeks, see, businesses, key, intangible, assets]","['trengriffin', 'watch', 'earning', 'release', 'past', 'week', 'business', 'key', 'intangible', 'asset']"
887,1289335765340545024,alexdtang,2020-07-31 23:02:55,en,edlatimore picture/meme true get paid proved could math others,0,0,@EdLatimore Not my picture/meme but this is very true. Get paid because you proved you could do the math and others… https://t.co/ixw3uF2LRL,"[edlatimore, picture/meme, true, get, paid, proved, could, math, others]","['edlatimore', 'picture', 'meme', 'true', 'pay', 'prove', 'math']"
888,1289328937416273920,alexdtang,2020-07-31 22:35:47,en,modestproposal: porch going public via spac intrigued vertical software home services industry sounds great,0,19,"RT @modestproposal1: Porch is going public via a SPAC, and I was intrigued. Vertical software to the home services industry sounds great.…","[modestproposal:, porch, going, public, via, spac, intrigued, vertical, software, home, services, industry, sounds, great]","['modestproposal', 'porch', 'go', 'public', 'spac', 'intrigued', 'vertical', 'software', 'home', 'service', 'industry', 'sound', 'great']"
889,1289328645409038341,alexdtang,2020-07-31 22:34:38,en,jwangark: wow nvidiaarm deal really happening first thought terrible idea paulrteich convinced otherwise,0,45,RT @jwangARK: Wow this Nvidia–ARM deal is really happening. I first thought it's a terrible idea but @paulrteich convinced me otherwise. He…,"[jwangark:, wow, nvidiaarm, deal, really, happening, first, thought, terrible, idea, paulrteich, convinced, otherwise]","['jwangark', 'wow', 'nvidiaarm', 'deal', 'happen', 'think', 'terrible', 'idea', 'paulrteich', 'convince']"
890,1289326623435526145,alexdtang,2020-07-31 22:26:36,en,jrepodcast: every man two lives second starts realizes one naval joe rogan experience pod,0,1305,"RT @JRE_Podcast: ""Every man has two lives, and the second starts when he realizes he has just one."" 
@naval on the Joe Rogan Experience Pod…","[jrepodcast:, every, man, two, lives, second, starts, realizes, one, naval, joe, rogan, experience, pod]","['jrepodcast', 'man', 'live', 'second', 'start', 'realize', 'naval', 'joe', 'rogan', 'experience', 'pod']"
891,1289325091663351814,alexdtang,2020-07-31 22:20:31,en,minalhasan: founders possible come back brink went startup i'm board i'm really p,0,99,"RT @minal_hasan: Founders, it's possible to come back from the brink. Just went through it with a startup I'm on the Board of. I'm really p…","[minalhasan:, founders, possible, come, back, brink, went, startup, i'm, board, i'm, really, p]","['minalhasan', 'founder', 'possible', 'come', 'brink', 'go', 'startup', 'board', 'p']"
892,1289323643621634053,alexdtang,2020-07-31 22:14:45,en,vitaliyk: seth klarman right future dominance labor capital we'll seeing lower corporate margins e,0,9,"RT @vitaliyk: If Seth Klarman is right about the future dominance of labor over capital, then we'll be seeing lower corporate margins.  

E…","[vitaliyk:, seth, klarman, right, future, dominance, labor, capital, we'll, seeing, lower, corporate, margins, e]","['vitaliyk', 'seth', 'klarman', 'right', 'future', 'dominance', 'labor', 'capital', 'see', 'low', 'corporate', 'margin', 'e']"
