,id,username,created_at,lang,cleaned_tweets,favorite_count,retweet_count,text,tokens,lemmas
864,1245003755545939969,ChrisHammer180,2020-03-31 15:03:21,en,sportinglife: mike gregory missed six match darts beat phil taylor iconic world championship final late,0,4,"RT @SportingLife: 😱🏆 Mike Gregory missed six match darts to beat Phil Taylor in the iconic World Championship final of 1992.

🎯 In his late…","[sportinglife:, mike, gregory, missed, six, match, darts, beat, phil, taylor, iconic, world, championship, final, late]","['sportinglife', 'mike', 'gregory', 'miss', 'match', 'dart', 'beat', 'phil', 'taylor', 'iconic', 'world', 'championship', 'final', 'late']"
865,1244997867061813248,ChrisHammer180,2020-03-31 14:39:57,en,encouraging hear darts players need receive financial support pdpa crisi,3,0,Encouraging to hear those darts players most in need will receive financial support from the PDPA during this crisi… https://t.co/kTjLiWp6wv,"[encouraging, hear, darts, players, need, receive, financial, support, pdpa, crisi]","['encourage', 'hear', 'dart', 'player', 'nee', 'receive', 'financial', 'support', 'pdpa', 'crisi']"
866,1244377028620693506,ChrisHammer180,2020-03-29 21:32:57,en,hamisharnold going one day might needlessly string long even crisis,1,0,"@hamisharnold I was going to do one a day but that might needlessly string it out too long, even in this crisis!","[hamisharnold, going, one, day, might, needlessly, string, long, even, crisis]","['hamisharnold', 'go', 'day', 'needlessly', 'string', 'long', 'crisis']"
867,1244374158450077698,ChrisHammer180,2020-03-29 21:21:33,en,hamisharnold well one quarter-finals 'hit bullseye' win leg albeit withou,1,0,"@hamisharnold Well, in one of the other quarter-finals there will be 'hit the bullseye' to win a leg, albeit withou… https://t.co/bC5zEiJB2c","[hamisharnold, well, one, quarter-finals, 'hit, bullseye', win, leg, albeit, withou]","['hamisharnold', 'quarter', 'final', 'hit', 'bullseye', 'win', 'leg', 'albeit', 'withou']"
868,1244371265084850176,ChrisHammer180,2020-03-29 21:10:03,en,world cup best feelings darts players certain standard qf hitting last dart aft,2,1,"World Cup of the ‘best feelings in darts for players of a certain standard’

QF 1

1 Hitting T20 with last dart aft… https://t.co/ip5Ic8RWNv","[world, cup, best, feelings, darts, players, certain, standard, qf, hitting, last, dart, aft]","['world', 'cup', 'good', 'feeling', 'dart', 'player', 'certain', 'standard', 'qf', 'hit', 'dart', 'aft']"
869,1244355208567808002,ChrisHammer180,2020-03-29 20:06:15,en,game round board qa john part,7,1,"A game of round the board Q&amp;A with John Part

https://t.co/7UcNQxXEEj","[game, round, board, qa, john, part]","['game', 'round', 'board', 'qa', 'john']"
870,1244273946381422595,ChrisHammer180,2020-03-29 14:43:20,en,markrobbo winmau practice ring improvement pack - although must say last visit wasnt,1,0,@markrobbo15 They are from the @Winmau Practice Ring Improvement Pack - although I must say my last visit I wasn’t… https://t.co/XscmMMoUaS,"[markrobbo, winmau, practice, ring, improvement, pack, -, although, must, say, last, visit, wasnt]","['markrobbo', 'winmau', 'practice', 'ring', 'improvement', 'pack', 'visit', 'not']"
871,1244247268577992704,ChrisHammer180,2020-03-29 12:57:20,en,fatboysarky eurosportuk mofarah siyidocopping whitesugarduck mediumdobbers match extra time golds,0,0,@fatboysarky @Eurosport_UK @Mo_Farah @siyidocopping @White1SugarDuck @mediumdobbers Was the match in extra time during all those golds?!,"[fatboysarky, eurosportuk, mofarah, siyidocopping, whitesugarduck, mediumdobbers, match, extra, time, golds]","['fatboysarky', 'eurosportuk', 'mofarah', 'siyidocopping', 'whitesugarduck', 'mediumdobber', 'match', 'extra', 'time', 'gold']"
872,1244244688598687744,ChrisHammer180,2020-03-29 12:47:05,en,watching super saturday replay eurosportuk rekindled special memories incredible night,2,0,Watching Super Saturday replay on @Eurosport_UK rekindled special memories of being at that incredible night. The a… https://t.co/DEX3i2cE1n,"[watching, super, saturday, replay, eurosportuk, rekindled, special, memories, incredible, night]","['watch', 'super', 'saturday', 'replay', 'eurosportuk', 'rekindle', 'special', 'memory', 'incredible', 'night']"
873,1243955625362628609,ChrisHammer180,2020-03-28 17:38:27,en,onlyjohngwynne theasset given long players play darts high level - young star,0,0,@OnlyJohnGwynne @TheAsset180 Given how long players can to play darts at a high level - and how young they are star… https://t.co/dcf4gUiKDi,"[onlyjohngwynne, theasset, given, long, players, play, darts, high, level, -, young, star]","['onlyjohngwynne', 'theasset', 'give', 'long', 'player', 'play', 'dart', 'high', 'level', 'young', 'star']"
874,1243953538826452993,ChrisHammer180,2020-03-28 17:30:09,en,sportinglife: final member paul nicholson's five darting icons revealed rising star chris dobey,0,7,RT @SportingLife: 🎯😯 The final member of Paul Nicholson's five darting icons has been revealed and it isn't rising star Chris @Dobey10...…,"[sportinglife:, final, member, paul, nicholson's, five, darting, icons, revealed, rising, star, chris, dobey]","['sportinglife', 'final', 'member', 'paul', 'nicholson', 'darting', 'icon', 'reveal', 'rise', 'star', 'chris', 'dobey']"
875,1243953316184416256,ChrisHammer180,2020-03-28 17:29:16,en,warrenallsworth theasset staggering educated guess i'm impressed,0,0,"@warrenallsworth @TheAsset180 Staggering educated guess, I'm very impressed!","[warrenallsworth, theasset, staggering, educated, guess, i'm, impressed]","['warrenallsworth', 'theasset', 'staggering', 'educate', 'guess', 'impressed']"
876,1243952695146315776,ChrisHammer180,2020-03-28 17:26:48,en,onlyjohngwynne theasset john answer revealed gordon dobey,0,0,"@OnlyJohnGwynne @TheAsset180 John, the answer has now been revealed and it's Gordon Dobey!","[onlyjohngwynne, theasset, john, answer, revealed, gordon, dobey]","['onlyjohngwynne', 'theasset', 'john', 'answer', 'reveal', 'gordon', 'dobey']"
877,1243951547463208960,ChrisHammer180,2020-03-28 17:22:15,en,warrenallsworth theasset answer revealed may like take look,1,0,@warrenallsworth @TheAsset180 The answer has now been revealed and you may like to take a look!,"[warrenallsworth, theasset, answer, revealed, may, like, take, look]","['warrenallsworth', 'theasset', 'answer', 'reveal', 'like', 'look']"
878,1243648846980317187,ChrisHammer180,2020-03-27 21:19:25,en,shadesofhaigh theasset never gets old brings smile face every time watch,0,0,@50shadesofhaigh @TheAsset180 Never gets old does it? Brings a smile to my face every time I watch it!,"[shadesofhaigh, theasset, never, gets, old, brings, smile, face, every, time, watch]","['shadesofhaigh', 'theasset', 'get', 'old', 'bring', 'smile', 'face', 'time', 'watch']"
879,1243648457396703234,ChrisHammer180,2020-03-27 21:17:52,en,ian theasset incorrect fan gary interested know gets mention,1,0,@Ian21479923 @TheAsset180 Incorrect but if you're a fan of Gary then you'll be interested to know he gets a mention… https://t.co/rS6pHZGxop,"[ian, theasset, incorrect, fan, gary, interested, know, gets, mention]","['ian', 'theasset', 'incorrect', 'fan', 'gary', 'interested', 'know', 'get', 'mention']"
880,1243646716441767939,ChrisHammer180,2020-03-27 21:10:57,en,shadesofhaigh theasset he'd definitely five,1,0,@50shadesofhaigh @TheAsset180 He'd definitely be in my five!,"[shadesofhaigh, theasset, he'd, definitely, five]","['shadesofhaigh', 'theasset', 'definitely']"
881,1243646636615766016,ChrisHammer180,2020-03-27 21:10:38,en,benonsport theasset actually got mention section trina gulliver bad guess,1,0,@benonsport @TheAsset180 She actually got a mention in his section on Trina Gulliver so not a bad guess at all!,"[benonsport, theasset, actually, got, mention, section, trina, gulliver, bad, guess]","['benonsport', 'theasset', 'actually', 'get', 'mention', 'section', 'trina', 'gulliver', 'bad', 'guess']"
882,1243608563764940802,ChrisHammer180,2020-03-27 18:39:21,en,johnnycree theasset say wrong - admire outside box thinking paul,1,0,"@JohnnyCree @TheAsset180 I won't say if you are wrong or not - but I admire your outside of the box thinking, as will Paul!","[johnnycree, theasset, say, wrong, -, admire, outside, box, thinking, paul]","['johnnycree', 'theasset', 'wrong', 'admire', 'outside', 'box', 'think', 'paul']"
883,1243606713498025985,ChrisHammer180,2020-03-27 18:32:00,en,challenge darts fan player try guess fifth theasset's heroes stand chance,1,1,"I challenge any darts fan or player to try and guess the fifth of @TheAsset180's heroes. To stand a chance, you'll… https://t.co/32JzFqYhki","[challenge, darts, fan, player, try, guess, fifth, theasset's, heroes, stand, chance]","['challenge', 'dart', 'fan', 'player', 'try', 'guess', 'fifth', 'theasset', 'hero', 'stand', 'chance']"
884,1243269260278927360,ChrisHammer180,2020-03-26 20:11:05,en,hamisharnold hope rest street enthusiastic,2,0,@hamisharnold I hope the rest of your street was as enthusiastic as you!,"[hamisharnold, hope, rest, street, enthusiastic]","['hamisharnold', 'hope', 'rest', 'street', 'enthusiastic']"
885,1243268577999945729,ChrisHammer180,2020-03-26 20:08:22,en,great moments shared across uk surely #clapfornhs every night least,4,1,Great moments shared across the UK. Surely we should do #clapforNHS every night? Very least we can do!,"[great, moments, shared, across, uk, surely, #clapfornhs, every, night, least]","['great', 'moment', 'share', 'uk', 'surely', 'clapfornh', 'night']"
886,1242551466893684742,ChrisHammer180,2020-03-24 20:38:49,en,onlyjohngwynne bobanderson idea one leg shoot talked recent months - perhaps us,1,0,@OnlyJohnGwynne @BobAnderson180 The idea of a one leg shoot out has been talked about in recent months - perhaps us… https://t.co/KKpaR01Rfd,"[onlyjohngwynne, bobanderson, idea, one, leg, shoot, talked, recent, months, -, perhaps, us]","['onlyjohngwynne', 'bobanderson', 'idea', 'leg', 'shoot', 'talk', 'recent', 'month']"
887,1242544784172072963,ChrisHammer180,2020-03-24 20:12:16,en,onlyjohngwynne bobanderson john would like board make comeback highest level one tournament,0,0,"@OnlyJohnGwynne @BobAnderson180 John would you like this board to make a comeback at the highest level, if only for a one off tournament?","[onlyjohngwynne, bobanderson, john, would, like, board, make, comeback, highest, level, one, tournament]","['onlyjohngwynne', 'bobanderson', 'john', 'like', 'board', 'comeback', 'high', 'level', 'tournament']"
888,1242543761705570307,ChrisHammer180,2020-03-24 20:08:12,en,jimnewlands dont want board make comeback,1,0,@Jim_Newlands So you don’t want the board to make a comeback?!!,"[jimnewlands, dont, want, board, make, comeback]","['jimnewland', 'not', 'want', 'board', 'comeback']"
889,1242524570852220932,ChrisHammer180,2020-03-24 18:51:57,en,thefellaboss bobanderson know uk matchplay stopped i'm sure theasset chrismason,0,0,@TheFellaboss @BobAnderson180 I know the UK Matchplay stopped in 1996 but I'm sure @TheAsset180 and @Chris180Mason… https://t.co/MUNtTNlrOp,"[thefellaboss, bobanderson, know, uk, matchplay, stopped, i'm, sure, theasset, chrismason]","['thefellaboss', 'bobanderson', 'know', 'uk', 'matchplay', 'stop', 'sure', 'theasset', 'chrismason']"
890,1242524015861825537,ChrisHammer180,2020-03-24 18:49:45,en,supportpdc bobanderson immense angle looks though quad smaller bull,0,0,@SupportPDC @BobAnderson180 That is immense! From that angle it looks as though the quad is smaller than the bull?,"[supportpdc, bobanderson, immense, angle, looks, though, quad, smaller, bull]","['supportpdc', 'bobanderson', 'immense', 'angle', 'look', 'quad', 'small', 'bull']"
891,1242523581512384512,ChrisHammer180,2020-03-24 18:48:01,en,supportpdc bobanderson incredible - wondering many people would one let alone four,0,0,"@SupportPDC @BobAnderson180 Incredible - i was wondering how many people would have one, let alone four! You should… https://t.co/MXio2MTZh3","[supportpdc, bobanderson, incredible, -, wondering, many, people, would, one, let, alone, four]","['supportpdc', 'bobanderson', 'incredible', 'wonder', 'people', 'let']"
892,1242522568269103104,ChrisHammer180,2020-03-24 18:43:59,en,harrybaseball bobanderson upset thrilled count i'd still find positives,0,0,@Harrybaseball78 @BobAnderson180 Was he upset or thrilled by a 180 that didn't count?! I'd still find the positives if I did that.,"[harrybaseball, bobanderson, upset, thrilled, count, i'd, still, find, positives]","['harrybaseball', 'bobanderson', 'upset', 'thrilled', 'count', 'find', 'positive']"
893,1242521640820506625,ChrisHammer180,2020-03-24 18:40:18,en,jaynemurray let's hope,1,0,@jayne_murray Let's hope so!,"[jaynemurray, let's, hope]","['jaynemurray', 'let', 'hope']"
894,1242521482556846081,ChrisHammer180,2020-03-24 18:39:41,en,hestono hi heston phil taylor uk matchplay played quadro board bob,1,0,"@HestonO Hi Heston, Phil Taylor did the 240 in the 1993 UK Matchplay which was played on a Quadro Board. The Bob An… https://t.co/GdtX8EwNTI","[hestono, hi, heston, phil, taylor, uk, matchplay, played, quadro, board, bob]","['hestono', 'hi', 'heston', 'phil', 'taylor', 'uk', 'matchplay', 'play', 'quadro', 'board', 'bob']"
895,1242501894242742272,ChrisHammer180,2020-03-24 17:21:50,en,sportinglifefc: collection absolute horror misses pass two minutes seconds lockdown time,0,61,RT @SportingLifeFC: 😱 A collection of absolute horror misses to pass two minutes and 40 seconds of lockdown time... https://t.co/HUwBJ9eQoA,"[sportinglifefc:, collection, absolute, horror, misses, pass, two, minutes, seconds, lockdown, time]","['sportinglifefc', 'collection', 'absolute', 'horror', 'miss', 'pass', 'minute', 'second', 'lockdown', 'time']"
896,1242497568925454338,ChrisHammer180,2020-03-24 17:04:39,en,bobanderson threw checkout,52,7,When @BobAnderson180 threw a 180 checkout... https://t.co/5uW9WoElB9,"[bobanderson, threw, checkout]","['bobanderson', 'throw', 'checkout']"
897,1242495913110765568,ChrisHammer180,2020-03-24 16:58:04,en,thought #threebullchallenge tough trying score three darts,54,14,"If you thought the #threebullchallenge was tough, how about trying to score 240 with three darts! https://t.co/RHUg0GSaOg","[thought, #threebullchallenge, tough, trying, score, three, darts]","['think', 'threebullchallenge', 'tough', 'try', 'score', 'dart']"
898,1242444521071353856,ChrisHammer180,2020-03-24 13:33:51,en,mattcoopergolf watch actual staging see run crazy event,0,0,@MattCooperGolf To watch an actual staging of it or to see where it's run? Crazy event!,"[mattcoopergolf, watch, actual, staging, see, run, crazy, event]","['mattcoopergolf', 'watch', 'actual', 'staging', 'run', 'crazy', 'event']"
899,1242441077333909504,ChrisHammer180,2020-03-24 13:20:10,en,sporting calendar also hit cancellation gloucester cheese rolling contest there's,4,0,"The sporting calendar has also been hit by the cancellation of the Gloucester Cheese Rolling contest.

But there's… https://t.co/yc0z9Wa3Ir","[sporting, calendar, also, hit, cancellation, gloucester, cheese, rolling, contest, there's]","['sporting', 'calendar', 'hit', 'cancellation', 'gloucester', 'cheese', 'rolling', 'contest']"
900,1242090896482611202,ChrisHammer180,2020-03-23 14:08:41,en,markrobbo couldnt expect kids memorise checkouts yet,1,0,@markrobbo15 I couldn’t expect my kids to memorise all the checkouts yet!,"[markrobbo, couldnt, expect, kids, memorise, checkouts, yet]","['markrobbo', 'not', 'expect', 'kid', 'memorise', 'checkout']"
901,1242064447184744449,ChrisHammer180,2020-03-23 12:23:35,en,thesportsman yes course glad like,1,0,"@TheSportsman Yes of course, glad you like it!","[thesportsman, yes, course, glad, like]","['thesportsman', 'yes', 'course', 'glad', 'like']"
902,1242035685567102979,ChrisHammer180,2020-03-23 10:29:18,en,dartsweb good thinking daughter big iceman fan (as refers as) it'll probably,1,0,"@dartsweb180 Good thinking. My daughter is a big ""Iceman"" fan (as she only refers to him as) so it'll probably be him!","[dartsweb, good, thinking, daughter, big, iceman, fan, (as, refers, as), it'll, probably]","['dartsweb', 'good', 'thinking', 'daughter', 'big', 'iceman', 'fan', 'refer', 'probably']"
903,1242026588025303040,ChrisHammer180,2020-03-23 09:53:08,en,philhaigh ordered handmadetodayuk really nice dart board surround designs,1,0,@philhaigh_ I ordered it from @HandmadeTodayUK who do some other really nice dart board surround designs!,"[philhaigh, ordered, handmadetodayuk, really, nice, dart, board, surround, designs]","['philhaigh', 'order', 'handmadetodayuk', 'nice', 'dart', 'board', 'surround', 'design']"
904,1242022558339399680,ChrisHammer180,2020-03-23 09:37:08,en,gwsnookertips need little snooker table adding,1,0,@GWSnookerTips I just need a little snooker table for the adding up!,"[gwsnookertips, need, little, snooker, table, adding]","['gwsnookertips', 'need', 'little', 'snooker', 'table', 'add']"
905,1242021391257317383,ChrisHammer180,2020-03-23 09:32:29,en,apart toilet roll kick-ups sports stars coronavirus crisis world number,16,6,"Apart from toilet roll kick-ups, what are other sports stars doing during the Coronavirus crisis? 

World number 30… https://t.co/v2tKTg1bea","[apart, toilet, roll, kick-ups, sports, stars, coronavirus, crisis, world, number]","['apart', 'toilet', 'roll', 'kick', 'up', 'sport', 'star', 'coronavirus', 'crisis', 'world', 'number']"
906,1242018563591897098,ChrisHammer180,2020-03-23 09:21:15,en,day one home schooling first subject maths,222,15,"Day one of home schooling. First subject, maths. https://t.co/Al5z8LDQ0d","[day, one, home, schooling, first, subject, maths]","['day', 'home', 'school', 'subject', 'math']"
907,1241779192737542147,ChrisHammer180,2020-03-22 17:30:05,en,oh goodness one best putts youll see long time commentary match,2,0,"“Oh my goodness!”

One of the best putts you’ll see for a long time, with the commentary to match... https://t.co/2uIdnudZ8l","[oh, goodness, one, best, putts, youll, see, long, time, commentary, match]","['oh', 'goodness', 'good', 'putt', 'will', 'long', 'time', 'commentary', 'match']"
908,1241776917344387076,ChrisHammer180,2020-03-22 17:21:02,en,mattcoopergolf bencoleygolf tannerswines europeantour sensational deserves reach toilet,1,0,@MattCooperGolf @BenColeyGolf @TannersWines @EuropeanTour That is sensational! This deserves more reach than toilet… https://t.co/I5uQQLyOLm,"[mattcoopergolf, bencoleygolf, tannerswines, europeantour, sensational, deserves, reach, toilet]","['mattcoopergolf', 'bencoleygolf', 'tannerswines', 'europeantour', 'sensational', 'deserve', 'reach', 'toilet']"
909,1241743325448847362,ChrisHammer180,2020-03-22 15:07:33,en,hamisharnold officialpdc tournament continued finished im assuming,1,0,@hamisharnold @OfficialPDC The tournament continued and finished so I’m assuming so!,"[hamisharnold, officialpdc, tournament, continued, finished, im, assuming]","['hamisharnold', 'officialpdc', 'tournament', 'continue', 'finish', 'be', 'assume']"
910,1241699426252525570,ChrisHammer180,2020-03-22 12:13:07,en,knockedoffperch officialpdc close grabbing hand guess would happened slow motion,0,0,"@knockedoffperch @OfficialPDC So, so close to grabbing his hand! I guess it would have happened in slow motion for… https://t.co/Agi4R6pxvC","[knockedoffperch, officialpdc, close, grabbing, hand, guess, would, happened, slow, motion]","['knockedoffperch', 'officialpdc', 'close', 'grab', 'hand', 'guess', 'happen', 'slow', 'motion']"
911,1241693763732484096,ChrisHammer180,2020-03-22 11:50:37,en,enjoying world cup walk-ons here's world cup fall-offs champion officialpdc,28,6,"Enjoying the World Cup of Walk-Ons? Here's the World Cup of Fall-Offs champion...

@OfficialPDC https://t.co/H7Hl8v6RjH","[enjoying, world, cup, walk-ons, here's, world, cup, fall-offs, champion, officialpdc]","['enjoy', 'world', 'cup', 'walk', 'on', 'world', 'cup', 'fall', 'off', 'champion', 'officialpdc']"
912,1240971224253071361,ChrisHammer180,2020-03-20 11:59:30,en,eric bristow john lowe completing #threebullchallenge successive visits legends jloweprodart,428,78,"Eric Bristow and John Lowe BOTH completing the #ThreeBullChallenge in successive visits. Legends.

@jloweprodart

https://t.co/BycepdpZ26","[eric, bristow, john, lowe, completing, #threebullchallenge, successive, visits, legends, jloweprodart]","['eric', 'bristow', 'john', 'lowe', 'complete', 'threebullchallenge', 'successive', 'visit', 'legend', 'jloweprodart']"
913,1240758379762630656,ChrisHammer180,2020-03-19 21:53:44,en,sportinglife: phil taylor raymond van barneveld coming rescue give darts fans live action th mee,0,14,"RT @SportingLife: 🎯🙌 Phil Taylor and Raymond van Barneveld are coming to the rescue to give darts fans some live action!

🖥👍 Their 84th mee…","[sportinglife:, phil, taylor, raymond, van, barneveld, coming, rescue, give, darts, fans, live, action, th, mee]","['sportinglife', 'phil', 'taylor', 'raymond', 'van', 'barneveld', 'come', 'rescue', 'dart', 'fan', 'live', 'action', 'th', 'mee']"
914,1240551708478013440,ChrisHammer180,2020-03-19 08:12:30,en,sidlambert: reading latest news coronavirus outbreak trying raise morale breakfast table,0,85,"RT @sid_lambert: Me reading the latest news on the Coronavirus outbreak, then trying to raise morale at the breakfast table...

https://t.c…","[sidlambert:, reading, latest, news, coronavirus, outbreak, trying, raise, morale, breakfast, table]","['sidlambert', 'read', 'late', 'news', 'coronavirus', 'outbreak', 'try', 'raise', 'morale', 'breakfast', 'table']"
915,1240316545265537028,ChrisHammer180,2020-03-18 16:38:03,en,michael van gerwen completed #threebullchallenge match,452,60,When Michael van Gerwen completed the #ThreeBullChallenge ...in a match! https://t.co/O94szESsl1,"[michael, van, gerwen, completed, #threebullchallenge, match]","['michael', 'van', 'gerwen', 'complete', 'threebullchallenge', 'match']"
916,1240249726886387713,ChrisHammer180,2020-03-18 12:12:32,en,important discussion points darts theasset's latest column away coronavirus,5,1,Some very important discussion points for darts in @TheAsset180's latest column but away from the coronavirus there… https://t.co/SqWuSWNuIw,"[important, discussion, points, darts, theasset's, latest, column, away, coronavirus]","['important', 'discussion', 'point', 'darts', 'theasset', 'late', 'column', 'away', 'coronavirus']"
917,1240080834738208768,ChrisHammer180,2020-03-18 01:01:25,en,tomc thank introducing new favourite twitter feed,0,0,@TomC_22 Thank you for introducing me to my new favourite twitter feed!,"[tomc, thank, introducing, new, favourite, twitter, feed]","['tomc', 'thank', 'introduce', 'new', 'favourite', 'twitter', 'feed']"
918,1239635255016988679,ChrisHammer180,2020-03-16 19:30:50,en,stands newcastle host premier league play-offs october knows much resc,1,1,"So as it stands, Newcastle will now host the Premier League Play-Offs on October 1 but who knows how much more resc… https://t.co/w4TYoKn81t","[stands, newcastle, host, premier, league, play-offs, october, knows, much, resc]","['stand', 'newcastle', 'host', 'premier', 'league', 'play', 'offs', 'october', 'know', 'resc']"
919,1239266887718010880,ChrisHammer180,2020-03-15 19:07:05,en,sportinglife: ian white today seven wins seven six match averages (high ) total average legs,0,3,"RT @SportingLife: 💎 Ian White today...

🎯 Seven wins out of seven
💯 Six 100+ match averages (High of 111!)
🔥 103 total average over 68 legs…","[sportinglife:, ian, white, today, seven, wins, seven, six, match, averages, (high, ), total, average, legs]","['sportinglife', 'ian', 'white', 'today', 'seven', 'win', 'seven', 'match', 'average', 'high', 'total', 'average', 'leg']"
920,1239131120601628672,ChrisHammer180,2020-03-15 10:07:35,en,snooker decided matches without referees weekend ah,17,1,"So snooker decided to have some matches without referees this weekend. Ah...

https://t.co/DRRBxKo32c","[snooker, decided, matches, without, referees, weekend, ah]","['snooker', 'decide', 'match', 'referee', 'weekend', 'ah']"
921,1238885648699981829,ChrisHammer180,2020-03-14 17:52:10,en,nathan aspinall - star quality character loses mvg first match uk open week later,10,3,Nathan Aspinall - what star quality and character. Loses to MVG in his first match at the UK Open but a week later… https://t.co/UERrGSovF9,"[nathan, aspinall, -, star, quality, character, loses, mvg, first, match, uk, open, week, later]","['nathan', 'aspinall', 'star', 'quality', 'character', 'lose', 'mvg', 'match', 'uk', 'open', 'week', 'later']"
922,1238499881284747265,ChrisHammer180,2020-03-13 16:19:16,en,pdc swift finding solution premier league darts stands rotterdam's double-header includes,4,1,"PDC very swift at finding a solution for Premier League Darts. As it now stands, Rotterdam's double-header includes… https://t.co/3ZO1GJaBy5","[pdc, swift, finding, solution, premier, league, darts, stands, rotterdam's, double-header, includes]","['pdc', 'swift', 'finding', 'solution', 'premier', 'league', 'dart', 'stand', 'rotterdam', 'double', 'header', 'include']"
923,1238216970534821891,ChrisHammer180,2020-03-12 21:35:05,en,sportinglife: michael van gerwen nearly took dart head (accidentally) gerwyn price credit mvg,0,9,"RT @SportingLife: 😲 Michael van Gerwen nearly took a dart in the head (accidentally) from Gerwyn Price! 

👍 But credit to @MvG180 for being…","[sportinglife:, michael, van, gerwen, nearly, took, dart, head, (accidentally), gerwyn, price, credit, mvg]","['sportinglife', 'michael', 'van', 'gerwen', 'nearly', 'take', 'dart', 'head', 'accidentally', 'gerwyn', 'price', 'credit', 'mvg']"
