,id,username,created_at,lang,cleaned_tweets,favorite_count,retweet_count,text,tokens,lemmas
293,1343247392007725056,annasmithjourno,2020-12-27 17:28:29,en,today's film day uplifting heartwarming comedy-drama eddie eagle uk channel pm today,5,0,"Today's Film of the Day is the uplifting, heartwarming comedy-drama EDDIE THE EAGLE, on UK Channel 4 at 6pm today.… https://t.co/5IiqYyDSNv","[today's, film, day, uplifting, heartwarming, comedy-drama, eddie, eagle, uk, channel, pm, today]","['today', 'film', 'day', 'uplifting', 'heartwarming', 'comedy', 'drama', 'eddie', 'eagle', 'uk', 'channel', 'pm', 'today']"
294,1341787816284606468,annasmithjourno,2020-12-23 16:48:39,en,definitely time cosy film day bring sleeping (pg) classic sandra bullock rom,14,1,"Definitely time for a cosy Film of the Day, so bring on WHILE YOU WERE SLEEPING (PG), a classic Sandra Bullock rom… https://t.co/hbK20av2CT","[definitely, time, cosy, film, day, bring, sleeping, (pg), classic, sandra, bullock, rom]","['definitely', 'time', 'cosy', 'film', 'day', 'bring', 'sleep', 'pg', 'classic', 'sandra', 'bullock', 'rom']"
295,1341457038061277186,annasmithjourno,2020-12-22 18:54:15,en,birdseyeviewff: really proud part ace review girlsonfilmpod annasmithjourno - special messages,0,2,RT @BirdsEyeViewFF: Really proud of being part of this ace Review of 2020 @GirlsOnFilm_Pod @annasmithjourno - with special messages from ma…,"[birdseyeviewff:, really, proud, part, ace, review, girlsonfilmpod, annasmithjourno, -, special, messages]","['birdseyeviewff', 'proud', 'ace', 'review', 'girlsonfilmpod', 'annasmithjourno', 'special', 'message']"
296,1341045389617672193,annasmithjourno,2020-12-21 15:38:30,en,we're looking back year film latest ep girlsonfilmpod birdseyeviewff want se,15,5,We're looking back at the year in film in the latest ep of @GirlsOnFilm_Pod with @birdseyeviewff. If you want to se… https://t.co/QI44m2qsUS,"[we're, looking, back, year, film, latest, ep, girlsonfilmpod, birdseyeviewff, want, se]","['look', 'year', 'film', 'late', 'ep', 'girlsonfilmpod', 'birdseyeviewff', 'want', 'se']"
297,1340987166739079169,annasmithjourno,2020-12-21 11:47:09,en,girlsonfilmpod: year seen many fab films women - including #luxor shot zelmira gainza joins #girlsonfilm,0,7,"RT @GirlsOnFilm_Pod: This year has seen SO many fab films by women - including #Luxor, shot by Zelmira Gainza📽️

She joins our #GirlsOnFilm…","[girlsonfilmpod:, year, seen, many, fab, films, women, -, including, #luxor, shot, zelmira, gainza, joins, #girlsonfilm]","['girlsonfilmpod', 'year', 'see', 'fab', 'film', 'woman', 'include', 'luxor', 'shoot', 'zelmira', 'gainza', 'join', 'girlsonfilm']"
298,1340986852115959809,annasmithjourno,2020-12-21 11:45:54,en,wxifzine: amazing interviews annasmithjourno - myriamraja - thegreatvon - keringforwomen 's cline bonnaire film recomm,0,3,"RT @wxifzine: With amazing interviews from @annasmithjourno - @MyriamRaja - @TheGreatVon - @KeringForWomen  's Céline Bonnaire, film recomm…","[wxifzine:, amazing, interviews, annasmithjourno, -, myriamraja, -, thegreatvon, -, keringforwomen, 's, cline, bonnaire, film, recomm]","['wxifzine', 'amazing', 'interview', 'annasmithjourno', 'myriamraja', 'thegreatvon', 'keringforwomen', 'cline', 'bonnaire', 'film', 'recomm']"
299,1340986491980410880,annasmithjourno,2020-12-21 11:44:28,en,film day: fighting family heart-warming witty brit flick that's netflix sight sound,3,0,"Film of the Day: FIGHTING WITH MY FAMILY, a heart-warming, witty Brit flick that's now on Netflix. My Sight &amp; Sound… https://t.co/9eHmQ19mRy","[film, day:, fighting, family, heart-warming, witty, brit, flick, that's, netflix, sight, sound]","['film', 'day', 'fight', 'family', 'heart', 'warm', 'witty', 'brit', 'flick', 'netflix', 'sight', 'sound']"
300,1340586739992309760,annasmithjourno,2020-12-20 09:16:00,en,think time restarted film day keeping fairly upbeat today's recommendation catch,26,1,"I think it's about time I restarted Film of the Day, keeping it up fairly upbeat! Today's recommendation is CATCH M… https://t.co/xDPA0F6yYt","[think, time, restarted, film, day, keeping, fairly, upbeat, today's, recommendation, catch]","['think', 'time', 'restart', 'film', 'day', 'keep', 'fairly', 'upbeat', 'today', 'recommendation', 'catch']"
301,1340240475106795521,annasmithjourno,2020-12-19 10:20:04,en,film news: #wonderwoman available pvod jan uk #ww,7,1,Film News: #WonderWoman1984 will now be available on PVOD from Jan 13 in the UK. #WW84 https://t.co/EBMV4ptXXO,"[film, news:, #wonderwoman, available, pvod, jan, uk, #ww]","['film', 'news', 'wonderwoman', 'available', 'pvod', 'jan', 'uk', 'ww']"
302,1340035696376115203,annasmithjourno,2020-12-18 20:46:21,en,girlsonfilmpod: weekend (and xmas) starts new #girlsonfilm pod birdseyeviewff miafilms box office analyst delphil,0,12,"RT @GirlsOnFilm_Pod: The weekend (and Xmas) starts NOW! New #GirlsOnFilm pod with @BirdsEyeViewFF🎉

@miafilms + box office analyst @DelphiL…","[girlsonfilmpod:, weekend, (and, xmas), starts, new, #girlsonfilm, pod, birdseyeviewff, miafilms, box, office, analyst, delphil]","['girlsonfilmpod', 'weekend', 'xmas', 'start', 'new', 'girlsonfilm', 'pod', 'birdseyeviewff', 'miafilms', 'box', 'office', 'analyst', 'delphil']"
303,1340035676868382725,annasmithjourno,2020-12-18 20:46:16,en,girlsonfilmpod: check #girlsonfilm ep tuneful chat things musical critic katbrown house,0,3,"RT @GirlsOnFilm_Pod: Check out #GirlsOnFilm ep 57 for tuneful chat on all things musical!
https://t.co/0PqOkt4gWT
Critic @katbrown &amp; house…","[girlsonfilmpod:, check, #girlsonfilm, ep, tuneful, chat, things, musical, critic, katbrown, house]","['girlsonfilmpod', 'check', 'girlsonfilm', 'ep', 'tuneful', 'chat', 'thing', 'musical', 'critic', 'katbrown', 'house']"
304,1340002538926579714,annasmithjourno,2020-12-18 18:34:35,en,katbrown girlsonfilmpod joy ever kat tune,3,0,"@katbrown @GirlsOnFilm_Pod A joy to have you on. As ever, Kat, we are in tune!","[katbrown, girlsonfilmpod, joy, ever, kat, tune]","['katbrown', 'girlsonfilmpod', 'joy', 'kat', 'tune']"
305,1339942225736830977,annasmithjourno,2020-12-18 14:34:56,en,#wonderwoman first #metoo superhero movie here's article guardian quotes helenlohara,26,6,"Is #WonderWoman1984 the first #MeToo superhero movie? Here's my article in @guardian, with quotes from @HelenLOHara… https://t.co/i3MHgMRbGB","[#wonderwoman, first, #metoo, superhero, movie, here's, article, guardian, quotes, helenlohara]","['wonderwoman', 'metoo', 'superhero', 'movie', 'article', 'guardian', 'quote', 'helenlohara']"
306,1339550702167859203,annasmithjourno,2020-12-17 12:39:09,en,congratulations filmmakers took part daysfilms - watch powerful work,17,4,Congratulations to the filmmakers who took part in @16Days16Films - you can watch their powerful work on… https://t.co/gMw0nOFp3I,"[congratulations, filmmakers, took, part, daysfilms, -, watch, powerful, work]","['congratulation', 'filmmaker', 'take', 'daysfilms', 'watch', 'powerful', 'work']"
307,1339311275998912520,annasmithjourno,2020-12-16 20:47:46,en,katbrown: lovely time speaking annasmithjourno podcast girlsonfilmpod like musicals acapella singing,0,1,"RT @katbrown: I had a lovely time speaking to @annasmithjourno for her podcast, @GirlsOnFilm_Pod. If you like musicals, acapella singing, a…","[katbrown:, lovely, time, speaking, annasmithjourno, podcast, girlsonfilmpod, like, musicals, acapella, singing]","['katbrown', 'lovely', 'time', 'speak', 'annasmithjourno', 'podcast', 'girlsonfilmpod', 'like', 'musical', 'acapella', 'singing']"
308,1339268662805622789,annasmithjourno,2020-12-16 17:58:26,en,girlsonfilmpod: making film industry safe equal place women ashleyjudd says we're hour go til tonight's,0,3,"RT @GirlsOnFilm_Pod: Making the film industry a safe &amp; equal place for women? @AshleyJudd says ""we're on it!""

1 hour to go til TONIGHT'S @…","[girlsonfilmpod:, making, film, industry, safe, equal, place, women, ashleyjudd, says, we're, hour, go, til, tonight's]","['girlsonfilmpod', 'make', 'film', 'industry', 'safe', 'equal', 'place', 'woman', 'ashleyjudd', 'say', 'hour', 'til', 'tonight']"
309,1339234118933024769,annasmithjourno,2020-12-16 15:41:10,en,girlsonfilmpod: anti-#fgm activist psychotherapist daysfilms juror leylahussein joins us tonight's virtual awards - speaki,0,6,"RT @GirlsOnFilm_Pod: Anti-#FGM activist, psychotherapist &amp; @16Days16Films juror @LeylaHussein joins us in tonight's virtual awards - speaki…","[girlsonfilmpod:, anti-#fgm, activist, psychotherapist, daysfilms, juror, leylahussein, joins, us, tonight's, virtual, awards, -, speaki]","['girlsonfilmpod', 'anti-#fgm', 'activist', 'psychotherapist', 'daysfilms', 'juror', 'leylahussein', 'join', 'tonight', 'virtual', 'award', 'speaki']"
310,1339138928432082944,annasmithjourno,2020-12-16 09:22:55,en,girlsonfilmpod: tonight's night join us pm gmt daysfilms awards - hosted annasmithjourno featuring,0,8,"RT @GirlsOnFilm_Pod: 🏆Tonight's the night!🏆

Join us at 6pm GMT for the @16Days16Films Awards 2020 - hosted by @annasmithjourno &amp; featuring…","[girlsonfilmpod:, tonight's, night, join, us, pm, gmt, daysfilms, awards, -, hosted, annasmithjourno, featuring]","['girlsonfilmpod', 'tonight', 'night', 'join', 'pm', 'gmt', 'daysfilms', 'award', 'host', 'annasmithjourno', 'feature']"
311,1338929893091008515,annasmithjourno,2020-12-15 19:32:17,en,spot,9,0,Spot on. https://t.co/UZYqivBanP,[spot],['spot']
312,1338920145771704324,annasmithjourno,2020-12-15 18:53:33,en,daysfilms: tune tomorrow pm (gmt) awards special girlsonfilmpod reveal #daysfilms,0,5,RT @16Days16Films: Tune in 📣 TOMORROW 📣 at 6PM (GMT) for our Awards Special with @GirlsOnFilm_Pod for the reveal of the #16Days16Films 2020…,"[daysfilms:, tune, tomorrow, pm, (gmt), awards, special, girlsonfilmpod, reveal, #daysfilms]","['daysfilms', 'tune', 'tomorrow', 'pm', 'gmt', 'award', 'special', 'girlsonfilmpod', 'reveal', 'daysfilms']"
313,1338221159649861634,annasmithjourno,2020-12-13 20:36:02,en,girlsonfilmpod: fantastic short films available watch free #days less hours left vote yo,0,7,"RT @GirlsOnFilm_Pod: 16 fantastic short films available to watch for for free from #16Days now🎞️
And less than 24 hours left to vote for yo…","[girlsonfilmpod:, fantastic, short, films, available, watch, free, #days, less, hours, left, vote, yo]","['girlsonfilmpod', 'fantastic', 'short', 'film', 'available', 'watch', 'free', 'day', 'hour', 'leave', 'vote', 'yo']"
314,1338196537822863360,annasmithjourno,2020-12-13 18:58:11,en,anonymousriter: adore ruthmadeley (who doesnt) absolutely adored talk disability diversity media girl,0,1,RT @Anonymous_Riter: I adore @ruth_madeley (who doesn’t?)! &amp; I absolutely adored her talk on disability diversity in the media on the @Girl…,"[anonymousriter:, adore, ruthmadeley, (who, doesnt), absolutely, adored, talk, disability, diversity, media, girl]","['anonymousriter', 'adore', 'ruthmadeley', 'not', 'absolutely', 'adore', 'talk', 'disability', 'diversity', 'medium', 'girl']"
315,1337390534831304705,annasmithjourno,2020-12-11 13:35:25,en,great supporting thanks namecheck thelistmagazine,0,0,"Great to be supporting this, thanks for the namecheck @thelistmagazine. https://t.co/y0AzY1qpnk","[great, supporting, thanks, namecheck, thelistmagazine]","['great', 'support', 'thank', 'namecheck', 'thelistmagazine']"
316,1337362414711558150,annasmithjourno,2020-12-11 11:43:41,en,thrilled hosting qa viggo mortensen tonight everymancinema hampstead sold #falling,16,4,So thrilled to be hosting a Q&amp;A with Viggo Mortensen tonight @Everymancinema Hampstead. It's sold out but #Falling… https://t.co/32g0ImpxJg,"[thrilled, hosting, qa, viggo, mortensen, tonight, everymancinema, hampstead, sold, #falling]","['thrill', 'host', 'qa', 'viggo', 'mortensen', 'tonight', 'everymancinema', 'hampstead', 'sell', 'fall']"
317,1336738891685109761,annasmithjourno,2020-12-09 18:26:01,en,bifafilm: congratulations #bifa nominees view full list here:,0,50,RT @BIFA_film: Congratulations to all of the #BIFA2020 nominees! View the full list here: https://t.co/q2HLuRVuZV,"[bifafilm:, congratulations, #bifa, nominees, view, full, list, here:]","['bifafilm', 'congratulation', 'bifa', 'nominee', 'view', 'list']"
318,1336706732744192000,annasmithjourno,2020-12-09 16:18:14,en,girlsonfilmpod team outing girlsonfilmpod second viewing,2,0,"@GirlsOnFilm_Pod Team outing, @GirlsOnFilm_Pod? I am so up for a second viewing.","[girlsonfilmpod, team, outing, girlsonfilmpod, second, viewing]","['girlsonfilmpod', 'team', 'outing', 'girlsonfilmpod', 'second', 'viewing']"
319,1336705809380741123,annasmithjourno,2020-12-09 16:14:34,en,wow #wonderwoman blockbuster we've waiting year - like six fave movies roll,41,1,WOW! #WonderWoman1984 is the blockbuster we've been waiting for all year - it’s like six of my fave 80s movies roll… https://t.co/Weq8TahlLI,"[wow, #wonderwoman, blockbuster, we've, waiting, year, -, like, six, fave, movies, roll]","['wow', 'wonderwoman', 'blockbuster', 'wait', 'year', 'like', 'fave', 'movie', 'roll']"
320,1336232220323958785,annasmithjourno,2020-12-08 08:52:41,en,bfi: live bfi youtube: viggo mortensen lancehenriksen conversation annasmithjourno #bfiathome #hereforculture,0,6,"RT @BFI: 🔴 Now live on BFI YouTube: Viggo Mortensen and @lancehenriksen in conversation with @annasmithjourno 

#BFIatHome #HereForCulture…","[bfi:, live, bfi, youtube:, viggo, mortensen, lancehenriksen, conversation, annasmithjourno, #bfiathome, #hereforculture]","['bfi', 'live', 'bfi', 'youtube', 'viggo', 'mortensen', 'lancehenriksen', 'conversation', 'annasmithjourno', 'bfiathome', 'hereforculture']"
321,1335567118079827970,annasmithjourno,2020-12-06 12:49:49,en,bttfmusical hello could share email press department please thanks,0,0,"@BTTFmusical Hello! Could you share an email for your press department, please? Thanks.","[bttfmusical, hello, could, share, email, press, department, please, thanks]","['bttfmusical', 'hello', 'share', 'email', 'press', 'department', 'thank']"
322,1335142794109792257,annasmithjourno,2020-12-05 08:43:42,en,treat fill great kermodemovie bbcnews film review week - choices include lesbian,38,10,A treat to fill in for the great @KermodeMovie on the @BBCNews Film Review this week - my choices include a lesbian… https://t.co/ZqFmVF9XMd,"[treat, fill, great, kermodemovie, bbcnews, film, review, week, -, choices, include, lesbian]","['treat', 'fill', 'great', 'kermodemovie', 'bbcnews', 'film', 'review', 'week', 'choice', 'include', 'lesbian']"
323,1334904455658164224,annasmithjourno,2020-12-04 16:56:38,en,girlsonfilmpod: check badass #girlsonfilm recent pods primevideouk listen:,0,6,"RT @GirlsOnFilm_Pod: Check out the badass #GirlsOnFilm of our recent pods with @primevideouk ♀️🙌
Listen: https://t.co/BH1snmx5mm https://t.…","[girlsonfilmpod:, check, badass, #girlsonfilm, recent, pods, primevideouk, listen:]","['girlsonfilmpod', 'check', 'badass', 'girlsonfilm', 'recent', 'pod', 'primevideouk', 'listen']"
324,1334561803406282754,annasmithjourno,2020-12-03 18:15:03,en,bfi: next week viggo mortensen lancehenriksen join annasmithjourno discuss mortensen's debut film falling tune,0,7,"RT @BFI: Next week, Viggo Mortensen and @lancehenriksen will join @annasmithjourno to discuss Mortensen's debut film, Falling. 

Tune into…","[bfi:, next, week, viggo, mortensen, lancehenriksen, join, annasmithjourno, discuss, mortensen's, debut, film, falling, tune]","['bfi', 'week', 'viggo', 'mortensen', 'lancehenriksen', 'join', 'annasmithjourno', 'discuss', 'mortensen', 'debut', 'film', 'fall', 'tune']"
325,1334458088380882945,annasmithjourno,2020-12-03 11:22:55,en,girlsonfilmpod: new #girlsonfilm talk stripping on-screen hustlersmovie #sexworkersrights,0,4,"RT @GirlsOnFilm_Pod: NEW #GirlsOnFilm! &gt; https://t.co/OTXV2Nqyh7

We talk stripping on-screen, @HustlersMovie and  #SexWorkersRights with @…","[girlsonfilmpod:, new, #girlsonfilm, talk, stripping, on-screen, hustlersmovie, #sexworkersrights]","['girlsonfilmpod', 'new', 'girlsonfilm', 'talk', 'strip', 'screen', 'hustlersmovie', 'sexworkersrights']"
326,1334197183801913344,annasmithjourno,2020-12-02 18:06:11,en,honour host global premiere iambelmaya last night ghfilm festival online festival,1,1,It was an honour to host the Global Premiere for @IAmBelmaya last night at @GHFilm festival. The online festival is… https://t.co/WkbV1YLqkW,"[honour, host, global, premiere, iambelmaya, last, night, ghfilm, festival, online, festival]","['honour', 'host', 'global', 'premiere', 'iambelmaya', 'night', 'ghfilm', 'festival', 'online', 'festival']"
327,1334164713140260864,annasmithjourno,2020-12-02 15:57:09,en,girlsonfilmpod: halfway see dec,0,3,RT @GirlsOnFilm_Pod: Halfway! See you all on Dec 16 🙌 https://t.co/H4cQK9u8pQ,"[girlsonfilmpod:, halfway, see, dec]","['girlsonfilmpod', 'halfway', 'dec']"
328,1333094880671911941,annasmithjourno,2020-11-29 17:06:01,en,traceycollinsss: help michelleluther written female led #sitcom sticky vickys chippy brilliant,0,12,RT @traceycollinsss: Can you help? Myself &amp; @MichelleLuther have written a female led #sitcom ‘Sticky Vicky’s Chippy’. After a brilliant re…,"[traceycollinsss:, help, michelleluther, written, female, led, #sitcom, sticky, vickys, chippy, brilliant]","['traceycollinsss', 'help', 'michelleluther', 'write', 'female', 'lead', 'sitcom', 'sticky', 'vickys', 'chippy', 'brilliant']"
329,1332291099227000832,annasmithjourno,2020-11-27 11:52:05,en,ghfilm: great review iambelmaya girlsonfilmpod annasmithjourno lesliefelperin world premiere tuesday december :,0,2,"RT @GHFilm: Great review of @IAmBelmaya by @GirlsOnFilm_Pod @annasmithjourno and @LeslieFelperin! 
World Premiere Tuesday 01 December 19:00…","[ghfilm:, great, review, iambelmaya, girlsonfilmpod, annasmithjourno, lesliefelperin, world, premiere, tuesday, december, :]","['ghfilm', 'great', 'review', 'iambelmaya', 'girlsonfilmpod', 'annasmithjourno', 'lesliefelperin', 'world', 'premiere', 'tuesday', 'december']"
330,1331930429893578752,annasmithjourno,2020-11-26 11:58:55,en,girlsonfilmpod: great see host annasmithjourno ghfilm festival - kicking powerful iambelmaya next week,0,4,RT @GirlsOnFilm_Pod: Great to see our host @annasmithjourno at the @GHFilm Festival - kicking off with the powerful @IAmBelmaya next week!…,"[girlsonfilmpod:, great, see, host, annasmithjourno, ghfilm, festival, -, kicking, powerful, iambelmaya, next, week]","['girlsonfilmpod', 'great', 'host', 'annasmithjourno', 'ghfilm', 'festival', 'kick', 'powerful', 'iambelmaya', 'week']"
331,1331595256937279490,annasmithjourno,2020-11-25 13:47:03,en,girlsonfilmpod: excited working brilliant daysfilms see virtual awards dec #days https,0,1,"RT @GirlsOnFilm_Pod: So excited to be working with the brilliant @16Days16Films 
See you all at the virtual awards on Dec 16!
#16Days https…","[girlsonfilmpod:, excited, working, brilliant, daysfilms, see, virtual, awards, dec, #days, https]","['girlsonfilmpod', 'excited', 'work', 'brilliant', 'daysfilms', 'virtual', 'award', 'dec', 'day', 'https']"
332,1331594862320365580,annasmithjourno,2020-11-25 13:45:29,en,girlsonfilmpod: we're exploring modernfilmsent's #luxor week's #girlsonfilm director zeina durra cinematographer zelmira ga,0,4,"RT @GirlsOnFilm_Pod: We're exploring @ModernFilmsEnt's #Luxor in this week's #GirlsOnFilm
Director Zeina Durra &amp; cinematographer Zelmira Ga…","[girlsonfilmpod:, we're, exploring, modernfilmsent's, #luxor, week's, #girlsonfilm, director, zeina, durra, cinematographer, zelmira, ga]","['girlsonfilmpod', 'explore', 'modernfilmsent', 'luxor', 'week', 'girlsonfilm', 'director', 'zeina', 'durra', 'cinematographer', 'zelmira', 'ga']"
333,1331527344109088769,annasmithjourno,2020-11-25 09:17:12,en,ghfilm: global health film festival - december open #worldpremiere iambelmaya tues dec pm gmt join annasmith,0,1,RT @GHFilm: Global Health Film Festival 01-06 December! We open with the #WorldPremiere of @IAmBelmaya Tues 01 Dec 7pm GMT! Join @annasmith…,"[ghfilm:, global, health, film, festival, -, december, open, #worldpremiere, iambelmaya, tues, dec, pm, gmt, join, annasmith]","['ghfilm', 'global', 'health', 'film', 'festival', 'december', 'open', 'worldpremiere', 'iambelmaya', 'tues', 'dec', 'pm', 'gmt', 'join', 'annasmith']"
334,1331370073047658497,annasmithjourno,2020-11-24 22:52:15,en,legacurrylad: weve released quite podcasts since dhfilmfestival wrapped end october one,0,3,"RT @legacurrylad: We’ve released a quite a few podcasts since the @dhfilmfestival wrapped at the end of October, but this has been one of m…","[legacurrylad:, weve, released, quite, podcasts, since, dhfilmfestival, wrapped, end, october, one]","['legacurrylad', 'have', 'release', 'podcast', 'dhfilmfestival', 'wrap', 'end', 'october']"
335,1330575258743697408,annasmithjourno,2020-11-22 18:13:57,en,anonymousriter girlsonfilmpod heddatweet janelong phililowthorpe homemcr thanks great ev,4,0,"@Anonymous_Riter @GirlsOnFilm_Pod @Hedda_tweet @janelong @phililowthorpe @HOME_mcr Thanks, that was such a great ev… https://t.co/dDQiqYPNyU","[anonymousriter, girlsonfilmpod, heddatweet, janelong, phililowthorpe, homemcr, thanks, great, ev]","['anonymousriter', 'girlsonfilmpod', 'heddatweet', 'janelong', 'phililowthorpe', 'homemcr', 'thank', 'great', 'ev']"
336,1329769665023930370,annasmithjourno,2020-11-20 12:52:48,en,happy friday today's film recommendation patrick offbeat comedy set belgian nudist camp guy wh,7,0,"Happy Friday! Today's film recommendation is PATRICK, an offbeat comedy set in a Belgian nudist camp about a guy wh… https://t.co/Zjfui2STXd","[happy, friday, today's, film, recommendation, patrick, offbeat, comedy, set, belgian, nudist, camp, guy, wh]","['happy', 'friday', 'today', 'film', 'recommendation', 'patrick', 'offbeat', 'comedy', 'set', 'belgian', 'nudist', 'camp', 'guy', 'wh']"
337,1329408528302346240,annasmithjourno,2020-11-19 12:57:47,en,girlsonfilmpod: fab see three awesome rocksthefilm cast list check convo director sarahgavron live f,0,2,RT @GirlsOnFilm_Pod: Fab to see THREE of the awesome @RocksTheFilm cast on this list! Check out our convo with director @SarahGavron live f…,"[girlsonfilmpod:, fab, see, three, awesome, rocksthefilm, cast, list, check, convo, director, sarahgavron, live, f]","['girlsonfilmpod', 'fab', 'awesome', 'rocksthefilm', 'cast', 'list', 'check', 'convo', 'director', 'sarahgavron', 'live', 'f']"
338,1328661968539033603,annasmithjourno,2020-11-17 11:31:13,en,bifafilm: #bifa new talent long lists who's ready rising stars we're excited present bifa's long lis,0,45,"RT @BIFA_film: 📣 #BIFA2020 New Talent long lists 📣

Who's ready for some rising stars? 🌟 

We're SO EXCITED to present BIFA's 2020 long lis…","[bifafilm:, #bifa, new, talent, long, lists, who's, ready, rising, stars, we're, excited, present, bifa's, long, lis]","['bifafilm', 'bifa', 'new', 'talent', 'long', 'list', 'ready', 'rise', 'star', 'excite', 'present', 'bifa', 'long', 'lis']"
339,1328272837573038083,annasmithjourno,2020-11-16 09:44:57,en,girlsonfilmpod: helen mirren salute susan wokoma shares love latest #girlsonfilm pod emmaziadarcy j,0,2,"RT @GirlsOnFilm_Pod: Helen Mirren, we salute you! 
Susan Wokoma shares the love in the latest #GirlsOnFilm pod, where she &amp; @EmmaZiaDArcy j…","[girlsonfilmpod:, helen, mirren, salute, susan, wokoma, shares, love, latest, #girlsonfilm, pod, emmaziadarcy, j]","['girlsonfilmpod', 'helen', 'mirren', 'salute', 'susan', 'wokoma', 'share', 'love', 'late', 'girlsonfilm', 'pod', 'emmaziadarcy', 'j']"
340,1328042232633552899,annasmithjourno,2020-11-15 18:28:36,en,bbcmusic deetah sampling dire strats,0,0,@BBC6Music Deetah sampling Dire Strats,"[bbcmusic, deetah, sampling, dire, strats]","['bbcmusic', 'deetah', 'sampling', 'dire', 'strat']"
341,1327307663668113408,annasmithjourno,2020-11-13 17:49:41,en,loved chatting emmaziadarcy susan wokoma episode #truthseekers excuse talk g,9,1,I loved chatting to @EmmaZiaDArcy and Susan Wokoma for this episode about #TruthSeekers. Any excuse to talk about g… https://t.co/lrn7Ks2CM1,"[loved, chatting, emmaziadarcy, susan, wokoma, episode, #truthseekers, excuse, talk, g]","['love', 'chat', 'emmaziadarcy', 'susan', 'wokoma', 'episode', 'truthseekers', 'excuse', 'talk', 'g']"
342,1326222381673820162,annasmithjourno,2020-11-10 17:57:10,en,girlsonfilmpod: ever paranormal experience #truthseekers star susan wokoma - check today's new #girlsonfilm gh,0,3,"RT @GirlsOnFilm_Pod: Ever had a paranormal experience? 
#TruthSeekers star Susan Wokoma has - check out today's new #GirlsOnFilm for the gh…","[girlsonfilmpod:, ever, paranormal, experience, #truthseekers, star, susan, wokoma, -, check, today's, new, #girlsonfilm, gh]","['girlsonfilmpod', 'paranormal', 'experience', 'truthseekers', 'star', 'susan', 'wokoma', 'check', 'today', 'new', 'girlsonfilm', 'gh']"
343,1326099831299973121,annasmithjourno,2020-11-10 09:50:12,en,always pleasure guest monocle particular episode - shirley,1,0,It’s always a pleasure to be a guest on @Monocle24 and this particular episode - about Shirley from… https://t.co/Faavc9w1r2,"[always, pleasure, guest, monocle, particular, episode, -, shirley]","['pleasure', 'guest', 'monocle', 'particular', 'episode', 'shirley']"
344,1326098865624322050,annasmithjourno,2020-11-10 09:46:21,en,robertbound lucyscholes hollyfisher ive listened (again) agree love show thanks,3,0,"@RobertBound @LucyScholes @holly_fisher I’ve just listened (again) and have to agree, I love this show! Thanks all","[robertbound, lucyscholes, hollyfisher, ive, listened, (again), agree, love, show, thanks]","['robertbound', 'lucyscholes', 'hollyfisher', 'have', 'listen', 'agree', 'love', 'thank']"
