,id,username,created_at,lang,cleaned_tweets,favorite_count,retweet_count,text,tokens,lemmas
0,1389982171599831043,amitabhnews18,2021-05-05 16:35:48,en,#covid supplies received global community effectively allocated states/uts govt india,0,0,"#COVID19 supplies received from Global Community have been Effectively Allocated to States/UTs by Govt of India 
*1… https://t.co/jTSaFWzDpm","[#covid, supplies, received, global, community, effectively, allocated, states/uts, govt, india]","['covid', 'supply', 'receive', 'global', 'community', 'effectively', 'allocate', 'states', 'uts', 'govt', 'india']"
1,1389901073477931020,amitabhnews18,2021-05-05 11:13:33,en,india meaindia strongly condemns terror attack logarafghanistan leaving innocent deadover injured nee,2,0,"India @MEAIndia strongly condemns terror attack in Logar,Afghanistan leaving 21 innocent dead&amp;over100 injured 
*nee… https://t.co/tDVy3YGzMg","[india, meaindia, strongly, condemns, terror, attack, logarafghanistan, leaving, innocent, deadover, injured, nee]","['india', 'meaindia', 'strongly', 'condemn', 'terror', 'attack', 'logarafghanistan', 'leave', 'innocent', 'deadover', 'injure', 'nee']"
2,1389896762651860996,amitabhnews18,2021-05-05 10:56:25,en,cabinet #ccea chaired pm narendramodi approves strategic disinvestmenttransfer management control,4,1,Cabinet #CCEA chaired by PM @narendramodi approves strategic disinvestment&amp;transfer of management control in… https://t.co/FokCAHUW34,"[cabinet, #ccea, chaired, pm, narendramodi, approves, strategic, disinvestmenttransfer, management, control]","['cabinet', 'ccea', 'chair', 'pm', 'narendramodi', 'approve', 'strategic', 'disinvestmenttransfer', 'management', 'control']"
3,1389862545930932225,amitabhnews18,2021-05-05 08:40:28,en,atal bihari #vajpayee #covid hospital setup drdoindia lucknow made operational today may,1,1,Atal Bihari #Vajpayee #COVID19 hospital setup by @DRDO_India in Lucknow made operational today on 5 May… https://t.co/UmJfApxwu7,"[atal, bihari, #vajpayee, #covid, hospital, setup, drdoindia, lucknow, made, operational, today, may]","['atal', 'bihari', 'vajpayee', 'covid', 'hospital', 'setup', 'drdoindia', 'lucknow', 'operational', 'today']"
4,1389631246314065920,amitabhnews18,2021-05-04 17:21:21,en,delhi receive tonnes #oxygen today oxygen express would deliver nearly mt #lmo #delhi,3,0,"Delhi to receive 244 tonnes more #Oxygen Today. Now, Oxygen Express would deliver nearly 450 MT of #LMO to #Delhi a… https://t.co/mVyKzpqbst","[delhi, receive, tonnes, #oxygen, today, oxygen, express, would, deliver, nearly, mt, #lmo, #delhi]","['delhi', 'receive', 'tonne', 'oxygen', 'today', 'oxygen', 'express', 'deliver', 'nearly', 'mt', 'lmo', 'delhi']"
5,1389627177805570048,amitabhnews18,2021-05-04 17:05:11,en,indianhrc takes cognizance alleged post poll violence bengal orders investigation fact finding team r,24,10,. @India_NHRC takes cognizance of alleged post poll violence in Bengal. Orders investigation. A fact finding team r… https://t.co/dW6z2UXf2m,"[indianhrc, takes, cognizance, alleged, post, poll, violence, bengal, orders, investigation, fact, finding, team, r]","['indianhrc', 'take', 'cognizance', 'allege', 'post', 'poll', 'violence', 'bengal', 'orders', 'investigation', 'fact', 'find', 'team', 'r']"
6,1389574429919698944,amitabhnews18,2021-05-04 13:35:35,en,india-uk global innovation partnership announced johnson invited pm modi visit uk g- summit,4,1,"India-UK ‘Global Innovation Partnership’ was announced
*Johnson invited PM Modi to visit UK for G-7 Summit https://t.co/SSAOpFMqjx","[india-uk, global, innovation, partnership, announced, johnson, invited, pm, modi, visit, uk, g-, summit]","['india', 'uk', 'global', 'innovation', 'partnership', 'announce', 'johnson', 'invite', 'pm', 'modi', 'visit', 'uk', 'g-', 'summit']"
7,1389573672994676738,amitabhnews18,2021-05-04 13:32:35,en,pm narendramodi #uk pm borisjohnson virtual summit roadmap adopted comprehensive strategic partne,6,1,"PM @narendramodi &amp; #UK PM @BorisJohnson Virtual Summit 
*Roadmap 2030’ adopted  to a Comprehensive Strategic Partne… https://t.co/bNtsUouGWt","[pm, narendramodi, #uk, pm, borisjohnson, virtual, summit, roadmap, adopted, comprehensive, strategic, partne]","['pm', 'narendramodi', 'uk', 'pm', 'borisjohnson', 'virtual', 'summit', 'roadmap', 'adopt', 'comprehensive', 'strategic', 'partne']"
8,1389568717697077249,amitabhnews18,2021-05-04 13:12:53,en,drdoindia install medical #oxygen plants delhi haryana within st week may equipment arrives,20,10,". @DRDO_India to install 5 Medical #Oxygen Plants in Delhi &amp; Haryana within 1st week of May 
*Equipment arrives at… https://t.co/BbAzN2UmM2","[drdoindia, install, medical, #oxygen, plants, delhi, haryana, within, st, week, may, equipment, arrives]","['drdoindia', 'install', 'medical', 'oxygen', 'plant', 'delhi', 'haryana', 'st', 'week', 'equipment', 'arrive']"
9,1389533072840740866,amitabhnews18,2021-05-04 10:51:15,en,effective allocation centre #covid supplies received global community mohfwindia medical infrastruc,6,0,"Effective Allocation by Centre of #COVID19 supplies received from Global Community @MoHFW_INDIA
*Medical Infrastruc… https://t.co/8H8Fio3m0s","[effective, allocation, centre, #covid, supplies, received, global, community, mohfwindia, medical, infrastruc]","['effective', 'allocation', 'centre', 'covid', 'supply', 'receive', 'global', 'community', 'mohfwindia', 'medical', 'infrastruc']"
10,1389521746286497795,amitabhnews18,2021-05-04 10:06:15,en,production #remdesivir increased rapid pace #india achieved times production capacity remedesvir wi,3,1,Production of #Remdesivir increased at a rapid pace. #India achieved 3 times production capacity of Remedesvir &amp; wi… https://t.co/1X7DQYJxR1,"[production, #remdesivir, increased, rapid, pace, #india, achieved, times, production, capacity, remedesvir, wi]","['production', 'remdesivir', 'increase', 'rapid', 'pace', 'india', 'achieve', 'time', 'production', 'capacity', 'remedesvir', 'wi']"
11,1389514362365251588,amitabhnews18,2021-05-04 09:36:54,hi,newsindia: breakingnews #b,0,37,"RT @News18India: BreakingNews
बंगाल में हो रही हिंसा को लेकर प्रधानमंत्री मोदी ने बंगाल के राज्यपाल से फोन पर बात की और गहरी चिंता जताई

#B…","[newsindia:, breakingnews, #b]","['newsindia', 'breakingnews', 'b']"
12,1389221337743302662,amitabhnews18,2021-05-03 14:12:32,en,pm narendramodi reviewed #covid initiatives indiannavy naval hospitals opened civilians many cities,8,0,"PM @narendramodi reviewed #COVID19 initiatives by  @indiannavy
*Naval Hospitals opened for civilians in many cities… https://t.co/KwmR05FBVB","[pm, narendramodi, reviewed, #covid, initiatives, indiannavy, naval, hospitals, opened, civilians, many, cities]","['pm', 'narendramodi', 'review', 'covid', 'initiatives', 'indiannavy', 'naval', 'hospital', 'open', 'civilian', 'city']"
13,1389189842169331713,amitabhnews18,2021-05-03 12:07:22,hi,newsindia: #breaking,0,9,"RT @News18India: #BREAKING
सरकार ने टीके पर ऑर्डर न देने की बात को ग़लत बताया,वैक्सीन निर्माण करने वाली कंपनियों को एडवांस में दी गई रकम…","[newsindia:, #breaking]","['newsindia', 'break']"
14,1389158392153788417,amitabhnews18,2021-05-03 10:02:24,en,medical personnel completing days #covid duties given pms distinguished covid national service samm,3,0,Medical personnel completing 100 days of #Covid duties will be given PM’s Distinguished Covid National Service Samm… https://t.co/6TzGpSnz5X,"[medical, personnel, completing, days, #covid, duties, given, pms, distinguished, covid, national, service, samm]","['medical', 'personnel', 'complete', 'day', 'covid', 'duty', 'give', 'pms', 'distinguished', 'covid', 'national', 'service', 'samm']"
15,1389157964263485443,amitabhnews18,2021-05-03 10:00:42,en,decisions #covid final year mbbs students utilized tele-consultationmonitoring mild covid case,3,1,"Decisions on #COVID19
*final Year MBBS students can be utilized for tele-consultation&amp;monitoring of mild Covid case… https://t.co/Ompg1e6Weg","[decisions, #covid, final, year, mbbs, students, utilized, tele-consultationmonitoring, mild, covid, case]","['decision', 'covid', 'final', 'year', 'mbbs', 'student', 'utilize', 'tele', 'consultationmonitoring', 'mild', 'covid', 'case']"
16,1389155781853941762,amitabhnews18,2021-05-03 09:52:02,en,pm narendramodi key decisions boost availability medical personnel fight #covid neet-pg exam pos,69,6,"PM @narendramodi key decisions to boost availability of medical personnel to fight #COVID19
*NEET-PG Exam to be pos… https://t.co/ofLmUYWts8","[pm, narendramodi, key, decisions, boost, availability, medical, personnel, fight, #covid, neet-pg, exam, pos]","['pm', 'narendramodi', 'key', 'decision', 'boost', 'availability', 'medical', 'personnel', 'fight', 'covid', 'neet', 'pg', 'exam', 'pos']"
17,1389149891583123457,amitabhnews18,2021-05-03 09:28:37,en,centre rejects allegations fresh order placed #covid says incorrect based facts,2,2,"Centre rejects allegations that no fresh order was placed for #COVID19 
*says incorrect &amp;not based on facts
*100% a… https://t.co/0LPM2fAofe","[centre, rejects, allegations, fresh, order, placed, #covid, says, incorrect, based, facts]","['centre', 'reject', 'allegation', 'fresh', 'order', 'place', 'covid', 'say', 'incorrect', 'base', 'fact']"
18,1388858490756628483,amitabhnews18,2021-05-02 14:10:42,en,meaindia medical requirements foreign hcs/embassies india chief protocolheads divisions c,2,1,".@MEAIndia on medical requirements of Foreign HCs/Embassies in India
""Chief of Protocol&amp;Heads of Divisions are in c… https://t.co/3FYE82Jcgn","[meaindia, medical, requirements, foreign, hcs/embassies, india, chief, protocolheads, divisions, c]","['meaindia', 'medical', 'requirement', 'foreign', 'hcs', 'embassies', 'india', 'chief', 'protocolheads', 'division', 'c']"
19,1388856356174663680,amitabhnews18,2021-05-02 14:02:13,en,cabinet secretary reviews state #covid preparedness #delhi expressed anguish people suffering due,6,2,"Cabinet Secretary reviews state of #COVID19 preparedness in #Delhi
*expressed anguish over people suffering due to… https://t.co/FJkuGcRdnU","[cabinet, secretary, reviews, state, #covid, preparedness, #delhi, expressed, anguish, people, suffering, due]","['cabinet', 'secretary', 'review', 'state', 'covid', 'preparedness', 'delhi', 'express', 'anguish', 'people', 'suffer']"
20,1388849664053563398,amitabhnews18,2021-05-02 13:35:38,en,external affairs minister drsjaishankar visiting #london - may participate #g foreign,46,3,External Affairs Minister @DrSJaishankar will be visiting #London from 3-6 May 2021 to participate in #G7 Foreign M… https://t.co/G8nsvKuOwn,"[external, affairs, minister, drsjaishankar, visiting, #london, -, may, participate, #g, foreign]","['external', 'affairs', 'minister', 'drsjaishankar', 'visit', 'london', 'participate', 'g', 'foreign']"
21,1388831263700701187,amitabhnews18,2021-05-02 12:22:31,en,delhi receives nd #oxygenexpress mt liquid oxygen indian railway railminindia delivers cumulative,12,3,"Delhi receives its 2nd #OxygenExpress  with 120 MT Liquid Oxygen

Indian Railway @RailMinIndia delivers cumulative… https://t.co/jLVvLVRjmi","[delhi, receives, nd, #oxygenexpress, mt, liquid, oxygen, indian, railway, railminindia, delivers, cumulative]","['delhi', 'receive', 'nd', 'oxygenexpress', 'mt', 'liquid', 'oxygen', 'indian', 'railway', 'railminindia', 'deliver', 'cumulative']"
22,1388801984136843268,amitabhnews18,2021-05-02 10:26:10,en,pm narendramodi held multiple meetings review #covid related situationhe reviewed upgradation health infr,25,1,PM @narendramodi held multiple meetings to review #COVID19 related situation.He reviewed upgradation of health infr… https://t.co/4XoPNUvHbs,"[pm, narendramodi, held, multiple, meetings, review, #covid, related, situationhe, reviewed, upgradation, health, infr]","['pm', 'narendramodi', 'hold', 'multiple', 'meeting', 'review', 'covid', 'relate', 'situationhe', 'review', 'upgradation', 'health', 'infr']"
23,1388772688349450241,amitabhnews18,2021-05-02 08:29:45,en,pm narendramodi reviewed issue augmenting human resources #covid sources decisions delaying neetin,8,3,"PM @narendramodi reviewed issue of augmenting human resources for #COVIDー19 
Sources on decisions
*delaying NEET&amp;in… https://t.co/Jxn1RNPjb9","[pm, narendramodi, reviewed, issue, augmenting, human, resources, #covid, sources, decisions, delaying, neetin]","['pm', 'narendramodi', 'review', 'issue', 'augment', 'human', 'resource', 'covid', 'source', 'decision', 'delay', 'neetin']"
24,1388701190418882560,amitabhnews18,2021-05-02 03:45:39,en,pm narendramodi review human resource situation relation #covid pandemic ways augment c,41,3,"PM @narendramodi will review the human resource situation in relation with #COVID19 pandemic &amp;ways to augment it
*c… https://t.co/TwAsMQcRT1","[pm, narendramodi, review, human, resource, situation, relation, #covid, pandemic, ways, augment, c]","['pm', 'narendramodi', 'review', 'human', 'resource', 'situation', 'relation', 'covid', 'pandemic', 'way', 'augment', 'c']"
25,1388690876956778497,amitabhnews18,2021-05-02 03:04:40,hi,newsindia: #missionbengal,0,6,"RT @News18India: #MissionBengal
पोस्टल बैलेट के रुझान आने शुरु. 2300 से ज्यादा हॉल में काउंटिंग. कांटे की टक्कर होने वाली है. देखिए अमिताभ…","[newsindia:, #missionbengal]","['newsindia', 'missionbengal']"
26,1388477980918181891,amitabhnews18,2021-05-01 12:58:41,en,ecisveep reviewed counting preparations amidst #covid victory processions banned rtpcr/rat tests counting,5,1,".@ECISVEEP reviewed counting preparations amidst #COVID19
*victory processions banned
*RTPCR/RAT tests for counting… https://t.co/yRPFvnfzLQ","[ecisveep, reviewed, counting, preparations, amidst, #covid, victory, processions, banned, rtpcr/rat, tests, counting]","['ecisveep', 'review', 'count', 'preparation', 'amidst', 'covid', 'victory', 'procession', 'ban', 'rtpcr', 'rat', 'test', 'count']"
27,1388475529745952768,amitabhnews18,2021-05-01 12:48:57,en,states/ut gear foolproof counting honouring #covidindia protocol arrangements ecisveep cec sushil chandr,4,1,"5 States/UT Gear up for Foolproof Counting Honouring #CovidIndia Protocol Arrangements @ECISVEEP
*CEC Sushil Chandr… https://t.co/scDisTaeO2","[states/ut, gear, foolproof, counting, honouring, #covidindia, protocol, arrangements, ecisveep, cec, sushil, chandr]","['states', 'ut', 'gear', 'foolproof', 'counting', 'honour', 'covidindia', 'protocol', 'arrangement', 'ecisveep', 'cec', 'sushil', 'chandr']"
28,1388428911818772480,amitabhnews18,2021-05-01 09:43:42,en,production medical #oxygen modified industrial nitrogen plants industries identified efforts,4,1,"*Production of Medical #Oxygen from modified Industrial Nitrogen Plants
*30 industries identified, efforts on to ma… https://t.co/RL2olLyPOZ","[production, medical, #oxygen, modified, industrial, nitrogen, plants, industries, identified, efforts]","['production', 'medical', 'oxygen', 'modify', 'industrial', 'nitrogen', 'plant', 'industry', 'identify', 'effort']"
29,1388425887188615173,amitabhnews18,2021-05-01 09:31:41,en,import #oxygen concentrators personal use included exempted category list import oxygen concentrators,3,2,"Import of #Oxygen Concentrators for personal use included in exempted category list
*Import of oxygen concentrators… https://t.co/Wp3y3lgyQ7","[import, #oxygen, concentrators, personal, use, included, exempted, category, list, import, oxygen, concentrators]","['import', 'oxygen', 'concentrator', 'personal', 'use', 'include', 'exempt', 'category', 'list', 'import', 'oxygen', 'concentrator']"
30,1388346731255930885,amitabhnews18,2021-05-01 04:17:09,en,payalmehta: senior journalist assam tribune kalyan baruah morehe passed away hospital gurugram vent,0,50,RT @payalmehta100: Senior journalist from Assam Tribune Kalyan Baruah no more..He passed away at a hospital in Gurugram after being on vent…,"[payalmehta:, senior, journalist, assam, tribune, kalyan, baruah, morehe, passed, away, hospital, gurugram, vent]","['payalmehta', 'senior', 'journalist', 'assam', 'tribune', 'kalyan', 'baruah', 'morehe', 'pass', 'away', 'hospital', 'gurugram', 'vent']"
31,1388346205621526528,amitabhnews18,2021-05-01 04:15:04,en,pm narendramodi visited sishganj #gurudwara early mornin,5,0,"श्री गुरु तेग बहादर जी के प्रकाश उत्सव की सभी को बधाई
*PM @narendramodi visited SishGanj #Gurudwara early in mornin… https://t.co/ZIO2sKcLcj","[pm, narendramodi, visited, sishganj, #gurudwara, early, mornin]","['pm', 'narendramodi', 'visit', 'sishganj', 'gurudwara', 'early', 'mornin']"
32,1388156805377773570,amitabhnews18,2021-04-30 15:42:27,en,pm narendramodi reviewed functioning empowered groups insurance scheme frontline health workers,7,1,"PM @narendramodi reviewed  functioning of 3 empowered groups 
*Insurance scheme for frontline health workers has be… https://t.co/hQFiMeiBaB","[pm, narendramodi, reviewed, functioning, empowered, groups, insurance, scheme, frontline, health, workers]","['pm', 'narendramodi', 'review', 'function', 'empowered', 'group', 'insurance', 'scheme', 'frontline', 'health', 'worker']"
33,1388143776149868545,amitabhnews18,2021-04-30 14:50:41,en,cnnnews: rajnath singh invoked special provisions granted emergency financial powers armed forces speed efforts #covid,0,5,RT @CNNnews18: Rajnath Singh invoked special provisions &amp; granted Emergency Financial Powers to Armed Forces to speed up efforts on #COVID1…,"[cnnnews:, rajnath, singh, invoked, special, provisions, granted, emergency, financial, powers, armed, forces, speed, efforts, #covid]","['cnnnews', 'rajnath', 'singh', 'invoke', 'special', 'provision', 'grant', 'emergency', 'financial', 'power', 'armed', 'force', 'speed', 'effort', 'covid']"
34,1388138999256997890,amitabhnews18,2021-04-30 14:31:42,en,rajnathsingh invoked special provisionsgranted emergency financial powers armed forces speed efforts,48,12,. @rajnathsingh invoked special provisions&amp;granted Emergency Financial Powers to Armed Forces to speed up efforts o… https://t.co/32K2eCOnus,"[rajnathsingh, invoked, special, provisionsgranted, emergency, financial, powers, armed, forces, speed, efforts]","['rajnathsingh', 'invoke', 'special', 'provisionsgrante', 'emergency', 'financial', 'power', 'armed', 'force', 'speed', 'effort']"
35,1388133706926227460,amitabhnews18,2021-04-30 14:10:40,en,cr beneficiaries register co-win phase iii #vaccination commences (till today) indias cumul,4,2,"*2.45 Cr beneficiaries register on Co-WIN as Phase III of #Vaccination commences (till 930 am today)
*India’s Cumul… https://t.co/HgK2F82fxr","[cr, beneficiaries, register, co-win, phase, iii, #vaccination, commences, (till, today), indias, cumul]","['cr', 'beneficiary', 'register', 'co', 'win', 'phase', 'iii', 'vaccination', 'commence', 'till', 'today', 'indias', 'cumul']"
36,1388131202553417732,amitabhnews18,2021-04-30 14:00:43,en,celebrating birth centenary #satyajitray moibofficial organizing year-long celebrations indiaabroad satya,4,0,"Celebrating Birth Centenary of #SatyajitRay @MoIB_Official organizing Year-long celebrations in India&amp;abroad
“Satya… https://t.co/DOgaFSHy6N","[celebrating, birth, centenary, #satyajitray, moibofficial, organizing, year-long, celebrations, indiaabroad, satya]","['celebrate', 'birth', 'centenary', 'satyajitray', 'moibofficial', 'organizing', 'year', 'long', 'celebration', 'indiaabroad', 'satya']"
37,1388085338170695680,amitabhnews18,2021-04-30 10:58:28,en,#councilofministers meet narendramodi urged ministers stay touch people regionshelp themk,5,0,"#councilofministers meet
* @narendramodi  urged Ministers to stay in touch with people of their regions,help them&amp;k… https://t.co/hYEb78omBQ","[#councilofministers, meet, narendramodi, urged, ministers, stay, touch, people, regionshelp, themk]","['councilofminister', 'meet', 'narendramodi', 'urge', 'minister', 'stay', 'touch', 'people', 'regionshelp', 'themk']"
38,1388083114874920964,amitabhnews18,2021-04-30 10:49:38,en,council ministers meets discuss situation arising second wave #covid present pandemic crisi,4,0,"Council of Ministers meets to discuss the situation arising out of second wave of #COVID19
* present pandemic crisi… https://t.co/R41KQaiycV","[council, ministers, meets, discuss, situation, arising, second, wave, #covid, present, pandemic, crisi]","['council', 'minister', 'meet', 'discuss', 'situation', 'arise', 'second', 'wave', 'covid', 'present', 'pandemic', 'crisi']"
39,1388030976626888706,amitabhnews18,2021-04-30 07:22:27,en,india import vials #remdesivir first consignment vials reach today hll lifecare ltd,1,0,"India to import 4,50,000 vials of #Remdesivir
*First Consignment of 75000 vials to reach today
*HLL Lifecare Ltd, a… https://t.co/fKkF2RsQvx","[india, import, vials, #remdesivir, first, consignment, vials, reach, today, hll, lifecare, ltd]","['india', 'import', 'vial', 'remdesivir', 'consignment', 'vial', 'reach', 'today', 'hll', 'lifecare', 'ltd']"
40,1387734612055498752,amitabhnews18,2021-04-29 11:44:49,en,isolations beds oxygen supported beds operation port hospitals dedicated #covid care mana,4,0,"422 isolations beds,305 oxygen supported beds are in operation at the Port Hospitals for dedicated #Covid care mana… https://t.co/PDKb1u6b5X","[isolations, beds, oxygen, supported, beds, operation, port, hospitals, dedicated, #covid, care, mana]","['isolation', 'bed', 'oxygen', 'support', 'bed', 'operation', 'port', 'hospital', 'dedicate', 'covid', 'care', 'mana']"
41,1387702666562785281,amitabhnews18,2021-04-29 09:37:52,hi,says rssorg sunilambekarm,8,1,"कोरोना के प्रकोप पर शासन व समाज के समन्वित प्रयास से ही विजय प्राप्त करेगा भारत says @RSSorg @SunilAmbekarM
*219… https://t.co/OPRMXie1XR","[says, rssorg, sunilambekarm]","['say', 'rssorg', 'sunilambekarm']"
42,1387700378536497152,amitabhnews18,2021-04-29 09:28:47,hi,newsindia: #breakingnews pm,0,4,"RT @News18India: #BreakingNews
सेनाध्यक्ष  से मिले PM मोदी. नरवणे ने प्रधानमंत्री मोदी को सेना की ओर से कोरोना पर हो रही तैयारियों की जानका…","[newsindia:, #breakingnews, pm]","['newsindia', 'breakingnews', 'pm']"
43,1387682493155844104,amitabhnews18,2021-04-29 08:17:42,en,pm narendramodi reviews #army preparedness #covid army chief gen naravane met pm medical staff made availa,8,0,"PM @narendramodi reviews #Army preparedness for #COVID19
*Army Chief Gen Naravane met PM
*medical staff made availa… https://t.co/fN7C6pFYam","[pm, narendramodi, reviews, #army, preparedness, #covid, army, chief, gen, naravane, met, pm, medical, staff, made, availa]","['pm', 'narendramodi', 'review', 'army', 'preparedness', 'covid', 'army', 'chief', 'gen', 'naravane', 'meet', 'pm', 'medical', 'staff', 'availa']"
44,1387395555450449921,amitabhnews18,2021-04-28 13:17:31,en,pm narendramodi talked prez putin kremlinrussiae thanked prez putin support #indiafightscovid,7,2,"PM @narendramodi talked to Prez Putin @KremlinRussia_E 
*thanked Prez Putin for support to #IndiaFightsCOVID19
*Our… https://t.co/zYzkaD3qEk","[pm, narendramodi, talked, prez, putin, kremlinrussiae, thanked, prez, putin, support, #indiafightscovid]","['pm', 'narendramodi', 'talk', 'prez', 'putin', 'kremlinrussiae', 'thank', 'prez', 'putin', 'support', 'indiafightscovid']"
45,1387386299359940612,amitabhnews18,2021-04-28 12:40:44,hi,jpnadda #bjymdoctor helpline -,7,3,"भाजपा अध्यक्ष @JPNadda ने #BJYMDoctor Helpline - 080 6817 3286 की शुरुआत की
*कोई भी नागरिक डायल कर चिकित्सकों का… https://t.co/zEsRbeP9Ob","[jpnadda, #bjymdoctor, helpline, -]","['jpnadda', 'bjymdoctor', 'helpline']"
46,1387373241992241154,amitabhnews18,2021-04-28 11:48:51,en,lakh portable #oxygen concentrators procured #pmcares fund #psa oxygen plants based tech,2,0,"1 Lakh Portable #Oxygen Concentrators to be procured from #PMCares Fund
*500 more #PSA oxygen plants, based on tech… https://t.co/YE8A8GvxBI","[lakh, portable, #oxygen, concentrators, procured, #pmcares, fund, #psa, oxygen, plants, based, tech]","['lakh', 'portable', 'oxygen', 'concentrator', 'procure', 'pmcare', 'fund', 'psa', 'oxygen', 'plant', 'base', 'tech']"
47,1387342410666057730,amitabhnews18,2021-04-28 09:46:20,en,pm narendramodi met iaf chief rks bhadauria reviews iafmcc #covid operations x readiness entire heavy,7,3,"PM @narendramodi met IAF Chief RKS Bhadauria
*reviews @IAF_MCC #COVID19 operations 
*24x7 readiness of entire heavy… https://t.co/sTmTCspRja","[pm, narendramodi, met, iaf, chief, rks, bhadauria, reviews, iafmcc, #covid, operations, x, readiness, entire, heavy]","['pm', 'narendramodi', 'meet', 'iaf', 'chief', 'rks', 'bhadauria', 'review', 'iafmcc', 'covid', 'operation', 'x', 'readiness', 'entire', 'heavy']"
